MMM,BRIEF-3M up 2.6 percent premarket after outlook, dividend boostREFILE-3M expects 2014 sales to grow 3-6 pct; raises dividendUPDATE 2-3M sets year's biggest U.S. buyback plan, raises dividend Dec 17 3M Co, whose products range from Post-It notes to films used in flat-panel TVs, said it could buy back up to $22 billion of shares in the five years through 2017, joining a list of companies announcing big capital returns to shareholders.  UPDATE 2-3M sets year's biggest U.S. buyback plan, raises dividend Dec 17 3M Co, whose products range from Post-It notes to films used in flat-panel TVs, said it could buy back up to $22 billion of shares in the five years through 2017, joining a list of companies announcing big capital returns to shareholders. Dec 17 3M Co, whose products include Post-it notes and film for flat-panel televisions, said it expects organic sales to rise by 3-6 percent excluding the effect of foreign exchange in 2014.UPDATE 2-3M sets year's biggest U.S. buyback plan, raises dividend Dec 17 3M Co, whose products range from Post-It notes to films used in flat-panel TVs, said it could buy back up to $22 billion of shares in the five years through 2017, joining a list of companies announcing big capital returns to shareholders.   REFILE-3M expects 2014 sales to grow 3-6 pct; raises dividendUPDATE 2-3M sets year's biggest U.S. buyback plan, raises dividend Dec 17 3M Co, whose products range from Post-It notes to films used in flat-panel TVs, said it could buy back up to $22 billion of shares in the five years through 2017, joining a list of companies announcing big capital returns to shareholders.  UPDATE 2-3M sets year's biggest U.S. buyback plan, raises dividend Dec 17 3M Co, whose products range from Post-It notes to films used in flat-panel TVs, said it could buy back up to $22 billion of shares in the five years through 2017, joining a list of companies announcing big capital returns to shareholders. Dec 17 3M Co, whose products include Post-it notes and film for flat-panel televisions, said it expects organic sales to rise by 3-6 percent excluding the effect of foreign exchange in 2014.UPDATE 2-3M sets year's biggest U.S. buyback plan, raises dividend Dec 17 3M Co, whose products range from Post-It notes to films used in flat-panel TVs, said it could buy back up to $22 billion of shares in the five years through 2017, joining a list of companies announcing big capital returns to shareholders.  NEW YORK, Dec 17 3M Co :  * Up 2.6 percent to $131 in premarket after outlook, dividend boostREFILE-3M expects 2014 sales to grow 3-6 pct; raises dividendUPDATE 2-3M sets year's biggest U.S. buyback plan, raises dividend Dec 17 3M Co, whose products range from Post-It notes to films used in flat-panel TVs, said it could buy back up to $22 billion of shares in the five years through 2017, joining a list of companies announcing big capital returns to shareholders.  UPDATE 2-3M sets year's biggest U.S. buyback plan, raises dividend Dec 17 3M Co, whose products range from Post-It notes to films used in flat-panel TVs, said it could buy back up to $22 billion of shares in the five years through 2017, joining a list of companies announcing big capital returns to shareholders. Dec 17 3M Co, whose products include Post-it notes and film for flat-panel televisions, said it expects organic sales to rise by 3-6 percent excluding the effect of foreign exchange in 2014.UPDATE 2-3M sets year's biggest U.S. buyback plan, raises dividend Dec 17 3M Co, whose products range from Post-It notes to films used in flat-panel TVs, said it could buy back up to $22 billion of shares in the five years through 2017, joining a list of companies announcing big capital returns to shareholders.   
AAL,BRIEF-American Airlines reached $135 million settlement with Cantor Fitzgerald over 9/11 attacks Dec 17 American Airlines Group Inc :  * Reached $135 million settlement with cantor Fitzgerald over property damage 
AIG,AerCap's largest shareholder says will vote for $5.4 bln ILFC buyAerCap's largest shareholder says will vote for $5.4 billion ILFC buy DUBAI Waha Capital , an Abu Dhabi-based investment firm, said on Tuesday it would vote in favor of AerCap Holdings' $5.4 billion acquisition of American International Group Inc's  aircraft leasing unit.  AerCap's largest shareholder says will vote for $5.4 billion ILFC buy DUBAI Waha Capital , an Abu Dhabi-based investment firm, said on Tuesday it would vote in favor of AerCap Holdings' $5.4 billion acquisition of American International Group Inc's  aircraft leasing unit. DUBAI, Dec 17 Waha Capital, an Abu Dhabi-based investment firm, said on Tuesday it would vote in favour of AerCap Holdings' $5.4 billion acquisition of American International Group Inc's aircraft leasing unit.AerCap's largest shareholder says will vote for $5.4 billion ILFC buy DUBAI Waha Capital , an Abu Dhabi-based investment firm, said on Tuesday it would vote in favor of AerCap Holdings' $5.4 billion acquisition of American International Group Inc's  aircraft leasing unit.  
T,AT&T; to sell Connecticut wireline operations for $2 blnREFILE-UPDATE 3-AT&T; to sell Conn. wireline assets to Frontier for $2 bln Dec 17 AT&T; Inc, the biggest U.S. phone company, said on Tuesday that it would sell its wireline operations in Connecticut to regional telephone operator Frontier Communications for $2 billion in cash, to help fund network upgrades.  REFILE-UPDATE 3-AT&T; to sell Conn. wireline assets to Frontier for $2 bln Dec 17 AT&T; Inc, the biggest U.S. phone company, said on Tuesday that it would sell its wireline operations in Connecticut to regional telephone operator Frontier Communications for $2 billion in cash, to help fund network upgrades. Dec 17 AT&T; Inc said it would sell its wireline operations in Connecticut to Frontier Communications  for $2 billion in cash.REFILE-UPDATE 3-AT&T; to sell Conn. wireline assets to Frontier for $2 bln Dec 17 AT&T; Inc, the biggest U.S. phone company, said on Tuesday that it would sell its wireline operations in Connecticut to regional telephone operator Frontier Communications for $2 billion in cash, to help fund network upgrades.  
BA,UPDATE 3-Boeing announces $10 billion buyback, raises dividendUPDATE 1-Japan to bolster military, boost Asia ties to counter ChinaJapan to bolster military, boost Asia ties to counter China TOKYO Japan will boost its military spending in coming years, buying early-warning planes, beach-assault vehicles and troop-carrying aircraft, while seeking closer ties with Asian partners to counter a more militarily assertive China.  Japan to bolster military, boost Asia ties to counter China TOKYO Japan will boost its military spending in coming years, buying early-warning planes, beach-assault vehicles and troop-carrying aircraft, while seeking closer ties with Asian partners to counter a more militarily assertive China. * Japan PM Abe reverses decade of military-spending declinesJapan to bolster military, boost Asia ties to counter China TOKYO Japan will boost its military spending in coming years, buying early-warning planes, beach-assault vehicles and troop-carrying aircraft, while seeking closer ties with Asian partners to counter a more militarily assertive China.   UPDATE 1-Japan to bolster military, boost Asia ties to counter ChinaJapan to bolster military, boost Asia ties to counter China TOKYO Japan will boost its military spending in coming years, buying early-warning planes, beach-assault vehicles and troop-carrying aircraft, while seeking closer ties with Asian partners to counter a more militarily assertive China.  Japan to bolster military, boost Asia ties to counter China TOKYO Japan will boost its military spending in coming years, buying early-warning planes, beach-assault vehicles and troop-carrying aircraft, while seeking closer ties with Asian partners to counter a more militarily assertive China. * Japan PM Abe reverses decade of military-spending declinesJapan to bolster military, boost Asia ties to counter China TOKYO Japan will boost its military spending in coming years, buying early-warning planes, beach-assault vehicles and troop-carrying aircraft, while seeking closer ties with Asian partners to counter a more militarily assertive China.  * Buyback to occur over next 2-3 years, beginning 2014     * Increases dividend by 50 percent     * Many U.S. companies doing buybacks       By Alwyn Scott     SEATTLE, Dec 16 Boeing Co's board raised the company dividend about 50 percent on Monday and approved $10 billion in new share buyback authority that the company said it would use in the next two to three years.     The share repurchase represents about 10 percent of Boeing's outstanding stock, ranking it in the middle of buybUPDATE 1-Japan to bolster military, boost Asia ties to counter ChinaJapan to bolster military, boost Asia ties to counter China TOKYO Japan will boost its military spending in coming years, buying early-warning planes, beach-assault vehicles and troop-carrying aircraft, while seeking closer ties with Asian partners to counter a more militarily assertive China.  Japan to bolster military, boost Asia ties to counter China TOKYO Japan will boost its military spending in coming years, buying early-warning planes, beach-assault vehicles and troop-carrying aircraft, while seeking closer ties with Asian partners to counter a more militarily assertive China. * Japan PM Abe reverses decade of military-spending declinesJapan to bolster military, boost Asia ties to counter China TOKYO Japan will boost its military spending in coming years, buying early-warning planes, beach-assault vehicles and troop-carrying aircraft, while seeking closer ties with Asian partners to counter a more militarily assertive China.   
C,U.S. preparing civil charges against Citigroup, Merrill Lynch -sources Dec 17 The U.S. Justice Department is preparing to file civil fraud charges against Citigroup Inc and Bank of America's Merrill Lynch unit over their sale of flawed mortgage securities ahead of the financial crisis, according to people familiar with the probes. 
CMCSA,Market Chatter-Corporate finance press digestUS STOCKS-Futures little changed as Fed meeting to beginUS STOCKS-Wall Street set for modest gain at open; Fed to meet NEW YORK, Dec 17 U.S. stocks were set to open slightly higher on Tuesday as the Federal Reserve prepared to begin its last policy-setting meeting of the year.  US STOCKS-Wall Street set for modest gain at open; Fed to meet NEW YORK, Dec 17 U.S. stocks were set to open slightly higher on Tuesday as the Federal Reserve prepared to begin its last policy-setting meeting of the year. NEW YORK, Dec 17 U.S. stock index futures were little changed on Tuesday ahead of consumer price data and as the Federal Reserve prepared to begin its last policy-setting meeting of the year.US STOCKS-Wall Street set for modest gain at open; Fed to meet NEW YORK, Dec 17 U.S. stocks were set to open slightly higher on Tuesday as the Federal Reserve prepared to begin its last policy-setting meeting of the year.   US STOCKS-Futures little changed as Fed meeting to beginUS STOCKS-Wall Street set for modest gain at open; Fed to meet NEW YORK, Dec 17 U.S. stocks were set to open slightly higher on Tuesday as the Federal Reserve prepared to begin its last policy-setting meeting of the year.  US STOCKS-Wall Street set for modest gain at open; Fed to meet NEW YORK, Dec 17 U.S. stocks were set to open slightly higher on Tuesday as the Federal Reserve prepared to begin its last policy-setting meeting of the year. NEW YORK, Dec 17 U.S. stock index futures were little changed on Tuesday ahead of consumer price data and as the Federal Reserve prepared to begin its last policy-setting meeting of the year.US STOCKS-Wall Street set for modest gain at open; Fed to meet NEW YORK, Dec 17 U.S. stocks were set to open slightly higher on Tuesday as the Federal Reserve prepared to begin its last policy-setting meeting of the year.  Dec 17 The following corporate finance-related stories were reported by media:US STOCKS-Futures little changed as Fed meeting to beginUS STOCKS-Wall Street set for modest gain at open; Fed to meet NEW YORK, Dec 17 U.S. stocks were set to open slightly higher on Tuesday as the Federal Reserve prepared to begin its last policy-setting meeting of the year.  US STOCKS-Wall Street set for modest gain at open; Fed to meet NEW YORK, Dec 17 U.S. stocks were set to open slightly higher on Tuesday as the Federal Reserve prepared to begin its last policy-setting meeting of the year. NEW YORK, Dec 17 U.S. stock index futures were little changed on Tuesday ahead of consumer price data and as the Federal Reserve prepared to begin its last policy-setting meeting of the year.US STOCKS-Wall Street set for modest gain at open; Fed to meet NEW YORK, Dec 17 U.S. stocks were set to open slightly higher on Tuesday as the Federal Reserve prepared to begin its last policy-setting meeting of the year.   
DOV,Canada's Athabasca Oil to spend 42 pct less in 2014 Dec 17 Canadian oil producer Athabasca Oil Corp  said it planned to spend 42 percent less in 2014 to develop its assets, as it awaits government approval for its Dover project. 
FB,Oregon politician gets six years for Facebook IPO fraudFacebook to begin selling video ads - WSJUPDATE 1-Facebook to test video ads, opening new revenue sourceFacebook to test video ads, opening new revenue source SAN FRANCISCO Facebook Inc took a first step on Tuesday toward selling video ads that play automatically in newsfeeds, moving cautiously to unlock a source of revenue that could annoy users.  Facebook to test video ads, opening new revenue source SAN FRANCISCO Facebook Inc took a first step on Tuesday toward selling video ads that play automatically in newsfeeds, moving cautiously to unlock a source of revenue that could annoy users. SAN FRANCISCO, Dec 17 Facebook Inc took a first step on Tuesday toward selling video ads that play automatically in newsfeeds, moving cautiously to unlock a source of revenue that could annoy users.Facebook to test video ads, opening new revenue source SAN FRANCISCO Facebook Inc took a first step on Tuesday toward selling video ads that play automatically in newsfeeds, moving cautiously to unlock a source of revenue that could annoy users.   UPDATE 1-Facebook to test video ads, opening new revenue sourceFacebook to test video ads, opening new revenue source SAN FRANCISCO Facebook Inc took a first step on Tuesday toward selling video ads that play automatically in newsfeeds, moving cautiously to unlock a source of revenue that could annoy users.  Facebook to test video ads, opening new revenue source SAN FRANCISCO Facebook Inc took a first step on Tuesday toward selling video ads that play automatically in newsfeeds, moving cautiously to unlock a source of revenue that could annoy users. SAN FRANCISCO, Dec 17 Facebook Inc took a first step on Tuesday toward selling video ads that play automatically in newsfeeds, moving cautiously to unlock a source of revenue that could annoy users.Facebook to test video ads, opening new revenue source SAN FRANCISCO Facebook Inc took a first step on Tuesday toward selling video ads that play automatically in newsfeeds, moving cautiously to unlock a source of revenue that could annoy users.  Dec 17 Facebook Inc will begin selling video ads later this week and plans to make an announcement on Tuesday, the Wall Street Journal reported, citing people familiar with the matter.UPDATE 1-Facebook to test video ads, opening new revenue sourceFacebook to test video ads, opening new revenue source SAN FRANCISCO Facebook Inc took a first step on Tuesday toward selling video ads that play automatically in newsfeeds, moving cautiously to unlock a source of revenue that could annoy users.  Facebook to test video ads, opening new revenue source SAN FRANCISCO Facebook Inc took a first step on Tuesday toward selling video ads that play automatically in newsfeeds, moving cautiously to unlock a source of revenue that could annoy users. SAN FRANCISCO, Dec 17 Facebook Inc took a first step on Tuesday toward selling video ads that play automatically in newsfeeds, moving cautiously to unlock a source of revenue that could annoy users.Facebook to test video ads, opening new revenue source SAN FRANCISCO Facebook Inc took a first step on Tuesday toward selling video ads that play automatically in newsfeeds, moving cautiously to unlock a source of revenue that could annoy users.    Facebook to begin selling video ads - WSJUPDATE 1-Facebook to test video ads, opening new revenue sourceFacebook to test video ads, opening new revenue source SAN FRANCISCO Facebook Inc took a first step on Tuesday toward selling video ads that play automatically in newsfeeds, moving cautiously to unlock a source of revenue that could annoy users.  Facebook to test video ads, opening new revenue source SAN FRANCISCO Facebook Inc took a first step on Tuesday toward selling video ads that play automatically in newsfeeds, moving cautiously to unlock a source of revenue that could annoy users. SAN FRANCISCO, Dec 17 Facebook Inc took a first step on Tuesday toward selling video ads that play automatically in newsfeeds, moving cautiously to unlock a source of revenue that could annoy users.Facebook to test video ads, opening new revenue source SAN FRANCISCO Facebook Inc took a first step on Tuesday toward selling video ads that play automatically in newsfeeds, moving cautiously to unlock a source of revenue that could annoy users.   UPDATE 1-Facebook to test video ads, opening new revenue sourceFacebook to test video ads, opening new revenue source SAN FRANCISCO Facebook Inc took a first step on Tuesday toward selling video ads that play automatically in newsfeeds, moving cautiously to unlock a source of revenue that could annoy users.  Facebook to test video ads, opening new revenue source SAN FRANCISCO Facebook Inc took a first step on Tuesday toward selling video ads that play automatically in newsfeeds, moving cautiously to unlock a source of revenue that could annoy users. SAN FRANCISCO, Dec 17 Facebook Inc took a first step on Tuesday toward selling video ads that play automatically in newsfeeds, moving cautiously to unlock a source of revenue that could annoy users.Facebook to test video ads, opening new revenue source SAN FRANCISCO Facebook Inc took a first step on Tuesday toward selling video ads that play automatically in newsfeeds, moving cautiously to unlock a source of revenue that could annoy users.  Dec 17 Facebook Inc will begin selling video ads later this week and plans to make an announcement on Tuesday, the Wall Street Journal reported, citing people familiar with the matter.UPDATE 1-Facebook to test video ads, opening new revenue sourceFacebook to test video ads, opening new revenue source SAN FRANCISCO Facebook Inc took a first step on Tuesday toward selling video ads that play automatically in newsfeeds, moving cautiously to unlock a source of revenue that could annoy users.  Facebook to test video ads, opening new revenue source SAN FRANCISCO Facebook Inc took a first step on Tuesday toward selling video ads that play automatically in newsfeeds, moving cautiously to unlock a source of revenue that could annoy users. SAN FRANCISCO, Dec 17 Facebook Inc took a first step on Tuesday toward selling video ads that play automatically in newsfeeds, moving cautiously to unlock a source of revenue that could annoy users.Facebook to test video ads, opening new revenue source SAN FRANCISCO Facebook Inc took a first step on Tuesday toward selling video ads that play automatically in newsfeeds, moving cautiously to unlock a source of revenue that could annoy users.   NEW YORK A former candidate for governor of Oregon was sentenced to six years in prison on Monday for fraudulently convincing investors he had access to shares of Facebook Inc before its highly anticipated initial public offering in 2012.Facebook to begin selling video ads - WSJUPDATE 1-Facebook to test video ads, opening new revenue sourceFacebook to test video ads, opening new revenue source SAN FRANCISCO Facebook Inc took a first step on Tuesday toward selling video ads that play automatically in newsfeeds, moving cautiously to unlock a source of revenue that could annoy users.  Facebook to test video ads, opening new revenue source SAN FRANCISCO Facebook Inc took a first step on Tuesday toward selling video ads that play automatically in newsfeeds, moving cautiously to unlock a source of revenue that could annoy users. SAN FRANCISCO, Dec 17 Facebook Inc took a first step on Tuesday toward selling video ads that play automatically in newsfeeds, moving cautiously to unlock a source of revenue that could annoy users.Facebook to test video ads, opening new revenue source SAN FRANCISCO Facebook Inc took a first step on Tuesday toward selling video ads that play automatically in newsfeeds, moving cautiously to unlock a source of revenue that could annoy users.   UPDATE 1-Facebook to test video ads, opening new revenue sourceFacebook to test video ads, opening new revenue source SAN FRANCISCO Facebook Inc took a first step on Tuesday toward selling video ads that play automatically in newsfeeds, moving cautiously to unlock a source of revenue that could annoy users.  Facebook to test video ads, opening new revenue source SAN FRANCISCO Facebook Inc took a first step on Tuesday toward selling video ads that play automatically in newsfeeds, moving cautiously to unlock a source of revenue that could annoy users. SAN FRANCISCO, Dec 17 Facebook Inc took a first step on Tuesday toward selling video ads that play automatically in newsfeeds, moving cautiously to unlock a source of revenue that could annoy users.Facebook to test video ads, opening new revenue source SAN FRANCISCO Facebook Inc took a first step on Tuesday toward selling video ads that play automatically in newsfeeds, moving cautiously to unlock a source of revenue that could annoy users.  Dec 17 Facebook Inc will begin selling video ads later this week and plans to make an announcement on Tuesday, the Wall Street Journal reported, citing people familiar with the matter.UPDATE 1-Facebook to test video ads, opening new revenue sourceFacebook to test video ads, opening new revenue source SAN FRANCISCO Facebook Inc took a first step on Tuesday toward selling video ads that play automatically in newsfeeds, moving cautiously to unlock a source of revenue that could annoy users.  Facebook to test video ads, opening new revenue source SAN FRANCISCO Facebook Inc took a first step on Tuesday toward selling video ads that play automatically in newsfeeds, moving cautiously to unlock a source of revenue that could annoy users. SAN FRANCISCO, Dec 17 Facebook Inc took a first step on Tuesday toward selling video ads that play automatically in newsfeeds, moving cautiously to unlock a source of revenue that could annoy users.Facebook to test video ads, opening new revenue source SAN FRANCISCO Facebook Inc took a first step on Tuesday toward selling video ads that play automatically in newsfeeds, moving cautiously to unlock a source of revenue that could annoy users.    
FTR,BRIEF-Frontier Communications up 13.6 percent premarketREFILE-UPDATE 3-AT&T; to sell Conn. wireline assets to Frontier for $2 bln Dec 17 AT&T; Inc, the biggest U.S. phone company, said on Tuesday that it would sell its wireline operations in Connecticut to regional telephone operator Frontier Communications for $2 billion in cash, to help fund network upgrades.  REFILE-UPDATE 3-AT&T; to sell Conn. wireline assets to Frontier for $2 bln Dec 17 AT&T; Inc, the biggest U.S. phone company, said on Tuesday that it would sell its wireline operations in Connecticut to regional telephone operator Frontier Communications for $2 billion in cash, to help fund network upgrades. NEW YORK, Dec 17 Frontier Communications Corp  :  * Up 13.6 percent to $5 in premarket; to buy Conneticut wireline operations from AT&T; for $2 billion in cashREFILE-UPDATE 3-AT&T; to sell Conn. wireline assets to Frontier for $2 bln Dec 17 AT&T; Inc, the biggest U.S. phone company, said on Tuesday that it would sell its wireline operations in Connecticut to regional telephone operator Frontier Communications for $2 billion in cash, to help fund network upgrades.  
