AMZN,Amazon plans big expansion of online grocery business: sourcesUPDATE 2-Amazon targets frequent shoppers with new Prime service SAN FRANCISCO, June 10 Amazon.com Inc  unveiled a new version of its successful Prime shipping service on Monday as the world's largest Internet retailer tries to attract more-frequent shoppers with groceries and other everyday household products.  UPDATE 2-Amazon targets frequent shoppers with new Prime service SAN FRANCISCO, June 10 Amazon.com Inc  unveiled a new version of its successful Prime shipping service on Monday as the world's largest Internet retailer tries to attract more-frequent shoppers with groceries and other everyday household products. SAN FRANCISCO Amazon.com Inc is planning a major roll-out of an online grocery business that it has been quietly developing for years, targeting one of the largest retail sectors yet to be upended by e-commerce, according to two people familiar with the situation.UPDATE 2-Amazon targets frequent shoppers with new Prime service SAN FRANCISCO, June 10 Amazon.com Inc  unveiled a new version of its successful Prime shipping service on Monday as the world's largest Internet retailer tries to attract more-frequent shoppers with groceries and other everyday household products.  
APC,Subsea 7 wins contract from Anadarko, value undisclosedIndia firms bid $2.5 bln for Anadarko's 10 pct in Mozambique field-source NEW DELHI, June 10 India's state-owned ONGC Videsh Ltd and Oil India Ltd continue to seek a 10 percent stake in a Mozambique gas field from Anadarko Petroleum Corp and have bid about $2.5 billion for it, a source with direct knowledge of the matter said on Monday.  India firms bid $2.5 bln for Anadarko's 10 pct in Mozambique field-source NEW DELHI, June 10 India's state-owned ONGC Videsh Ltd and Oil India Ltd continue to seek a 10 percent stake in a Mozambique gas field from Anadarko Petroleum Corp and have bid about $2.5 billion for it, a source with direct knowledge of the matter said on Monday. OSLO, June 10 The offshore engineering group Subsea 7 has won a contract from oil firm Anadarko  and partners for the development of the Heidelberg field in the Gulf of Mexico, Subsea 7 said on Monday.India firms bid $2.5 bln for Anadarko's 10 pct in Mozambique field-source NEW DELHI, June 10 India's state-owned ONGC Videsh Ltd and Oil India Ltd continue to seek a 10 percent stake in a Mozambique gas field from Anadarko Petroleum Corp and have bid about $2.5 billion for it, a source with direct knowledge of the matter said on Monday.  
AAPL,UPDATE 1-Apple's CEO Cook kicks off event, music service expectedUPDATE 6-Apple unveils music streaming service, revamps iOSThe desktop gets a makeover, courtesy of AppleThe desktop gets a makeover, courtesy of Apple SAN FRANCISCO Apple Inc, known for its bold experiments with computer design, has come up with a radically re-imagined Mac Pro that departs from the venerable, boxy design of the typical desktop personal computer tower.  The desktop gets a makeover, courtesy of Apple SAN FRANCISCO Apple Inc, known for its bold experiments with computer design, has come up with a radically re-imagined Mac Pro that departs from the venerable, boxy design of the typical desktop personal computer tower. SAN FRANCISCO, June 10 Apple Inc, known for its bold experiments with computer design, has come up with a radically re-imagined Mac Pro that departs from the venerable, boxy design of the typical desktop personal computer tower.The desktop gets a makeover, courtesy of Apple SAN FRANCISCO Apple Inc, known for its bold experiments with computer design, has come up with a radically re-imagined Mac Pro that departs from the venerable, boxy design of the typical desktop personal computer tower.   The desktop gets a makeover, courtesy of AppleThe desktop gets a makeover, courtesy of Apple SAN FRANCISCO Apple Inc, known for its bold experiments with computer design, has come up with a radically re-imagined Mac Pro that departs from the venerable, boxy design of the typical desktop personal computer tower.  The desktop gets a makeover, courtesy of Apple SAN FRANCISCO Apple Inc, known for its bold experiments with computer design, has come up with a radically re-imagined Mac Pro that departs from the venerable, boxy design of the typical desktop personal computer tower. SAN FRANCISCO, June 10 Apple Inc, known for its bold experiments with computer design, has come up with a radically re-imagined Mac Pro that departs from the venerable, boxy design of the typical desktop personal computer tower.The desktop gets a makeover, courtesy of Apple SAN FRANCISCO Apple Inc, known for its bold experiments with computer design, has come up with a radically re-imagined Mac Pro that departs from the venerable, boxy design of the typical desktop personal computer tower.  SAN FRANCISCO, June 10 Apple Inc  unveiled a music streaming service called iTunes Radio and new mobile software on Monday, in the biggest re-design of its operating system since the original iPhone was introduced in 2007.The desktop gets a makeover, courtesy of AppleThe desktop gets a makeover, courtesy of Apple SAN FRANCISCO Apple Inc, known for its bold experiments with computer design, has come up with a radically re-imagined Mac Pro that departs from the venerable, boxy design of the typical desktop personal computer tower.  The desktop gets a makeover, courtesy of Apple SAN FRANCISCO Apple Inc, known for its bold experiments with computer design, has come up with a radically re-imagined Mac Pro that departs from the venerable, boxy design of the typical desktop personal computer tower. SAN FRANCISCO, June 10 Apple Inc, known for its bold experiments with computer design, has come up with a radically re-imagined Mac Pro that departs from the venerable, boxy design of the typical desktop personal computer tower.The desktop gets a makeover, courtesy of Apple SAN FRANCISCO Apple Inc, known for its bold experiments with computer design, has come up with a radically re-imagined Mac Pro that departs from the venerable, boxy design of the typical desktop personal computer tower.    UPDATE 6-Apple unveils music streaming service, revamps iOSThe desktop gets a makeover, courtesy of AppleThe desktop gets a makeover, courtesy of Apple SAN FRANCISCO Apple Inc, known for its bold experiments with computer design, has come up with a radically re-imagined Mac Pro that departs from the venerable, boxy design of the typical desktop personal computer tower.  The desktop gets a makeover, courtesy of Apple SAN FRANCISCO Apple Inc, known for its bold experiments with computer design, has come up with a radically re-imagined Mac Pro that departs from the venerable, boxy design of the typical desktop personal computer tower. SAN FRANCISCO, June 10 Apple Inc, known for its bold experiments with computer design, has come up with a radically re-imagined Mac Pro that departs from the venerable, boxy design of the typical desktop personal computer tower.The desktop gets a makeover, courtesy of Apple SAN FRANCISCO Apple Inc, known for its bold experiments with computer design, has come up with a radically re-imagined Mac Pro that departs from the venerable, boxy design of the typical desktop personal computer tower.   The desktop gets a makeover, courtesy of AppleThe desktop gets a makeover, courtesy of Apple SAN FRANCISCO Apple Inc, known for its bold experiments with computer design, has come up with a radically re-imagined Mac Pro that departs from the venerable, boxy design of the typical desktop personal computer tower.  The desktop gets a makeover, courtesy of Apple SAN FRANCISCO Apple Inc, known for its bold experiments with computer design, has come up with a radically re-imagined Mac Pro that departs from the venerable, boxy design of the typical desktop personal computer tower. SAN FRANCISCO, June 10 Apple Inc, known for its bold experiments with computer design, has come up with a radically re-imagined Mac Pro that departs from the venerable, boxy design of the typical desktop personal computer tower.The desktop gets a makeover, courtesy of Apple SAN FRANCISCO Apple Inc, known for its bold experiments with computer design, has come up with a radically re-imagined Mac Pro that departs from the venerable, boxy design of the typical desktop personal computer tower.  SAN FRANCISCO, June 10 Apple Inc  unveiled a music streaming service called iTunes Radio and new mobile software on Monday, in the biggest re-design of its operating system since the original iPhone was introduced in 2007.The desktop gets a makeover, courtesy of AppleThe desktop gets a makeover, courtesy of Apple SAN FRANCISCO Apple Inc, known for its bold experiments with computer design, has come up with a radically re-imagined Mac Pro that departs from the venerable, boxy design of the typical desktop personal computer tower.  The desktop gets a makeover, courtesy of Apple SAN FRANCISCO Apple Inc, known for its bold experiments with computer design, has come up with a radically re-imagined Mac Pro that departs from the venerable, boxy design of the typical desktop personal computer tower. SAN FRANCISCO, June 10 Apple Inc, known for its bold experiments with computer design, has come up with a radically re-imagined Mac Pro that departs from the venerable, boxy design of the typical desktop personal computer tower.The desktop gets a makeover, courtesy of Apple SAN FRANCISCO Apple Inc, known for its bold experiments with computer design, has come up with a radically re-imagined Mac Pro that departs from the venerable, boxy design of the typical desktop personal computer tower.   SAN FRANCISCO, June 10 Apple Inc Chief Executive Tim Cook kicked off the company's annual confab for its developers on Monday, where the company is expected to unveil a new design and revamped features for its iOS mobile operating system along with a new streaming-music service.UPDATE 6-Apple unveils music streaming service, revamps iOSThe desktop gets a makeover, courtesy of AppleThe desktop gets a makeover, courtesy of Apple SAN FRANCISCO Apple Inc, known for its bold experiments with computer design, has come up with a radically re-imagined Mac Pro that departs from the venerable, boxy design of the typical desktop personal computer tower.  The desktop gets a makeover, courtesy of Apple SAN FRANCISCO Apple Inc, known for its bold experiments with computer design, has come up with a radically re-imagined Mac Pro that departs from the venerable, boxy design of the typical desktop personal computer tower. SAN FRANCISCO, June 10 Apple Inc, known for its bold experiments with computer design, has come up with a radically re-imagined Mac Pro that departs from the venerable, boxy design of the typical desktop personal computer tower.The desktop gets a makeover, courtesy of Apple SAN FRANCISCO Apple Inc, known for its bold experiments with computer design, has come up with a radically re-imagined Mac Pro that departs from the venerable, boxy design of the typical desktop personal computer tower.   The desktop gets a makeover, courtesy of AppleThe desktop gets a makeover, courtesy of Apple SAN FRANCISCO Apple Inc, known for its bold experiments with computer design, has come up with a radically re-imagined Mac Pro that departs from the venerable, boxy design of the typical desktop personal computer tower.  The desktop gets a makeover, courtesy of Apple SAN FRANCISCO Apple Inc, known for its bold experiments with computer design, has come up with a radically re-imagined Mac Pro that departs from the venerable, boxy design of the typical desktop personal computer tower. SAN FRANCISCO, June 10 Apple Inc, known for its bold experiments with computer design, has come up with a radically re-imagined Mac Pro that departs from the venerable, boxy design of the typical desktop personal computer tower.The desktop gets a makeover, courtesy of Apple SAN FRANCISCO Apple Inc, known for its bold experiments with computer design, has come up with a radically re-imagined Mac Pro that departs from the venerable, boxy design of the typical desktop personal computer tower.  SAN FRANCISCO, June 10 Apple Inc  unveiled a music streaming service called iTunes Radio and new mobile software on Monday, in the biggest re-design of its operating system since the original iPhone was introduced in 2007.The desktop gets a makeover, courtesy of AppleThe desktop gets a makeover, courtesy of Apple SAN FRANCISCO Apple Inc, known for its bold experiments with computer design, has come up with a radically re-imagined Mac Pro that departs from the venerable, boxy design of the typical desktop personal computer tower.  The desktop gets a makeover, courtesy of Apple SAN FRANCISCO Apple Inc, known for its bold experiments with computer design, has come up with a radically re-imagined Mac Pro that departs from the venerable, boxy design of the typical desktop personal computer tower. SAN FRANCISCO, June 10 Apple Inc, known for its bold experiments with computer design, has come up with a radically re-imagined Mac Pro that departs from the venerable, boxy design of the typical desktop personal computer tower.The desktop gets a makeover, courtesy of Apple SAN FRANCISCO Apple Inc, known for its bold experiments with computer design, has come up with a radically re-imagined Mac Pro that departs from the venerable, boxy design of the typical desktop personal computer tower.    
BAC,Bank of America Merrill Lynch, JP Morgan top Extel awardsCORRECTED-(OFFICIAL)-TABLE-Thomson Reuters Extel awards (Corrects to show Credit Suisse placed third in Leading Pan-European Brokerage Firm for Trading and Execution category, not Bank of America Merrill Lynch)     June 10 Bank of America Merrill Lynch  scooped the top prize at the annual Thomson Reuters  Extel Awards, ending UBS's 12-year winning streak, while JP Morgan was named best fund manager for the fourth consecutive year.      The following table lists the winners and runners-up in the awards:        AWARD                    RANK  CORRECTED-(OFFICIAL)-TABLE-Thomson Reuters Extel awards (Corrects to show Credit Suisse placed third in Leading Pan-European Brokerage Firm for Trading and Execution category, not Bank of America Merrill Lynch)     June 10 Bank of America Merrill Lynch  scooped the top prize at the annual Thomson Reuters  Extel Awards, ending UBS's 12-year winning streak, while JP Morgan was named best fund manager for the fourth consecutive year.      The following table lists the winners and runners-up in the awards:        AWARD                    RANK LONDON Bank of America Merrill Lynch  scooped the prize as top pan-European equity brokerage at the annual Thomson Reuters  Extel Awards on Monday, ending UBS's  12-year winning streak.CORRECTED-(OFFICIAL)-TABLE-Thomson Reuters Extel awards (Corrects to show Credit Suisse placed third in Leading Pan-European Brokerage Firm for Trading and Execution category, not Bank of America Merrill Lynch)     June 10 Bank of America Merrill Lynch  scooped the top prize at the annual Thomson Reuters  Extel Awards, ending UBS's 12-year winning streak, while JP Morgan was named best fund manager for the fourth consecutive year.      The following table lists the winners and runners-up in the awards:        AWARD                    RANK  
BA,British Airways to receive Boeing Dreamliner from June 26U.S. Navy to sign deal with Bell, Boeing for 99 more V-22 tilt-rotor aircraft WASHINGTON, June 10 The U.S. Navy plans to sign this week a five-year contract valued just under $6.5 billion to buy 99 new V-22 Osprey tilt-rotor aircraft built by Boeing Co  and Bell Helicopter, a unit of Textron Inc, saving $1 billion over that period, the program's manager said in an interview on Monday.  U.S. Navy to sign deal with Bell, Boeing for 99 more V-22 tilt-rotor aircraft WASHINGTON, June 10 The U.S. Navy plans to sign this week a five-year contract valued just under $6.5 billion to buy 99 new V-22 Osprey tilt-rotor aircraft built by Boeing Co  and Bell Helicopter, a unit of Textron Inc, saving $1 billion over that period, the program's manager said in an interview on Monday. LONDON British Airways will receive its first two Boeing  787 Dreamliner planes on June 26 and 27 and its first Airbus  A380 superjumbo jet seven days later, becoming the first European airline to operate both aircraft.U.S. Navy to sign deal with Bell, Boeing for 99 more V-22 tilt-rotor aircraft WASHINGTON, June 10 The U.S. Navy plans to sign this week a five-year contract valued just under $6.5 billion to buy 99 new V-22 Osprey tilt-rotor aircraft built by Boeing Co  and Bell Helicopter, a unit of Textron Inc, saving $1 billion over that period, the program's manager said in an interview on Monday.  
BMY,Former Bristol-Myers executive admits to insider tradingFormer Bristol-Myers executive admits to insider trading A former Bristol-Myers Squibb Co  finance executive on Monday pleaded guilty to an insider trading charge, admitting to buying stock options in a biotechnology company that the drugmaker was preparing to buy.  Former Bristol-Myers executive admits to insider trading A former Bristol-Myers Squibb Co  finance executive on Monday pleaded guilty to an insider trading charge, admitting to buying stock options in a biotechnology company that the drugmaker was preparing to buy. * Defendant accused of buying options in takeover targetsFormer Bristol-Myers executive admits to insider trading A former Bristol-Myers Squibb Co  finance executive on Monday pleaded guilty to an insider trading charge, admitting to buying stock options in a biotechnology company that the drugmaker was preparing to buy.  
DAL,EXCLUSIVE-EU regulators to clear Delta, Virgin deal unconditionally -sources BRUSSELS, June 10 EU antitrust regulators are expected to give unconditional approval to Delta Air Lines  to buy a 49 percent stake in Virgin Atlantic, allowing it to compete better with U.S. rivals, three people with knowledge of the matter said on Monday. 
