ACN,Piercy hits another jackpot to stun DonaldDonald exits, Mahan and Poulter advanceTime off gives Poulter a Match Play boostColsaerts thrives on tour with roadie days behind him MARANA, Arizona With his reckless nightclubbing days while living "like a roadie" now well behind him, Belgian Nicolas Colsaerts has relished his golfing success over the last two years.  Colsaerts thrives on tour with roadie days behind him MARANA, Arizona With his reckless nightclubbing days while living "like a roadie" now well behind him, Belgian Nicolas Colsaerts has relished his golfing success over the last two years. MARANA, Arizona A bold decision to take six weeks off since he tied for ninth at the PGA Tour's season-opening Hyundai Tournament of Champions in Hawaii has, so far, proved to be immensely beneficial for Ian Poulter.Colsaerts thrives on tour with roadie days behind him MARANA, Arizona With his reckless nightclubbing days while living "like a roadie" now well behind him, Belgian Nicolas Colsaerts has relished his golfing success over the last two years.   Time off gives Poulter a Match Play boostColsaerts thrives on tour with roadie days behind him MARANA, Arizona With his reckless nightclubbing days while living "like a roadie" now well behind him, Belgian Nicolas Colsaerts has relished his golfing success over the last two years.  Colsaerts thrives on tour with roadie days behind him MARANA, Arizona With his reckless nightclubbing days while living "like a roadie" now well behind him, Belgian Nicolas Colsaerts has relished his golfing success over the last two years. MARANA, Arizona A bold decision to take six weeks off since he tied for ninth at the PGA Tour's season-opening Hyundai Tournament of Champions in Hawaii has, so far, proved to be immensely beneficial for Ian Poulter.Colsaerts thrives on tour with roadie days behind him MARANA, Arizona With his reckless nightclubbing days while living "like a roadie" now well behind him, Belgian Nicolas Colsaerts has relished his golfing success over the last two years.  MARANA, Arizona Former champion Luke Donald was the biggest name to fall in the second round of the snow-delayed WGC-Accenture Match Play Championship after being pummeled 7&6 by American Scott Piercy on Friday.Time off gives Poulter a Match Play boostColsaerts thrives on tour with roadie days behind him MARANA, Arizona With his reckless nightclubbing days while living "like a roadie" now well behind him, Belgian Nicolas Colsaerts has relished his golfing success over the last two years.  Colsaerts thrives on tour with roadie days behind him MARANA, Arizona With his reckless nightclubbing days while living "like a roadie" now well behind him, Belgian Nicolas Colsaerts has relished his golfing success over the last two years. MARANA, Arizona A bold decision to take six weeks off since he tied for ninth at the PGA Tour's season-opening Hyundai Tournament of Champions in Hawaii has, so far, proved to be immensely beneficial for Ian Poulter.Colsaerts thrives on tour with roadie days behind him MARANA, Arizona With his reckless nightclubbing days while living "like a roadie" now well behind him, Belgian Nicolas Colsaerts has relished his golfing success over the last two years.    Donald exits, Mahan and Poulter advanceTime off gives Poulter a Match Play boostColsaerts thrives on tour with roadie days behind him MARANA, Arizona With his reckless nightclubbing days while living "like a roadie" now well behind him, Belgian Nicolas Colsaerts has relished his golfing success over the last two years.  Colsaerts thrives on tour with roadie days behind him MARANA, Arizona With his reckless nightclubbing days while living "like a roadie" now well behind him, Belgian Nicolas Colsaerts has relished his golfing success over the last two years. MARANA, Arizona A bold decision to take six weeks off since he tied for ninth at the PGA Tour's season-opening Hyundai Tournament of Champions in Hawaii has, so far, proved to be immensely beneficial for Ian Poulter.Colsaerts thrives on tour with roadie days behind him MARANA, Arizona With his reckless nightclubbing days while living "like a roadie" now well behind him, Belgian Nicolas Colsaerts has relished his golfing success over the last two years.   Time off gives Poulter a Match Play boostColsaerts thrives on tour with roadie days behind him MARANA, Arizona With his reckless nightclubbing days while living "like a roadie" now well behind him, Belgian Nicolas Colsaerts has relished his golfing success over the last two years.  Colsaerts thrives on tour with roadie days behind him MARANA, Arizona With his reckless nightclubbing days while living "like a roadie" now well behind him, Belgian Nicolas Colsaerts has relished his golfing success over the last two years. MARANA, Arizona A bold decision to take six weeks off since he tied for ninth at the PGA Tour's season-opening Hyundai Tournament of Champions in Hawaii has, so far, proved to be immensely beneficial for Ian Poulter.Colsaerts thrives on tour with roadie days behind him MARANA, Arizona With his reckless nightclubbing days while living "like a roadie" now well behind him, Belgian Nicolas Colsaerts has relished his golfing success over the last two years.  MARANA, Arizona Former champion Luke Donald was the biggest name to fall in the second round of the snow-delayed WGC-Accenture Match Play Championship after being pummeled 7&6 by American Scott Piercy on Friday.Time off gives Poulter a Match Play boostColsaerts thrives on tour with roadie days behind him MARANA, Arizona With his reckless nightclubbing days while living "like a roadie" now well behind him, Belgian Nicolas Colsaerts has relished his golfing success over the last two years.  Colsaerts thrives on tour with roadie days behind him MARANA, Arizona With his reckless nightclubbing days while living "like a roadie" now well behind him, Belgian Nicolas Colsaerts has relished his golfing success over the last two years. MARANA, Arizona A bold decision to take six weeks off since he tied for ninth at the PGA Tour's season-opening Hyundai Tournament of Champions in Hawaii has, so far, proved to be immensely beneficial for Ian Poulter.Colsaerts thrives on tour with roadie days behind him MARANA, Arizona With his reckless nightclubbing days while living "like a roadie" now well behind him, Belgian Nicolas Colsaerts has relished his golfing success over the last two years.   MARANA, Arizona Six years after he overcame the odds to earn a $2 million cheque, Scott Piercy landed a different jackpot with a stunning 7&6 victory over Luke Donald at the WGC-Accenture Match Play Championship on Friday.Donald exits, Mahan and Poulter advanceTime off gives Poulter a Match Play boostColsaerts thrives on tour with roadie days behind him MARANA, Arizona With his reckless nightclubbing days while living "like a roadie" now well behind him, Belgian Nicolas Colsaerts has relished his golfing success over the last two years.  Colsaerts thrives on tour with roadie days behind him MARANA, Arizona With his reckless nightclubbing days while living "like a roadie" now well behind him, Belgian Nicolas Colsaerts has relished his golfing success over the last two years. MARANA, Arizona A bold decision to take six weeks off since he tied for ninth at the PGA Tour's season-opening Hyundai Tournament of Champions in Hawaii has, so far, proved to be immensely beneficial for Ian Poulter.Colsaerts thrives on tour with roadie days behind him MARANA, Arizona With his reckless nightclubbing days while living "like a roadie" now well behind him, Belgian Nicolas Colsaerts has relished his golfing success over the last two years.   Time off gives Poulter a Match Play boostColsaerts thrives on tour with roadie days behind him MARANA, Arizona With his reckless nightclubbing days while living "like a roadie" now well behind him, Belgian Nicolas Colsaerts has relished his golfing success over the last two years.  Colsaerts thrives on tour with roadie days behind him MARANA, Arizona With his reckless nightclubbing days while living "like a roadie" now well behind him, Belgian Nicolas Colsaerts has relished his golfing success over the last two years. MARANA, Arizona A bold decision to take six weeks off since he tied for ninth at the PGA Tour's season-opening Hyundai Tournament of Champions in Hawaii has, so far, proved to be immensely beneficial for Ian Poulter.Colsaerts thrives on tour with roadie days behind him MARANA, Arizona With his reckless nightclubbing days while living "like a roadie" now well behind him, Belgian Nicolas Colsaerts has relished his golfing success over the last two years.  MARANA, Arizona Former champion Luke Donald was the biggest name to fall in the second round of the snow-delayed WGC-Accenture Match Play Championship after being pummeled 7&6 by American Scott Piercy on Friday.Time off gives Poulter a Match Play boostColsaerts thrives on tour with roadie days behind him MARANA, Arizona With his reckless nightclubbing days while living "like a roadie" now well behind him, Belgian Nicolas Colsaerts has relished his golfing success over the last two years.  Colsaerts thrives on tour with roadie days behind him MARANA, Arizona With his reckless nightclubbing days while living "like a roadie" now well behind him, Belgian Nicolas Colsaerts has relished his golfing success over the last two years. MARANA, Arizona A bold decision to take six weeks off since he tied for ninth at the PGA Tour's season-opening Hyundai Tournament of Champions in Hawaii has, so far, proved to be immensely beneficial for Ian Poulter.Colsaerts thrives on tour with roadie days behind him MARANA, Arizona With his reckless nightclubbing days while living "like a roadie" now well behind him, Belgian Nicolas Colsaerts has relished his golfing success over the last two years.    
AAPL,Microsoft says small number of its computers hackedUPDATE 4-Einhorn scores legal victory vs Apple in cash scuffle * Judge says Einhorn "likely to succeed" on merits of case  UPDATE 4-Einhorn scores legal victory vs Apple in cash scuffle * Judge says Einhorn "likely to succeed" on merits of case SEATTLE Microsoft Corp said on Friday a small number of its computers, including some in its Mac software business unit, were infected with malware, but there was no evidence of customer data being affected and it is continuing its investigation.UPDATE 4-Einhorn scores legal victory vs Apple in cash scuffle * Judge says Einhorn "likely to succeed" on merits of case  
BA,UPDATE 4-Boeing proposes full 787 battery fix to FAA-sourcesBoeing says talks with SPEEA union will resume WednesdayBoeing says talks with SPEEA union will resume Wednesday SEATTLE Boeing Co  and its engineering union have agreed to resume talks on Wednesday to replace an expired contract for 7,500 technical workers, another step toward settling negotiations that have continued for nearly a year.  Boeing says talks with SPEEA union will resume Wednesday SEATTLE Boeing Co  and its engineering union have agreed to resume talks on Wednesday to replace an expired contract for 7,500 technical workers, another step toward settling negotiations that have continued for nearly a year. SEATTLE, Feb 22 Boeing Co and its engineering union have agreed to resume talks on Wednesday to replace an expired contract for 7,500 technical workers, another step toward settling negotiations that have continued for nearly a year.Boeing says talks with SPEEA union will resume Wednesday SEATTLE Boeing Co  and its engineering union have agreed to resume talks on Wednesday to replace an expired contract for 7,500 technical workers, another step toward settling negotiations that have continued for nearly a year.   Boeing says talks with SPEEA union will resume WednesdayBoeing says talks with SPEEA union will resume Wednesday SEATTLE Boeing Co  and its engineering union have agreed to resume talks on Wednesday to replace an expired contract for 7,500 technical workers, another step toward settling negotiations that have continued for nearly a year.  Boeing says talks with SPEEA union will resume Wednesday SEATTLE Boeing Co  and its engineering union have agreed to resume talks on Wednesday to replace an expired contract for 7,500 technical workers, another step toward settling negotiations that have continued for nearly a year. SEATTLE, Feb 22 Boeing Co and its engineering union have agreed to resume talks on Wednesday to replace an expired contract for 7,500 technical workers, another step toward settling negotiations that have continued for nearly a year.Boeing says talks with SPEEA union will resume Wednesday SEATTLE Boeing Co  and its engineering union have agreed to resume talks on Wednesday to replace an expired contract for 7,500 technical workers, another step toward settling negotiations that have continued for nearly a year.  WASHINGTON/SEATTLE, Feb 22 Boeing Co on Friday gave U.S. aviation regulators its plan to fix the volatile battery aboard its new 787 Dreamliner, even though investigators have not yet determined what caused the batteries to overheat on two planes last month.Boeing says talks with SPEEA union will resume WednesdayBoeing says talks with SPEEA union will resume Wednesday SEATTLE Boeing Co  and its engineering union have agreed to resume talks on Wednesday to replace an expired contract for 7,500 technical workers, another step toward settling negotiations that have continued for nearly a year.  Boeing says talks with SPEEA union will resume Wednesday SEATTLE Boeing Co  and its engineering union have agreed to resume talks on Wednesday to replace an expired contract for 7,500 technical workers, another step toward settling negotiations that have continued for nearly a year. SEATTLE, Feb 22 Boeing Co and its engineering union have agreed to resume talks on Wednesday to replace an expired contract for 7,500 technical workers, another step toward settling negotiations that have continued for nearly a year.Boeing says talks with SPEEA union will resume Wednesday SEATTLE Boeing Co  and its engineering union have agreed to resume talks on Wednesday to replace an expired contract for 7,500 technical workers, another step toward settling negotiations that have continued for nearly a year.   
JNJ,Johnson & Johnson says its marketing practices being investigated Feb 22 Johnson & Johnson said on Friday the U.S. Justice Department is investigating the company's marketing practices related to the hip-replacement product it recalled in 2010 over safety concerns. 
MSFT,Microsoft says small number of its computers hacked SEATTLE Microsoft Corp said on Friday a small number of its computers, including some in its Mac software business unit, were infected with malware, but there was no evidence of customer data being affected and it is continuing its investigation. 
NWSA,NY Times received bid of over $100 mln for Boston Globe - WSJ Feb 22 The New York Times Co last month received a formal bid that valued its Boston Globe subsidiary at more than $100 million, with about a third of the value from buyers assuming some of the newspapers's pension liabilities, the Wall Street Journal said, citing people familiar with the matter. 
NWS,NY Times received bid of over $100 mln for Boston Globe - WSJ Feb 22 The New York Times Co last month received a formal bid that valued its Boston Globe subsidiary at more than $100 million, with about a third of the value from buyers assuming some of the newspapers's pension liabilities, the Wall Street Journal said, citing people familiar with the matter. 
