JPM,New Issue-Rentenbank prices 500 mln NOK 2020 bondCORRECTED-(OFFICIAL)-TABLE-Thomson Reuters Extel awards (Corrects to show Credit Suisse placed third in Leading Pan-European Brokerage Firm for Trading and Execution category, not Bank of America Merrill Lynch)     June 10 Bank of America Merrill Lynch  scooped the top prize at the annual Thomson Reuters  Extel Awards, ending UBS's 12-year winning streak, while JP Morgan was named best fund manager for the fourth consecutive year.      The following table lists the winners and runners-up in the awards:        AWARD                    RANK  CORRECTED-(OFFICIAL)-TABLE-Thomson Reuters Extel awards (Corrects to show Credit Suisse placed third in Leading Pan-European Brokerage Firm for Trading and Execution category, not Bank of America Merrill Lynch)     June 10 Bank of America Merrill Lynch  scooped the top prize at the annual Thomson Reuters  Extel Awards, ending UBS's 12-year winning streak, while JP Morgan was named best fund manager for the fourth consecutive year.      The following table lists the winners and runners-up in the awards:        AWARD                    RANK Notes                   Launched under issuer EMTN programmeCORRECTED-(OFFICIAL)-TABLE-Thomson Reuters Extel awards (Corrects to show Credit Suisse placed third in Leading Pan-European Brokerage Firm for Trading and Execution category, not Bank of America Merrill Lynch)     June 10 Bank of America Merrill Lynch  scooped the top prize at the annual Thomson Reuters  Extel Awards, ending UBS's 12-year winning streak, while JP Morgan was named best fund manager for the fourth consecutive year.      The following table lists the winners and runners-up in the awards:        AWARD                    RANK  
MCD,McDonald's May sales rise 2.6 percentUPDATE 1-McDonald's May sales rise 2.6 percent; shares up * Consensus Metrix had expected a 1.9 pct rise in global sales  UPDATE 1-McDonald's May sales rise 2.6 percent; shares up * Consensus Metrix had expected a 1.9 pct rise in global sales June 10 McDonald's Corp said sales at its established restaurants around the world rose 2.6 percent in May as it expanded late-night breakfasts, tweaked other menus and spent more on advertising value-priced meals.UPDATE 1-McDonald's May sales rise 2.6 percent; shares up * Consensus Metrix had expected a 1.9 pct rise in global sales  
MSFT,Microsoft prices Xbox at $499 for November launchMicrosoft prices Xbox at $499 for November launch LOS ANGELES Microsoft Corp said on Monday its new Xbox One console would be launched in November at a price of $499 in the United States.  Microsoft prices Xbox at $499 for November launch LOS ANGELES Microsoft Corp said on Monday its new Xbox One console would be launched in November at a price of $499 in the United States. LOS ANGELES, June 10 Microsoft Corp  said on Monday its new Xbox One console would be launched in November at a price of $499 in the United States.Microsoft prices Xbox at $499 for November launch LOS ANGELES Microsoft Corp said on Monday its new Xbox One console would be launched in November at a price of $499 in the United States.  
MON,UPDATE 1-Brazil says China clears new GMO soy varieties for importOrganic growers lose decision in suit vs. Monsanto over seedsUPDATE 1-Organic growers lose decision in suit vs. Monsanto over seeds June 10 Monsanto Co. on Monday won another round in a legal battle with U.S. organic growers as an appeals court threw out the growers' efforts to stop the company from suing farmers if traces of its patented biotech genes are found in crops.  UPDATE 1-Organic growers lose decision in suit vs. Monsanto over seeds June 10 Monsanto Co. on Monday won another round in a legal battle with U.S. organic growers as an appeals court threw out the growers' efforts to stop the company from suing farmers if traces of its patented biotech genes are found in crops. June 10 Monsanto Co. on Monday won another round in a lawsuit brought by U.S. organic growers as an appellate court threw out the growers' legal challenge to prohibit the biotech seed company from suing them.UPDATE 1-Organic growers lose decision in suit vs. Monsanto over seeds June 10 Monsanto Co. on Monday won another round in a legal battle with U.S. organic growers as an appeals court threw out the growers' efforts to stop the company from suing farmers if traces of its patented biotech genes are found in crops.   Organic growers lose decision in suit vs. Monsanto over seedsUPDATE 1-Organic growers lose decision in suit vs. Monsanto over seeds June 10 Monsanto Co. on Monday won another round in a legal battle with U.S. organic growers as an appeals court threw out the growers' efforts to stop the company from suing farmers if traces of its patented biotech genes are found in crops.  UPDATE 1-Organic growers lose decision in suit vs. Monsanto over seeds June 10 Monsanto Co. on Monday won another round in a legal battle with U.S. organic growers as an appeals court threw out the growers' efforts to stop the company from suing farmers if traces of its patented biotech genes are found in crops. June 10 Monsanto Co. on Monday won another round in a lawsuit brought by U.S. organic growers as an appellate court threw out the growers' legal challenge to prohibit the biotech seed company from suing them.UPDATE 1-Organic growers lose decision in suit vs. Monsanto over seeds June 10 Monsanto Co. on Monday won another round in a legal battle with U.S. organic growers as an appeals court threw out the growers' efforts to stop the company from suing farmers if traces of its patented biotech genes are found in crops.  * Approval ends anxious wait for Brazil     * New varieties fend off caterpillars, other threats     * Monsanto shares up 4.8 percent early on Monday       BRASILIA, June 10 China has authorized three new varieties of genetically-modified soy from world No. 2 grower Brazil, including Monsanto Co's Intacta RR2, the South American country's agriculture ministry said on Monday, an endorsement critical to avoid trade disruption with Brazil's top soy customer.     China's Agriculture MiniOrganic growers lose decision in suit vs. Monsanto over seedsUPDATE 1-Organic growers lose decision in suit vs. Monsanto over seeds June 10 Monsanto Co. on Monday won another round in a legal battle with U.S. organic growers as an appeals court threw out the growers' efforts to stop the company from suing farmers if traces of its patented biotech genes are found in crops.  UPDATE 1-Organic growers lose decision in suit vs. Monsanto over seeds June 10 Monsanto Co. on Monday won another round in a legal battle with U.S. organic growers as an appeals court threw out the growers' efforts to stop the company from suing farmers if traces of its patented biotech genes are found in crops. June 10 Monsanto Co. on Monday won another round in a lawsuit brought by U.S. organic growers as an appellate court threw out the growers' legal challenge to prohibit the biotech seed company from suing them.UPDATE 1-Organic growers lose decision in suit vs. Monsanto over seeds June 10 Monsanto Co. on Monday won another round in a legal battle with U.S. organic growers as an appeals court threw out the growers' efforts to stop the company from suing farmers if traces of its patented biotech genes are found in crops.   
NFLX,Netflix does not infringe Rovi patents -judge's preliminary decisionUPDATE 1-Netflix does not infringe on Rovi patents -preliminary ruling WASHINGTON, June 10 The internet video streaming service Netflix Inc does not infringe on Rovi Corp  patents for interactive television program guides, an International Trade Commission judge said in a preliminary decision.  UPDATE 1-Netflix does not infringe on Rovi patents -preliminary ruling WASHINGTON, June 10 The internet video streaming service Netflix Inc does not infringe on Rovi Corp  patents for interactive television program guides, an International Trade Commission judge said in a preliminary decision. WASHINGTON, June 10 Internet video streaming service Netflix Inc does not infringe Rovi Corp  patents for interactive television program guides, an International Trade Commission judge said on Monday in a preliminary decision.UPDATE 1-Netflix does not infringe on Rovi patents -preliminary ruling WASHINGTON, June 10 The internet video streaming service Netflix Inc does not infringe on Rovi Corp  patents for interactive television program guides, an International Trade Commission judge said in a preliminary decision.  
PSX,INSIGHT-Ethanol lobby sees red over a yellow gas hose in Kansas NEW YORK, June 10 At a handful of gas stations in eastern Kansas, the intensifying fight between major oil refiners and the ethanol industry over the future of America's fuel supply has found a new focus: the color of the gas hose. 
LUV,Southwest flight diverted to Phoenix over possible threat PHOENIX, June 10 A Southwest Airlines flight was diverted to Phoenix on Monday after a possible threat was received, airport authorities said. 
TRV,Travelers to buy insurer from E-L Financial for $1.1 blnUPDATE 2-Travelers to buy insurer from Canada's E-L Financial for $1.1 bln June 10 U.S. insurer Travelers Co Inc  said it would buy Dominion of Canada General Insurance Co from E-L Financial Co Ltd for about $1.1 billion to boost its presence in Canada.  UPDATE 2-Travelers to buy insurer from Canada's E-L Financial for $1.1 bln June 10 U.S. insurer Travelers Co Inc  said it would buy Dominion of Canada General Insurance Co from E-L Financial Co Ltd for about $1.1 billion to boost its presence in Canada. June 10 Travelers Co Inc said it would buy Dominion of Canada General Insurance Co from E-L Financial Co Ltd for about $1.1 billion to boost its presence in Canada.UPDATE 2-Travelers to buy insurer from Canada's E-L Financial for $1.1 bln June 10 U.S. insurer Travelers Co Inc  said it would buy Dominion of Canada General Insurance Co from E-L Financial Co Ltd for about $1.1 billion to boost its presence in Canada.  
WMT,Wal-Mart CEO, others again get many "No" votes from shareholders June 10 Wal-Mart Stores Inc shareholders approved the election of all 14 director nominees at the company's annual meeting last week, but many again voted against Chief Executive Michael Duke and others as the company continued to face fallout from a Mexican bribery scandal. 
