AAPL,UPDATE 2-First Steve Jobs movie gets red carpet premiere PARK CITY, Utah, Jan 25 The first movie about Apple's legendary co-founder got a warm reception at its world premiere on Friday, just 15 months after Steve Jobs' death. 
BA,UPDATE 1-Japan's ANA cancels more Dreamliner flights; no quick fix in sightAnalysis: Lengthy 787 probe, fixing problem, may cost Boeing dear SEATTLE The slow progress of investigations into battery problems on Boeing Co's 787 Dreamliner jets suggest the new plane could be grounded for months, raising fears that the financial hit to Boeing will be greater than had been initially predicted.  Analysis: Lengthy 787 probe, fixing problem, may cost Boeing dear SEATTLE The slow progress of investigations into battery problems on Boeing Co's 787 Dreamliner jets suggest the new plane could be grounded for months, raising fears that the financial hit to Boeing will be greater than had been initially predicted. * ANA cancels another 379 Dreamliner flights     * ANA says 82,620 passengers affected by grounding     * Regulators, experts suggest probe may take months       By Leika Kihara     TOKYO, Jan 26 All Nippon Airways Co, which has the biggest fleet of Boeing Co's troubled Dreamliner jets, on Saturday cancelled hundreds of flights until Feb. 18, signalling a quick fix to the plane's safety problems was unlikely.     ANA, Asia's biggest airline by revenue and an important launch customerAnalysis: Lengthy 787 probe, fixing problem, may cost Boeing dear SEATTLE The slow progress of investigations into battery problems on Boeing Co's 787 Dreamliner jets suggest the new plane could be grounded for months, raising fears that the financial hit to Boeing will be greater than had been initially predicted.  
CBS,UPDATE 1-Viacom CEO Philippe Dauman's pay falls by $10 million Jan 25 Viacom Inc, parent of cable networks MTV and Nickelodeon and movie studio Paramount Pictures, paid Chief Executive Philippe Dauman about $10 million less in 2012 than a year earlier, a regulatory filing showed. 
JPM,JPMorgan risk officer John Hogan takes leave until summer Jan 25 The chief risk officer of JPMorgan Chase & Co, John Hogan, is taking a leave of absence until early summer to spend time with his family after grappling with the fallout from the company's "London Whale" trading debacle for much of the past year. 
MS,Morgan Stanley to allow India banking licence to lapse -report MUMBAI, Jan 26 Morgan Stanley intends to allow its banking licence in India to lapse as part of its changed business strategy, the Economic Times newspaper reported on Saturday. 
SPG,PIMCO managing director Simon to leave firm NEW YORK, Jan 25 Scott Simon, a managing director at Pacific Investment Management Co who heads mortgage- and asset-backed securities investing, plans to retire from the manager of the world's largest bond fund, a source familiar with the situation said. 
VIAB,UPDATE 1-Viacom CEO Philippe Dauman's pay falls by $10 million Jan 25 Viacom Inc, parent of cable networks MTV and Nickelodeon and movie studio Paramount Pictures, paid Chief Executive Philippe Dauman about $10 million less in 2012 than a year earlier, a regulatory filing showed. 
WYNN,Okada sues Wynn Resorts in bid to keep board seat SAN FRANCISCO, Jan 25 Japanese gaming billionaire Kazuo Okada has filed a lawsuit in a Nevada court in an attempt to keep his seat on the board of Wynn Resorts  Ltd. 
