ITW,Market Chatter- Corporate finance press digestUPDATE 1-Market Chatter-Corporate finance press digestCANADA STOCKS-TSX may open lower; Iran deal and Asian tension in focus Nov 26 Canadian stock market futures pointed to a flat to slightly lower open on Tuesday as investors turned cautious about the impact of Iran's nuclear deal and an escalation of political tensions in parts of Asia.  CANADA STOCKS-TSX may open lower; Iran deal and Asian tension in focus Nov 26 Canadian stock market futures pointed to a flat to slightly lower open on Tuesday as investors turned cautious about the impact of Iran's nuclear deal and an escalation of political tensions in parts of Asia. Nov 26 The following corporate finance-related stories were reported by media:CANADA STOCKS-TSX may open lower; Iran deal and Asian tension in focus Nov 26 Canadian stock market futures pointed to a flat to slightly lower open on Tuesday as investors turned cautious about the impact of Iran's nuclear deal and an escalation of political tensions in parts of Asia.   UPDATE 1-Market Chatter-Corporate finance press digestCANADA STOCKS-TSX may open lower; Iran deal and Asian tension in focus Nov 26 Canadian stock market futures pointed to a flat to slightly lower open on Tuesday as investors turned cautious about the impact of Iran's nuclear deal and an escalation of political tensions in parts of Asia.  CANADA STOCKS-TSX may open lower; Iran deal and Asian tension in focus Nov 26 Canadian stock market futures pointed to a flat to slightly lower open on Tuesday as investors turned cautious about the impact of Iran's nuclear deal and an escalation of political tensions in parts of Asia. Nov 26 The following corporate finance-related stories were reported by media:CANADA STOCKS-TSX may open lower; Iran deal and Asian tension in focus Nov 26 Canadian stock market futures pointed to a flat to slightly lower open on Tuesday as investors turned cautious about the impact of Iran's nuclear deal and an escalation of political tensions in parts of Asia.  Nov 26 The following corporate finance-related stories were reported by media:UPDATE 1-Market Chatter-Corporate finance press digestCANADA STOCKS-TSX may open lower; Iran deal and Asian tension in focus Nov 26 Canadian stock market futures pointed to a flat to slightly lower open on Tuesday as investors turned cautious about the impact of Iran's nuclear deal and an escalation of political tensions in parts of Asia.  CANADA STOCKS-TSX may open lower; Iran deal and Asian tension in focus Nov 26 Canadian stock market futures pointed to a flat to slightly lower open on Tuesday as investors turned cautious about the impact of Iran's nuclear deal and an escalation of political tensions in parts of Asia. Nov 26 The following corporate finance-related stories were reported by media:CANADA STOCKS-TSX may open lower; Iran deal and Asian tension in focus Nov 26 Canadian stock market futures pointed to a flat to slightly lower open on Tuesday as investors turned cautious about the impact of Iran's nuclear deal and an escalation of political tensions in parts of Asia.   
INTC,Intel wants $500 million for Internet TV service -BloombergIntel wants $500 million for Internet TV service: Bloomberg SAN FRANCISCO Intel Corp is trying to sell its yet-to-launch Internet television service for $500 million and wants to complete a deal by year-end, Bloomberg reported on Monday.  Intel wants $500 million for Internet TV service: Bloomberg SAN FRANCISCO Intel Corp is trying to sell its yet-to-launch Internet television service for $500 million and wants to complete a deal by year-end, Bloomberg reported on Monday. SAN FRANCISCO, Nov 25 Intel Corp is trying to sell its yet-to-launch Internet television service for $500 million and wants to complete a deal by year-end, Bloomberg reported on Monday.Intel wants $500 million for Internet TV service: Bloomberg SAN FRANCISCO Intel Corp is trying to sell its yet-to-launch Internet television service for $500 million and wants to complete a deal by year-end, Bloomberg reported on Monday.  
LMT,Software maker Command wins $24.8 mln judgment against LockheedUPDATE 1-Small software maker wins $24.8 mln judgment vs LockheedSmall software maker wins $24.8 million judgment vs. Lockheed WASHINGTON Command Technology Inc, a privately held firm that developed electronic maintenance manuals for Lockheed Martin Corp's F-16 fighter jet, has won a $24.8 million judgment against the Pentagon's biggest supplier for unfair competition.  Small software maker wins $24.8 million judgment vs. Lockheed WASHINGTON Command Technology Inc, a privately held firm that developed electronic maintenance manuals for Lockheed Martin Corp's F-16 fighter jet, has won a $24.8 million judgment against the Pentagon's biggest supplier for unfair competition. WASHINGTON, Nov 26 Command Technology Inc, a privately held firm that developed electronic maintenance manuals for Lockheed Martin Corp's F-16 fighter jet, has won a $24.8 million judgment against the Pentagon's biggest supplier for unfair competition.Small software maker wins $24.8 million judgment vs. Lockheed WASHINGTON Command Technology Inc, a privately held firm that developed electronic maintenance manuals for Lockheed Martin Corp's F-16 fighter jet, has won a $24.8 million judgment against the Pentagon's biggest supplier for unfair competition.   UPDATE 1-Small software maker wins $24.8 mln judgment vs LockheedSmall software maker wins $24.8 million judgment vs. Lockheed WASHINGTON Command Technology Inc, a privately held firm that developed electronic maintenance manuals for Lockheed Martin Corp's F-16 fighter jet, has won a $24.8 million judgment against the Pentagon's biggest supplier for unfair competition.  Small software maker wins $24.8 million judgment vs. Lockheed WASHINGTON Command Technology Inc, a privately held firm that developed electronic maintenance manuals for Lockheed Martin Corp's F-16 fighter jet, has won a $24.8 million judgment against the Pentagon's biggest supplier for unfair competition. WASHINGTON, Nov 26 Command Technology Inc, a privately held firm that developed electronic maintenance manuals for Lockheed Martin Corp's F-16 fighter jet, has won a $24.8 million judgment against the Pentagon's biggest supplier for unfair competition.Small software maker wins $24.8 million judgment vs. Lockheed WASHINGTON Command Technology Inc, a privately held firm that developed electronic maintenance manuals for Lockheed Martin Corp's F-16 fighter jet, has won a $24.8 million judgment against the Pentagon's biggest supplier for unfair competition.  WASHINGTON, Nov 26 Command Technology Inc, a privately held firm that developed electronic maintenance manuals for Lockheed Martin Corp's F-16 fighter jet, has won a $24.8 million judgment against the Pentagon's biggest supplier after a jury found Lockheed guilty of unfairly competing with the smaller firm.UPDATE 1-Small software maker wins $24.8 mln judgment vs LockheedSmall software maker wins $24.8 million judgment vs. Lockheed WASHINGTON Command Technology Inc, a privately held firm that developed electronic maintenance manuals for Lockheed Martin Corp's F-16 fighter jet, has won a $24.8 million judgment against the Pentagon's biggest supplier for unfair competition.  Small software maker wins $24.8 million judgment vs. Lockheed WASHINGTON Command Technology Inc, a privately held firm that developed electronic maintenance manuals for Lockheed Martin Corp's F-16 fighter jet, has won a $24.8 million judgment against the Pentagon's biggest supplier for unfair competition. WASHINGTON, Nov 26 Command Technology Inc, a privately held firm that developed electronic maintenance manuals for Lockheed Martin Corp's F-16 fighter jet, has won a $24.8 million judgment against the Pentagon's biggest supplier for unfair competition.Small software maker wins $24.8 million judgment vs. Lockheed WASHINGTON Command Technology Inc, a privately held firm that developed electronic maintenance manuals for Lockheed Martin Corp's F-16 fighter jet, has won a $24.8 million judgment against the Pentagon's biggest supplier for unfair competition.   
MCK,Hedge fund Elliott gains control of 25 pct of CelesioUPDATE 2-Hedge fund Elliott lifts stake in Celesio * Celesio says Elliott has control of 25 pct of voting rights  UPDATE 2-Hedge fund Elliott lifts stake in Celesio * Celesio says Elliott has control of 25 pct of voting rights FRANKFURT, Nov 26 Hedge fund Elliott International has gained control of 25.16 percent of the voting rights in German drugs distributor Celesio, the subject of an $8.3 billion takeover bid by U.S. rival McKesson , Celesio said in a regulatory statement on Thursday.UPDATE 2-Hedge fund Elliott lifts stake in Celesio * Celesio says Elliott has control of 25 pct of voting rights  
MS,Carlyle to buy funds-of-hedge-funds manager Carlyle Group LP  said on Tuesday it would acquire Diversified Global Asset Management Corporation (DGAM), becoming the latest alternative asset manager to add a manager of funds that in turn invest in other hedge funds to its investment platform. 
MYL,INDIA PRESS-Mylan, two Indian companies line up to buy Bafna Pharma-Economic Times Note: Reuters has not verified this story and does not vouch for its accuracy. 
OMC,Omnicom, Publicis seek EU approval for $35.1 bln dealOmnicom, Publicis seek EU approval for $35.1 billion deal BRUSSELS U.S. advertising company Omnicom Group Inc and French peer Publicis Groupe SA have asked European Union antitrust regulators to approve their proposed $35.1 billion merger to create the world number one agency.  Omnicom, Publicis seek EU approval for $35.1 billion deal BRUSSELS U.S. advertising company Omnicom Group Inc and French peer Publicis Groupe SA have asked European Union antitrust regulators to approve their proposed $35.1 billion merger to create the world number one agency. BRUSSELS, Nov 26 U.S. advertising company Omnicom Group Inc and French peer Publicis Groupe SA  have asked European Union antitrust regulators to approve their proposed $35.1 billion merger to create the world number one agency.Omnicom, Publicis seek EU approval for $35.1 billion deal BRUSSELS U.S. advertising company Omnicom Group Inc and French peer Publicis Groupe SA have asked European Union antitrust regulators to approve their proposed $35.1 billion merger to create the world number one agency.  
QCOM,UPDATE 5-China probe may be aimed at Qualcomm's 4G royalties * Chinese regulator not saying why Qualcomm being investigated 
TMO,EU clears $13.6 bln Thermo Fisher, Life Tech deal with conditionsEU clears $13.6 billion Thermo Fisher, Life Tech deal with conditionsEU mergers and takeovers (Nov 26) BRUSSELS, Nov 26 The following are mergers under review by the European Commission and a brief guide to the EU merger process:  EU mergers and takeovers (Nov 26) BRUSSELS, Nov 26 The following are mergers under review by the European Commission and a brief guide to the EU merger process: BRUSSELS European Union antitrust regulators cleared on Tuesday Thermo Fisher Scientific Inc's  proposed $13.6 billion takeover of Life Technologies Corp , after the U.S. company agreed to sell three units to ease competition concerns.EU mergers and takeovers (Nov 26) BRUSSELS, Nov 26 The following are mergers under review by the European Commission and a brief guide to the EU merger process:   EU clears $13.6 billion Thermo Fisher, Life Tech deal with conditionsEU mergers and takeovers (Nov 26) BRUSSELS, Nov 26 The following are mergers under review by the European Commission and a brief guide to the EU merger process:  EU mergers and takeovers (Nov 26) BRUSSELS, Nov 26 The following are mergers under review by the European Commission and a brief guide to the EU merger process: BRUSSELS European Union antitrust regulators cleared on Tuesday Thermo Fisher Scientific Inc's  proposed $13.6 billion takeover of Life Technologies Corp , after the U.S. company agreed to sell three units to ease competition concerns.EU mergers and takeovers (Nov 26) BRUSSELS, Nov 26 The following are mergers under review by the European Commission and a brief guide to the EU merger process:  BRUSSELS, Nov 26 European Union antitrust regulators cleared on Tuesday Thermo Fisher Scientific Inc's  proposed $13.6 billion takeover of Life Technologies Corp, after the U.S. company agreed to sell three units to ease competition concerns.EU clears $13.6 billion Thermo Fisher, Life Tech deal with conditionsEU mergers and takeovers (Nov 26) BRUSSELS, Nov 26 The following are mergers under review by the European Commission and a brief guide to the EU merger process:  EU mergers and takeovers (Nov 26) BRUSSELS, Nov 26 The following are mergers under review by the European Commission and a brief guide to the EU merger process: BRUSSELS European Union antitrust regulators cleared on Tuesday Thermo Fisher Scientific Inc's  proposed $13.6 billion takeover of Life Technologies Corp , after the U.S. company agreed to sell three units to ease competition concerns.EU mergers and takeovers (Nov 26) BRUSSELS, Nov 26 The following are mergers under review by the European Commission and a brief guide to the EU merger process:   
