MMM,3M expects 2015 sales to grow 3-6 pct; raises dividend Dec 16 3M Co, a maker of adhesives, abrasives and other products for a variety of industries, said it expected organic sales to rise 3-6 percent in 2015, excluding the effect of foreign exchange rates. 
AET,INSIGHT-U.S. corporate health exchanges find no new blue chip clients NEW YORK, Dec 15 Healthcare companies including Aetna Inc, Mercer and Towers Watson & Co have invested hundreds of millions of dollars to build exchanges that allow company employees to buy their own insurance, betting that Corporate America wants to get out of managing workers' health benefits. 
APA,US jury finds Apache did not breach contract with W&T; OffshoreU.S. jury finds Apache did not breach contract with W&T; Offshore Apache Corp was not in breach of contract in a lawsuit brought by Houston-based oil and gas producer W&T; Offshore Inc in 2011, a federal jury found on Monday, according to a court filing.  U.S. jury finds Apache did not breach contract with W&T; Offshore Apache Corp was not in breach of contract in a lawsuit brought by Houston-based oil and gas producer W&T; Offshore Inc in 2011, a federal jury found on Monday, according to a court filing. Dec 15 Apache Corp was not in breach of contract in a lawsuit brought by Houston-based oil and gas producer W&T; Offshore Inc in 2011, a federal jury found on Monday, according to a court filing.U.S. jury finds Apache did not breach contract with W&T; Offshore Apache Corp was not in breach of contract in a lawsuit brought by Houston-based oil and gas producer W&T; Offshore Inc in 2011, a federal jury found on Monday, according to a court filing.  
