BA,India puts on hold search for missing plane - officialsUPDATE 1-India puts on hold search for missing plane -officials PORT BLAIR, India, March 16 India on Sunday put on hold its search for missing Malaysia Airlines flight MH370, at the request of the government in Kuala Lumpur, which wants to reassess the week-old hunt for the Boeing 777 that is suspected of being deliberately flown off course.  UPDATE 1-India puts on hold search for missing plane -officials PORT BLAIR, India, March 16 India on Sunday put on hold its search for missing Malaysia Airlines flight MH370, at the request of the government in Kuala Lumpur, which wants to reassess the week-old hunt for the Boeing 777 that is suspected of being deliberately flown off course. PORT BLAIR, India, March 16 India on Sunday put on hold its search for missing Malaysia Airlines flight MH370, at the request of the government in Kuala Lumpur, which wants to reassess the week-old hunt for the Boeing 777 that is now suspected of being hijacked.UPDATE 1-India puts on hold search for missing plane -officials PORT BLAIR, India, March 16 India on Sunday put on hold its search for missing Malaysia Airlines flight MH370, at the request of the government in Kuala Lumpur, which wants to reassess the week-old hunt for the Boeing 777 that is suspected of being deliberately flown off course.  
DG,Bargain retail lifts U.S. shopping centers as big names stumble BOSTON, March 16 Bargain store chains are flooding into North American malls and shopping centers like never before, upstaging old mainstays like J.C. Penney and Sears that are reeling from the one-two punch of an ailing economy and competition from online stores. 
FB,UPDATE 2-Alibaba picks US for IPO; in talks with six banks for lead roles * Alibaba's US IPO move could be a blow to Hong Kong stock exchange 
HRL,CORRECTED-UPDATE 1-Smithfield halts hog kill at N. Carolina plant due to hog virus -sources (Corrects with annual USDA slaughter figures paragraph nine) 
NKE,As giant U.S. IPO nears, Alibaba's China e-commerce crown slips * Share of China online retail fell for first time in 2013 
TJX,Bargain retail lifts U.S. shopping centers as big names stumble BOSTON, March 16 Bargain store chains are flooding into North American malls and shopping centers like never before, upstaging old mainstays like J.C. Penney and Sears that are reeling from the one-two punch of an ailing economy and competition from online stores. 
