ADM,UPDATE 3-Olam to become top-tier cocoa processor with $1.3 bln ADM dealFactbox: ADM's and Olam's cocoa businessesOlam to become top-tier cocoa processor with $1.3 bln ADM dealUPDATE 1-China buyers in deals for more than 1 mln tonnes of U.S. soy (Adds details on sellers, buyers, background, futures prices)  UPDATE 1-China buyers in deals for more than 1 mln tonnes of U.S. soy (Adds details on sellers, buyers, background, futures prices) NEW YORK/SINGAPORE Olam International Ltd will buy Archer Daniels Midland Co's cocoa business for $1.3 billion, catapulting the Singapore-based commodities firm into the top tier of global suppliers to the growing chocolate business.UPDATE 1-China buyers in deals for more than 1 mln tonnes of U.S. soy (Adds details on sellers, buyers, background, futures prices)   Olam to become top-tier cocoa processor with $1.3 bln ADM dealUPDATE 1-China buyers in deals for more than 1 mln tonnes of U.S. soy (Adds details on sellers, buyers, background, futures prices)  UPDATE 1-China buyers in deals for more than 1 mln tonnes of U.S. soy (Adds details on sellers, buyers, background, futures prices) NEW YORK/SINGAPORE Olam International Ltd will buy Archer Daniels Midland Co's cocoa business for $1.3 billion, catapulting the Singapore-based commodities firm into the top tier of global suppliers to the growing chocolate business.UPDATE 1-China buyers in deals for more than 1 mln tonnes of U.S. soy (Adds details on sellers, buyers, background, futures prices)  Olam International Ltd's $1.3 billion deal to buy Archer Daniels Midland Co's cocoa business will create one of the world's top cocoa bean processors and traders, rivaling Barry Callebaut AG and Cargill Inc.Olam to become top-tier cocoa processor with $1.3 bln ADM dealUPDATE 1-China buyers in deals for more than 1 mln tonnes of U.S. soy (Adds details on sellers, buyers, background, futures prices)  UPDATE 1-China buyers in deals for more than 1 mln tonnes of U.S. soy (Adds details on sellers, buyers, background, futures prices) NEW YORK/SINGAPORE Olam International Ltd will buy Archer Daniels Midland Co's cocoa business for $1.3 billion, catapulting the Singapore-based commodities firm into the top tier of global suppliers to the growing chocolate business.UPDATE 1-China buyers in deals for more than 1 mln tonnes of U.S. soy (Adds details on sellers, buyers, background, futures prices)    Factbox: ADM's and Olam's cocoa businessesOlam to become top-tier cocoa processor with $1.3 bln ADM dealUPDATE 1-China buyers in deals for more than 1 mln tonnes of U.S. soy (Adds details on sellers, buyers, background, futures prices)  UPDATE 1-China buyers in deals for more than 1 mln tonnes of U.S. soy (Adds details on sellers, buyers, background, futures prices) NEW YORK/SINGAPORE Olam International Ltd will buy Archer Daniels Midland Co's cocoa business for $1.3 billion, catapulting the Singapore-based commodities firm into the top tier of global suppliers to the growing chocolate business.UPDATE 1-China buyers in deals for more than 1 mln tonnes of U.S. soy (Adds details on sellers, buyers, background, futures prices)   Olam to become top-tier cocoa processor with $1.3 bln ADM dealUPDATE 1-China buyers in deals for more than 1 mln tonnes of U.S. soy (Adds details on sellers, buyers, background, futures prices)  UPDATE 1-China buyers in deals for more than 1 mln tonnes of U.S. soy (Adds details on sellers, buyers, background, futures prices) NEW YORK/SINGAPORE Olam International Ltd will buy Archer Daniels Midland Co's cocoa business for $1.3 billion, catapulting the Singapore-based commodities firm into the top tier of global suppliers to the growing chocolate business.UPDATE 1-China buyers in deals for more than 1 mln tonnes of U.S. soy (Adds details on sellers, buyers, background, futures prices)  Olam International Ltd's $1.3 billion deal to buy Archer Daniels Midland Co's cocoa business will create one of the world's top cocoa bean processors and traders, rivaling Barry Callebaut AG and Cargill Inc.Olam to become top-tier cocoa processor with $1.3 bln ADM dealUPDATE 1-China buyers in deals for more than 1 mln tonnes of U.S. soy (Adds details on sellers, buyers, background, futures prices)  UPDATE 1-China buyers in deals for more than 1 mln tonnes of U.S. soy (Adds details on sellers, buyers, background, futures prices) NEW YORK/SINGAPORE Olam International Ltd will buy Archer Daniels Midland Co's cocoa business for $1.3 billion, catapulting the Singapore-based commodities firm into the top tier of global suppliers to the growing chocolate business.UPDATE 1-China buyers in deals for more than 1 mln tonnes of U.S. soy (Adds details on sellers, buyers, background, futures prices)   NEW YORK/SINGAPORE, Dec 16 Olam International Ltd will buy Archer Daniels Midland Co's cocoa business for $1.3 billion, catapulting the Singapore-based commodities firm into the top tier of global suppliers to the growing chocolate business.Factbox: ADM's and Olam's cocoa businessesOlam to become top-tier cocoa processor with $1.3 bln ADM dealUPDATE 1-China buyers in deals for more than 1 mln tonnes of U.S. soy (Adds details on sellers, buyers, background, futures prices)  UPDATE 1-China buyers in deals for more than 1 mln tonnes of U.S. soy (Adds details on sellers, buyers, background, futures prices) NEW YORK/SINGAPORE Olam International Ltd will buy Archer Daniels Midland Co's cocoa business for $1.3 billion, catapulting the Singapore-based commodities firm into the top tier of global suppliers to the growing chocolate business.UPDATE 1-China buyers in deals for more than 1 mln tonnes of U.S. soy (Adds details on sellers, buyers, background, futures prices)   Olam to become top-tier cocoa processor with $1.3 bln ADM dealUPDATE 1-China buyers in deals for more than 1 mln tonnes of U.S. soy (Adds details on sellers, buyers, background, futures prices)  UPDATE 1-China buyers in deals for more than 1 mln tonnes of U.S. soy (Adds details on sellers, buyers, background, futures prices) NEW YORK/SINGAPORE Olam International Ltd will buy Archer Daniels Midland Co's cocoa business for $1.3 billion, catapulting the Singapore-based commodities firm into the top tier of global suppliers to the growing chocolate business.UPDATE 1-China buyers in deals for more than 1 mln tonnes of U.S. soy (Adds details on sellers, buyers, background, futures prices)  Olam International Ltd's $1.3 billion deal to buy Archer Daniels Midland Co's cocoa business will create one of the world's top cocoa bean processors and traders, rivaling Barry Callebaut AG and Cargill Inc.Olam to become top-tier cocoa processor with $1.3 bln ADM dealUPDATE 1-China buyers in deals for more than 1 mln tonnes of U.S. soy (Adds details on sellers, buyers, background, futures prices)  UPDATE 1-China buyers in deals for more than 1 mln tonnes of U.S. soy (Adds details on sellers, buyers, background, futures prices) NEW YORK/SINGAPORE Olam International Ltd will buy Archer Daniels Midland Co's cocoa business for $1.3 billion, catapulting the Singapore-based commodities firm into the top tier of global suppliers to the growing chocolate business.UPDATE 1-China buyers in deals for more than 1 mln tonnes of U.S. soy (Adds details on sellers, buyers, background, futures prices)    
BA,US STOCKS-Energy rally boosts Wall St despite global growth woesUS STOCKS-Energy rally boosts Wall St despite global growth woesUS STOCKS-Dow, S&P; 500 edge up as energy shares rebound; Nasdaq slips * Indexes: Dow up 0.4 pct, S&P; up 0.3 pct, Nasdaq down 0.1 pct   (Updates to afternoon)  US STOCKS-Dow, S&P; 500 edge up as energy shares rebound; Nasdaq slips * Indexes: Dow up 0.4 pct, S&P; up 0.3 pct, Nasdaq down 0.1 pct   (Updates to afternoon) * Indexes up: Dow 0.7 pct, S&P; 0.6 pct, Nasdaq 0.3 pct   (Updates prices)US STOCKS-Dow, S&P; 500 edge up as energy shares rebound; Nasdaq slips * Indexes: Dow up 0.4 pct, S&P; up 0.3 pct, Nasdaq down 0.1 pct   (Updates to afternoon)   US STOCKS-Energy rally boosts Wall St despite global growth woesUS STOCKS-Dow, S&P; 500 edge up as energy shares rebound; Nasdaq slips * Indexes: Dow up 0.4 pct, S&P; up 0.3 pct, Nasdaq down 0.1 pct   (Updates to afternoon)  US STOCKS-Dow, S&P; 500 edge up as energy shares rebound; Nasdaq slips * Indexes: Dow up 0.4 pct, S&P; up 0.3 pct, Nasdaq down 0.1 pct   (Updates to afternoon) * Indexes up: Dow 0.7 pct, S&P; 0.6 pct, Nasdaq 0.3 pct   (Updates prices)US STOCKS-Dow, S&P; 500 edge up as energy shares rebound; Nasdaq slips * Indexes: Dow up 0.4 pct, S&P; up 0.3 pct, Nasdaq down 0.1 pct   (Updates to afternoon)  * Indexes up: Dow 0.9 pct, S&P; 0.8 pct, Nasdaq 0.4 pct   (Updates to midday)US STOCKS-Energy rally boosts Wall St despite global growth woesUS STOCKS-Dow, S&P; 500 edge up as energy shares rebound; Nasdaq slips * Indexes: Dow up 0.4 pct, S&P; up 0.3 pct, Nasdaq down 0.1 pct   (Updates to afternoon)  US STOCKS-Dow, S&P; 500 edge up as energy shares rebound; Nasdaq slips * Indexes: Dow up 0.4 pct, S&P; up 0.3 pct, Nasdaq down 0.1 pct   (Updates to afternoon) * Indexes up: Dow 0.7 pct, S&P; 0.6 pct, Nasdaq 0.3 pct   (Updates prices)US STOCKS-Dow, S&P; 500 edge up as energy shares rebound; Nasdaq slips * Indexes: Dow up 0.4 pct, S&P; up 0.3 pct, Nasdaq down 0.1 pct   (Updates to afternoon)   
CVS,US STOCKS-Energy rally boosts Wall St despite global growth woesUS STOCKS-Energy rally boosts Wall St despite global growth woes * Indexes up: Dow 0.7 pct, S&P; 0.6 pct, Nasdaq 0.3 pct   (Updates prices)  US STOCKS-Energy rally boosts Wall St despite global growth woes * Indexes up: Dow 0.7 pct, S&P; 0.6 pct, Nasdaq 0.3 pct   (Updates prices) * Indexes up: Dow 0.9 pct, S&P; 0.8 pct, Nasdaq 0.4 pct   (Updates to midday)US STOCKS-Energy rally boosts Wall St despite global growth woes * Indexes up: Dow 0.7 pct, S&P; 0.6 pct, Nasdaq 0.3 pct   (Updates prices)  
DRI,Darden sales rise on growing demand at Olive GardenDarden sales rise on growing demand at Olive Garden Darden Restaurants Inc reported a 4.9 percent rise in quarterly sales, helped by higher comparable sales at its flagship Olive Garden chain, and raised the lower end of its adjusted profit forecast for the full year.  Darden sales rise on growing demand at Olive Garden Darden Restaurants Inc reported a 4.9 percent rise in quarterly sales, helped by higher comparable sales at its flagship Olive Garden chain, and raised the lower end of its adjusted profit forecast for the full year. Dec 16 Darden Restaurants Inc reported a 4.9 percent rise in quarterly sales as demand rose at its flagship Olive Garden chain.Darden sales rise on growing demand at Olive Garden Darden Restaurants Inc reported a 4.9 percent rise in quarterly sales, helped by higher comparable sales at its flagship Olive Garden chain, and raised the lower end of its adjusted profit forecast for the full year.  
XOM,Exclusive: Citgo valued at more than $10 billion in revised bids - sources Citgo Petroleum Corp, Venezuela's U.S. oil refining unit, has received revised bids from at least four bidders, some which have valued the company at more than $10 billion, according to three people familiar with the matter. 
F,Ford India to recall 20,752 EcoSport cars to inspect corrosion concernsFord India to recall 20,752 EcoSport cars to inspect corrosion concerns MUMBAI Ford Motor Co's  India unit on Tuesday said it will recall 20,752 EcoSport cars in the country to correct concerns about fuel and vapor line corrosion in the long-term.  Ford India to recall 20,752 EcoSport cars to inspect corrosion concerns MUMBAI Ford Motor Co's  India unit on Tuesday said it will recall 20,752 EcoSport cars in the country to correct concerns about fuel and vapor line corrosion in the long-term. MUMBAI, Dec 16 Ford Motor Co's India unit on Tuesday said it will recall 20,752 EcoSport cars in the country to correct concerns about fuel and vapour line corrosion in the long-term.Ford India to recall 20,752 EcoSport cars to inspect corrosion concerns MUMBAI Ford Motor Co's  India unit on Tuesday said it will recall 20,752 EcoSport cars in the country to correct concerns about fuel and vapor line corrosion in the long-term.  
GE,CAMBODIA PRESS-General Electric to sign power deal with Cambodian firm - Cambodia DailyAlstom nearing $700 mln U.S. bribery settlement -BloombergGE expects 2015 industrials units profit to rise at least 10 pctUPDATE 3-GE sees 2015 profit pressured by "sluggish" oil business * Sets target to raise margins by 50 basis points/year   (Adds CEO quote, details, background)  UPDATE 3-GE sees 2015 profit pressured by "sluggish" oil business * Sets target to raise margins by 50 basis points/year   (Adds CEO quote, details, background) NEW YORK, Dec 16 General Electric Co said it expects profit from its industrial units to rise by at least 10 percent in 2015, as the conglomerate cuts reliance on its financial services business.UPDATE 3-GE sees 2015 profit pressured by "sluggish" oil business * Sets target to raise margins by 50 basis points/year   (Adds CEO quote, details, background)   GE expects 2015 industrials units profit to rise at least 10 pctUPDATE 3-GE sees 2015 profit pressured by "sluggish" oil business * Sets target to raise margins by 50 basis points/year   (Adds CEO quote, details, background)  UPDATE 3-GE sees 2015 profit pressured by "sluggish" oil business * Sets target to raise margins by 50 basis points/year   (Adds CEO quote, details, background) NEW YORK, Dec 16 General Electric Co said it expects profit from its industrial units to rise by at least 10 percent in 2015, as the conglomerate cuts reliance on its financial services business.UPDATE 3-GE sees 2015 profit pressured by "sluggish" oil business * Sets target to raise margins by 50 basis points/year   (Adds CEO quote, details, background)  PARIS, Dec 16 Alstom is close to settling a bribery case with the U.S. Justice Department for $700 million, Bloomberg reported on Tuesday, citing people familiar with the matter.GE expects 2015 industrials units profit to rise at least 10 pctUPDATE 3-GE sees 2015 profit pressured by "sluggish" oil business * Sets target to raise margins by 50 basis points/year   (Adds CEO quote, details, background)  UPDATE 3-GE sees 2015 profit pressured by "sluggish" oil business * Sets target to raise margins by 50 basis points/year   (Adds CEO quote, details, background) NEW YORK, Dec 16 General Electric Co said it expects profit from its industrial units to rise by at least 10 percent in 2015, as the conglomerate cuts reliance on its financial services business.UPDATE 3-GE sees 2015 profit pressured by "sluggish" oil business * Sets target to raise margins by 50 basis points/year   (Adds CEO quote, details, background)    Alstom nearing $700 mln U.S. bribery settlement -BloombergGE expects 2015 industrials units profit to rise at least 10 pctUPDATE 3-GE sees 2015 profit pressured by "sluggish" oil business * Sets target to raise margins by 50 basis points/year   (Adds CEO quote, details, background)  UPDATE 3-GE sees 2015 profit pressured by "sluggish" oil business * Sets target to raise margins by 50 basis points/year   (Adds CEO quote, details, background) NEW YORK, Dec 16 General Electric Co said it expects profit from its industrial units to rise by at least 10 percent in 2015, as the conglomerate cuts reliance on its financial services business.UPDATE 3-GE sees 2015 profit pressured by "sluggish" oil business * Sets target to raise margins by 50 basis points/year   (Adds CEO quote, details, background)   GE expects 2015 industrials units profit to rise at least 10 pctUPDATE 3-GE sees 2015 profit pressured by "sluggish" oil business * Sets target to raise margins by 50 basis points/year   (Adds CEO quote, details, background)  UPDATE 3-GE sees 2015 profit pressured by "sluggish" oil business * Sets target to raise margins by 50 basis points/year   (Adds CEO quote, details, background) NEW YORK, Dec 16 General Electric Co said it expects profit from its industrial units to rise by at least 10 percent in 2015, as the conglomerate cuts reliance on its financial services business.UPDATE 3-GE sees 2015 profit pressured by "sluggish" oil business * Sets target to raise margins by 50 basis points/year   (Adds CEO quote, details, background)  PARIS, Dec 16 Alstom is close to settling a bribery case with the U.S. Justice Department for $700 million, Bloomberg reported on Tuesday, citing people familiar with the matter.GE expects 2015 industrials units profit to rise at least 10 pctUPDATE 3-GE sees 2015 profit pressured by "sluggish" oil business * Sets target to raise margins by 50 basis points/year   (Adds CEO quote, details, background)  UPDATE 3-GE sees 2015 profit pressured by "sluggish" oil business * Sets target to raise margins by 50 basis points/year   (Adds CEO quote, details, background) NEW YORK, Dec 16 General Electric Co said it expects profit from its industrial units to rise by at least 10 percent in 2015, as the conglomerate cuts reliance on its financial services business.UPDATE 3-GE sees 2015 profit pressured by "sluggish" oil business * Sets target to raise margins by 50 basis points/year   (Adds CEO quote, details, background)   U.S. conglomerate General Electric (GE) will sign a deal with Cambodia's state-owned utility company Electricite du Cambodge (EdC) on Thursday to improve the country's electricity grid, the Cambodia Daily reported, citing a press release from the U.S. Embassy. (http://bit.ly/1DDVBcm)Alstom nearing $700 mln U.S. bribery settlement -BloombergGE expects 2015 industrials units profit to rise at least 10 pctUPDATE 3-GE sees 2015 profit pressured by "sluggish" oil business * Sets target to raise margins by 50 basis points/year   (Adds CEO quote, details, background)  UPDATE 3-GE sees 2015 profit pressured by "sluggish" oil business * Sets target to raise margins by 50 basis points/year   (Adds CEO quote, details, background) NEW YORK, Dec 16 General Electric Co said it expects profit from its industrial units to rise by at least 10 percent in 2015, as the conglomerate cuts reliance on its financial services business.UPDATE 3-GE sees 2015 profit pressured by "sluggish" oil business * Sets target to raise margins by 50 basis points/year   (Adds CEO quote, details, background)   GE expects 2015 industrials units profit to rise at least 10 pctUPDATE 3-GE sees 2015 profit pressured by "sluggish" oil business * Sets target to raise margins by 50 basis points/year   (Adds CEO quote, details, background)  UPDATE 3-GE sees 2015 profit pressured by "sluggish" oil business * Sets target to raise margins by 50 basis points/year   (Adds CEO quote, details, background) NEW YORK, Dec 16 General Electric Co said it expects profit from its industrial units to rise by at least 10 percent in 2015, as the conglomerate cuts reliance on its financial services business.UPDATE 3-GE sees 2015 profit pressured by "sluggish" oil business * Sets target to raise margins by 50 basis points/year   (Adds CEO quote, details, background)  PARIS, Dec 16 Alstom is close to settling a bribery case with the U.S. Justice Department for $700 million, Bloomberg reported on Tuesday, citing people familiar with the matter.GE expects 2015 industrials units profit to rise at least 10 pctUPDATE 3-GE sees 2015 profit pressured by "sluggish" oil business * Sets target to raise margins by 50 basis points/year   (Adds CEO quote, details, background)  UPDATE 3-GE sees 2015 profit pressured by "sluggish" oil business * Sets target to raise margins by 50 basis points/year   (Adds CEO quote, details, background) NEW YORK, Dec 16 General Electric Co said it expects profit from its industrial units to rise by at least 10 percent in 2015, as the conglomerate cuts reliance on its financial services business.UPDATE 3-GE sees 2015 profit pressured by "sluggish" oil business * Sets target to raise margins by 50 basis points/year   (Adds CEO quote, details, background)    
JNJ,Galapagos loses partner on inflammatory bowel drug BRUSSELS, Dec 16 Belgian biotech group Galapagos  said on Tuesday that its research partner Janssen Pharmaceutica, a unit of Johnson & Johnson, had pulled out of a programme to develop a new drug to treat bowel disease. 
LUK,Jefferies reports loss, seeks options for brokerage unitUPDATE 2-Jefferies in talks to sell futures business Dec 16 Investment bank Jefferies Group LLC, owned by Leucadia National Corp, said it was in talks to sell its commodities and financial derivatives brokerage, which has been struggling with high costs and falling fees.  UPDATE 2-Jefferies in talks to sell futures business Dec 16 Investment bank Jefferies Group LLC, owned by Leucadia National Corp, said it was in talks to sell its commodities and financial derivatives brokerage, which has been struggling with high costs and falling fees. Dec 16 Investment bank Jefferies Group LLC, owned by Leucadia National Corp, reported a quarterly loss and said it was exploring strategic alternatives for its futures-brokerage unit.UPDATE 2-Jefferies in talks to sell futures business Dec 16 Investment bank Jefferies Group LLC, owned by Leucadia National Corp, said it was in talks to sell its commodities and financial derivatives brokerage, which has been struggling with high costs and falling fees.  
PGR,Progressive to take controlling stake in ARX Holding for $875 mln Dec 16 Progressive Corp, a provider of auto insurance products, said it would acquire a controlling stake in property insurer ARX Holding Corp for $875 million in cash. 
QCOM,As Qualcomm decision looms, U.S. presses China on antitrust policyAs Qualcomm decision looms, U.S. presses China on antitrust policyRPT-As Qualcomm decision looms, U.S. presses China on antitrust policy BEIJING, Dec 16 U.S. President Barack Obama pressed China's Xi Jinping during recent talks on the use of Chinese antitrust policy to limit royalty fees for foreign companies, an issue at the heart of a probe into U.S. mobile chipset maker Qualcomm Inc.  RPT-As Qualcomm decision looms, U.S. presses China on antitrust policy BEIJING, Dec 16 U.S. President Barack Obama pressed China's Xi Jinping during recent talks on the use of Chinese antitrust policy to limit royalty fees for foreign companies, an issue at the heart of a probe into U.S. mobile chipset maker Qualcomm Inc. BEIJING U.S. President Barack Obama pressed China's Xi Jinping during recent talks on the use of Chinese antitrust policy to limit royalty fees for foreign companies, an issue at the heart of a probe into U.S. mobile chipset maker Qualcomm Inc.RPT-As Qualcomm decision looms, U.S. presses China on antitrust policy BEIJING, Dec 16 U.S. President Barack Obama pressed China's Xi Jinping during recent talks on the use of Chinese antitrust policy to limit royalty fees for foreign companies, an issue at the heart of a probe into U.S. mobile chipset maker Qualcomm Inc.   As Qualcomm decision looms, U.S. presses China on antitrust policyRPT-As Qualcomm decision looms, U.S. presses China on antitrust policy BEIJING, Dec 16 U.S. President Barack Obama pressed China's Xi Jinping during recent talks on the use of Chinese antitrust policy to limit royalty fees for foreign companies, an issue at the heart of a probe into U.S. mobile chipset maker Qualcomm Inc.  RPT-As Qualcomm decision looms, U.S. presses China on antitrust policy BEIJING, Dec 16 U.S. President Barack Obama pressed China's Xi Jinping during recent talks on the use of Chinese antitrust policy to limit royalty fees for foreign companies, an issue at the heart of a probe into U.S. mobile chipset maker Qualcomm Inc. BEIJING U.S. President Barack Obama pressed China's Xi Jinping during recent talks on the use of Chinese antitrust policy to limit royalty fees for foreign companies, an issue at the heart of a probe into U.S. mobile chipset maker Qualcomm Inc.RPT-As Qualcomm decision looms, U.S. presses China on antitrust policy BEIJING, Dec 16 U.S. President Barack Obama pressed China's Xi Jinping during recent talks on the use of Chinese antitrust policy to limit royalty fees for foreign companies, an issue at the heart of a probe into U.S. mobile chipset maker Qualcomm Inc.  BEIJING, Dec 16 U.S. President Barack Obama pressed China's Xi Jinping during recent talks on the use of Chinese antitrust policy to limit royalty fees for foreign companies, an issue at the heart of a probe into U.S. mobile chipset maker Qualcomm Inc.As Qualcomm decision looms, U.S. presses China on antitrust policyRPT-As Qualcomm decision looms, U.S. presses China on antitrust policy BEIJING, Dec 16 U.S. President Barack Obama pressed China's Xi Jinping during recent talks on the use of Chinese antitrust policy to limit royalty fees for foreign companies, an issue at the heart of a probe into U.S. mobile chipset maker Qualcomm Inc.  RPT-As Qualcomm decision looms, U.S. presses China on antitrust policy BEIJING, Dec 16 U.S. President Barack Obama pressed China's Xi Jinping during recent talks on the use of Chinese antitrust policy to limit royalty fees for foreign companies, an issue at the heart of a probe into U.S. mobile chipset maker Qualcomm Inc. BEIJING U.S. President Barack Obama pressed China's Xi Jinping during recent talks on the use of Chinese antitrust policy to limit royalty fees for foreign companies, an issue at the heart of a probe into U.S. mobile chipset maker Qualcomm Inc.RPT-As Qualcomm decision looms, U.S. presses China on antitrust policy BEIJING, Dec 16 U.S. President Barack Obama pressed China's Xi Jinping during recent talks on the use of Chinese antitrust policy to limit royalty fees for foreign companies, an issue at the heart of a probe into U.S. mobile chipset maker Qualcomm Inc.   
VRSK,Verisk Analytics scraps plan to buy EagleView Technology Corp WASHINGTON Verisk Analytics'  said on Tuesday it would scrap its plan to buy EagleView Technology Corp because the Federal Trade Commission said it would file a lawsuit to block the deal. 
