GS,UBS's Brazil unit to make quiet return to investment banking -sources SAO PAULO, March 7 UBS AG will restart investment banking operations in Brazil as early as next week, sources said, almost five years after Switzerland's biggest bank sold its highly profitable securities unit there following the global financial crisis. 
JPM,UPDATE 1-Appeals court acquits banks in Milan derivatives caseAppeals court acquits banks in Milan derivatives caseJPMorgan whistleblower gets $63.9 million in mortgage fraud accordUPDATE 1-JPMorgan whistleblower gets $63.9 mln in mortgage fraud deal March 7 A whistleblower will be paid $63.9 million for providing tips that led to JPMorgan Chase & Co's  agreement to pay $614 million and tighten oversight to resolve charges that it defrauded the government into insuring flawed home loans.  UPDATE 1-JPMorgan whistleblower gets $63.9 mln in mortgage fraud deal March 7 A whistleblower will be paid $63.9 million for providing tips that led to JPMorgan Chase & Co's  agreement to pay $614 million and tighten oversight to resolve charges that it defrauded the government into insuring flawed home loans. March 7 A whistleblower will be paid $63.9 million for providing tips that led to JPMorgan Chase & Co's  agreement to pay $614 million and tighten oversight to resolve charges that it defrauded the government into insuring flawed home loans.UPDATE 1-JPMorgan whistleblower gets $63.9 mln in mortgage fraud deal March 7 A whistleblower will be paid $63.9 million for providing tips that led to JPMorgan Chase & Co's  agreement to pay $614 million and tighten oversight to resolve charges that it defrauded the government into insuring flawed home loans.   JPMorgan whistleblower gets $63.9 million in mortgage fraud accordUPDATE 1-JPMorgan whistleblower gets $63.9 mln in mortgage fraud deal March 7 A whistleblower will be paid $63.9 million for providing tips that led to JPMorgan Chase & Co's  agreement to pay $614 million and tighten oversight to resolve charges that it defrauded the government into insuring flawed home loans.  UPDATE 1-JPMorgan whistleblower gets $63.9 mln in mortgage fraud deal March 7 A whistleblower will be paid $63.9 million for providing tips that led to JPMorgan Chase & Co's  agreement to pay $614 million and tighten oversight to resolve charges that it defrauded the government into insuring flawed home loans. March 7 A whistleblower will be paid $63.9 million for providing tips that led to JPMorgan Chase & Co's  agreement to pay $614 million and tighten oversight to resolve charges that it defrauded the government into insuring flawed home loans.UPDATE 1-JPMorgan whistleblower gets $63.9 mln in mortgage fraud deal March 7 A whistleblower will be paid $63.9 million for providing tips that led to JPMorgan Chase & Co's  agreement to pay $614 million and tighten oversight to resolve charges that it defrauded the government into insuring flawed home loans.  MILAN A Milan appeals court has acquitted four international banks, including JPMorgan and UBS, found guilty in an earlier trial of mis-selling derivatives to the city of Milan.JPMorgan whistleblower gets $63.9 million in mortgage fraud accordUPDATE 1-JPMorgan whistleblower gets $63.9 mln in mortgage fraud deal March 7 A whistleblower will be paid $63.9 million for providing tips that led to JPMorgan Chase & Co's  agreement to pay $614 million and tighten oversight to resolve charges that it defrauded the government into insuring flawed home loans.  UPDATE 1-JPMorgan whistleblower gets $63.9 mln in mortgage fraud deal March 7 A whistleblower will be paid $63.9 million for providing tips that led to JPMorgan Chase & Co's  agreement to pay $614 million and tighten oversight to resolve charges that it defrauded the government into insuring flawed home loans. March 7 A whistleblower will be paid $63.9 million for providing tips that led to JPMorgan Chase & Co's  agreement to pay $614 million and tighten oversight to resolve charges that it defrauded the government into insuring flawed home loans.UPDATE 1-JPMorgan whistleblower gets $63.9 mln in mortgage fraud deal March 7 A whistleblower will be paid $63.9 million for providing tips that led to JPMorgan Chase & Co's  agreement to pay $614 million and tighten oversight to resolve charges that it defrauded the government into insuring flawed home loans.    Appeals court acquits banks in Milan derivatives caseJPMorgan whistleblower gets $63.9 million in mortgage fraud accordUPDATE 1-JPMorgan whistleblower gets $63.9 mln in mortgage fraud deal March 7 A whistleblower will be paid $63.9 million for providing tips that led to JPMorgan Chase & Co's  agreement to pay $614 million and tighten oversight to resolve charges that it defrauded the government into insuring flawed home loans.  UPDATE 1-JPMorgan whistleblower gets $63.9 mln in mortgage fraud deal March 7 A whistleblower will be paid $63.9 million for providing tips that led to JPMorgan Chase & Co's  agreement to pay $614 million and tighten oversight to resolve charges that it defrauded the government into insuring flawed home loans. March 7 A whistleblower will be paid $63.9 million for providing tips that led to JPMorgan Chase & Co's  agreement to pay $614 million and tighten oversight to resolve charges that it defrauded the government into insuring flawed home loans.UPDATE 1-JPMorgan whistleblower gets $63.9 mln in mortgage fraud deal March 7 A whistleblower will be paid $63.9 million for providing tips that led to JPMorgan Chase & Co's  agreement to pay $614 million and tighten oversight to resolve charges that it defrauded the government into insuring flawed home loans.   JPMorgan whistleblower gets $63.9 million in mortgage fraud accordUPDATE 1-JPMorgan whistleblower gets $63.9 mln in mortgage fraud deal March 7 A whistleblower will be paid $63.9 million for providing tips that led to JPMorgan Chase & Co's  agreement to pay $614 million and tighten oversight to resolve charges that it defrauded the government into insuring flawed home loans.  UPDATE 1-JPMorgan whistleblower gets $63.9 mln in mortgage fraud deal March 7 A whistleblower will be paid $63.9 million for providing tips that led to JPMorgan Chase & Co's  agreement to pay $614 million and tighten oversight to resolve charges that it defrauded the government into insuring flawed home loans. March 7 A whistleblower will be paid $63.9 million for providing tips that led to JPMorgan Chase & Co's  agreement to pay $614 million and tighten oversight to resolve charges that it defrauded the government into insuring flawed home loans.UPDATE 1-JPMorgan whistleblower gets $63.9 mln in mortgage fraud deal March 7 A whistleblower will be paid $63.9 million for providing tips that led to JPMorgan Chase & Co's  agreement to pay $614 million and tighten oversight to resolve charges that it defrauded the government into insuring flawed home loans.  MILAN A Milan appeals court has acquitted four international banks, including JPMorgan and UBS, found guilty in an earlier trial of mis-selling derivatives to the city of Milan.JPMorgan whistleblower gets $63.9 million in mortgage fraud accordUPDATE 1-JPMorgan whistleblower gets $63.9 mln in mortgage fraud deal March 7 A whistleblower will be paid $63.9 million for providing tips that led to JPMorgan Chase & Co's  agreement to pay $614 million and tighten oversight to resolve charges that it defrauded the government into insuring flawed home loans.  UPDATE 1-JPMorgan whistleblower gets $63.9 mln in mortgage fraud deal March 7 A whistleblower will be paid $63.9 million for providing tips that led to JPMorgan Chase & Co's  agreement to pay $614 million and tighten oversight to resolve charges that it defrauded the government into insuring flawed home loans. March 7 A whistleblower will be paid $63.9 million for providing tips that led to JPMorgan Chase & Co's  agreement to pay $614 million and tighten oversight to resolve charges that it defrauded the government into insuring flawed home loans.UPDATE 1-JPMorgan whistleblower gets $63.9 mln in mortgage fraud deal March 7 A whistleblower will be paid $63.9 million for providing tips that led to JPMorgan Chase & Co's  agreement to pay $614 million and tighten oversight to resolve charges that it defrauded the government into insuring flawed home loans.   MILAN, March 7 A Milan appeals court has acquitted four international banks, including JPMorgan  and UBS, found guilty in an earlier trial of mis-selling derivatives to the city of Milan.Appeals court acquits banks in Milan derivatives caseJPMorgan whistleblower gets $63.9 million in mortgage fraud accordUPDATE 1-JPMorgan whistleblower gets $63.9 mln in mortgage fraud deal March 7 A whistleblower will be paid $63.9 million for providing tips that led to JPMorgan Chase & Co's  agreement to pay $614 million and tighten oversight to resolve charges that it defrauded the government into insuring flawed home loans.  UPDATE 1-JPMorgan whistleblower gets $63.9 mln in mortgage fraud deal March 7 A whistleblower will be paid $63.9 million for providing tips that led to JPMorgan Chase & Co's  agreement to pay $614 million and tighten oversight to resolve charges that it defrauded the government into insuring flawed home loans. March 7 A whistleblower will be paid $63.9 million for providing tips that led to JPMorgan Chase & Co's  agreement to pay $614 million and tighten oversight to resolve charges that it defrauded the government into insuring flawed home loans.UPDATE 1-JPMorgan whistleblower gets $63.9 mln in mortgage fraud deal March 7 A whistleblower will be paid $63.9 million for providing tips that led to JPMorgan Chase & Co's  agreement to pay $614 million and tighten oversight to resolve charges that it defrauded the government into insuring flawed home loans.   JPMorgan whistleblower gets $63.9 million in mortgage fraud accordUPDATE 1-JPMorgan whistleblower gets $63.9 mln in mortgage fraud deal March 7 A whistleblower will be paid $63.9 million for providing tips that led to JPMorgan Chase & Co's  agreement to pay $614 million and tighten oversight to resolve charges that it defrauded the government into insuring flawed home loans.  UPDATE 1-JPMorgan whistleblower gets $63.9 mln in mortgage fraud deal March 7 A whistleblower will be paid $63.9 million for providing tips that led to JPMorgan Chase & Co's  agreement to pay $614 million and tighten oversight to resolve charges that it defrauded the government into insuring flawed home loans. March 7 A whistleblower will be paid $63.9 million for providing tips that led to JPMorgan Chase & Co's  agreement to pay $614 million and tighten oversight to resolve charges that it defrauded the government into insuring flawed home loans.UPDATE 1-JPMorgan whistleblower gets $63.9 mln in mortgage fraud deal March 7 A whistleblower will be paid $63.9 million for providing tips that led to JPMorgan Chase & Co's  agreement to pay $614 million and tighten oversight to resolve charges that it defrauded the government into insuring flawed home loans.  MILAN A Milan appeals court has acquitted four international banks, including JPMorgan and UBS, found guilty in an earlier trial of mis-selling derivatives to the city of Milan.JPMorgan whistleblower gets $63.9 million in mortgage fraud accordUPDATE 1-JPMorgan whistleblower gets $63.9 mln in mortgage fraud deal March 7 A whistleblower will be paid $63.9 million for providing tips that led to JPMorgan Chase & Co's  agreement to pay $614 million and tighten oversight to resolve charges that it defrauded the government into insuring flawed home loans.  UPDATE 1-JPMorgan whistleblower gets $63.9 mln in mortgage fraud deal March 7 A whistleblower will be paid $63.9 million for providing tips that led to JPMorgan Chase & Co's  agreement to pay $614 million and tighten oversight to resolve charges that it defrauded the government into insuring flawed home loans. March 7 A whistleblower will be paid $63.9 million for providing tips that led to JPMorgan Chase & Co's  agreement to pay $614 million and tighten oversight to resolve charges that it defrauded the government into insuring flawed home loans.UPDATE 1-JPMorgan whistleblower gets $63.9 mln in mortgage fraud deal March 7 A whistleblower will be paid $63.9 million for providing tips that led to JPMorgan Chase & Co's  agreement to pay $614 million and tighten oversight to resolve charges that it defrauded the government into insuring flawed home loans.    
MA,Mastercard, Visa form cross-industry group for payment securityMastercard, Visa form cross-industry group for payment securityUPDATE 3-MasterCard, Visa form group to push for better card security March 7 Visa Inc and MasterCard Inc  said they had launched a cross-industry group to improve security for card transactions and press U.S. retailers and banks to meet a 2015 deadline to adopt technology that would make it safer to pay with plastic.  UPDATE 3-MasterCard, Visa form group to push for better card security March 7 Visa Inc and MasterCard Inc  said they had launched a cross-industry group to improve security for card transactions and press U.S. retailers and banks to meet a 2015 deadline to adopt technology that would make it safer to pay with plastic. Credit card companies MasterCard Inc  and Visa Inc  said they had formed a new cross-industry group to enhance payment system security across networks.UPDATE 3-MasterCard, Visa form group to push for better card security March 7 Visa Inc and MasterCard Inc  said they had launched a cross-industry group to improve security for card transactions and press U.S. retailers and banks to meet a 2015 deadline to adopt technology that would make it safer to pay with plastic.   Mastercard, Visa form cross-industry group for payment securityUPDATE 3-MasterCard, Visa form group to push for better card security March 7 Visa Inc and MasterCard Inc  said they had launched a cross-industry group to improve security for card transactions and press U.S. retailers and banks to meet a 2015 deadline to adopt technology that would make it safer to pay with plastic.  UPDATE 3-MasterCard, Visa form group to push for better card security March 7 Visa Inc and MasterCard Inc  said they had launched a cross-industry group to improve security for card transactions and press U.S. retailers and banks to meet a 2015 deadline to adopt technology that would make it safer to pay with plastic. Credit card companies MasterCard Inc  and Visa Inc  said they had formed a new cross-industry group to enhance payment system security across networks.UPDATE 3-MasterCard, Visa form group to push for better card security March 7 Visa Inc and MasterCard Inc  said they had launched a cross-industry group to improve security for card transactions and press U.S. retailers and banks to meet a 2015 deadline to adopt technology that would make it safer to pay with plastic.  March 7 Credit card companies MasterCard Inc  and Visa Inc said they had formed a new cross-industry group to enhance payment system security across networks.Mastercard, Visa form cross-industry group for payment securityUPDATE 3-MasterCard, Visa form group to push for better card security March 7 Visa Inc and MasterCard Inc  said they had launched a cross-industry group to improve security for card transactions and press U.S. retailers and banks to meet a 2015 deadline to adopt technology that would make it safer to pay with plastic.  UPDATE 3-MasterCard, Visa form group to push for better card security March 7 Visa Inc and MasterCard Inc  said they had launched a cross-industry group to improve security for card transactions and press U.S. retailers and banks to meet a 2015 deadline to adopt technology that would make it safer to pay with plastic. Credit card companies MasterCard Inc  and Visa Inc  said they had formed a new cross-industry group to enhance payment system security across networks.UPDATE 3-MasterCard, Visa form group to push for better card security March 7 Visa Inc and MasterCard Inc  said they had launched a cross-industry group to improve security for card transactions and press U.S. retailers and banks to meet a 2015 deadline to adopt technology that would make it safer to pay with plastic.   
MS,REFILE-Mentor women after maternity leave, says Morgan Stanley bossMentor women after maternity leave, says Morgan Stanley bossON THE MOVE-BB&T; hires two financial advisers from Morgan Stanley March 7 BB&T; Corp's brokerage unit said on Friday it hired two veteran advisers from Morgan Stanley .  ON THE MOVE-BB&T; hires two financial advisers from Morgan Stanley March 7 BB&T; Corp's brokerage unit said on Friday it hired two veteran advisers from Morgan Stanley . LONDON For top Morgan Stanley financier Cecile Houlot-Hillary, every day brings pressure in the form of complex bond deals, intense competition and demands from high level clients.ON THE MOVE-BB&T; hires two financial advisers from Morgan Stanley March 7 BB&T; Corp's brokerage unit said on Friday it hired two veteran advisers from Morgan Stanley .   Mentor women after maternity leave, says Morgan Stanley bossON THE MOVE-BB&T; hires two financial advisers from Morgan Stanley March 7 BB&T; Corp's brokerage unit said on Friday it hired two veteran advisers from Morgan Stanley .  ON THE MOVE-BB&T; hires two financial advisers from Morgan Stanley March 7 BB&T; Corp's brokerage unit said on Friday it hired two veteran advisers from Morgan Stanley . LONDON For top Morgan Stanley financier Cecile Houlot-Hillary, every day brings pressure in the form of complex bond deals, intense competition and demands from high level clients.ON THE MOVE-BB&T; hires two financial advisers from Morgan Stanley March 7 BB&T; Corp's brokerage unit said on Friday it hired two veteran advisers from Morgan Stanley .  LONDON, March 7 For top Morgan Stanley financier Cecile Houlot-Hillary, every day brings pressure in the form of complex bond deals, intense competition and demands from high level clients.Mentor women after maternity leave, says Morgan Stanley bossON THE MOVE-BB&T; hires two financial advisers from Morgan Stanley March 7 BB&T; Corp's brokerage unit said on Friday it hired two veteran advisers from Morgan Stanley .  ON THE MOVE-BB&T; hires two financial advisers from Morgan Stanley March 7 BB&T; Corp's brokerage unit said on Friday it hired two veteran advisers from Morgan Stanley . LONDON For top Morgan Stanley financier Cecile Houlot-Hillary, every day brings pressure in the form of complex bond deals, intense competition and demands from high level clients.ON THE MOVE-BB&T; hires two financial advisers from Morgan Stanley March 7 BB&T; Corp's brokerage unit said on Friday it hired two veteran advisers from Morgan Stanley .   
REGN,U.S. FDA probes cognitive impact of new cholesterol drugs; Regeneron, Sanofi shares fallUPDATE 1-U.S. FDA asks Sanofi, Regeneron to assess cholesterol drug's cognitive risksUPDATE 3-U.S. FDA probes cognitive impact of new cholesterol drugs March 7 The U.S. Food and Drug Administration has asked Regeneron Pharmaceuticals Inc and Sanofi SA  to assess potential neurocognitive side effects of their experimental cholesterol drug, Sanofi said in its annual report on Friday.  UPDATE 3-U.S. FDA probes cognitive impact of new cholesterol drugs March 7 The U.S. Food and Drug Administration has asked Regeneron Pharmaceuticals Inc and Sanofi SA  to assess potential neurocognitive side effects of their experimental cholesterol drug, Sanofi said in its annual report on Friday. March 7 The U.S. Food and Drug Administration has asked Regeneron and Sanofi to assess potential neurocognitive side effects of their experimental cholesterol drug, Sanofi said in its annual report on Friday.UPDATE 3-U.S. FDA probes cognitive impact of new cholesterol drugs March 7 The U.S. Food and Drug Administration has asked Regeneron Pharmaceuticals Inc and Sanofi SA  to assess potential neurocognitive side effects of their experimental cholesterol drug, Sanofi said in its annual report on Friday.   UPDATE 1-U.S. FDA asks Sanofi, Regeneron to assess cholesterol drug's cognitive risksUPDATE 3-U.S. FDA probes cognitive impact of new cholesterol drugs March 7 The U.S. Food and Drug Administration has asked Regeneron Pharmaceuticals Inc and Sanofi SA  to assess potential neurocognitive side effects of their experimental cholesterol drug, Sanofi said in its annual report on Friday.  UPDATE 3-U.S. FDA probes cognitive impact of new cholesterol drugs March 7 The U.S. Food and Drug Administration has asked Regeneron Pharmaceuticals Inc and Sanofi SA  to assess potential neurocognitive side effects of their experimental cholesterol drug, Sanofi said in its annual report on Friday. March 7 The U.S. Food and Drug Administration has asked Regeneron and Sanofi to assess potential neurocognitive side effects of their experimental cholesterol drug, Sanofi said in its annual report on Friday.UPDATE 3-U.S. FDA probes cognitive impact of new cholesterol drugs March 7 The U.S. Food and Drug Administration has asked Regeneron Pharmaceuticals Inc and Sanofi SA  to assess potential neurocognitive side effects of their experimental cholesterol drug, Sanofi said in its annual report on Friday.  March 7 The U.S. Food and Drug Administration has called for an assessment of potential neurocognitive side effects of an experimental cholesterol drug being developed by Regeneron and Sanofi, Sanofi said in its annual report on Friday.UPDATE 1-U.S. FDA asks Sanofi, Regeneron to assess cholesterol drug's cognitive risksUPDATE 3-U.S. FDA probes cognitive impact of new cholesterol drugs March 7 The U.S. Food and Drug Administration has asked Regeneron Pharmaceuticals Inc and Sanofi SA  to assess potential neurocognitive side effects of their experimental cholesterol drug, Sanofi said in its annual report on Friday.  UPDATE 3-U.S. FDA probes cognitive impact of new cholesterol drugs March 7 The U.S. Food and Drug Administration has asked Regeneron Pharmaceuticals Inc and Sanofi SA  to assess potential neurocognitive side effects of their experimental cholesterol drug, Sanofi said in its annual report on Friday. March 7 The U.S. Food and Drug Administration has asked Regeneron and Sanofi to assess potential neurocognitive side effects of their experimental cholesterol drug, Sanofi said in its annual report on Friday.UPDATE 3-U.S. FDA probes cognitive impact of new cholesterol drugs March 7 The U.S. Food and Drug Administration has asked Regeneron Pharmaceuticals Inc and Sanofi SA  to assess potential neurocognitive side effects of their experimental cholesterol drug, Sanofi said in its annual report on Friday.   
DIS,Walt Disney, Shanghai Media Group to develop Disney-branded movies March 7 Walt Disney Studios has signed an agreement with Shanghai Media Group Pictures to develop Disney-branded movies, the latest move by a U.S. studio to grow its presence in China's entertainment business. 
VZ,U.S. extends Terremark contract as HealthCare.gov host WASHINGTON, March 7 The Obama administration said on Friday Verizon Communications Inc's Terremark unit will remain under contract as host of the federal website HealthCare.gov to better ensure a smooth end to Obamacare's open enrollment period on March 31. 
