AMZN,Shifts in rainfall, not warming pause, slow sea level rise * Underlying rate of sea level rise continues - French study 
AAPL,Apple shares to be fueled by new iPhone - Barron's March 23 Apple Inc shares could rise by 20 percent over the next year, fueled by sales of a new version of its iPhone smartphone that is expected to have a bigger screen, according to an article in the March 24 edition of Barron's. 
BLK,BlackRock warns over "major uncertainties" of Scottish independence March 23 BlackRock Inc, the world's largest money manager, warned that Scottish independence would bring about "major uncertainties, costs and risks" in Britain, becoming the latest company to join the debate on this year's referendum. 
MA,Russian bank SMP says Visa, MasterCard resume servicesUPDATE 1-Russian bank SMP says Visa, MasterCard resume payment services MOSCOW, March 23 Visa Inc and MasterCard Inc have resumed services for payment transactions for clients at Russia's SMP bank, whose main shareholders were affected by U.S. sanctions, the bank said on Sunday.  UPDATE 1-Russian bank SMP says Visa, MasterCard resume payment services MOSCOW, March 23 Visa Inc and MasterCard Inc have resumed services for payment transactions for clients at Russia's SMP bank, whose main shareholders were affected by U.S. sanctions, the bank said on Sunday. MOSCOW, March 23 Visa Inc and MasterCard Inc have resumed services for payment transactions for clients at Russia's SMP bank, whose main shareholders were affected by U.S. sanctions, the bank said on Sunday.UPDATE 1-Russian bank SMP says Visa, MasterCard resume payment services MOSCOW, March 23 Visa Inc and MasterCard Inc have resumed services for payment transactions for clients at Russia's SMP bank, whose main shareholders were affected by U.S. sanctions, the bank said on Sunday.  
PFG,Principal Financial shares primed to rise - Barron's March 23 Principal Financial Group Inc  shares could rise 25 percent if the company is valued more as a global money manager, as opposed to an insurance company, according to an article in the March 24 edition of Barron's. 
V,Russian bank SMP says Visa, MasterCard resume servicesUPDATE 1-Russian bank SMP says Visa, MasterCard resume payment services MOSCOW, March 23 Visa Inc and MasterCard Inc have resumed services for payment transactions for clients at Russia's SMP bank, whose main shareholders were affected by U.S. sanctions, the bank said on Sunday.  UPDATE 1-Russian bank SMP says Visa, MasterCard resume payment services MOSCOW, March 23 Visa Inc and MasterCard Inc have resumed services for payment transactions for clients at Russia's SMP bank, whose main shareholders were affected by U.S. sanctions, the bank said on Sunday. MOSCOW, March 23 Visa Inc and MasterCard Inc have resumed services for payment transactions for clients at Russia's SMP bank, whose main shareholders were affected by U.S. sanctions, the bank said on Sunday.UPDATE 1-Russian bank SMP says Visa, MasterCard resume payment services MOSCOW, March 23 Visa Inc and MasterCard Inc have resumed services for payment transactions for clients at Russia's SMP bank, whose main shareholders were affected by U.S. sanctions, the bank said on Sunday.  
