DHI,Homebuilder D.R. Horton's profit jumps nearly 44 pctCORRECTED-UPDATE 1-D.R. Horton profit jumps nearly 44 pct on higher home salesUPDATE 2-D.R. Horton's profit surges as home sales jump * Shares up 2.5 pct premarket   (Adds details, background; updates shares)  UPDATE 2-D.R. Horton's profit surges as home sales jump * Shares up 2.5 pct premarket   (Adds details, background; updates shares) Nov 10 D.R. Horton Inc's quarterly profit jumped nearly 44 percent as the largest U.S. homebuilder sold more homes and the company said its orders rose 19 percent.UPDATE 2-D.R. Horton's profit surges as home sales jump * Shares up 2.5 pct premarket   (Adds details, background; updates shares)   CORRECTED-UPDATE 1-D.R. Horton profit jumps nearly 44 pct on higher home salesUPDATE 2-D.R. Horton's profit surges as home sales jump * Shares up 2.5 pct premarket   (Adds details, background; updates shares)  UPDATE 2-D.R. Horton's profit surges as home sales jump * Shares up 2.5 pct premarket   (Adds details, background; updates shares) Nov 10 D.R. Horton Inc's quarterly profit jumped nearly 44 percent as the largest U.S. homebuilder sold more homes and the company said its orders rose 19 percent.UPDATE 2-D.R. Horton's profit surges as home sales jump * Shares up 2.5 pct premarket   (Adds details, background; updates shares)  Nov 10 U.S. homebuilder D.R. Horton Inc's  quarterly profit rose 43.7 percent as the company sold more homes.CORRECTED-UPDATE 1-D.R. Horton profit jumps nearly 44 pct on higher home salesUPDATE 2-D.R. Horton's profit surges as home sales jump * Shares up 2.5 pct premarket   (Adds details, background; updates shares)  UPDATE 2-D.R. Horton's profit surges as home sales jump * Shares up 2.5 pct premarket   (Adds details, background; updates shares) Nov 10 D.R. Horton Inc's quarterly profit jumped nearly 44 percent as the largest U.S. homebuilder sold more homes and the company said its orders rose 19 percent.UPDATE 2-D.R. Horton's profit surges as home sales jump * Shares up 2.5 pct premarket   (Adds details, background; updates shares)   
DAL,U.S. government seeks to block United Airlines from acquiring Newark slotsUPDATE 4-U.S. sues to block United Airlines from Newark expansionU.S. sues to block United Airlines from Newark expansion WASHINGTON/CHICAGO The U.S. Justice Department on Tuesday sued to stop United Continental Holdings Inc  from taking over 24 take-off and landing slots at Newark Liberty International Airport, an action that could thwart United's expansion at its New Jersey hub.  U.S. sues to block United Airlines from Newark expansion WASHINGTON/CHICAGO The U.S. Justice Department on Tuesday sued to stop United Continental Holdings Inc  from taking over 24 take-off and landing slots at Newark Liberty International Airport, an action that could thwart United's expansion at its New Jersey hub. WASHINGTON/CHICAGO, Nov 10 The U.S. Justice Department on Tuesday sued to stop United Continental Holdings Inc from taking over 24 take-off and landing slots at Newark Liberty International Airport, an action that could thwart United's expansion at its New Jersey hub.U.S. sues to block United Airlines from Newark expansion WASHINGTON/CHICAGO The U.S. Justice Department on Tuesday sued to stop United Continental Holdings Inc  from taking over 24 take-off and landing slots at Newark Liberty International Airport, an action that could thwart United's expansion at its New Jersey hub.   UPDATE 4-U.S. sues to block United Airlines from Newark expansionU.S. sues to block United Airlines from Newark expansion WASHINGTON/CHICAGO The U.S. Justice Department on Tuesday sued to stop United Continental Holdings Inc  from taking over 24 take-off and landing slots at Newark Liberty International Airport, an action that could thwart United's expansion at its New Jersey hub.  U.S. sues to block United Airlines from Newark expansion WASHINGTON/CHICAGO The U.S. Justice Department on Tuesday sued to stop United Continental Holdings Inc  from taking over 24 take-off and landing slots at Newark Liberty International Airport, an action that could thwart United's expansion at its New Jersey hub. WASHINGTON/CHICAGO, Nov 10 The U.S. Justice Department on Tuesday sued to stop United Continental Holdings Inc from taking over 24 take-off and landing slots at Newark Liberty International Airport, an action that could thwart United's expansion at its New Jersey hub.U.S. sues to block United Airlines from Newark expansion WASHINGTON/CHICAGO The U.S. Justice Department on Tuesday sued to stop United Continental Holdings Inc  from taking over 24 take-off and landing slots at Newark Liberty International Airport, an action that could thwart United's expansion at its New Jersey hub.  WASHINGTON, Nov 10 The U.S. Justice Department has sued to stop United Airlines from acquiring 24 takeoff and landing slots at Newark Liberty International Airport from Delta Airlines, it said on Tuesday.UPDATE 4-U.S. sues to block United Airlines from Newark expansionU.S. sues to block United Airlines from Newark expansion WASHINGTON/CHICAGO The U.S. Justice Department on Tuesday sued to stop United Continental Holdings Inc  from taking over 24 take-off and landing slots at Newark Liberty International Airport, an action that could thwart United's expansion at its New Jersey hub.  U.S. sues to block United Airlines from Newark expansion WASHINGTON/CHICAGO The U.S. Justice Department on Tuesday sued to stop United Continental Holdings Inc  from taking over 24 take-off and landing slots at Newark Liberty International Airport, an action that could thwart United's expansion at its New Jersey hub. WASHINGTON/CHICAGO, Nov 10 The U.S. Justice Department on Tuesday sued to stop United Continental Holdings Inc from taking over 24 take-off and landing slots at Newark Liberty International Airport, an action that could thwart United's expansion at its New Jersey hub.U.S. sues to block United Airlines from Newark expansion WASHINGTON/CHICAGO The U.S. Justice Department on Tuesday sued to stop United Continental Holdings Inc  from taking over 24 take-off and landing slots at Newark Liberty International Airport, an action that could thwart United's expansion at its New Jersey hub.   
FB,German prosecutor investigates Facebook manager for ignoring racist postsGerman prosecutor investigates Facebook manager for ignoring racist posts FRANKFURT Prosecutors in Hamburg have launched an investigation into the European head of Facebook over the social platform's alleged failure to remove racist hate speech, a spokeswoman for the prosecutor said on Tuesday.  German prosecutor investigates Facebook manager for ignoring racist posts FRANKFURT Prosecutors in Hamburg have launched an investigation into the European head of Facebook over the social platform's alleged failure to remove racist hate speech, a spokeswoman for the prosecutor said on Tuesday. FRANKFURT, Nov 10 Prosecutors in Hamburg have launched an investigation into the European head of Facebook  over the social platform's alleged failure to remove racist hate speech, a spokeswoman for the prosecutor said on Tuesday.German prosecutor investigates Facebook manager for ignoring racist posts FRANKFURT Prosecutors in Hamburg have launched an investigation into the European head of Facebook over the social platform's alleged failure to remove racist hate speech, a spokeswoman for the prosecutor said on Tuesday.  
GE,U.S. government, Electrolux argue at trial over GE appliance dealUPDATE 2-GE, Alstom land $5.6 billion deals to supply Indian railwayGE, Alstom land $5.6 billion deals to supply Indian railway NEW DELHI General Electric and Alstom have won contracts worth a combined $5.6 billion to supply India's railways with new locomotives, as the vast but dilapidated state-owned network looks to foreign companies to help it modernise.  GE, Alstom land $5.6 billion deals to supply Indian railway NEW DELHI General Electric and Alstom have won contracts worth a combined $5.6 billion to supply India's railways with new locomotives, as the vast but dilapidated state-owned network looks to foreign companies to help it modernise. * India seeking foreign help to modernise railways   (Recasts with Alstom contract, adds details on deals)GE, Alstom land $5.6 billion deals to supply Indian railway NEW DELHI General Electric and Alstom have won contracts worth a combined $5.6 billion to supply India's railways with new locomotives, as the vast but dilapidated state-owned network looks to foreign companies to help it modernise.   UPDATE 2-GE, Alstom land $5.6 billion deals to supply Indian railwayGE, Alstom land $5.6 billion deals to supply Indian railway NEW DELHI General Electric and Alstom have won contracts worth a combined $5.6 billion to supply India's railways with new locomotives, as the vast but dilapidated state-owned network looks to foreign companies to help it modernise.  GE, Alstom land $5.6 billion deals to supply Indian railway NEW DELHI General Electric and Alstom have won contracts worth a combined $5.6 billion to supply India's railways with new locomotives, as the vast but dilapidated state-owned network looks to foreign companies to help it modernise. * India seeking foreign help to modernise railways   (Recasts with Alstom contract, adds details on deals)GE, Alstom land $5.6 billion deals to supply Indian railway NEW DELHI General Electric and Alstom have won contracts worth a combined $5.6 billion to supply India's railways with new locomotives, as the vast but dilapidated state-owned network looks to foreign companies to help it modernise.  WASHINGTON The government argued Monday that U.S. consumers would pay 5 percent more for ranges and wall ovens if AB Electrolux  was allowed to buy General Electric's  appliance business but the companies accused antitrust enforcers of failing to acknowledge powerful and growing competition from overseas manufacturers.UPDATE 2-GE, Alstom land $5.6 billion deals to supply Indian railwayGE, Alstom land $5.6 billion deals to supply Indian railway NEW DELHI General Electric and Alstom have won contracts worth a combined $5.6 billion to supply India's railways with new locomotives, as the vast but dilapidated state-owned network looks to foreign companies to help it modernise.  GE, Alstom land $5.6 billion deals to supply Indian railway NEW DELHI General Electric and Alstom have won contracts worth a combined $5.6 billion to supply India's railways with new locomotives, as the vast but dilapidated state-owned network looks to foreign companies to help it modernise. * India seeking foreign help to modernise railways   (Recasts with Alstom contract, adds details on deals)GE, Alstom land $5.6 billion deals to supply Indian railway NEW DELHI General Electric and Alstom have won contracts worth a combined $5.6 billion to supply India's railways with new locomotives, as the vast but dilapidated state-owned network looks to foreign companies to help it modernise.   
GS,Anadarko approached Apache with offer that was rejected -sourceUPDATE 2-Anadarko approached Apache with offer that was rejected -source NEW YORK, Nov 10 U.S. oil and gas exploration and production company Anadarko Petroleum Corp has approached Apache Corp with a potential acquisition as low crude oil prices prompt companies to seek merger partners, according to a person familiar with the matter.  UPDATE 2-Anadarko approached Apache with offer that was rejected -source NEW YORK, Nov 10 U.S. oil and gas exploration and production company Anadarko Petroleum Corp has approached Apache Corp with a potential acquisition as low crude oil prices prompt companies to seek merger partners, according to a person familiar with the matter. HOUSTON, Nov 10 U.S. oil and gas exploration and production company Anadarko Petroleum Corp has approached Apache Corp with a potential acquisition as low crude oil prices prompt companies to seek merger partners, according to a person familiar with the matter.UPDATE 2-Anadarko approached Apache with offer that was rejected -source NEW YORK, Nov 10 U.S. oil and gas exploration and production company Anadarko Petroleum Corp has approached Apache Corp with a potential acquisition as low crude oil prices prompt companies to seek merger partners, according to a person familiar with the matter.  
LMT,UPDATE 1-AIRSHOW-U.S. Air Force defends bomber competition processU.S. Air Force defends bomber competition processAIRSHOW-Lockheed in initial talks with Saudi Arabia about more helicoptersLockheed in initial talks with Saudi Arabia about more helicopters DUBAI Lockheed Martin Corp  on Tuesday said it was in initial talks with Saudi Arabia about the sale of 20 more Sikorsky MH-60R helicopters in addition to a $1.9 billion deal for 10 helicopters that should be finalized by year's end.  Lockheed in initial talks with Saudi Arabia about more helicopters DUBAI Lockheed Martin Corp  on Tuesday said it was in initial talks with Saudi Arabia about the sale of 20 more Sikorsky MH-60R helicopters in addition to a $1.9 billion deal for 10 helicopters that should be finalized by year's end. DUBAI, Nov 10 Lockheed Martin Corp on Tuesday said it was in initial talks with Saudi Arabia about the sale of 20 more Sikorsky MH-60R helicopters in addition to a $1.9 billion deal for 10 helicopters that should be finalized by year's end.Lockheed in initial talks with Saudi Arabia about more helicopters DUBAI Lockheed Martin Corp  on Tuesday said it was in initial talks with Saudi Arabia about the sale of 20 more Sikorsky MH-60R helicopters in addition to a $1.9 billion deal for 10 helicopters that should be finalized by year's end.   AIRSHOW-Lockheed in initial talks with Saudi Arabia about more helicoptersLockheed in initial talks with Saudi Arabia about more helicopters DUBAI Lockheed Martin Corp  on Tuesday said it was in initial talks with Saudi Arabia about the sale of 20 more Sikorsky MH-60R helicopters in addition to a $1.9 billion deal for 10 helicopters that should be finalized by year's end.  Lockheed in initial talks with Saudi Arabia about more helicopters DUBAI Lockheed Martin Corp  on Tuesday said it was in initial talks with Saudi Arabia about the sale of 20 more Sikorsky MH-60R helicopters in addition to a $1.9 billion deal for 10 helicopters that should be finalized by year's end. DUBAI, Nov 10 Lockheed Martin Corp on Tuesday said it was in initial talks with Saudi Arabia about the sale of 20 more Sikorsky MH-60R helicopters in addition to a $1.9 billion deal for 10 helicopters that should be finalized by year's end.Lockheed in initial talks with Saudi Arabia about more helicopters DUBAI Lockheed Martin Corp  on Tuesday said it was in initial talks with Saudi Arabia about the sale of 20 more Sikorsky MH-60R helicopters in addition to a $1.9 billion deal for 10 helicopters that should be finalized by year's end.  DUBAI U.S. Air Force Secretary Deborah James defended on Tuesday the process that selected Northrop Grumman Corp  to build the next-generation U.S. bomber, saying it was "very deliberate" and included a number of independent reviews.AIRSHOW-Lockheed in initial talks with Saudi Arabia about more helicoptersLockheed in initial talks with Saudi Arabia about more helicopters DUBAI Lockheed Martin Corp  on Tuesday said it was in initial talks with Saudi Arabia about the sale of 20 more Sikorsky MH-60R helicopters in addition to a $1.9 billion deal for 10 helicopters that should be finalized by year's end.  Lockheed in initial talks with Saudi Arabia about more helicopters DUBAI Lockheed Martin Corp  on Tuesday said it was in initial talks with Saudi Arabia about the sale of 20 more Sikorsky MH-60R helicopters in addition to a $1.9 billion deal for 10 helicopters that should be finalized by year's end. DUBAI, Nov 10 Lockheed Martin Corp on Tuesday said it was in initial talks with Saudi Arabia about the sale of 20 more Sikorsky MH-60R helicopters in addition to a $1.9 billion deal for 10 helicopters that should be finalized by year's end.Lockheed in initial talks with Saudi Arabia about more helicopters DUBAI Lockheed Martin Corp  on Tuesday said it was in initial talks with Saudi Arabia about the sale of 20 more Sikorsky MH-60R helicopters in addition to a $1.9 billion deal for 10 helicopters that should be finalized by year's end.    U.S. Air Force defends bomber competition processAIRSHOW-Lockheed in initial talks with Saudi Arabia about more helicoptersLockheed in initial talks with Saudi Arabia about more helicopters DUBAI Lockheed Martin Corp  on Tuesday said it was in initial talks with Saudi Arabia about the sale of 20 more Sikorsky MH-60R helicopters in addition to a $1.9 billion deal for 10 helicopters that should be finalized by year's end.  Lockheed in initial talks with Saudi Arabia about more helicopters DUBAI Lockheed Martin Corp  on Tuesday said it was in initial talks with Saudi Arabia about the sale of 20 more Sikorsky MH-60R helicopters in addition to a $1.9 billion deal for 10 helicopters that should be finalized by year's end. DUBAI, Nov 10 Lockheed Martin Corp on Tuesday said it was in initial talks with Saudi Arabia about the sale of 20 more Sikorsky MH-60R helicopters in addition to a $1.9 billion deal for 10 helicopters that should be finalized by year's end.Lockheed in initial talks with Saudi Arabia about more helicopters DUBAI Lockheed Martin Corp  on Tuesday said it was in initial talks with Saudi Arabia about the sale of 20 more Sikorsky MH-60R helicopters in addition to a $1.9 billion deal for 10 helicopters that should be finalized by year's end.   AIRSHOW-Lockheed in initial talks with Saudi Arabia about more helicoptersLockheed in initial talks with Saudi Arabia about more helicopters DUBAI Lockheed Martin Corp  on Tuesday said it was in initial talks with Saudi Arabia about the sale of 20 more Sikorsky MH-60R helicopters in addition to a $1.9 billion deal for 10 helicopters that should be finalized by year's end.  Lockheed in initial talks with Saudi Arabia about more helicopters DUBAI Lockheed Martin Corp  on Tuesday said it was in initial talks with Saudi Arabia about the sale of 20 more Sikorsky MH-60R helicopters in addition to a $1.9 billion deal for 10 helicopters that should be finalized by year's end. DUBAI, Nov 10 Lockheed Martin Corp on Tuesday said it was in initial talks with Saudi Arabia about the sale of 20 more Sikorsky MH-60R helicopters in addition to a $1.9 billion deal for 10 helicopters that should be finalized by year's end.Lockheed in initial talks with Saudi Arabia about more helicopters DUBAI Lockheed Martin Corp  on Tuesday said it was in initial talks with Saudi Arabia about the sale of 20 more Sikorsky MH-60R helicopters in addition to a $1.9 billion deal for 10 helicopters that should be finalized by year's end.  DUBAI U.S. Air Force Secretary Deborah James defended on Tuesday the process that selected Northrop Grumman Corp  to build the next-generation U.S. bomber, saying it was "very deliberate" and included a number of independent reviews.AIRSHOW-Lockheed in initial talks with Saudi Arabia about more helicoptersLockheed in initial talks with Saudi Arabia about more helicopters DUBAI Lockheed Martin Corp  on Tuesday said it was in initial talks with Saudi Arabia about the sale of 20 more Sikorsky MH-60R helicopters in addition to a $1.9 billion deal for 10 helicopters that should be finalized by year's end.  Lockheed in initial talks with Saudi Arabia about more helicopters DUBAI Lockheed Martin Corp  on Tuesday said it was in initial talks with Saudi Arabia about the sale of 20 more Sikorsky MH-60R helicopters in addition to a $1.9 billion deal for 10 helicopters that should be finalized by year's end. DUBAI, Nov 10 Lockheed Martin Corp on Tuesday said it was in initial talks with Saudi Arabia about the sale of 20 more Sikorsky MH-60R helicopters in addition to a $1.9 billion deal for 10 helicopters that should be finalized by year's end.Lockheed in initial talks with Saudi Arabia about more helicopters DUBAI Lockheed Martin Corp  on Tuesday said it was in initial talks with Saudi Arabia about the sale of 20 more Sikorsky MH-60R helicopters in addition to a $1.9 billion deal for 10 helicopters that should be finalized by year's end.   DUBAI, Nov 10 U.S. Air Force Secretary Deborah James defended on Tuesday the process that selected Northrop Grumman Corp to build the next-generation U.S. bomber, saying it was "very deliberate" and included a number of independent reviews.U.S. Air Force defends bomber competition processAIRSHOW-Lockheed in initial talks with Saudi Arabia about more helicoptersLockheed in initial talks with Saudi Arabia about more helicopters DUBAI Lockheed Martin Corp  on Tuesday said it was in initial talks with Saudi Arabia about the sale of 20 more Sikorsky MH-60R helicopters in addition to a $1.9 billion deal for 10 helicopters that should be finalized by year's end.  Lockheed in initial talks with Saudi Arabia about more helicopters DUBAI Lockheed Martin Corp  on Tuesday said it was in initial talks with Saudi Arabia about the sale of 20 more Sikorsky MH-60R helicopters in addition to a $1.9 billion deal for 10 helicopters that should be finalized by year's end. DUBAI, Nov 10 Lockheed Martin Corp on Tuesday said it was in initial talks with Saudi Arabia about the sale of 20 more Sikorsky MH-60R helicopters in addition to a $1.9 billion deal for 10 helicopters that should be finalized by year's end.Lockheed in initial talks with Saudi Arabia about more helicopters DUBAI Lockheed Martin Corp  on Tuesday said it was in initial talks with Saudi Arabia about the sale of 20 more Sikorsky MH-60R helicopters in addition to a $1.9 billion deal for 10 helicopters that should be finalized by year's end.   AIRSHOW-Lockheed in initial talks with Saudi Arabia about more helicoptersLockheed in initial talks with Saudi Arabia about more helicopters DUBAI Lockheed Martin Corp  on Tuesday said it was in initial talks with Saudi Arabia about the sale of 20 more Sikorsky MH-60R helicopters in addition to a $1.9 billion deal for 10 helicopters that should be finalized by year's end.  Lockheed in initial talks with Saudi Arabia about more helicopters DUBAI Lockheed Martin Corp  on Tuesday said it was in initial talks with Saudi Arabia about the sale of 20 more Sikorsky MH-60R helicopters in addition to a $1.9 billion deal for 10 helicopters that should be finalized by year's end. DUBAI, Nov 10 Lockheed Martin Corp on Tuesday said it was in initial talks with Saudi Arabia about the sale of 20 more Sikorsky MH-60R helicopters in addition to a $1.9 billion deal for 10 helicopters that should be finalized by year's end.Lockheed in initial talks with Saudi Arabia about more helicopters DUBAI Lockheed Martin Corp  on Tuesday said it was in initial talks with Saudi Arabia about the sale of 20 more Sikorsky MH-60R helicopters in addition to a $1.9 billion deal for 10 helicopters that should be finalized by year's end.  DUBAI U.S. Air Force Secretary Deborah James defended on Tuesday the process that selected Northrop Grumman Corp  to build the next-generation U.S. bomber, saying it was "very deliberate" and included a number of independent reviews.AIRSHOW-Lockheed in initial talks with Saudi Arabia about more helicoptersLockheed in initial talks with Saudi Arabia about more helicopters DUBAI Lockheed Martin Corp  on Tuesday said it was in initial talks with Saudi Arabia about the sale of 20 more Sikorsky MH-60R helicopters in addition to a $1.9 billion deal for 10 helicopters that should be finalized by year's end.  Lockheed in initial talks with Saudi Arabia about more helicopters DUBAI Lockheed Martin Corp  on Tuesday said it was in initial talks with Saudi Arabia about the sale of 20 more Sikorsky MH-60R helicopters in addition to a $1.9 billion deal for 10 helicopters that should be finalized by year's end. DUBAI, Nov 10 Lockheed Martin Corp on Tuesday said it was in initial talks with Saudi Arabia about the sale of 20 more Sikorsky MH-60R helicopters in addition to a $1.9 billion deal for 10 helicopters that should be finalized by year's end.Lockheed in initial talks with Saudi Arabia about more helicopters DUBAI Lockheed Martin Corp  on Tuesday said it was in initial talks with Saudi Arabia about the sale of 20 more Sikorsky MH-60R helicopters in addition to a $1.9 billion deal for 10 helicopters that should be finalized by year's end.    
