AKAM,Akamai profit falls about 8 pct as costs riseUPDATE 1-Akamai forecasts revenue, profit below estimates; shares sink July 28 Online content distributor Akamai Technologies Inc forecast third-quarter revenue and profit below estimates, citing a stronger dollar.  UPDATE 1-Akamai forecasts revenue, profit below estimates; shares sink July 28 Online content distributor Akamai Technologies Inc forecast third-quarter revenue and profit below estimates, citing a stronger dollar. July 28 Akamai Technologies Inc, whose services help deliver Internet content faster, reported a near 8 percent fall in quarterly profit, hurt by a rise in costs.UPDATE 1-Akamai forecasts revenue, profit below estimates; shares sink July 28 Online content distributor Akamai Technologies Inc forecast third-quarter revenue and profit below estimates, citing a stronger dollar.  
APC,Anadarko Petroleum quarterly profit lower July 28 Anadarko Petroleum Corp, an oil and natural gas company with shale properties in Colorado and offshore assets in Africa, on Tuesday reported a drop in profit as lower crude oil prices took a toll on results. 
AAPL,Corning quarterly sales rise marginallyUPDATE 1-Corning sales miss Street on weak demand for LCD glass July 28 Corning Inc, the supplier of Gorilla glass to Apple Inc and Samsung Electronics Co Ltd, reported lower-than-expected quarterly sales due to weak demand for its glass used in TVs and personal computers.  UPDATE 1-Corning sales miss Street on weak demand for LCD glass July 28 Corning Inc, the supplier of Gorilla glass to Apple Inc and Samsung Electronics Co Ltd, reported lower-than-expected quarterly sales due to weak demand for its glass used in TVs and personal computers. July 28 Corning Inc, the supplier of Gorilla glass to Apple Inc, reported a marginal rise in quarterly core net sales, as strong demand for its fiber optic cables and connectors offset weak sales in its specialty materials unit.UPDATE 1-Corning sales miss Street on weak demand for LCD glass July 28 Corning Inc, the supplier of Gorilla glass to Apple Inc and Samsung Electronics Co Ltd, reported lower-than-expected quarterly sales due to weak demand for its glass used in TVs and personal computers.  
BA,BRIEF-Air China plans share private placement to fund purchase of Boeing aircrafts, projectsUPDATE 1-Cessna jets maker Textron's revenue falls on fewer deliveries July 28 Textron Inc, the maker of Beechcraft and Cessna planes, reported lower-than-expected quarterly revenue as it delivered fewer King Air Turboprops and Bell helicopters.  UPDATE 1-Cessna jets maker Textron's revenue falls on fewer deliveries July 28 Textron Inc, the maker of Beechcraft and Cessna planes, reported lower-than-expected quarterly revenue as it delivered fewer King Air Turboprops and Bell helicopters. * Says plans to raise up to 12 billion yuan ($1.93 billion) in private placement of A-share to fund acquisition of 15 Boeing B787 aircrafts, projects and replenish capitalUPDATE 1-Cessna jets maker Textron's revenue falls on fewer deliveries July 28 Textron Inc, the maker of Beechcraft and Cessna planes, reported lower-than-expected quarterly revenue as it delivered fewer King Air Turboprops and Bell helicopters.  
CNC,Health insurer Centene's profit jumps 79.6 pctUPDATE 2-Centene considers snapping up Medicare Advantage plans from rivals * Total revenue up 37 pct to $5.51 bln vs est $5.53 bln   (Adds details from conference call)  UPDATE 2-Centene considers snapping up Medicare Advantage plans from rivals * Total revenue up 37 pct to $5.51 bln vs est $5.53 bln   (Adds details from conference call) July 28 Health insurer Centene Corp  reported a 79.6 percent jump in quarterly profit as it added 1.3 million members.UPDATE 2-Centene considers snapping up Medicare Advantage plans from rivals * Total revenue up 37 pct to $5.51 bln vs est $5.53 bln   (Adds details from conference call)  
CVX,Chevron to lay off 1,500 workers amidst oil price slump July 28 Chevron Corp, the second-largest U.S. oil company, said on Tuesday it would lay off 1,500 employees, about 2 percent of its global work force, as it trims costs to offset declining crude prices. 
C,MOVES-Citigroup adds Barrier to head French, Benelux, Swiss ECM LONDON, July 28 (IFR) - Citigroup has hired Valery Barrier as head of equity capital markets for France, Benelux and Switzerland. He joins the firm in November and will report to Ken Robins, head of ECM for the Europe, Middle East and Africa region. 
CTXS,Citrix Systems CEO to resign; gives Elliott Management board seat July 28 Cloud-computing company Citrix Systems Inc said Chief Executive Mark Templeton would retire and separately said it had agreed to give activist investor Elliott Management a board seat. 
GLW,Corning quarterly sales rise marginallyUPDATE 1-Corning sales miss Street on weak demand for LCD glass July 28 Corning Inc, the supplier of Gorilla glass to Apple Inc and Samsung Electronics Co Ltd, reported lower-than-expected quarterly sales due to weak demand for its glass used in TVs and personal computers.  UPDATE 1-Corning sales miss Street on weak demand for LCD glass July 28 Corning Inc, the supplier of Gorilla glass to Apple Inc and Samsung Electronics Co Ltd, reported lower-than-expected quarterly sales due to weak demand for its glass used in TVs and personal computers. July 28 Corning Inc, the supplier of Gorilla glass to Apple Inc, reported a marginal rise in quarterly core net sales, as strong demand for its fiber optic cables and connectors offset weak sales in its specialty materials unit.UPDATE 1-Corning sales miss Street on weak demand for LCD glass July 28 Corning Inc, the supplier of Gorilla glass to Apple Inc and Samsung Electronics Co Ltd, reported lower-than-expected quarterly sales due to weak demand for its glass used in TVs and personal computers.  
CMI,Diesel engine maker Cummins' revenue rises on N America demandDiesel engine maker Cummins 2nd-qtr profit, revenue riseUPDATE 1-Diesel engine maker Cummins' quarterly profit, revenue rise July 28 Shares of Cummins Inc rose almost 4 percent after the diesel engine maker reported a rise in quarterly revenue, boosted by distributor acquisitions in North America and stronger demand in truck and bus markets.  UPDATE 1-Diesel engine maker Cummins' quarterly profit, revenue rise July 28 Shares of Cummins Inc rose almost 4 percent after the diesel engine maker reported a rise in quarterly revenue, boosted by distributor acquisitions in North America and stronger demand in truck and bus markets. July 28 Diesel engine maker Cummins Inc  reported a 4 percent rise in quarterly revenue, boosted by distributor acquisitions in North America and stronger demand in truck and bus markets.UPDATE 1-Diesel engine maker Cummins' quarterly profit, revenue rise July 28 Shares of Cummins Inc rose almost 4 percent after the diesel engine maker reported a rise in quarterly revenue, boosted by distributor acquisitions in North America and stronger demand in truck and bus markets.   Diesel engine maker Cummins 2nd-qtr profit, revenue riseUPDATE 1-Diesel engine maker Cummins' quarterly profit, revenue rise July 28 Shares of Cummins Inc rose almost 4 percent after the diesel engine maker reported a rise in quarterly revenue, boosted by distributor acquisitions in North America and stronger demand in truck and bus markets.  UPDATE 1-Diesel engine maker Cummins' quarterly profit, revenue rise July 28 Shares of Cummins Inc rose almost 4 percent after the diesel engine maker reported a rise in quarterly revenue, boosted by distributor acquisitions in North America and stronger demand in truck and bus markets. July 28 Diesel engine maker Cummins Inc  reported a 4 percent rise in quarterly revenue, boosted by distributor acquisitions in North America and stronger demand in truck and bus markets.UPDATE 1-Diesel engine maker Cummins' quarterly profit, revenue rise July 28 Shares of Cummins Inc rose almost 4 percent after the diesel engine maker reported a rise in quarterly revenue, boosted by distributor acquisitions in North America and stronger demand in truck and bus markets.  July 28 Diesel engines maker Cummins Inc  reported a 4 percent rise in quarterly revenue, helped by higher demand in North America.Diesel engine maker Cummins 2nd-qtr profit, revenue riseUPDATE 1-Diesel engine maker Cummins' quarterly profit, revenue rise July 28 Shares of Cummins Inc rose almost 4 percent after the diesel engine maker reported a rise in quarterly revenue, boosted by distributor acquisitions in North America and stronger demand in truck and bus markets.  UPDATE 1-Diesel engine maker Cummins' quarterly profit, revenue rise July 28 Shares of Cummins Inc rose almost 4 percent after the diesel engine maker reported a rise in quarterly revenue, boosted by distributor acquisitions in North America and stronger demand in truck and bus markets. July 28 Diesel engine maker Cummins Inc  reported a 4 percent rise in quarterly revenue, boosted by distributor acquisitions in North America and stronger demand in truck and bus markets.UPDATE 1-Diesel engine maker Cummins' quarterly profit, revenue rise July 28 Shares of Cummins Inc rose almost 4 percent after the diesel engine maker reported a rise in quarterly revenue, boosted by distributor acquisitions in North America and stronger demand in truck and bus markets.   
DHI,D.R. Horton's profit boosted by higher home salesUPDATE 2-D.R. Horton results indicate firming housing recoveryD.R. Horton results indicate firming housing recovery D.R. Horton Inc's  quarterly profit handily beat estimates and the No.1 U.S. homebuilder said orders rose 22 percent, indicating that a recovery in the housing market was gaining steam.  D.R. Horton results indicate firming housing recovery D.R. Horton Inc's  quarterly profit handily beat estimates and the No.1 U.S. homebuilder said orders rose 22 percent, indicating that a recovery in the housing market was gaining steam. * Shares rise as much as 4.3 pct   (Adds background, updates shares)D.R. Horton results indicate firming housing recovery D.R. Horton Inc's  quarterly profit handily beat estimates and the No.1 U.S. homebuilder said orders rose 22 percent, indicating that a recovery in the housing market was gaining steam.   UPDATE 2-D.R. Horton results indicate firming housing recoveryD.R. Horton results indicate firming housing recovery D.R. Horton Inc's  quarterly profit handily beat estimates and the No.1 U.S. homebuilder said orders rose 22 percent, indicating that a recovery in the housing market was gaining steam.  D.R. Horton results indicate firming housing recovery D.R. Horton Inc's  quarterly profit handily beat estimates and the No.1 U.S. homebuilder said orders rose 22 percent, indicating that a recovery in the housing market was gaining steam. * Shares rise as much as 4.3 pct   (Adds background, updates shares)D.R. Horton results indicate firming housing recovery D.R. Horton Inc's  quarterly profit handily beat estimates and the No.1 U.S. homebuilder said orders rose 22 percent, indicating that a recovery in the housing market was gaining steam.  July 28 D.R. Horton Inc, the No.1 U.S. homebuilder, said quarterly profit nearly doubled as it sold more homes, and it reported a 22 percent rise in orders.UPDATE 2-D.R. Horton results indicate firming housing recoveryD.R. Horton results indicate firming housing recovery D.R. Horton Inc's  quarterly profit handily beat estimates and the No.1 U.S. homebuilder said orders rose 22 percent, indicating that a recovery in the housing market was gaining steam.  D.R. Horton results indicate firming housing recovery D.R. Horton Inc's  quarterly profit handily beat estimates and the No.1 U.S. homebuilder said orders rose 22 percent, indicating that a recovery in the housing market was gaining steam. * Shares rise as much as 4.3 pct   (Adds background, updates shares)D.R. Horton results indicate firming housing recovery D.R. Horton Inc's  quarterly profit handily beat estimates and the No.1 U.S. homebuilder said orders rose 22 percent, indicating that a recovery in the housing market was gaining steam.   
DAL,China stocks fall as Beijing renews support, Hong Kong upHong Kong blue chips rise on hopes for China monetary easingChina Eastern says looks beyond U.S.-China routes with Delta stake dealAir China to raise up to 12 bln yuan to fund plane order BEIJING, July 28 Air China Ltd said on Tuesday it aims to raise up to 12 billion yuan ($1.93 billion) in a private placement of A-shares to help fund the purchase of 15 Boeing planes and upgrade its direct sales service.  Air China to raise up to 12 bln yuan to fund plane order BEIJING, July 28 Air China Ltd said on Tuesday it aims to raise up to 12 billion yuan ($1.93 billion) in a private placement of A-shares to help fund the purchase of 15 Boeing planes and upgrade its direct sales service. BEIJING/SHANGHAI, July 28 China Eastern Airlines  plans to work with new investor Delta Air Lines  to expand its global footprint beyond China-U.S. routes, an executive from the Shanghai-based carrier said.Air China to raise up to 12 bln yuan to fund plane order BEIJING, July 28 Air China Ltd said on Tuesday it aims to raise up to 12 billion yuan ($1.93 billion) in a private placement of A-shares to help fund the purchase of 15 Boeing planes and upgrade its direct sales service.   China Eastern says looks beyond U.S.-China routes with Delta stake dealAir China to raise up to 12 bln yuan to fund plane order BEIJING, July 28 Air China Ltd said on Tuesday it aims to raise up to 12 billion yuan ($1.93 billion) in a private placement of A-shares to help fund the purchase of 15 Boeing planes and upgrade its direct sales service.  Air China to raise up to 12 bln yuan to fund plane order BEIJING, July 28 Air China Ltd said on Tuesday it aims to raise up to 12 billion yuan ($1.93 billion) in a private placement of A-shares to help fund the purchase of 15 Boeing planes and upgrade its direct sales service. BEIJING/SHANGHAI, July 28 China Eastern Airlines  plans to work with new investor Delta Air Lines  to expand its global footprint beyond China-U.S. routes, an executive from the Shanghai-based carrier said.Air China to raise up to 12 bln yuan to fund plane order BEIJING, July 28 Air China Ltd said on Tuesday it aims to raise up to 12 billion yuan ($1.93 billion) in a private placement of A-shares to help fund the purchase of 15 Boeing planes and upgrade its direct sales service.  HONG KONG, July 28 Hong Kong blue chip stocks rose on Tuesday, bucking falls for mainland shares, on hopes for a stabilising China market as Beijing hinted at further monetary easing.China Eastern says looks beyond U.S.-China routes with Delta stake dealAir China to raise up to 12 bln yuan to fund plane order BEIJING, July 28 Air China Ltd said on Tuesday it aims to raise up to 12 billion yuan ($1.93 billion) in a private placement of A-shares to help fund the purchase of 15 Boeing planes and upgrade its direct sales service.  Air China to raise up to 12 bln yuan to fund plane order BEIJING, July 28 Air China Ltd said on Tuesday it aims to raise up to 12 billion yuan ($1.93 billion) in a private placement of A-shares to help fund the purchase of 15 Boeing planes and upgrade its direct sales service. BEIJING/SHANGHAI, July 28 China Eastern Airlines  plans to work with new investor Delta Air Lines  to expand its global footprint beyond China-U.S. routes, an executive from the Shanghai-based carrier said.Air China to raise up to 12 bln yuan to fund plane order BEIJING, July 28 Air China Ltd said on Tuesday it aims to raise up to 12 billion yuan ($1.93 billion) in a private placement of A-shares to help fund the purchase of 15 Boeing planes and upgrade its direct sales service.    Hong Kong blue chips rise on hopes for China monetary easingChina Eastern says looks beyond U.S.-China routes with Delta stake dealAir China to raise up to 12 bln yuan to fund plane order BEIJING, July 28 Air China Ltd said on Tuesday it aims to raise up to 12 billion yuan ($1.93 billion) in a private placement of A-shares to help fund the purchase of 15 Boeing planes and upgrade its direct sales service.  Air China to raise up to 12 bln yuan to fund plane order BEIJING, July 28 Air China Ltd said on Tuesday it aims to raise up to 12 billion yuan ($1.93 billion) in a private placement of A-shares to help fund the purchase of 15 Boeing planes and upgrade its direct sales service. BEIJING/SHANGHAI, July 28 China Eastern Airlines  plans to work with new investor Delta Air Lines  to expand its global footprint beyond China-U.S. routes, an executive from the Shanghai-based carrier said.Air China to raise up to 12 bln yuan to fund plane order BEIJING, July 28 Air China Ltd said on Tuesday it aims to raise up to 12 billion yuan ($1.93 billion) in a private placement of A-shares to help fund the purchase of 15 Boeing planes and upgrade its direct sales service.   China Eastern says looks beyond U.S.-China routes with Delta stake dealAir China to raise up to 12 bln yuan to fund plane order BEIJING, July 28 Air China Ltd said on Tuesday it aims to raise up to 12 billion yuan ($1.93 billion) in a private placement of A-shares to help fund the purchase of 15 Boeing planes and upgrade its direct sales service.  Air China to raise up to 12 bln yuan to fund plane order BEIJING, July 28 Air China Ltd said on Tuesday it aims to raise up to 12 billion yuan ($1.93 billion) in a private placement of A-shares to help fund the purchase of 15 Boeing planes and upgrade its direct sales service. BEIJING/SHANGHAI, July 28 China Eastern Airlines  plans to work with new investor Delta Air Lines  to expand its global footprint beyond China-U.S. routes, an executive from the Shanghai-based carrier said.Air China to raise up to 12 bln yuan to fund plane order BEIJING, July 28 Air China Ltd said on Tuesday it aims to raise up to 12 billion yuan ($1.93 billion) in a private placement of A-shares to help fund the purchase of 15 Boeing planes and upgrade its direct sales service.  HONG KONG, July 28 Hong Kong blue chip stocks rose on Tuesday, bucking falls for mainland shares, on hopes for a stabilising China market as Beijing hinted at further monetary easing.China Eastern says looks beyond U.S.-China routes with Delta stake dealAir China to raise up to 12 bln yuan to fund plane order BEIJING, July 28 Air China Ltd said on Tuesday it aims to raise up to 12 billion yuan ($1.93 billion) in a private placement of A-shares to help fund the purchase of 15 Boeing planes and upgrade its direct sales service.  Air China to raise up to 12 bln yuan to fund plane order BEIJING, July 28 Air China Ltd said on Tuesday it aims to raise up to 12 billion yuan ($1.93 billion) in a private placement of A-shares to help fund the purchase of 15 Boeing planes and upgrade its direct sales service. BEIJING/SHANGHAI, July 28 China Eastern Airlines  plans to work with new investor Delta Air Lines  to expand its global footprint beyond China-U.S. routes, an executive from the Shanghai-based carrier said.Air China to raise up to 12 bln yuan to fund plane order BEIJING, July 28 Air China Ltd said on Tuesday it aims to raise up to 12 billion yuan ($1.93 billion) in a private placement of A-shares to help fund the purchase of 15 Boeing planes and upgrade its direct sales service.   * China Eastern Airlines falls after Delta agrees to buy stakeHong Kong blue chips rise on hopes for China monetary easingChina Eastern says looks beyond U.S.-China routes with Delta stake dealAir China to raise up to 12 bln yuan to fund plane order BEIJING, July 28 Air China Ltd said on Tuesday it aims to raise up to 12 billion yuan ($1.93 billion) in a private placement of A-shares to help fund the purchase of 15 Boeing planes and upgrade its direct sales service.  Air China to raise up to 12 bln yuan to fund plane order BEIJING, July 28 Air China Ltd said on Tuesday it aims to raise up to 12 billion yuan ($1.93 billion) in a private placement of A-shares to help fund the purchase of 15 Boeing planes and upgrade its direct sales service. BEIJING/SHANGHAI, July 28 China Eastern Airlines  plans to work with new investor Delta Air Lines  to expand its global footprint beyond China-U.S. routes, an executive from the Shanghai-based carrier said.Air China to raise up to 12 bln yuan to fund plane order BEIJING, July 28 Air China Ltd said on Tuesday it aims to raise up to 12 billion yuan ($1.93 billion) in a private placement of A-shares to help fund the purchase of 15 Boeing planes and upgrade its direct sales service.   China Eastern says looks beyond U.S.-China routes with Delta stake dealAir China to raise up to 12 bln yuan to fund plane order BEIJING, July 28 Air China Ltd said on Tuesday it aims to raise up to 12 billion yuan ($1.93 billion) in a private placement of A-shares to help fund the purchase of 15 Boeing planes and upgrade its direct sales service.  Air China to raise up to 12 bln yuan to fund plane order BEIJING, July 28 Air China Ltd said on Tuesday it aims to raise up to 12 billion yuan ($1.93 billion) in a private placement of A-shares to help fund the purchase of 15 Boeing planes and upgrade its direct sales service. BEIJING/SHANGHAI, July 28 China Eastern Airlines  plans to work with new investor Delta Air Lines  to expand its global footprint beyond China-U.S. routes, an executive from the Shanghai-based carrier said.Air China to raise up to 12 bln yuan to fund plane order BEIJING, July 28 Air China Ltd said on Tuesday it aims to raise up to 12 billion yuan ($1.93 billion) in a private placement of A-shares to help fund the purchase of 15 Boeing planes and upgrade its direct sales service.  HONG KONG, July 28 Hong Kong blue chip stocks rose on Tuesday, bucking falls for mainland shares, on hopes for a stabilising China market as Beijing hinted at further monetary easing.China Eastern says looks beyond U.S.-China routes with Delta stake dealAir China to raise up to 12 bln yuan to fund plane order BEIJING, July 28 Air China Ltd said on Tuesday it aims to raise up to 12 billion yuan ($1.93 billion) in a private placement of A-shares to help fund the purchase of 15 Boeing planes and upgrade its direct sales service.  Air China to raise up to 12 bln yuan to fund plane order BEIJING, July 28 Air China Ltd said on Tuesday it aims to raise up to 12 billion yuan ($1.93 billion) in a private placement of A-shares to help fund the purchase of 15 Boeing planes and upgrade its direct sales service. BEIJING/SHANGHAI, July 28 China Eastern Airlines  plans to work with new investor Delta Air Lines  to expand its global footprint beyond China-U.S. routes, an executive from the Shanghai-based carrier said.Air China to raise up to 12 bln yuan to fund plane order BEIJING, July 28 Air China Ltd said on Tuesday it aims to raise up to 12 billion yuan ($1.93 billion) in a private placement of A-shares to help fund the purchase of 15 Boeing planes and upgrade its direct sales service.    
DD,DuPont profit falls 12 pctUPDATE 3-DuPont sees "challenging" months ahead as farm sales weaken July 28 Chemical and crop company DuPont  said the remainder of the year would be "challenging", as a strong dollar and persistently weak demand for its farm products continue to chip away at sales.  UPDATE 3-DuPont sees "challenging" months ahead as farm sales weaken July 28 Chemical and crop company DuPont  said the remainder of the year would be "challenging", as a strong dollar and persistently weak demand for its farm products continue to chip away at sales. July 28 Chemical and crop company DuPont  reported a 12 percent fall in quarterly profit, hurt by a fall in agriculture earnings and a stronger dollar.UPDATE 3-DuPont sees "challenging" months ahead as farm sales weaken July 28 Chemical and crop company DuPont  said the remainder of the year would be "challenging", as a strong dollar and persistently weak demand for its farm products continue to chip away at sales.  
EW,Edwards Lifesciences raises outlook on strong valve salesUPDATE 2-Edwards Lifesciences raises outlook on strong valve sales July 28 Edwards Lifesciences Corp on Tuesday raised its full-year profit forecast, citing strong demand for the medical device maker's replacement heart valves that are implanted in a minimally invasive procedure.  UPDATE 2-Edwards Lifesciences raises outlook on strong valve sales July 28 Edwards Lifesciences Corp on Tuesday raised its full-year profit forecast, citing strong demand for the medical device maker's replacement heart valves that are implanted in a minimally invasive procedure. July 28 Edwards Lifesciences Corp on Tuesday raised its full-year profit forecast due to strong demand for its replacement heart valves that are implanted in a minimally invasive procedure.UPDATE 2-Edwards Lifesciences raises outlook on strong valve sales July 28 Edwards Lifesciences Corp on Tuesday raised its full-year profit forecast, citing strong demand for the medical device maker's replacement heart valves that are implanted in a minimally invasive procedure.  
