GOOGL,PHILIPPINES PRESS-Chipmaker Cirtek on Google shortlist - BusinessWorldBRIEF-Cellcast denies Google in talks to use its technology * Notes recent press speculation suggesting that Google Inc in advanced talks with co to use their internet telephony technology  BRIEF-Cellcast denies Google in talks to use its technology * Notes recent press speculation suggesting that Google Inc in advanced talks with co to use their internet telephony technology Chipmaker Cirtek Holdings Philippines Corp has been shortlisted for a possible manufacturing deal with Google Inc  as the American technology giant continues to build its stable of self-driving cars, BusinessWorld newspaper reported, citing Cirtek's chief financial officer as saying. (http://bit.ly/1hGKLJn)BRIEF-Cellcast denies Google in talks to use its technology * Notes recent press speculation suggesting that Google Inc in advanced talks with co to use their internet telephony technology  
GOOG,PHILIPPINES PRESS-Chipmaker Cirtek on Google shortlist - BusinessWorldBRIEF-Cellcast denies Google in talks to use its technology * Notes recent press speculation suggesting that Google Inc in advanced talks with co to use their internet telephony technology  BRIEF-Cellcast denies Google in talks to use its technology * Notes recent press speculation suggesting that Google Inc in advanced talks with co to use their internet telephony technology Chipmaker Cirtek Holdings Philippines Corp has been shortlisted for a possible manufacturing deal with Google Inc  as the American technology giant continues to build its stable of self-driving cars, BusinessWorld newspaper reported, citing Cirtek's chief financial officer as saying. (http://bit.ly/1hGKLJn)BRIEF-Cellcast denies Google in talks to use its technology * Notes recent press speculation suggesting that Google Inc in advanced talks with co to use their internet telephony technology  
AMZN,LG Display to focus investment on OLED in next-generation push SEOUL, Aug 17 South Korea's LG Display Co Ltd  said on Monday it would focus investment on organic light-emitting diode (OLED) displays, betting on the next-generation technology to steer it clear of price wars and ahead of the competition. 
AAPL,Apple hires banks to lead potential Kangaroo bond debut SYDNEY, Aug 17 (IFR) - Apple Inc has mandated CBA, Deutsche Bank and Goldman Sachs to hold investor calls with debt investors starting tomorrow for a potential debut offering of Kangaroo bonds. 
T,U.N. says expects states to respect privacy after AT&T; spying report UNITED NATIONS, Aug 17 The United Nations said it expects member states to respect its right to privacy and is assessing how to respond to a report that telecommunications company AT&T; Inc helped the U.S. National Security Agency spy on the world body's communications. 
BA,UPDATE 2-India's IndiGo finalizes $26.5 bln purchase of 250 new Airbus jets * IndiGo to take delivery of jets from 2018 to 2026   (Adds IndiGo executive's comments) 
CSCO,OMERS' tech fund raises C$260 million from Cisco, Bank of Montreal TORONTO, Aug 17 OMERS Ventures, one of Canada's biggest venture-capital firms, said on Monday it has raised about C$260 million ($198.56 million) for a second fund to invest mainly in early-stage technology companies. 
DE,Damage from Tianjin blasts keeps John Deere factory closed NEW YORK, Aug 16 Deere & Co.'s John Deere said on Sunday it has suspended operations near the Chinese port of Tianjin indefinitely after huge explosions there last week killed more than 100 people and injured some of the company's 1,300 workers. 
EBAY,Luxury hotel owner Strategic Hotels to explore sale Aug 17 Luxury hotel owner Strategic Hotels & Resorts Inc said it was exploring strategic alternatives, including a sale, sending its shares up 4.5 percent in premarket trading. 
ESRX,CORRECTED-UPDATE 1-Target promotes CFO John Mulligan to newly created COO role Aug 17 Target Corp promoted Chief Financial Officer John Mulligan to the newly created role of chief operating officer, and appointed Express Scripts Holding Co's CFO, Cathy Smith, as his replacement. 
GE,Alstom and H&M; rise as European shares climb higherAlstom, H&M; among top gainers as European stocks reboundDeal-making hopes, earnings lift Europe sharesEU mergers and takeovers (Aug 17) BRUSSELS, Aug 17 The following are mergers under review by the European Commission and a brief guide to the EU merger process:  EU mergers and takeovers (Aug 17) BRUSSELS, Aug 17 The following are mergers under review by the European Commission and a brief guide to the EU merger process: * Asset performance in 2015: http://link.reuters.com/gap87v   (Adds euro zone data, dividends, Greece)EU mergers and takeovers (Aug 17) BRUSSELS, Aug 17 The following are mergers under review by the European Commission and a brief guide to the EU merger process:   Deal-making hopes, earnings lift Europe sharesEU mergers and takeovers (Aug 17) BRUSSELS, Aug 17 The following are mergers under review by the European Commission and a brief guide to the EU merger process:  EU mergers and takeovers (Aug 17) BRUSSELS, Aug 17 The following are mergers under review by the European Commission and a brief guide to the EU merger process: * Asset performance in 2015: http://link.reuters.com/gap87v   (Adds euro zone data, dividends, Greece)EU mergers and takeovers (Aug 17) BRUSSELS, Aug 17 The following are mergers under review by the European Commission and a brief guide to the EU merger process:  LONDON, Aug 17 European stocks rose on Monday, rebounding from losses last week caused by worries over currency devaluation in China, with shares in French industrial group Alstom outperforming.Deal-making hopes, earnings lift Europe sharesEU mergers and takeovers (Aug 17) BRUSSELS, Aug 17 The following are mergers under review by the European Commission and a brief guide to the EU merger process:  EU mergers and takeovers (Aug 17) BRUSSELS, Aug 17 The following are mergers under review by the European Commission and a brief guide to the EU merger process: * Asset performance in 2015: http://link.reuters.com/gap87v   (Adds euro zone data, dividends, Greece)EU mergers and takeovers (Aug 17) BRUSSELS, Aug 17 The following are mergers under review by the European Commission and a brief guide to the EU merger process:    Alstom, H&M; among top gainers as European stocks reboundDeal-making hopes, earnings lift Europe sharesEU mergers and takeovers (Aug 17) BRUSSELS, Aug 17 The following are mergers under review by the European Commission and a brief guide to the EU merger process:  EU mergers and takeovers (Aug 17) BRUSSELS, Aug 17 The following are mergers under review by the European Commission and a brief guide to the EU merger process: * Asset performance in 2015: http://link.reuters.com/gap87v   (Adds euro zone data, dividends, Greece)EU mergers and takeovers (Aug 17) BRUSSELS, Aug 17 The following are mergers under review by the European Commission and a brief guide to the EU merger process:   Deal-making hopes, earnings lift Europe sharesEU mergers and takeovers (Aug 17) BRUSSELS, Aug 17 The following are mergers under review by the European Commission and a brief guide to the EU merger process:  EU mergers and takeovers (Aug 17) BRUSSELS, Aug 17 The following are mergers under review by the European Commission and a brief guide to the EU merger process: * Asset performance in 2015: http://link.reuters.com/gap87v   (Adds euro zone data, dividends, Greece)EU mergers and takeovers (Aug 17) BRUSSELS, Aug 17 The following are mergers under review by the European Commission and a brief guide to the EU merger process:  LONDON, Aug 17 European stocks rose on Monday, rebounding from losses last week caused by worries over currency devaluation in China, with shares in French industrial group Alstom outperforming.Deal-making hopes, earnings lift Europe sharesEU mergers and takeovers (Aug 17) BRUSSELS, Aug 17 The following are mergers under review by the European Commission and a brief guide to the EU merger process:  EU mergers and takeovers (Aug 17) BRUSSELS, Aug 17 The following are mergers under review by the European Commission and a brief guide to the EU merger process: * Asset performance in 2015: http://link.reuters.com/gap87v   (Adds euro zone data, dividends, Greece)EU mergers and takeovers (Aug 17) BRUSSELS, Aug 17 The following are mergers under review by the European Commission and a brief guide to the EU merger process:   LONDON, Aug 17 European stocks rose on Monday to rebound from losses last week caused by worries over China's currency devaluation, with shares in French industrial group Alstom outperforming.Alstom, H&M; among top gainers as European stocks reboundDeal-making hopes, earnings lift Europe sharesEU mergers and takeovers (Aug 17) BRUSSELS, Aug 17 The following are mergers under review by the European Commission and a brief guide to the EU merger process:  EU mergers and takeovers (Aug 17) BRUSSELS, Aug 17 The following are mergers under review by the European Commission and a brief guide to the EU merger process: * Asset performance in 2015: http://link.reuters.com/gap87v   (Adds euro zone data, dividends, Greece)EU mergers and takeovers (Aug 17) BRUSSELS, Aug 17 The following are mergers under review by the European Commission and a brief guide to the EU merger process:   Deal-making hopes, earnings lift Europe sharesEU mergers and takeovers (Aug 17) BRUSSELS, Aug 17 The following are mergers under review by the European Commission and a brief guide to the EU merger process:  EU mergers and takeovers (Aug 17) BRUSSELS, Aug 17 The following are mergers under review by the European Commission and a brief guide to the EU merger process: * Asset performance in 2015: http://link.reuters.com/gap87v   (Adds euro zone data, dividends, Greece)EU mergers and takeovers (Aug 17) BRUSSELS, Aug 17 The following are mergers under review by the European Commission and a brief guide to the EU merger process:  LONDON, Aug 17 European stocks rose on Monday, rebounding from losses last week caused by worries over currency devaluation in China, with shares in French industrial group Alstom outperforming.Deal-making hopes, earnings lift Europe sharesEU mergers and takeovers (Aug 17) BRUSSELS, Aug 17 The following are mergers under review by the European Commission and a brief guide to the EU merger process:  EU mergers and takeovers (Aug 17) BRUSSELS, Aug 17 The following are mergers under review by the European Commission and a brief guide to the EU merger process: * Asset performance in 2015: http://link.reuters.com/gap87v   (Adds euro zone data, dividends, Greece)EU mergers and takeovers (Aug 17) BRUSSELS, Aug 17 The following are mergers under review by the European Commission and a brief guide to the EU merger process:    
