AET,Fitch Places Aetna on Rating Watch NegativeFitch: US Hospitals Well Positioned for Insurer ConsolidationHumana, Aetna set termination fees for deal July 7 Health insurer Humana Inc and buyer Aetna Inc set fees to be paid in the event of a failure of the largest deal in the health insurance industry.  Humana, Aetna set termination fees for deal July 7 Health insurer Humana Inc and buyer Aetna Inc set fees to be paid in the event of a failure of the largest deal in the health insurance industry. (The following statement was released by the rating agency) NEW YORK, July 07 (Fitch) The for-profit hospital industry is well positioned  with respect to the anticipated wave of mergers and acquisitions (M&A;) amongst  the largest for-profit health insurers, but consolidation could have some  important longer term ramifications, according to Fitch Ratings. M&A; amongst health insurers is not likely to immediately result in outright  price pressure for hospitals. In many markets, health insurers aHumana, Aetna set termination fees for deal July 7 Health insurer Humana Inc and buyer Aetna Inc set fees to be paid in the event of a failure of the largest deal in the health insurance industry.   Fitch: US Hospitals Well Positioned for Insurer ConsolidationHumana, Aetna set termination fees for deal July 7 Health insurer Humana Inc and buyer Aetna Inc set fees to be paid in the event of a failure of the largest deal in the health insurance industry.  Humana, Aetna set termination fees for deal July 7 Health insurer Humana Inc and buyer Aetna Inc set fees to be paid in the event of a failure of the largest deal in the health insurance industry. (The following statement was released by the rating agency) NEW YORK, July 07 (Fitch) The for-profit hospital industry is well positioned  with respect to the anticipated wave of mergers and acquisitions (M&A;) amongst  the largest for-profit health insurers, but consolidation could have some  important longer term ramifications, according to Fitch Ratings. M&A; amongst health insurers is not likely to immediately result in outright  price pressure for hospitals. In many markets, health insurers aHumana, Aetna set termination fees for deal July 7 Health insurer Humana Inc and buyer Aetna Inc set fees to be paid in the event of a failure of the largest deal in the health insurance industry.  (The following statement was released by the rating agency) CHICAGO, July 07 (Fitch) Fitch Ratings has placed the ratings of Aetna Inc.  (Aetna) on Rating Watch Negative. The rating action follows Aetna's recent  announcement that it has reached an agreement to acquire Humana Inc. (Humana) in  a cash and stock transaction valued at approximately $37 billion. A full list of  rating actions follows at the end of this release. KEY RATING DRIVERS The rating action reflects Fitch's concern about AetnFitch: US Hospitals Well Positioned for Insurer ConsolidationHumana, Aetna set termination fees for deal July 7 Health insurer Humana Inc and buyer Aetna Inc set fees to be paid in the event of a failure of the largest deal in the health insurance industry.  Humana, Aetna set termination fees for deal July 7 Health insurer Humana Inc and buyer Aetna Inc set fees to be paid in the event of a failure of the largest deal in the health insurance industry. (The following statement was released by the rating agency) NEW YORK, July 07 (Fitch) The for-profit hospital industry is well positioned  with respect to the anticipated wave of mergers and acquisitions (M&A;) amongst  the largest for-profit health insurers, but consolidation could have some  important longer term ramifications, according to Fitch Ratings. M&A; amongst health insurers is not likely to immediately result in outright  price pressure for hospitals. In many markets, health insurers aHumana, Aetna set termination fees for deal July 7 Health insurer Humana Inc and buyer Aetna Inc set fees to be paid in the event of a failure of the largest deal in the health insurance industry.   
BBT,Fed OKs BB&T;'s acquisition of Susquehanna BancsharesUPDATE 1-Fed OKs BB&T;'s acquisition of Susquehanna Bancshares July 7 The Federal Reserve Board approved BB&T; Corp's $2.5 billion acquisition of Susquehanna Bancshares Inc, signaling a softening stance on finance M&A.;  UPDATE 1-Fed OKs BB&T;'s acquisition of Susquehanna Bancshares July 7 The Federal Reserve Board approved BB&T; Corp's $2.5 billion acquisition of Susquehanna Bancshares Inc, signaling a softening stance on finance M&A.; July 7 The Federal Reserve said on Tuesday it had approved BB&T; Corp's acquisition of Susquehanna Bancshares Inc, one of the biggest U.S. banking deals since the 2008 financial crisis.UPDATE 1-Fed OKs BB&T;'s acquisition of Susquehanna Bancshares July 7 The Federal Reserve Board approved BB&T; Corp's $2.5 billion acquisition of Susquehanna Bancshares Inc, signaling a softening stance on finance M&A.;  
CCL,Carnival gets US approval to operate Cuba cruisesUPDATE 4-Carnival aims to start 'cultural' Cuba cruises next May MIAMI, July 7 Carnival Corp has won U.S. approval to operate culturally-themed cruises to Cuba and plans to start taking travelers there next May, joining a growing list of maritime companies hoping to profit from a thaw in relations between Washington and Havana.  UPDATE 4-Carnival aims to start 'cultural' Cuba cruises next May MIAMI, July 7 Carnival Corp has won U.S. approval to operate culturally-themed cruises to Cuba and plans to start taking travelers there next May, joining a growing list of maritime companies hoping to profit from a thaw in relations between Washington and Havana. July 7 Carnival Corp, the world's largest cruise operator, said it had received U.S. approvals to operate cruises to Cuba and planned to start in May.UPDATE 4-Carnival aims to start 'cultural' Cuba cruises next May MIAMI, July 7 Carnival Corp has won U.S. approval to operate culturally-themed cruises to Cuba and plans to start taking travelers there next May, joining a growing list of maritime companies hoping to profit from a thaw in relations between Washington and Havana.  
CBG,UPDATE 3-Chinese firm blames bankruptcy of Bahamas resort on developerChinese firm blames bankruptcy of Bahamas resort on developer The Chinese construction company building the unfinished $3.5 billion Baha Mar resort in the Bahamas on Tuesday accused the developer of mismanaging the project's design and not securing adequate financing.  Chinese firm blames bankruptcy of Bahamas resort on developer The Chinese construction company building the unfinished $3.5 billion Baha Mar resort in the Bahamas on Tuesday accused the developer of mismanaging the project's design and not securing adequate financing. July 7 The Chinese construction company building the unfinished $3.5 billion Baha Mar resort in the Bahamas on Tuesday accused the developer of mismanaging the project's design and not securing adequate financing.Chinese firm blames bankruptcy of Bahamas resort on developer The Chinese construction company building the unfinished $3.5 billion Baha Mar resort in the Bahamas on Tuesday accused the developer of mismanaging the project's design and not securing adequate financing.  
SCHW,Robo-advisor Wealthfront lowers account minimum to $500 NEW YORK, July 7 Wealthfront, one of the biggest of a new breed of investment management firms known as "robo-advisors," on Tuesday lowered the minimum investment customers must make to open an account  to $500 from $5,000. 
CVX,In new blow, Chevron's Gorgon faces struggle to offload test LNG * Gorgon has suffered cost overruns, competition from U.S. shale 
XOM,Venezuela recalls ambassador to Guyana amid territory disputeVenezuela recalls ambassador to Guyana amid territory disputeIn new blow, Chevron's Gorgon faces struggle to offload test LNG * Gorgon has suffered cost overruns, competition from U.S. shale  In new blow, Chevron's Gorgon faces struggle to offload test LNG * Gorgon has suffered cost overruns, competition from U.S. shale CARACAS Venezuelan President Nicolas Maduro on Monday said he was calling in the country's ambassador in neighboring Guyana for consultations amid an escalating row over oil exploration in a disputed offshore territory.In new blow, Chevron's Gorgon faces struggle to offload test LNG * Gorgon has suffered cost overruns, competition from U.S. shale   Venezuela recalls ambassador to Guyana amid territory disputeIn new blow, Chevron's Gorgon faces struggle to offload test LNG * Gorgon has suffered cost overruns, competition from U.S. shale  In new blow, Chevron's Gorgon faces struggle to offload test LNG * Gorgon has suffered cost overruns, competition from U.S. shale CARACAS Venezuelan President Nicolas Maduro on Monday said he was calling in the country's ambassador in neighboring Guyana for consultations amid an escalating row over oil exploration in a disputed offshore territory.In new blow, Chevron's Gorgon faces struggle to offload test LNG * Gorgon has suffered cost overruns, competition from U.S. shale  CARACAS, July 6 Venezuelan President Nicolas Maduro on Monday said he was calling in the country's ambassador in neighboring Guyana for consultations amid an escalating row over oil exploration in a disputed offshore territory.Venezuela recalls ambassador to Guyana amid territory disputeIn new blow, Chevron's Gorgon faces struggle to offload test LNG * Gorgon has suffered cost overruns, competition from U.S. shale  In new blow, Chevron's Gorgon faces struggle to offload test LNG * Gorgon has suffered cost overruns, competition from U.S. shale CARACAS Venezuelan President Nicolas Maduro on Monday said he was calling in the country's ambassador in neighboring Guyana for consultations amid an escalating row over oil exploration in a disputed offshore territory.In new blow, Chevron's Gorgon faces struggle to offload test LNG * Gorgon has suffered cost overruns, competition from U.S. shale   
FB,Facebook executive Sheryl Sandberg joins board of SurveyMonkeyUPDATE 2-Facebook executive Sheryl Sandberg joins board of SurveyMonkeyFacebook executive Sheryl Sandberg joins board of SurveyMonkey SAN FRANCISCO Facebook Inc's Chief Operating Officer Sheryl Sandberg is taking a seat on the board of SurveyMonkey, the online polling company that was run by her late husband, Dave Goldberg.  Facebook executive Sheryl Sandberg joins board of SurveyMonkey SAN FRANCISCO Facebook Inc's Chief Operating Officer Sheryl Sandberg is taking a seat on the board of SurveyMonkey, the online polling company that was run by her late husband, Dave Goldberg. SAN FRANCISCO, July 6 Facebook Inc's  Chief Operating Officer Sheryl Sandberg is taking a seat on the board of SurveyMonkey, the online polling company that was run by her late husband, Dave Goldberg.Facebook executive Sheryl Sandberg joins board of SurveyMonkey SAN FRANCISCO Facebook Inc's Chief Operating Officer Sheryl Sandberg is taking a seat on the board of SurveyMonkey, the online polling company that was run by her late husband, Dave Goldberg.   UPDATE 2-Facebook executive Sheryl Sandberg joins board of SurveyMonkeyFacebook executive Sheryl Sandberg joins board of SurveyMonkey SAN FRANCISCO Facebook Inc's Chief Operating Officer Sheryl Sandberg is taking a seat on the board of SurveyMonkey, the online polling company that was run by her late husband, Dave Goldberg.  Facebook executive Sheryl Sandberg joins board of SurveyMonkey SAN FRANCISCO Facebook Inc's Chief Operating Officer Sheryl Sandberg is taking a seat on the board of SurveyMonkey, the online polling company that was run by her late husband, Dave Goldberg. SAN FRANCISCO, July 6 Facebook Inc's  Chief Operating Officer Sheryl Sandberg is taking a seat on the board of SurveyMonkey, the online polling company that was run by her late husband, Dave Goldberg.Facebook executive Sheryl Sandberg joins board of SurveyMonkey SAN FRANCISCO Facebook Inc's Chief Operating Officer Sheryl Sandberg is taking a seat on the board of SurveyMonkey, the online polling company that was run by her late husband, Dave Goldberg.  SAN FRANCISCO, July 6 Facebook Inc's  Chief Operating Officer Sheryl Sandberg is taking a seat on the board of SurveyMonkey, company run by her late husband, Dave Goldberg.UPDATE 2-Facebook executive Sheryl Sandberg joins board of SurveyMonkeyFacebook executive Sheryl Sandberg joins board of SurveyMonkey SAN FRANCISCO Facebook Inc's Chief Operating Officer Sheryl Sandberg is taking a seat on the board of SurveyMonkey, the online polling company that was run by her late husband, Dave Goldberg.  Facebook executive Sheryl Sandberg joins board of SurveyMonkey SAN FRANCISCO Facebook Inc's Chief Operating Officer Sheryl Sandberg is taking a seat on the board of SurveyMonkey, the online polling company that was run by her late husband, Dave Goldberg. SAN FRANCISCO, July 6 Facebook Inc's  Chief Operating Officer Sheryl Sandberg is taking a seat on the board of SurveyMonkey, the online polling company that was run by her late husband, Dave Goldberg.Facebook executive Sheryl Sandberg joins board of SurveyMonkey SAN FRANCISCO Facebook Inc's Chief Operating Officer Sheryl Sandberg is taking a seat on the board of SurveyMonkey, the online polling company that was run by her late husband, Dave Goldberg.   
GS,MOVES-Goldman names Karen Cook co-chairman of investment bankingDEALTALK-Surge in Brazil toxic loans catches eyes of Goldman, JPMorganMOVES- Goldman Sachs, RSA Insurance, Royal Bank of Canada July 7 The following financial services industry appointments were announced on Tuesday. To inform us of other job changes, email moves@thomsonreuters.com.  MOVES- Goldman Sachs, RSA Insurance, Royal Bank of Canada July 7 The following financial services industry appointments were announced on Tuesday. To inform us of other job changes, email moves@thomsonreuters.com. SAO PAULO, July 7 Goldman Sachs Group Inc  and JPMorgan Chase & Co are among the global banks looking to invest in Brazilian distressed loans, an area some are calling the flavor of the month in Latin America's largest economy.MOVES- Goldman Sachs, RSA Insurance, Royal Bank of Canada July 7 The following financial services industry appointments were announced on Tuesday. To inform us of other job changes, email moves@thomsonreuters.com.   DEALTALK-Surge in Brazil toxic loans catches eyes of Goldman, JPMorganMOVES- Goldman Sachs, RSA Insurance, Royal Bank of Canada July 7 The following financial services industry appointments were announced on Tuesday. To inform us of other job changes, email moves@thomsonreuters.com.  MOVES- Goldman Sachs, RSA Insurance, Royal Bank of Canada July 7 The following financial services industry appointments were announced on Tuesday. To inform us of other job changes, email moves@thomsonreuters.com. SAO PAULO, July 7 Goldman Sachs Group Inc  and JPMorgan Chase & Co are among the global banks looking to invest in Brazilian distressed loans, an area some are calling the flavor of the month in Latin America's largest economy.MOVES- Goldman Sachs, RSA Insurance, Royal Bank of Canada July 7 The following financial services industry appointments were announced on Tuesday. To inform us of other job changes, email moves@thomsonreuters.com.  July 7 Goldman Sachs Group Inc appointed Karen Cook co-chairman of its investment banking division, according to an internal memo seen by Reuters.DEALTALK-Surge in Brazil toxic loans catches eyes of Goldman, JPMorganMOVES- Goldman Sachs, RSA Insurance, Royal Bank of Canada July 7 The following financial services industry appointments were announced on Tuesday. To inform us of other job changes, email moves@thomsonreuters.com.  MOVES- Goldman Sachs, RSA Insurance, Royal Bank of Canada July 7 The following financial services industry appointments were announced on Tuesday. To inform us of other job changes, email moves@thomsonreuters.com. SAO PAULO, July 7 Goldman Sachs Group Inc  and JPMorgan Chase & Co are among the global banks looking to invest in Brazilian distressed loans, an area some are calling the flavor of the month in Latin America's largest economy.MOVES- Goldman Sachs, RSA Insurance, Royal Bank of Canada July 7 The following financial services industry appointments were announced on Tuesday. To inform us of other job changes, email moves@thomsonreuters.com.   
HUM,Humana, Aetna set termination fees for deal July 7 Health insurer Humana Inc and buyer Aetna Inc set fees to be paid in the event of a failure of the largest deal in the health insurance industry. 
JPM,DEALTALK-Surge in Brazil toxic loans catches eyes of Goldman, JPMorganDeals of the day-Mergers and acquisitionsJPMorgan to add 1,000 jobs, keep 2,600 in New Jersey July 7 JPMorgan Chase & Co will create 1,000 jobs and retain over 2,600 workers in Jersey City, and invest more than $76 million in New Jersey under a state tax credit program.  JPMorgan to add 1,000 jobs, keep 2,600 in New Jersey July 7 JPMorgan Chase & Co will create 1,000 jobs and retain over 2,600 workers in Jersey City, and invest more than $76 million in New Jersey under a state tax credit program. July 7 The following bids, mergers, acquisitions and disposals were reported by 2000 GMT on Tuesday:JPMorgan to add 1,000 jobs, keep 2,600 in New Jersey July 7 JPMorgan Chase & Co will create 1,000 jobs and retain over 2,600 workers in Jersey City, and invest more than $76 million in New Jersey under a state tax credit program.   Deals of the day-Mergers and acquisitionsJPMorgan to add 1,000 jobs, keep 2,600 in New Jersey July 7 JPMorgan Chase & Co will create 1,000 jobs and retain over 2,600 workers in Jersey City, and invest more than $76 million in New Jersey under a state tax credit program.  JPMorgan to add 1,000 jobs, keep 2,600 in New Jersey July 7 JPMorgan Chase & Co will create 1,000 jobs and retain over 2,600 workers in Jersey City, and invest more than $76 million in New Jersey under a state tax credit program. July 7 The following bids, mergers, acquisitions and disposals were reported by 2000 GMT on Tuesday:JPMorgan to add 1,000 jobs, keep 2,600 in New Jersey July 7 JPMorgan Chase & Co will create 1,000 jobs and retain over 2,600 workers in Jersey City, and invest more than $76 million in New Jersey under a state tax credit program.  SAO PAULO, July 7 Goldman Sachs Group Inc  and JPMorgan Chase & Co are among the global banks looking to invest in Brazilian distressed loans, an area some are calling the flavor of the month in Latin America's largest economy.Deals of the day-Mergers and acquisitionsJPMorgan to add 1,000 jobs, keep 2,600 in New Jersey July 7 JPMorgan Chase & Co will create 1,000 jobs and retain over 2,600 workers in Jersey City, and invest more than $76 million in New Jersey under a state tax credit program.  JPMorgan to add 1,000 jobs, keep 2,600 in New Jersey July 7 JPMorgan Chase & Co will create 1,000 jobs and retain over 2,600 workers in Jersey City, and invest more than $76 million in New Jersey under a state tax credit program. July 7 The following bids, mergers, acquisitions and disposals were reported by 2000 GMT on Tuesday:JPMorgan to add 1,000 jobs, keep 2,600 in New Jersey July 7 JPMorgan Chase & Co will create 1,000 jobs and retain over 2,600 workers in Jersey City, and invest more than $76 million in New Jersey under a state tax credit program.   
LLY,FDA asks panel to weigh benefit, risk of Lilly lung cancer drug July 7 Eli Lilly & Co.'s experimental lung cancer drug necitumumab improved overall survival by an average of 1.6 months but also increased the risk of sometimes fatal blood clots according to a preliminary review by the U.S. Food and Drug Administration. 
M,PVH's apparel deal with Trump ends as Macy's cuts ties with tycoon July 7 PVH Corp said it would wind down the production of Donald Trump's menswear after exclusive retail partner Macy's Inc decided to stop selling his products in protest against racist remarks made by the real estate tycoon. 
MON,Monsanto holds "constructive" talks with Syngenta investors-paperMonsanto CEO says bigger Syngenta break-up fee "counterproductive" -paperMonsanto CEO says bigger Syngenta break-up fee 'counterproductive': paper ZURICH Monsanto  believes offering a higher break-up fee to Syngenta  if its $45 billion takeover approach does not go ahead would be counterproductive, Chief Executive Hugh Grant told a Swiss newspaper.  Monsanto CEO says bigger Syngenta break-up fee 'counterproductive': paper ZURICH Monsanto  believes offering a higher break-up fee to Syngenta  if its $45 billion takeover approach does not go ahead would be counterproductive, Chief Executive Hugh Grant told a Swiss newspaper. ZURICH, July 7 Monsanto believes offering a higher break-up fee to Syngenta if its $45 billion takeover approach does not go ahead would be counterproductive, Chief Executive Hugh Grant told a Swiss newspaper.Monsanto CEO says bigger Syngenta break-up fee 'counterproductive': paper ZURICH Monsanto  believes offering a higher break-up fee to Syngenta  if its $45 billion takeover approach does not go ahead would be counterproductive, Chief Executive Hugh Grant told a Swiss newspaper.   Monsanto CEO says bigger Syngenta break-up fee "counterproductive" -paperMonsanto CEO says bigger Syngenta break-up fee 'counterproductive': paper ZURICH Monsanto  believes offering a higher break-up fee to Syngenta  if its $45 billion takeover approach does not go ahead would be counterproductive, Chief Executive Hugh Grant told a Swiss newspaper.  Monsanto CEO says bigger Syngenta break-up fee 'counterproductive': paper ZURICH Monsanto  believes offering a higher break-up fee to Syngenta  if its $45 billion takeover approach does not go ahead would be counterproductive, Chief Executive Hugh Grant told a Swiss newspaper. ZURICH, July 7 Monsanto believes offering a higher break-up fee to Syngenta if its $45 billion takeover approach does not go ahead would be counterproductive, Chief Executive Hugh Grant told a Swiss newspaper.Monsanto CEO says bigger Syngenta break-up fee 'counterproductive': paper ZURICH Monsanto  believes offering a higher break-up fee to Syngenta  if its $45 billion takeover approach does not go ahead would be counterproductive, Chief Executive Hugh Grant told a Swiss newspaper.  ZURICH, July 7 Monstanto Chief Executive Hugh Grant had held "very constructive" talks with Syngenta  shareholders and reiterated to a Swiss newspaper it could raise its $45 billion offer for the Swiss group under certain conditions.Monsanto CEO says bigger Syngenta break-up fee "counterproductive" -paperMonsanto CEO says bigger Syngenta break-up fee 'counterproductive': paper ZURICH Monsanto  believes offering a higher break-up fee to Syngenta  if its $45 billion takeover approach does not go ahead would be counterproductive, Chief Executive Hugh Grant told a Swiss newspaper.  Monsanto CEO says bigger Syngenta break-up fee 'counterproductive': paper ZURICH Monsanto  believes offering a higher break-up fee to Syngenta  if its $45 billion takeover approach does not go ahead would be counterproductive, Chief Executive Hugh Grant told a Swiss newspaper. ZURICH, July 7 Monsanto believes offering a higher break-up fee to Syngenta if its $45 billion takeover approach does not go ahead would be counterproductive, Chief Executive Hugh Grant told a Swiss newspaper.Monsanto CEO says bigger Syngenta break-up fee 'counterproductive': paper ZURICH Monsanto  believes offering a higher break-up fee to Syngenta  if its $45 billion takeover approach does not go ahead would be counterproductive, Chief Executive Hugh Grant told a Swiss newspaper.   
MS,Morgan Stanley to advise on sale of Brazil's Cremer, sources say SAO PAULO, July 7 Brazilian investment firm Tarpon Investimentos SA hired Morgan Stanley & Co to explore a sale of Cremer SA, the nation's largest supplier of healthcare products, three sources with knowledge of the situation said on Tuesday. 
