GILD,US STOCKS-Wall Street rises after China market steadiesGilead 2nd-quarter profit increases 32 pct, 2015 outlook raisedUS STOCKS-Wall Street ends sharply higher as China jitters ebbUPDATE 2-Gilead hepatitis C sales beat Wall Street, sales outlook raised * Product sales rise 27 percent to $8.1 billion   (Adds company comment, updates share price)  UPDATE 2-Gilead hepatitis C sales beat Wall Street, sales outlook raised * Product sales rise 27 percent to $8.1 billion   (Adds company comment, updates share price) * Indexes close up: Dow 1.09 pct, S&P; 1.24 pct, Nasdaq 0.98 pct   (Updates to close)UPDATE 2-Gilead hepatitis C sales beat Wall Street, sales outlook raised * Product sales rise 27 percent to $8.1 billion   (Adds company comment, updates share price)   US STOCKS-Wall Street ends sharply higher as China jitters ebbUPDATE 2-Gilead hepatitis C sales beat Wall Street, sales outlook raised * Product sales rise 27 percent to $8.1 billion   (Adds company comment, updates share price)  UPDATE 2-Gilead hepatitis C sales beat Wall Street, sales outlook raised * Product sales rise 27 percent to $8.1 billion   (Adds company comment, updates share price) * Indexes close up: Dow 1.09 pct, S&P; 1.24 pct, Nasdaq 0.98 pct   (Updates to close)UPDATE 2-Gilead hepatitis C sales beat Wall Street, sales outlook raised * Product sales rise 27 percent to $8.1 billion   (Adds company comment, updates share price)  July 28 Gilead Sciences Inc said on Tuesday its quarterly net  profit rose 32 percent, driven by sales of hepatitis C drugs that beat Wall Street estimates.US STOCKS-Wall Street ends sharply higher as China jitters ebbUPDATE 2-Gilead hepatitis C sales beat Wall Street, sales outlook raised * Product sales rise 27 percent to $8.1 billion   (Adds company comment, updates share price)  UPDATE 2-Gilead hepatitis C sales beat Wall Street, sales outlook raised * Product sales rise 27 percent to $8.1 billion   (Adds company comment, updates share price) * Indexes close up: Dow 1.09 pct, S&P; 1.24 pct, Nasdaq 0.98 pct   (Updates to close)UPDATE 2-Gilead hepatitis C sales beat Wall Street, sales outlook raised * Product sales rise 27 percent to $8.1 billion   (Adds company comment, updates share price)    Gilead 2nd-quarter profit increases 32 pct, 2015 outlook raisedUS STOCKS-Wall Street ends sharply higher as China jitters ebbUPDATE 2-Gilead hepatitis C sales beat Wall Street, sales outlook raised * Product sales rise 27 percent to $8.1 billion   (Adds company comment, updates share price)  UPDATE 2-Gilead hepatitis C sales beat Wall Street, sales outlook raised * Product sales rise 27 percent to $8.1 billion   (Adds company comment, updates share price) * Indexes close up: Dow 1.09 pct, S&P; 1.24 pct, Nasdaq 0.98 pct   (Updates to close)UPDATE 2-Gilead hepatitis C sales beat Wall Street, sales outlook raised * Product sales rise 27 percent to $8.1 billion   (Adds company comment, updates share price)   US STOCKS-Wall Street ends sharply higher as China jitters ebbUPDATE 2-Gilead hepatitis C sales beat Wall Street, sales outlook raised * Product sales rise 27 percent to $8.1 billion   (Adds company comment, updates share price)  UPDATE 2-Gilead hepatitis C sales beat Wall Street, sales outlook raised * Product sales rise 27 percent to $8.1 billion   (Adds company comment, updates share price) * Indexes close up: Dow 1.09 pct, S&P; 1.24 pct, Nasdaq 0.98 pct   (Updates to close)UPDATE 2-Gilead hepatitis C sales beat Wall Street, sales outlook raised * Product sales rise 27 percent to $8.1 billion   (Adds company comment, updates share price)  July 28 Gilead Sciences Inc said on Tuesday its quarterly net  profit rose 32 percent, driven by sales of hepatitis C drugs that beat Wall Street estimates.US STOCKS-Wall Street ends sharply higher as China jitters ebbUPDATE 2-Gilead hepatitis C sales beat Wall Street, sales outlook raised * Product sales rise 27 percent to $8.1 billion   (Adds company comment, updates share price)  UPDATE 2-Gilead hepatitis C sales beat Wall Street, sales outlook raised * Product sales rise 27 percent to $8.1 billion   (Adds company comment, updates share price) * Indexes close up: Dow 1.09 pct, S&P; 1.24 pct, Nasdaq 0.98 pct   (Updates to close)UPDATE 2-Gilead hepatitis C sales beat Wall Street, sales outlook raised * Product sales rise 27 percent to $8.1 billion   (Adds company comment, updates share price)   * Indexes up: Dow 1.06 pct, S&P; 1.21 pct, Nasdaq 0.99 pct   (Updates to afternoon trade)Gilead 2nd-quarter profit increases 32 pct, 2015 outlook raisedUS STOCKS-Wall Street ends sharply higher as China jitters ebbUPDATE 2-Gilead hepatitis C sales beat Wall Street, sales outlook raised * Product sales rise 27 percent to $8.1 billion   (Adds company comment, updates share price)  UPDATE 2-Gilead hepatitis C sales beat Wall Street, sales outlook raised * Product sales rise 27 percent to $8.1 billion   (Adds company comment, updates share price) * Indexes close up: Dow 1.09 pct, S&P; 1.24 pct, Nasdaq 0.98 pct   (Updates to close)UPDATE 2-Gilead hepatitis C sales beat Wall Street, sales outlook raised * Product sales rise 27 percent to $8.1 billion   (Adds company comment, updates share price)   US STOCKS-Wall Street ends sharply higher as China jitters ebbUPDATE 2-Gilead hepatitis C sales beat Wall Street, sales outlook raised * Product sales rise 27 percent to $8.1 billion   (Adds company comment, updates share price)  UPDATE 2-Gilead hepatitis C sales beat Wall Street, sales outlook raised * Product sales rise 27 percent to $8.1 billion   (Adds company comment, updates share price) * Indexes close up: Dow 1.09 pct, S&P; 1.24 pct, Nasdaq 0.98 pct   (Updates to close)UPDATE 2-Gilead hepatitis C sales beat Wall Street, sales outlook raised * Product sales rise 27 percent to $8.1 billion   (Adds company comment, updates share price)  July 28 Gilead Sciences Inc said on Tuesday its quarterly net  profit rose 32 percent, driven by sales of hepatitis C drugs that beat Wall Street estimates.US STOCKS-Wall Street ends sharply higher as China jitters ebbUPDATE 2-Gilead hepatitis C sales beat Wall Street, sales outlook raised * Product sales rise 27 percent to $8.1 billion   (Adds company comment, updates share price)  UPDATE 2-Gilead hepatitis C sales beat Wall Street, sales outlook raised * Product sales rise 27 percent to $8.1 billion   (Adds company comment, updates share price) * Indexes close up: Dow 1.09 pct, S&P; 1.24 pct, Nasdaq 0.98 pct   (Updates to close)UPDATE 2-Gilead hepatitis C sales beat Wall Street, sales outlook raised * Product sales rise 27 percent to $8.1 billion   (Adds company comment, updates share price)    
GS,COLUMN-Goldman adds fuel to raging bear-bull copper fire: Andy Home (The opinions expressed here are those of the author, a columnist for Reuters.)     By Andy Home     LONDON, July 28 Goldman Sachs has inflamed further an already heated argument between analysts over the outlook for the copper market.      The Wall Street heavyweight has positioned itself as a super bear, slashing its short, medium and long-term forecasts by as much as 44 percent in the case of 2018.      Cash copper, currently trading around $5,200 per tonne, will fall to $4,500 
HON,BRIEF-Melrose Industries plans to sell Elster to HoneywellMelrose to sell Elster business to Honeywell for $5.1 blnNigeria's Honeywell Flourmills says 2015 profit down 66 pctUPDATE 3-Honeywell to buy Melrose's utility metering business for $5.1 bln July 28 Honeywell International Inc has made its largest purchase in more than a decade, agreeing to buy the utility consumption metering business of Britain's Melrose Industries Plc for about $5.1 billion.  UPDATE 3-Honeywell to buy Melrose's utility metering business for $5.1 bln July 28 Honeywell International Inc has made its largest purchase in more than a decade, agreeing to buy the utility consumption metering business of Britain's Melrose Industries Plc for about $5.1 billion. LAGOS, July 28 Nigeria's Honeywell Flourmills  said on Tuesday its 2015 pretax profit fell to 1.43 billion naira ($7.19 million), down 66 percent from a year earlier.UPDATE 3-Honeywell to buy Melrose's utility metering business for $5.1 bln July 28 Honeywell International Inc has made its largest purchase in more than a decade, agreeing to buy the utility consumption metering business of Britain's Melrose Industries Plc for about $5.1 billion.   Nigeria's Honeywell Flourmills says 2015 profit down 66 pctUPDATE 3-Honeywell to buy Melrose's utility metering business for $5.1 bln July 28 Honeywell International Inc has made its largest purchase in more than a decade, agreeing to buy the utility consumption metering business of Britain's Melrose Industries Plc for about $5.1 billion.  UPDATE 3-Honeywell to buy Melrose's utility metering business for $5.1 bln July 28 Honeywell International Inc has made its largest purchase in more than a decade, agreeing to buy the utility consumption metering business of Britain's Melrose Industries Plc for about $5.1 billion. LAGOS, July 28 Nigeria's Honeywell Flourmills  said on Tuesday its 2015 pretax profit fell to 1.43 billion naira ($7.19 million), down 66 percent from a year earlier.UPDATE 3-Honeywell to buy Melrose's utility metering business for $5.1 bln July 28 Honeywell International Inc has made its largest purchase in more than a decade, agreeing to buy the utility consumption metering business of Britain's Melrose Industries Plc for about $5.1 billion.  July 28 Engineering turnaround specialist Melrose Industries Plc said it would sell its Elster business to Honeywell International Inc for 3.3 billion pounds ($5.14 billion) in cash.Nigeria's Honeywell Flourmills says 2015 profit down 66 pctUPDATE 3-Honeywell to buy Melrose's utility metering business for $5.1 bln July 28 Honeywell International Inc has made its largest purchase in more than a decade, agreeing to buy the utility consumption metering business of Britain's Melrose Industries Plc for about $5.1 billion.  UPDATE 3-Honeywell to buy Melrose's utility metering business for $5.1 bln July 28 Honeywell International Inc has made its largest purchase in more than a decade, agreeing to buy the utility consumption metering business of Britain's Melrose Industries Plc for about $5.1 billion. LAGOS, July 28 Nigeria's Honeywell Flourmills  said on Tuesday its 2015 pretax profit fell to 1.43 billion naira ($7.19 million), down 66 percent from a year earlier.UPDATE 3-Honeywell to buy Melrose's utility metering business for $5.1 bln July 28 Honeywell International Inc has made its largest purchase in more than a decade, agreeing to buy the utility consumption metering business of Britain's Melrose Industries Plc for about $5.1 billion.    Melrose to sell Elster business to Honeywell for $5.1 blnNigeria's Honeywell Flourmills says 2015 profit down 66 pctUPDATE 3-Honeywell to buy Melrose's utility metering business for $5.1 bln July 28 Honeywell International Inc has made its largest purchase in more than a decade, agreeing to buy the utility consumption metering business of Britain's Melrose Industries Plc for about $5.1 billion.  UPDATE 3-Honeywell to buy Melrose's utility metering business for $5.1 bln July 28 Honeywell International Inc has made its largest purchase in more than a decade, agreeing to buy the utility consumption metering business of Britain's Melrose Industries Plc for about $5.1 billion. LAGOS, July 28 Nigeria's Honeywell Flourmills  said on Tuesday its 2015 pretax profit fell to 1.43 billion naira ($7.19 million), down 66 percent from a year earlier.UPDATE 3-Honeywell to buy Melrose's utility metering business for $5.1 bln July 28 Honeywell International Inc has made its largest purchase in more than a decade, agreeing to buy the utility consumption metering business of Britain's Melrose Industries Plc for about $5.1 billion.   Nigeria's Honeywell Flourmills says 2015 profit down 66 pctUPDATE 3-Honeywell to buy Melrose's utility metering business for $5.1 bln July 28 Honeywell International Inc has made its largest purchase in more than a decade, agreeing to buy the utility consumption metering business of Britain's Melrose Industries Plc for about $5.1 billion.  UPDATE 3-Honeywell to buy Melrose's utility metering business for $5.1 bln July 28 Honeywell International Inc has made its largest purchase in more than a decade, agreeing to buy the utility consumption metering business of Britain's Melrose Industries Plc for about $5.1 billion. LAGOS, July 28 Nigeria's Honeywell Flourmills  said on Tuesday its 2015 pretax profit fell to 1.43 billion naira ($7.19 million), down 66 percent from a year earlier.UPDATE 3-Honeywell to buy Melrose's utility metering business for $5.1 bln July 28 Honeywell International Inc has made its largest purchase in more than a decade, agreeing to buy the utility consumption metering business of Britain's Melrose Industries Plc for about $5.1 billion.  July 28 Engineering turnaround specialist Melrose Industries Plc said it would sell its Elster business to Honeywell International Inc for 3.3 billion pounds ($5.14 billion) in cash.Nigeria's Honeywell Flourmills says 2015 profit down 66 pctUPDATE 3-Honeywell to buy Melrose's utility metering business for $5.1 bln July 28 Honeywell International Inc has made its largest purchase in more than a decade, agreeing to buy the utility consumption metering business of Britain's Melrose Industries Plc for about $5.1 billion.  UPDATE 3-Honeywell to buy Melrose's utility metering business for $5.1 bln July 28 Honeywell International Inc has made its largest purchase in more than a decade, agreeing to buy the utility consumption metering business of Britain's Melrose Industries Plc for about $5.1 billion. LAGOS, July 28 Nigeria's Honeywell Flourmills  said on Tuesday its 2015 pretax profit fell to 1.43 billion naira ($7.19 million), down 66 percent from a year earlier.UPDATE 3-Honeywell to buy Melrose's utility metering business for $5.1 bln July 28 Honeywell International Inc has made its largest purchase in more than a decade, agreeing to buy the utility consumption metering business of Britain's Melrose Industries Plc for about $5.1 billion.   * Consideration is payable in cash on completion, subject to customary adjustments, and implies a multiple of 3.1 times 2014 revenue and 14.3 times 2014 headline EBITDAMelrose to sell Elster business to Honeywell for $5.1 blnNigeria's Honeywell Flourmills says 2015 profit down 66 pctUPDATE 3-Honeywell to buy Melrose's utility metering business for $5.1 bln July 28 Honeywell International Inc has made its largest purchase in more than a decade, agreeing to buy the utility consumption metering business of Britain's Melrose Industries Plc for about $5.1 billion.  UPDATE 3-Honeywell to buy Melrose's utility metering business for $5.1 bln July 28 Honeywell International Inc has made its largest purchase in more than a decade, agreeing to buy the utility consumption metering business of Britain's Melrose Industries Plc for about $5.1 billion. LAGOS, July 28 Nigeria's Honeywell Flourmills  said on Tuesday its 2015 pretax profit fell to 1.43 billion naira ($7.19 million), down 66 percent from a year earlier.UPDATE 3-Honeywell to buy Melrose's utility metering business for $5.1 bln July 28 Honeywell International Inc has made its largest purchase in more than a decade, agreeing to buy the utility consumption metering business of Britain's Melrose Industries Plc for about $5.1 billion.   Nigeria's Honeywell Flourmills says 2015 profit down 66 pctUPDATE 3-Honeywell to buy Melrose's utility metering business for $5.1 bln July 28 Honeywell International Inc has made its largest purchase in more than a decade, agreeing to buy the utility consumption metering business of Britain's Melrose Industries Plc for about $5.1 billion.  UPDATE 3-Honeywell to buy Melrose's utility metering business for $5.1 bln July 28 Honeywell International Inc has made its largest purchase in more than a decade, agreeing to buy the utility consumption metering business of Britain's Melrose Industries Plc for about $5.1 billion. LAGOS, July 28 Nigeria's Honeywell Flourmills  said on Tuesday its 2015 pretax profit fell to 1.43 billion naira ($7.19 million), down 66 percent from a year earlier.UPDATE 3-Honeywell to buy Melrose's utility metering business for $5.1 bln July 28 Honeywell International Inc has made its largest purchase in more than a decade, agreeing to buy the utility consumption metering business of Britain's Melrose Industries Plc for about $5.1 billion.  July 28 Engineering turnaround specialist Melrose Industries Plc said it would sell its Elster business to Honeywell International Inc for 3.3 billion pounds ($5.14 billion) in cash.Nigeria's Honeywell Flourmills says 2015 profit down 66 pctUPDATE 3-Honeywell to buy Melrose's utility metering business for $5.1 bln July 28 Honeywell International Inc has made its largest purchase in more than a decade, agreeing to buy the utility consumption metering business of Britain's Melrose Industries Plc for about $5.1 billion.  UPDATE 3-Honeywell to buy Melrose's utility metering business for $5.1 bln July 28 Honeywell International Inc has made its largest purchase in more than a decade, agreeing to buy the utility consumption metering business of Britain's Melrose Industries Plc for about $5.1 billion. LAGOS, July 28 Nigeria's Honeywell Flourmills  said on Tuesday its 2015 pretax profit fell to 1.43 billion naira ($7.19 million), down 66 percent from a year earlier.UPDATE 3-Honeywell to buy Melrose's utility metering business for $5.1 bln July 28 Honeywell International Inc has made its largest purchase in more than a decade, agreeing to buy the utility consumption metering business of Britain's Melrose Industries Plc for about $5.1 billion.    
MJN,Mead Johnson Nutrition to pay $12.03 mln to settle SEC FCPA charges WASHINGTON, July 28 Mead Johnson Nutrition Co.  will pay $12.03 million to settle civil charges that it ran afoul of U.S. bribery laws after its China-based unit made improper payments to certain healthcare professionals at state-owned hospitals, U.S. regulators said Tuesday. 
MRK,Strong dollar weighs on Merck revenueUPDATE 1-Merck raises forecast on strong sales of diabetes, cancer drugs July 28 Merck & Co Inc reported a better-than-expected quarterly profit and boosted its full-year earnings forecast as demand for its diabetes and cancer drugs increased.  UPDATE 1-Merck raises forecast on strong sales of diabetes, cancer drugs July 28 Merck & Co Inc reported a better-than-expected quarterly profit and boosted its full-year earnings forecast as demand for its diabetes and cancer drugs increased. July 28 Merck & Co Inc reported a nearly 11 percent drop in quarterly revenue as a strong dollar and the sale of its consumer care business overshadowed strong demand for its diabetes drugs.UPDATE 1-Merck raises forecast on strong sales of diabetes, cancer drugs July 28 Merck & Co Inc reported a better-than-expected quarterly profit and boosted its full-year earnings forecast as demand for its diabetes and cancer drugs increased.  
NOV,National Oilwell profit drops 53 pct on weak demandUPDATE 1-National Oilwell profit beats estimates due to cost cuts July 28 National Oilwell Varco Inc, the largest U.S. oilfield equipment provider, reported a higher-than-expected quarterly profit as cost cuts helped offset the impact of a fall in global drilling activity.  UPDATE 1-National Oilwell profit beats estimates due to cost cuts July 28 National Oilwell Varco Inc, the largest U.S. oilfield equipment provider, reported a higher-than-expected quarterly profit as cost cuts helped offset the impact of a fall in global drilling activity. July 28 National Oilwell Varco Inc, the largest U.S. oilfield equipment provider, reported a 53 percent fall in quarterly profit as a steep decline in commodity prices weighed on demand and prices for its products.UPDATE 1-National Oilwell profit beats estimates due to cost cuts July 28 National Oilwell Varco Inc, the largest U.S. oilfield equipment provider, reported a higher-than-expected quarterly profit as cost cuts helped offset the impact of a fall in global drilling activity.  
ORCL,Anaplan targets SAP, Oracle in fast-growing business planning market FRANKFURT, July 28 Business planning software start-up Anaplan is nipping at the heels of industry leaders SAP , Oracle and IBM, with sales of its cloud-based service tripling in each of the past three years as it seeks to shake up the market. 
PFE,Pfizer revenue falls 7 percentUS STOCKS-Wall St set to open higher ahead of Fed meetingUPDATE 2-Pfizer's revenue, profit beat as vaccine sales rise July 28 Pfizer Inc on Tuesday reported better-than-expected second-quarter profit and revenue, helped by strong demand for its pneumonia vaccine and new breast cancer drug, sending its shares up 1 percent.  UPDATE 2-Pfizer's revenue, profit beat as vaccine sales rise July 28 Pfizer Inc on Tuesday reported better-than-expected second-quarter profit and revenue, helped by strong demand for its pneumonia vaccine and new breast cancer drug, sending its shares up 1 percent. * Futures up: Dow 71 pts, S&P; 10 pts, Nasdaq 18 pts   (Adds details, comment, updates prices)UPDATE 2-Pfizer's revenue, profit beat as vaccine sales rise July 28 Pfizer Inc on Tuesday reported better-than-expected second-quarter profit and revenue, helped by strong demand for its pneumonia vaccine and new breast cancer drug, sending its shares up 1 percent.   US STOCKS-Wall St set to open higher ahead of Fed meetingUPDATE 2-Pfizer's revenue, profit beat as vaccine sales rise July 28 Pfizer Inc on Tuesday reported better-than-expected second-quarter profit and revenue, helped by strong demand for its pneumonia vaccine and new breast cancer drug, sending its shares up 1 percent.  UPDATE 2-Pfizer's revenue, profit beat as vaccine sales rise July 28 Pfizer Inc on Tuesday reported better-than-expected second-quarter profit and revenue, helped by strong demand for its pneumonia vaccine and new breast cancer drug, sending its shares up 1 percent. * Futures up: Dow 71 pts, S&P; 10 pts, Nasdaq 18 pts   (Adds details, comment, updates prices)UPDATE 2-Pfizer's revenue, profit beat as vaccine sales rise July 28 Pfizer Inc on Tuesday reported better-than-expected second-quarter profit and revenue, helped by strong demand for its pneumonia vaccine and new breast cancer drug, sending its shares up 1 percent.  July 28 U.S. drugmaker Pfizer Inc  reported a 7 percent fall in quarterly revenue, hurt by a strong dollar.US STOCKS-Wall St set to open higher ahead of Fed meetingUPDATE 2-Pfizer's revenue, profit beat as vaccine sales rise July 28 Pfizer Inc on Tuesday reported better-than-expected second-quarter profit and revenue, helped by strong demand for its pneumonia vaccine and new breast cancer drug, sending its shares up 1 percent.  UPDATE 2-Pfizer's revenue, profit beat as vaccine sales rise July 28 Pfizer Inc on Tuesday reported better-than-expected second-quarter profit and revenue, helped by strong demand for its pneumonia vaccine and new breast cancer drug, sending its shares up 1 percent. * Futures up: Dow 71 pts, S&P; 10 pts, Nasdaq 18 pts   (Adds details, comment, updates prices)UPDATE 2-Pfizer's revenue, profit beat as vaccine sales rise July 28 Pfizer Inc on Tuesday reported better-than-expected second-quarter profit and revenue, helped by strong demand for its pneumonia vaccine and new breast cancer drug, sending its shares up 1 percent.   
PG,P&G; says David Taylor to replace A.G. Lafley as CEO July 28 Procter & Gamble Co veteran David Taylor will replace A.G. Lafley as chief executive in a widely expected move that coincides with a massive overhaul at the world's largest household products maker. 
REGN,BRIEF-Sanofi to invest $2.17 bln in Regeneron cancer therapy collaborationSanofi links with Regeneron in $2.2 bln cancer drug push July 28 French drugmaker Sanofi said on Tuesday it was committing up to $2.17 billion to a collaboration with its long-time partner Regeneron Pharmaceuticals in the hot area of cancer immunotherapy.  Sanofi links with Regeneron in $2.2 bln cancer drug push July 28 French drugmaker Sanofi said on Tuesday it was committing up to $2.17 billion to a collaboration with its long-time partner Regeneron Pharmaceuticals in the hot area of cancer immunotherapy. * Sanofi and Regeneron agree to jointly develop PD-1 and other new immuno-oncology antibodies -Sanofi links with Regeneron in $2.2 bln cancer drug push July 28 French drugmaker Sanofi said on Tuesday it was committing up to $2.17 billion to a collaboration with its long-time partner Regeneron Pharmaceuticals in the hot area of cancer immunotherapy.  
TXT,Cessna jets maker Textron's profit rises 16 pctUPDATE 1-Cessna jets maker Textron's revenue falls on fewer deliveries July 28 Textron Inc, the maker of Beechcraft and Cessna planes, reported lower-than-expected quarterly revenue as it delivered fewer King Air Turboprops and Bell helicopters.  UPDATE 1-Cessna jets maker Textron's revenue falls on fewer deliveries July 28 Textron Inc, the maker of Beechcraft and Cessna planes, reported lower-than-expected quarterly revenue as it delivered fewer King Air Turboprops and Bell helicopters. July 28 Textron Inc, the maker of Beechcraft and Cessna planes and Bell helicopters, reported a 16 percent rise in quarterly profit, helped by lower costs.UPDATE 1-Cessna jets maker Textron's revenue falls on fewer deliveries July 28 Textron Inc, the maker of Beechcraft and Cessna planes, reported lower-than-expected quarterly revenue as it delivered fewer King Air Turboprops and Bell helicopters.  
