CAH,Cardinal to buy private generic drug distributor for $1.12 blnUPDATE 2-Cardinal Health to buy generics distributor for $1.12 bln * To add more than 15 cents/share to adj profit in 2016   (Adds details, analyst comment)  UPDATE 2-Cardinal Health to buy generics distributor for $1.12 bln * To add more than 15 cents/share to adj profit in 2016   (Adds details, analyst comment) June 5 Cardinal Health Inc said it would buy privately held drug distributor Harvard Drug Group for $1.12 billion.UPDATE 2-Cardinal Health to buy generics distributor for $1.12 bln * To add more than 15 cents/share to adj profit in 2016   (Adds details, analyst comment)  
CCL,REFILE-Carnival launches cruises for tourists who want volunteer work ORLANDO, June 4 Carnival Corp will tap into the volunteer tourism market with week-long trips beginning in 2016 that include up to three days of organized humanitarian work in the Dominican Republic, the company announced on Thursday. 
COP,Conoco stops its shale gas exploration in PolandConoco stops its shale gas exploration in Poland WARSAW ConocoPhillips, the U.S. energy company, is withdrawing from shale gas exploration in Poland as it has not encountered commercial volumes of the gas, the company said on Friday.  Conoco stops its shale gas exploration in Poland WARSAW ConocoPhillips, the U.S. energy company, is withdrawing from shale gas exploration in Poland as it has not encountered commercial volumes of the gas, the company said on Friday. WARSAW, June 5 ConocoPhillips, the U.S. energy company, is withdrawing from shale gas exploration in Poland as it has not encountered commercial volumes of the gas, the company said on Friday.Conoco stops its shale gas exploration in Poland WARSAW ConocoPhillips, the U.S. energy company, is withdrawing from shale gas exploration in Poland as it has not encountered commercial volumes of the gas, the company said on Friday.  
DOW,Exclusive: SEC investigates allegations of misspending by Dow Chemical CEO - sources NEW YORK The U.S. Securities and Exchange Commission is investigating allegations that Andrew Liveris, chairman and chief executive officer of industrial giant Dow Chemical Co , misused company funds for personal benefit, according to people familiar with the matter. 
F,Ford says China May retail vehicle sales up 4 pct yr/yr BEIJING, June 5 Ford Motor Co and its Chinese joint ventures sold 91,013 vehicles in China in May, up 4 percent from a year earlier, the U.S. carmaker said on Friday. 
GM,U.S. auto safety agency sets reform efforts after GM recall WASHINGTON, June 5 The Obama administration on Friday announced a new team of outside experts to advise the National Highway Traffic Safety Administration on how to implement reforms after criticism over its handling of the General Motors Co ignition switch recalls. 
INTC,Lattice and Xilinx seen gaining on Altera after Intel deal June 5 Intel Corp's $16.7 billion acquisition of programmable-chip maker Altera Corp is not the bad news for Altera's rivals that it may seem to be at first blush. 
