GOOGL,ISS recommends Google shareholders withhold vote for 3 directorsUPDATE 2-Three Google directors survive challenge over pay June 3 Three Google Inc compensation committee members were re-elected on Wednesday, the technology company said at its annual meeting, despite a challenge from a high-profile proxy adviser that raised concerns over executive pay.  UPDATE 2-Three Google directors survive challenge over pay June 3 Three Google Inc compensation committee members were re-elected on Wednesday, the technology company said at its annual meeting, despite a challenge from a high-profile proxy adviser that raised concerns over executive pay. June 3 Proxy adviser Institutional Shareholder Services (ISS) has recommended that Google Inc's  shareholders withhold votes for all three directors on the company's compensation committee, saying "mega grants" provided to the executive chairman and chief business officer were "problematic".UPDATE 2-Three Google directors survive challenge over pay June 3 Three Google Inc compensation committee members were re-elected on Wednesday, the technology company said at its annual meeting, despite a challenge from a high-profile proxy adviser that raised concerns over executive pay.  
GOOG,ISS recommends Google shareholders withhold vote for 3 directorsUPDATE 2-Three Google directors survive challenge over pay June 3 Three Google Inc compensation committee members were re-elected on Wednesday, the technology company said at its annual meeting, despite a challenge from a high-profile proxy adviser that raised concerns over executive pay.  UPDATE 2-Three Google directors survive challenge over pay June 3 Three Google Inc compensation committee members were re-elected on Wednesday, the technology company said at its annual meeting, despite a challenge from a high-profile proxy adviser that raised concerns over executive pay. June 3 Proxy adviser Institutional Shareholder Services (ISS) has recommended that Google Inc's  shareholders withhold votes for all three directors on the company's compensation committee, saying "mega grants" provided to the executive chairman and chief business officer were "problematic".UPDATE 2-Three Google directors survive challenge over pay June 3 Three Google Inc compensation committee members were re-elected on Wednesday, the technology company said at its annual meeting, despite a challenge from a high-profile proxy adviser that raised concerns over executive pay.  
AMGN,Novartis tries to get U.S. ban lifted on sale of Neupogen copycatNovartis tries to get U.S. ban lifted on sale of Neupogen copycat WASHINGTON Novartis AG unit Sandoz asked a U.S. appeals court on Wednesday to lift a preliminary injunction barring it from selling its biosimilar Zarxio, a cheaper version of a drug that fends off infections in cancer patients.  Novartis tries to get U.S. ban lifted on sale of Neupogen copycat WASHINGTON Novartis AG unit Sandoz asked a U.S. appeals court on Wednesday to lift a preliminary injunction barring it from selling its biosimilar Zarxio, a cheaper version of a drug that fends off infections in cancer patients. WASHINGTON, June 3 Novartis AG unit Sandoz asked a U.S. appeals court on Wednesday to lift a preliminary injunction barring it from selling its biosimilar Zarxio, a cheaper version of a drug that fends off infections in cancer patients.Novartis tries to get U.S. ban lifted on sale of Neupogen copycat WASHINGTON Novartis AG unit Sandoz asked a U.S. appeals court on Wednesday to lift a preliminary injunction barring it from selling its biosimilar Zarxio, a cheaper version of a drug that fends off infections in cancer patients.  
AAPL,Apple recalls Beats Pill XL speakersApple recalls Beats Pill XL speakersUPDATE 1-Apple recalls some Beats Pill XL speakersApple recalls some Beats Pill XL speakersApple recalls some Beats Pill XL speakers Apple Inc said it is recalling some Beats Pill XL portable wireless speakers due to a fire hazard caused by overheating batteries.  Apple recalls some Beats Pill XL speakers Apple Inc said it is recalling some Beats Pill XL portable wireless speakers due to a fire hazard caused by overheating batteries. Apple Inc said it is recalling some Beats Pill XL portable wireless speakers due to a fire hazard caused by overheating batteries.Apple recalls some Beats Pill XL speakers Apple Inc said it is recalling some Beats Pill XL portable wireless speakers due to a fire hazard caused by overheating batteries.   Apple recalls some Beats Pill XL speakersApple recalls some Beats Pill XL speakers Apple Inc said it is recalling some Beats Pill XL portable wireless speakers due to a fire hazard caused by overheating batteries.  Apple recalls some Beats Pill XL speakers Apple Inc said it is recalling some Beats Pill XL portable wireless speakers due to a fire hazard caused by overheating batteries. Apple Inc said it is recalling some Beats Pill XL portable wireless speakers due to a fire hazard caused by overheating batteries.Apple recalls some Beats Pill XL speakers Apple Inc said it is recalling some Beats Pill XL portable wireless speakers due to a fire hazard caused by overheating batteries.  June 3 Apple Inc said it is recalling some Beats Pill XL portable wireless speakers due to a fire hazard caused by overheating batteries.Apple recalls some Beats Pill XL speakersApple recalls some Beats Pill XL speakers Apple Inc said it is recalling some Beats Pill XL portable wireless speakers due to a fire hazard caused by overheating batteries.  Apple recalls some Beats Pill XL speakers Apple Inc said it is recalling some Beats Pill XL portable wireless speakers due to a fire hazard caused by overheating batteries. Apple Inc said it is recalling some Beats Pill XL portable wireless speakers due to a fire hazard caused by overheating batteries.Apple recalls some Beats Pill XL speakers Apple Inc said it is recalling some Beats Pill XL portable wireless speakers due to a fire hazard caused by overheating batteries.    UPDATE 1-Apple recalls some Beats Pill XL speakersApple recalls some Beats Pill XL speakersApple recalls some Beats Pill XL speakers Apple Inc said it is recalling some Beats Pill XL portable wireless speakers due to a fire hazard caused by overheating batteries.  Apple recalls some Beats Pill XL speakers Apple Inc said it is recalling some Beats Pill XL portable wireless speakers due to a fire hazard caused by overheating batteries. Apple Inc said it is recalling some Beats Pill XL portable wireless speakers due to a fire hazard caused by overheating batteries.Apple recalls some Beats Pill XL speakers Apple Inc said it is recalling some Beats Pill XL portable wireless speakers due to a fire hazard caused by overheating batteries.   Apple recalls some Beats Pill XL speakersApple recalls some Beats Pill XL speakers Apple Inc said it is recalling some Beats Pill XL portable wireless speakers due to a fire hazard caused by overheating batteries.  Apple recalls some Beats Pill XL speakers Apple Inc said it is recalling some Beats Pill XL portable wireless speakers due to a fire hazard caused by overheating batteries. Apple Inc said it is recalling some Beats Pill XL portable wireless speakers due to a fire hazard caused by overheating batteries.Apple recalls some Beats Pill XL speakers Apple Inc said it is recalling some Beats Pill XL portable wireless speakers due to a fire hazard caused by overheating batteries.  June 3 Apple Inc said it is recalling some Beats Pill XL portable wireless speakers due to a fire hazard caused by overheating batteries.Apple recalls some Beats Pill XL speakersApple recalls some Beats Pill XL speakers Apple Inc said it is recalling some Beats Pill XL portable wireless speakers due to a fire hazard caused by overheating batteries.  Apple recalls some Beats Pill XL speakers Apple Inc said it is recalling some Beats Pill XL portable wireless speakers due to a fire hazard caused by overheating batteries. Apple Inc said it is recalling some Beats Pill XL portable wireless speakers due to a fire hazard caused by overheating batteries.Apple recalls some Beats Pill XL speakers Apple Inc said it is recalling some Beats Pill XL portable wireless speakers due to a fire hazard caused by overheating batteries.   Apple Inc said it is recalling Beats Pill XL portable wireless speakers due to a fire hazard from overheating batteries.UPDATE 1-Apple recalls some Beats Pill XL speakersApple recalls some Beats Pill XL speakersApple recalls some Beats Pill XL speakers Apple Inc said it is recalling some Beats Pill XL portable wireless speakers due to a fire hazard caused by overheating batteries.  Apple recalls some Beats Pill XL speakers Apple Inc said it is recalling some Beats Pill XL portable wireless speakers due to a fire hazard caused by overheating batteries. Apple Inc said it is recalling some Beats Pill XL portable wireless speakers due to a fire hazard caused by overheating batteries.Apple recalls some Beats Pill XL speakers Apple Inc said it is recalling some Beats Pill XL portable wireless speakers due to a fire hazard caused by overheating batteries.   Apple recalls some Beats Pill XL speakersApple recalls some Beats Pill XL speakers Apple Inc said it is recalling some Beats Pill XL portable wireless speakers due to a fire hazard caused by overheating batteries.  Apple recalls some Beats Pill XL speakers Apple Inc said it is recalling some Beats Pill XL portable wireless speakers due to a fire hazard caused by overheating batteries. Apple Inc said it is recalling some Beats Pill XL portable wireless speakers due to a fire hazard caused by overheating batteries.Apple recalls some Beats Pill XL speakers Apple Inc said it is recalling some Beats Pill XL portable wireless speakers due to a fire hazard caused by overheating batteries.  June 3 Apple Inc said it is recalling some Beats Pill XL portable wireless speakers due to a fire hazard caused by overheating batteries.Apple recalls some Beats Pill XL speakersApple recalls some Beats Pill XL speakers Apple Inc said it is recalling some Beats Pill XL portable wireless speakers due to a fire hazard caused by overheating batteries.  Apple recalls some Beats Pill XL speakers Apple Inc said it is recalling some Beats Pill XL portable wireless speakers due to a fire hazard caused by overheating batteries. Apple Inc said it is recalling some Beats Pill XL portable wireless speakers due to a fire hazard caused by overheating batteries.Apple recalls some Beats Pill XL speakers Apple Inc said it is recalling some Beats Pill XL portable wireless speakers due to a fire hazard caused by overheating batteries.     Apple recalls Beats Pill XL speakersUPDATE 1-Apple recalls some Beats Pill XL speakersApple recalls some Beats Pill XL speakersApple recalls some Beats Pill XL speakers Apple Inc said it is recalling some Beats Pill XL portable wireless speakers due to a fire hazard caused by overheating batteries.  Apple recalls some Beats Pill XL speakers Apple Inc said it is recalling some Beats Pill XL portable wireless speakers due to a fire hazard caused by overheating batteries. Apple Inc said it is recalling some Beats Pill XL portable wireless speakers due to a fire hazard caused by overheating batteries.Apple recalls some Beats Pill XL speakers Apple Inc said it is recalling some Beats Pill XL portable wireless speakers due to a fire hazard caused by overheating batteries.   Apple recalls some Beats Pill XL speakersApple recalls some Beats Pill XL speakers Apple Inc said it is recalling some Beats Pill XL portable wireless speakers due to a fire hazard caused by overheating batteries.  Apple recalls some Beats Pill XL speakers Apple Inc said it is recalling some Beats Pill XL portable wireless speakers due to a fire hazard caused by overheating batteries. Apple Inc said it is recalling some Beats Pill XL portable wireless speakers due to a fire hazard caused by overheating batteries.Apple recalls some Beats Pill XL speakers Apple Inc said it is recalling some Beats Pill XL portable wireless speakers due to a fire hazard caused by overheating batteries.  June 3 Apple Inc said it is recalling some Beats Pill XL portable wireless speakers due to a fire hazard caused by overheating batteries.Apple recalls some Beats Pill XL speakersApple recalls some Beats Pill XL speakers Apple Inc said it is recalling some Beats Pill XL portable wireless speakers due to a fire hazard caused by overheating batteries.  Apple recalls some Beats Pill XL speakers Apple Inc said it is recalling some Beats Pill XL portable wireless speakers due to a fire hazard caused by overheating batteries. Apple Inc said it is recalling some Beats Pill XL portable wireless speakers due to a fire hazard caused by overheating batteries.Apple recalls some Beats Pill XL speakers Apple Inc said it is recalling some Beats Pill XL portable wireless speakers due to a fire hazard caused by overheating batteries.    UPDATE 1-Apple recalls some Beats Pill XL speakersApple recalls some Beats Pill XL speakersApple recalls some Beats Pill XL speakers Apple Inc said it is recalling some Beats Pill XL portable wireless speakers due to a fire hazard caused by overheating batteries.  Apple recalls some Beats Pill XL speakers Apple Inc said it is recalling some Beats Pill XL portable wireless speakers due to a fire hazard caused by overheating batteries. Apple Inc said it is recalling some Beats Pill XL portable wireless speakers due to a fire hazard caused by overheating batteries.Apple recalls some Beats Pill XL speakers Apple Inc said it is recalling some Beats Pill XL portable wireless speakers due to a fire hazard caused by overheating batteries.   Apple recalls some Beats Pill XL speakersApple recalls some Beats Pill XL speakers Apple Inc said it is recalling some Beats Pill XL portable wireless speakers due to a fire hazard caused by overheating batteries.  Apple recalls some Beats Pill XL speakers Apple Inc said it is recalling some Beats Pill XL portable wireless speakers due to a fire hazard caused by overheating batteries. Apple Inc said it is recalling some Beats Pill XL portable wireless speakers due to a fire hazard caused by overheating batteries.Apple recalls some Beats Pill XL speakers Apple Inc said it is recalling some Beats Pill XL portable wireless speakers due to a fire hazard caused by overheating batteries.  June 3 Apple Inc said it is recalling some Beats Pill XL portable wireless speakers due to a fire hazard caused by overheating batteries.Apple recalls some Beats Pill XL speakersApple recalls some Beats Pill XL speakers Apple Inc said it is recalling some Beats Pill XL portable wireless speakers due to a fire hazard caused by overheating batteries.  Apple recalls some Beats Pill XL speakers Apple Inc said it is recalling some Beats Pill XL portable wireless speakers due to a fire hazard caused by overheating batteries. Apple Inc said it is recalling some Beats Pill XL portable wireless speakers due to a fire hazard caused by overheating batteries.Apple recalls some Beats Pill XL speakers Apple Inc said it is recalling some Beats Pill XL portable wireless speakers due to a fire hazard caused by overheating batteries.   Apple Inc said it is recalling Beats Pill XL portable wireless speakers due to a fire hazard from overheating batteries.UPDATE 1-Apple recalls some Beats Pill XL speakersApple recalls some Beats Pill XL speakersApple recalls some Beats Pill XL speakers Apple Inc said it is recalling some Beats Pill XL portable wireless speakers due to a fire hazard caused by overheating batteries.  Apple recalls some Beats Pill XL speakers Apple Inc said it is recalling some Beats Pill XL portable wireless speakers due to a fire hazard caused by overheating batteries. Apple Inc said it is recalling some Beats Pill XL portable wireless speakers due to a fire hazard caused by overheating batteries.Apple recalls some Beats Pill XL speakers Apple Inc said it is recalling some Beats Pill XL portable wireless speakers due to a fire hazard caused by overheating batteries.   Apple recalls some Beats Pill XL speakersApple recalls some Beats Pill XL speakers Apple Inc said it is recalling some Beats Pill XL portable wireless speakers due to a fire hazard caused by overheating batteries.  Apple recalls some Beats Pill XL speakers Apple Inc said it is recalling some Beats Pill XL portable wireless speakers due to a fire hazard caused by overheating batteries. Apple Inc said it is recalling some Beats Pill XL portable wireless speakers due to a fire hazard caused by overheating batteries.Apple recalls some Beats Pill XL speakers Apple Inc said it is recalling some Beats Pill XL portable wireless speakers due to a fire hazard caused by overheating batteries.  June 3 Apple Inc said it is recalling some Beats Pill XL portable wireless speakers due to a fire hazard caused by overheating batteries.Apple recalls some Beats Pill XL speakersApple recalls some Beats Pill XL speakers Apple Inc said it is recalling some Beats Pill XL portable wireless speakers due to a fire hazard caused by overheating batteries.  Apple recalls some Beats Pill XL speakers Apple Inc said it is recalling some Beats Pill XL portable wireless speakers due to a fire hazard caused by overheating batteries. Apple Inc said it is recalling some Beats Pill XL portable wireless speakers due to a fire hazard caused by overheating batteries.Apple recalls some Beats Pill XL speakers Apple Inc said it is recalling some Beats Pill XL portable wireless speakers due to a fire hazard caused by overheating batteries.    June 3 Apple Inc said it is recalling Beats Pill XL portable wireless speakers due to a fire hazard from overheating batteries.Apple recalls Beats Pill XL speakersUPDATE 1-Apple recalls some Beats Pill XL speakersApple recalls some Beats Pill XL speakersApple recalls some Beats Pill XL speakers Apple Inc said it is recalling some Beats Pill XL portable wireless speakers due to a fire hazard caused by overheating batteries.  Apple recalls some Beats Pill XL speakers Apple Inc said it is recalling some Beats Pill XL portable wireless speakers due to a fire hazard caused by overheating batteries. Apple Inc said it is recalling some Beats Pill XL portable wireless speakers due to a fire hazard caused by overheating batteries.Apple recalls some Beats Pill XL speakers Apple Inc said it is recalling some Beats Pill XL portable wireless speakers due to a fire hazard caused by overheating batteries.   Apple recalls some Beats Pill XL speakersApple recalls some Beats Pill XL speakers Apple Inc said it is recalling some Beats Pill XL portable wireless speakers due to a fire hazard caused by overheating batteries.  Apple recalls some Beats Pill XL speakers Apple Inc said it is recalling some Beats Pill XL portable wireless speakers due to a fire hazard caused by overheating batteries. Apple Inc said it is recalling some Beats Pill XL portable wireless speakers due to a fire hazard caused by overheating batteries.Apple recalls some Beats Pill XL speakers Apple Inc said it is recalling some Beats Pill XL portable wireless speakers due to a fire hazard caused by overheating batteries.  June 3 Apple Inc said it is recalling some Beats Pill XL portable wireless speakers due to a fire hazard caused by overheating batteries.Apple recalls some Beats Pill XL speakersApple recalls some Beats Pill XL speakers Apple Inc said it is recalling some Beats Pill XL portable wireless speakers due to a fire hazard caused by overheating batteries.  Apple recalls some Beats Pill XL speakers Apple Inc said it is recalling some Beats Pill XL portable wireless speakers due to a fire hazard caused by overheating batteries. Apple Inc said it is recalling some Beats Pill XL portable wireless speakers due to a fire hazard caused by overheating batteries.Apple recalls some Beats Pill XL speakers Apple Inc said it is recalling some Beats Pill XL portable wireless speakers due to a fire hazard caused by overheating batteries.    UPDATE 1-Apple recalls some Beats Pill XL speakersApple recalls some Beats Pill XL speakersApple recalls some Beats Pill XL speakers Apple Inc said it is recalling some Beats Pill XL portable wireless speakers due to a fire hazard caused by overheating batteries.  Apple recalls some Beats Pill XL speakers Apple Inc said it is recalling some Beats Pill XL portable wireless speakers due to a fire hazard caused by overheating batteries. Apple Inc said it is recalling some Beats Pill XL portable wireless speakers due to a fire hazard caused by overheating batteries.Apple recalls some Beats Pill XL speakers Apple Inc said it is recalling some Beats Pill XL portable wireless speakers due to a fire hazard caused by overheating batteries.   Apple recalls some Beats Pill XL speakersApple recalls some Beats Pill XL speakers Apple Inc said it is recalling some Beats Pill XL portable wireless speakers due to a fire hazard caused by overheating batteries.  Apple recalls some Beats Pill XL speakers Apple Inc said it is recalling some Beats Pill XL portable wireless speakers due to a fire hazard caused by overheating batteries. Apple Inc said it is recalling some Beats Pill XL portable wireless speakers due to a fire hazard caused by overheating batteries.Apple recalls some Beats Pill XL speakers Apple Inc said it is recalling some Beats Pill XL portable wireless speakers due to a fire hazard caused by overheating batteries.  June 3 Apple Inc said it is recalling some Beats Pill XL portable wireless speakers due to a fire hazard caused by overheating batteries.Apple recalls some Beats Pill XL speakersApple recalls some Beats Pill XL speakers Apple Inc said it is recalling some Beats Pill XL portable wireless speakers due to a fire hazard caused by overheating batteries.  Apple recalls some Beats Pill XL speakers Apple Inc said it is recalling some Beats Pill XL portable wireless speakers due to a fire hazard caused by overheating batteries. Apple Inc said it is recalling some Beats Pill XL portable wireless speakers due to a fire hazard caused by overheating batteries.Apple recalls some Beats Pill XL speakers Apple Inc said it is recalling some Beats Pill XL portable wireless speakers due to a fire hazard caused by overheating batteries.   Apple Inc said it is recalling Beats Pill XL portable wireless speakers due to a fire hazard from overheating batteries.UPDATE 1-Apple recalls some Beats Pill XL speakersApple recalls some Beats Pill XL speakersApple recalls some Beats Pill XL speakers Apple Inc said it is recalling some Beats Pill XL portable wireless speakers due to a fire hazard caused by overheating batteries.  Apple recalls some Beats Pill XL speakers Apple Inc said it is recalling some Beats Pill XL portable wireless speakers due to a fire hazard caused by overheating batteries. Apple Inc said it is recalling some Beats Pill XL portable wireless speakers due to a fire hazard caused by overheating batteries.Apple recalls some Beats Pill XL speakers Apple Inc said it is recalling some Beats Pill XL portable wireless speakers due to a fire hazard caused by overheating batteries.   Apple recalls some Beats Pill XL speakersApple recalls some Beats Pill XL speakers Apple Inc said it is recalling some Beats Pill XL portable wireless speakers due to a fire hazard caused by overheating batteries.  Apple recalls some Beats Pill XL speakers Apple Inc said it is recalling some Beats Pill XL portable wireless speakers due to a fire hazard caused by overheating batteries. Apple Inc said it is recalling some Beats Pill XL portable wireless speakers due to a fire hazard caused by overheating batteries.Apple recalls some Beats Pill XL speakers Apple Inc said it is recalling some Beats Pill XL portable wireless speakers due to a fire hazard caused by overheating batteries.  June 3 Apple Inc said it is recalling some Beats Pill XL portable wireless speakers due to a fire hazard caused by overheating batteries.Apple recalls some Beats Pill XL speakersApple recalls some Beats Pill XL speakers Apple Inc said it is recalling some Beats Pill XL portable wireless speakers due to a fire hazard caused by overheating batteries.  Apple recalls some Beats Pill XL speakers Apple Inc said it is recalling some Beats Pill XL portable wireless speakers due to a fire hazard caused by overheating batteries. Apple Inc said it is recalling some Beats Pill XL portable wireless speakers due to a fire hazard caused by overheating batteries.Apple recalls some Beats Pill XL speakers Apple Inc said it is recalling some Beats Pill XL portable wireless speakers due to a fire hazard caused by overheating batteries.     
