ADP,U.S. private sector adds 201,000 jobs in May: ADPCORRECTED-US STOCKS-Wall St set to open up on strong ADP jobs dataWRAPUP 3-U.S. trade, jobs data encouraging; services sector disappoints NEW YORK, June 3 The U.S. trade deficit narrowed in April on a drop in imports, which surged in March following the end of a West Coast ports labor dispute, while companies picked up their hiring in May after a pullback the previous month.  WRAPUP 3-U.S. trade, jobs data encouraging; services sector disappoints NEW YORK, June 3 The U.S. trade deficit narrowed in April on a drop in imports, which surged in March following the end of a West Coast ports labor dispute, while companies picked up their hiring in May after a pullback the previous month. * Private employers added 201,000 jobs in May vs est. 200,000WRAPUP 3-U.S. trade, jobs data encouraging; services sector disappoints NEW YORK, June 3 The U.S. trade deficit narrowed in April on a drop in imports, which surged in March following the end of a West Coast ports labor dispute, while companies picked up their hiring in May after a pullback the previous month.   CORRECTED-US STOCKS-Wall St set to open up on strong ADP jobs dataWRAPUP 3-U.S. trade, jobs data encouraging; services sector disappoints NEW YORK, June 3 The U.S. trade deficit narrowed in April on a drop in imports, which surged in March following the end of a West Coast ports labor dispute, while companies picked up their hiring in May after a pullback the previous month.  WRAPUP 3-U.S. trade, jobs data encouraging; services sector disappoints NEW YORK, June 3 The U.S. trade deficit narrowed in April on a drop in imports, which surged in March following the end of a West Coast ports labor dispute, while companies picked up their hiring in May after a pullback the previous month. * Private employers added 201,000 jobs in May vs est. 200,000WRAPUP 3-U.S. trade, jobs data encouraging; services sector disappoints NEW YORK, June 3 The U.S. trade deficit narrowed in April on a drop in imports, which surged in March following the end of a West Coast ports labor dispute, while companies picked up their hiring in May after a pullback the previous month.  NEW YORK U.S. private employers added 201,000 jobs in May, compared with a downwardly revised 165,000 jobs in April which were the fewest since January 2014, a report by a payrolls processor showed on Wednesday.CORRECTED-US STOCKS-Wall St set to open up on strong ADP jobs dataWRAPUP 3-U.S. trade, jobs data encouraging; services sector disappoints NEW YORK, June 3 The U.S. trade deficit narrowed in April on a drop in imports, which surged in March following the end of a West Coast ports labor dispute, while companies picked up their hiring in May after a pullback the previous month.  WRAPUP 3-U.S. trade, jobs data encouraging; services sector disappoints NEW YORK, June 3 The U.S. trade deficit narrowed in April on a drop in imports, which surged in March following the end of a West Coast ports labor dispute, while companies picked up their hiring in May after a pullback the previous month. * Private employers added 201,000 jobs in May vs est. 200,000WRAPUP 3-U.S. trade, jobs data encouraging; services sector disappoints NEW YORK, June 3 The U.S. trade deficit narrowed in April on a drop in imports, which surged in March following the end of a West Coast ports labor dispute, while companies picked up their hiring in May after a pullback the previous month.   
BBT,Fed approves BB&T;'s acquisition of Bank of Kentucky Financial WASHINGTON, June 3 The Federal Reserve Board on Wednesday said it had approved BB&T; Corp's application to acquire Bank of Kentucky Financial Corp. 
BA,BRIEF-Air China's unit Shenzhen Airlines plans to acquire 46 aircrafts from Boeing for about $4.3 blnShenzhen Air signs deal with Boeing to buy 46 jets for $4.3 bln BEIJING, June 3 Shenzhen Airlines has struck a deal with Boeing Co to buy 46 B737 planes for $4.3 billion, the carrier's parent Air China Ltd said on Wednesday, as the group seeks to grow the number of routes served in China's booming air travel market.  Shenzhen Air signs deal with Boeing to buy 46 jets for $4.3 bln BEIJING, June 3 Shenzhen Airlines has struck a deal with Boeing Co to buy 46 B737 planes for $4.3 billion, the carrier's parent Air China Ltd said on Wednesday, as the group seeks to grow the number of routes served in China's booming air travel market. * Says unit Shenzhen Airlines signs agreement to purchase 46 aircrafts from Boeing for about $4.3 billionShenzhen Air signs deal with Boeing to buy 46 jets for $4.3 bln BEIJING, June 3 Shenzhen Airlines has struck a deal with Boeing Co to buy 46 B737 planes for $4.3 billion, the carrier's parent Air China Ltd said on Wednesday, as the group seeks to grow the number of routes served in China's booming air travel market.  
CHRW,US STOCKS-Wall St rises as Greece worries fade, data impresses * Indexes up: Dow 0.34 pct, S&P; 0.14 pct, Nasdaq 0.34 pct   (Updates to early afternoon) 
C,Citi metals financing in China at standstill after suspected fraud LONDON U.S. bank Citigroup Inc said it currently has no metals financing clients in China after suspected fraud led to a web of lawsuits, and was reviewing the future of the business. 
EXPE,Accor steps up digital push and changes name PARIS, June 3 Accor said on Wednesday it would spend 22 million euros ($25 million) to enable independent hoteliers to offer their rooms on its booking website as it seeks ways to fight back against online travel agents such as Expedia and Booking.com. 
XOM,Oil majors' climate call exposes U.S.-Europe rift on carbon pricing * U.S. and European majors have held talks for joint initiative Exxon wants carbon tax to be revenue-neutral 
F,Ford says Toyota studying its SDL in-car smartphone app interfaceUPDATE 1-Toyota to explore Ford's SDL in-car smartphone app interface June 3 Toyota Motor Corp said it reached an agreement with Ford Motor to explore collaboration for the implementation of Ford's SmartDeviceLink (SDL) technology in future Toyota and Lexus vehicles.  UPDATE 1-Toyota to explore Ford's SDL in-car smartphone app interface June 3 Toyota Motor Corp said it reached an agreement with Ford Motor to explore collaboration for the implementation of Ford's SmartDeviceLink (SDL) technology in future Toyota and Lexus vehicles. June 3 Ford Motor Co said Toyota Motor Corp is studying the open-source version of Ford AppLink, called SmartDeviceLink (SDL), to integrate smartphone apps into its vehicles in future.UPDATE 1-Toyota to explore Ford's SDL in-car smartphone app interface June 3 Toyota Motor Corp said it reached an agreement with Ford Motor to explore collaboration for the implementation of Ford's SmartDeviceLink (SDL) technology in future Toyota and Lexus vehicles.  
FCX,Freeport may sell less than 20 pct of oil, gas unit in IPO June 3 Freeport-McMoRan Inc, which is exploring a public offer for a stake in its oil and gas business, will likely sell off less than 20 percent of the unit, Freeport Chief Financial Officer Kathleen Quirk said on Wednesday. 
IBM,Deutsche Bank partners with Microsoft, HCL, IBM in tech lab launchDeutsche Bank partners with Microsoft, HCL, IBM in tech lab launch FRANKFURT Deutsche Bank  will launch three innovation labs this year, partnering with big development firms to speed creation of financial technology for its own uses and will spend up to 1 billion euros ($1.11 billion) on digital development in the next five years.  Deutsche Bank partners with Microsoft, HCL, IBM in tech lab launch FRANKFURT Deutsche Bank  will launch three innovation labs this year, partnering with big development firms to speed creation of financial technology for its own uses and will spend up to 1 billion euros ($1.11 billion) on digital development in the next five years. FRANKFURT, June 3 Deutsche Bank will launch three innovation labs this year, partnering with big development firms to speed creation of financial technology for its own uses and will spend up to 1 billion euros ($1.11 billion) on digital development in the next 5 years.Deutsche Bank partners with Microsoft, HCL, IBM in tech lab launch FRANKFURT Deutsche Bank  will launch three innovation labs this year, partnering with big development firms to speed creation of financial technology for its own uses and will spend up to 1 billion euros ($1.11 billion) on digital development in the next five years.  
INTU,GI Partners buys software firm from Vista Equity June 3 GI Partners is buying the real estate software company MRI Software LLC for an undisclosed sum from the technology focused private equity firm Vista Equity Partners, the firms said on Wednesday. 
