AET,Two more U.S. healthcare workers repatriated for Ebola monitoring March 18 The last two members of a group of U.S. healthcare workers whose colleague is being treated for the Ebola virus returned on Wednesday from Sierra Leone to the United States, where they are being monitored for possible exposure to the deadly virus. 
GOOGL,CORRECTED-Tag Heuer unveils smartwatch venture with Intel, Google BASEL, Switzerland, March 19 Tag Heuer, French luxury group LVMH's biggest watch maker, announced a partnership with Google Inc and Intel Corp to create a luxury smartwatch to compete head-on with Apple Inc . 
GOOG,CORRECTED-Tag Heuer unveils smartwatch venture with Intel, Google BASEL, Switzerland, March 19 Tag Heuer, French luxury group LVMH's biggest watch maker, announced a partnership with Google Inc and Intel Corp to create a luxury smartwatch to compete head-on with Apple Inc . 
AMZN,UPDATE 3-U.S. regulators give Amazon go-ahead for drone tests SEATTLE, March 19 Amazon.com Inc has won approval from U.S. federal regulators to test a delivery drone outdoors, as the e-commerce company pursues its goal of sending packages to customers by air, even as it faces public concern about safety and privacy. 
AMGN,U.S. judge rejects Amgen injunction bid against Novartis Sandoz unitU.S. judge rejects Amgen bid to block biosimilar NeupogenBRIEF-Novartis says it, Amgen want expedited appellate review of Neupogen decisionUPDATE 2-U.S. judge rejects Amgen bid to block 'biosimilar' Neupogen NEW YORK, March 19 A U.S. judge on Thursday denied Amgen Inc's bid to block the sale of Novartis AG's recently approved "biosimilar" form of Neupogen, Amgen's blockbuster drug used to prevent infections in cancer patients.  UPDATE 2-U.S. judge rejects Amgen bid to block 'biosimilar' Neupogen NEW YORK, March 19 A U.S. judge on Thursday denied Amgen Inc's bid to block the sale of Novartis AG's recently approved "biosimilar" form of Neupogen, Amgen's blockbuster drug used to prevent infections in cancer patients. March 19 Novartis AG :  * Says it, Amgen both agreed to seek expedited review by U.S. appealsUPDATE 2-U.S. judge rejects Amgen bid to block 'biosimilar' Neupogen NEW YORK, March 19 A U.S. judge on Thursday denied Amgen Inc's bid to block the sale of Novartis AG's recently approved "biosimilar" form of Neupogen, Amgen's blockbuster drug used to prevent infections in cancer patients.   BRIEF-Novartis says it, Amgen want expedited appellate review of Neupogen decisionUPDATE 2-U.S. judge rejects Amgen bid to block 'biosimilar' Neupogen NEW YORK, March 19 A U.S. judge on Thursday denied Amgen Inc's bid to block the sale of Novartis AG's recently approved "biosimilar" form of Neupogen, Amgen's blockbuster drug used to prevent infections in cancer patients.  UPDATE 2-U.S. judge rejects Amgen bid to block 'biosimilar' Neupogen NEW YORK, March 19 A U.S. judge on Thursday denied Amgen Inc's bid to block the sale of Novartis AG's recently approved "biosimilar" form of Neupogen, Amgen's blockbuster drug used to prevent infections in cancer patients. March 19 Novartis AG :  * Says it, Amgen both agreed to seek expedited review by U.S. appealsUPDATE 2-U.S. judge rejects Amgen bid to block 'biosimilar' Neupogen NEW YORK, March 19 A U.S. judge on Thursday denied Amgen Inc's bid to block the sale of Novartis AG's recently approved "biosimilar" form of Neupogen, Amgen's blockbuster drug used to prevent infections in cancer patients.  SAN FRANCISCO A U.S. judge on Thursday denied Amgen Inc's bid to block the sale of Novartis AG's  recently approved "biosimilar" form of Neupogen, Amgen's blockbuster drug used to prevent infections in cancer patients.BRIEF-Novartis says it, Amgen want expedited appellate review of Neupogen decisionUPDATE 2-U.S. judge rejects Amgen bid to block 'biosimilar' Neupogen NEW YORK, March 19 A U.S. judge on Thursday denied Amgen Inc's bid to block the sale of Novartis AG's recently approved "biosimilar" form of Neupogen, Amgen's blockbuster drug used to prevent infections in cancer patients.  UPDATE 2-U.S. judge rejects Amgen bid to block 'biosimilar' Neupogen NEW YORK, March 19 A U.S. judge on Thursday denied Amgen Inc's bid to block the sale of Novartis AG's recently approved "biosimilar" form of Neupogen, Amgen's blockbuster drug used to prevent infections in cancer patients. March 19 Novartis AG :  * Says it, Amgen both agreed to seek expedited review by U.S. appealsUPDATE 2-U.S. judge rejects Amgen bid to block 'biosimilar' Neupogen NEW YORK, March 19 A U.S. judge on Thursday denied Amgen Inc's bid to block the sale of Novartis AG's recently approved "biosimilar" form of Neupogen, Amgen's blockbuster drug used to prevent infections in cancer patients.    U.S. judge rejects Amgen bid to block biosimilar NeupogenBRIEF-Novartis says it, Amgen want expedited appellate review of Neupogen decisionUPDATE 2-U.S. judge rejects Amgen bid to block 'biosimilar' Neupogen NEW YORK, March 19 A U.S. judge on Thursday denied Amgen Inc's bid to block the sale of Novartis AG's recently approved "biosimilar" form of Neupogen, Amgen's blockbuster drug used to prevent infections in cancer patients.  UPDATE 2-U.S. judge rejects Amgen bid to block 'biosimilar' Neupogen NEW YORK, March 19 A U.S. judge on Thursday denied Amgen Inc's bid to block the sale of Novartis AG's recently approved "biosimilar" form of Neupogen, Amgen's blockbuster drug used to prevent infections in cancer patients. March 19 Novartis AG :  * Says it, Amgen both agreed to seek expedited review by U.S. appealsUPDATE 2-U.S. judge rejects Amgen bid to block 'biosimilar' Neupogen NEW YORK, March 19 A U.S. judge on Thursday denied Amgen Inc's bid to block the sale of Novartis AG's recently approved "biosimilar" form of Neupogen, Amgen's blockbuster drug used to prevent infections in cancer patients.   BRIEF-Novartis says it, Amgen want expedited appellate review of Neupogen decisionUPDATE 2-U.S. judge rejects Amgen bid to block 'biosimilar' Neupogen NEW YORK, March 19 A U.S. judge on Thursday denied Amgen Inc's bid to block the sale of Novartis AG's recently approved "biosimilar" form of Neupogen, Amgen's blockbuster drug used to prevent infections in cancer patients.  UPDATE 2-U.S. judge rejects Amgen bid to block 'biosimilar' Neupogen NEW YORK, March 19 A U.S. judge on Thursday denied Amgen Inc's bid to block the sale of Novartis AG's recently approved "biosimilar" form of Neupogen, Amgen's blockbuster drug used to prevent infections in cancer patients. March 19 Novartis AG :  * Says it, Amgen both agreed to seek expedited review by U.S. appealsUPDATE 2-U.S. judge rejects Amgen bid to block 'biosimilar' Neupogen NEW YORK, March 19 A U.S. judge on Thursday denied Amgen Inc's bid to block the sale of Novartis AG's recently approved "biosimilar" form of Neupogen, Amgen's blockbuster drug used to prevent infections in cancer patients.  SAN FRANCISCO A U.S. judge on Thursday denied Amgen Inc's bid to block the sale of Novartis AG's  recently approved "biosimilar" form of Neupogen, Amgen's blockbuster drug used to prevent infections in cancer patients.BRIEF-Novartis says it, Amgen want expedited appellate review of Neupogen decisionUPDATE 2-U.S. judge rejects Amgen bid to block 'biosimilar' Neupogen NEW YORK, March 19 A U.S. judge on Thursday denied Amgen Inc's bid to block the sale of Novartis AG's recently approved "biosimilar" form of Neupogen, Amgen's blockbuster drug used to prevent infections in cancer patients.  UPDATE 2-U.S. judge rejects Amgen bid to block 'biosimilar' Neupogen NEW YORK, March 19 A U.S. judge on Thursday denied Amgen Inc's bid to block the sale of Novartis AG's recently approved "biosimilar" form of Neupogen, Amgen's blockbuster drug used to prevent infections in cancer patients. March 19 Novartis AG :  * Says it, Amgen both agreed to seek expedited review by U.S. appealsUPDATE 2-U.S. judge rejects Amgen bid to block 'biosimilar' Neupogen NEW YORK, March 19 A U.S. judge on Thursday denied Amgen Inc's bid to block the sale of Novartis AG's recently approved "biosimilar" form of Neupogen, Amgen's blockbuster drug used to prevent infections in cancer patients.   SAN FRANCISCO, March 19 A U.S. judge on Thursday denied Amgen Inc's bid for a preliminary injunction against Novartis AG's Sandoz unit over disputed biologic product filgrastim.U.S. judge rejects Amgen bid to block biosimilar NeupogenBRIEF-Novartis says it, Amgen want expedited appellate review of Neupogen decisionUPDATE 2-U.S. judge rejects Amgen bid to block 'biosimilar' Neupogen NEW YORK, March 19 A U.S. judge on Thursday denied Amgen Inc's bid to block the sale of Novartis AG's recently approved "biosimilar" form of Neupogen, Amgen's blockbuster drug used to prevent infections in cancer patients.  UPDATE 2-U.S. judge rejects Amgen bid to block 'biosimilar' Neupogen NEW YORK, March 19 A U.S. judge on Thursday denied Amgen Inc's bid to block the sale of Novartis AG's recently approved "biosimilar" form of Neupogen, Amgen's blockbuster drug used to prevent infections in cancer patients. March 19 Novartis AG :  * Says it, Amgen both agreed to seek expedited review by U.S. appealsUPDATE 2-U.S. judge rejects Amgen bid to block 'biosimilar' Neupogen NEW YORK, March 19 A U.S. judge on Thursday denied Amgen Inc's bid to block the sale of Novartis AG's recently approved "biosimilar" form of Neupogen, Amgen's blockbuster drug used to prevent infections in cancer patients.   BRIEF-Novartis says it, Amgen want expedited appellate review of Neupogen decisionUPDATE 2-U.S. judge rejects Amgen bid to block 'biosimilar' Neupogen NEW YORK, March 19 A U.S. judge on Thursday denied Amgen Inc's bid to block the sale of Novartis AG's recently approved "biosimilar" form of Neupogen, Amgen's blockbuster drug used to prevent infections in cancer patients.  UPDATE 2-U.S. judge rejects Amgen bid to block 'biosimilar' Neupogen NEW YORK, March 19 A U.S. judge on Thursday denied Amgen Inc's bid to block the sale of Novartis AG's recently approved "biosimilar" form of Neupogen, Amgen's blockbuster drug used to prevent infections in cancer patients. March 19 Novartis AG :  * Says it, Amgen both agreed to seek expedited review by U.S. appealsUPDATE 2-U.S. judge rejects Amgen bid to block 'biosimilar' Neupogen NEW YORK, March 19 A U.S. judge on Thursday denied Amgen Inc's bid to block the sale of Novartis AG's recently approved "biosimilar" form of Neupogen, Amgen's blockbuster drug used to prevent infections in cancer patients.  SAN FRANCISCO A U.S. judge on Thursday denied Amgen Inc's bid to block the sale of Novartis AG's  recently approved "biosimilar" form of Neupogen, Amgen's blockbuster drug used to prevent infections in cancer patients.BRIEF-Novartis says it, Amgen want expedited appellate review of Neupogen decisionUPDATE 2-U.S. judge rejects Amgen bid to block 'biosimilar' Neupogen NEW YORK, March 19 A U.S. judge on Thursday denied Amgen Inc's bid to block the sale of Novartis AG's recently approved "biosimilar" form of Neupogen, Amgen's blockbuster drug used to prevent infections in cancer patients.  UPDATE 2-U.S. judge rejects Amgen bid to block 'biosimilar' Neupogen NEW YORK, March 19 A U.S. judge on Thursday denied Amgen Inc's bid to block the sale of Novartis AG's recently approved "biosimilar" form of Neupogen, Amgen's blockbuster drug used to prevent infections in cancer patients. March 19 Novartis AG :  * Says it, Amgen both agreed to seek expedited review by U.S. appealsUPDATE 2-U.S. judge rejects Amgen bid to block 'biosimilar' Neupogen NEW YORK, March 19 A U.S. judge on Thursday denied Amgen Inc's bid to block the sale of Novartis AG's recently approved "biosimilar" form of Neupogen, Amgen's blockbuster drug used to prevent infections in cancer patients.    
AAPL,CORRECTED-Tag Heuer unveils smartwatch venture with Intel, GoogleUPDATE 2-Tag Heuer, Intel challenge Apple with Android smartwatch BASEL, Switzerland, March 19 Tag Heuer, French luxury group LVMH's biggest watch maker, said it will launch a smartwatch later this year using Google Inc's  Android operating system in a venture with Intel Corp  to compete head-on with the Apple Watch.  UPDATE 2-Tag Heuer, Intel challenge Apple with Android smartwatch BASEL, Switzerland, March 19 Tag Heuer, French luxury group LVMH's biggest watch maker, said it will launch a smartwatch later this year using Google Inc's  Android operating system in a venture with Intel Corp  to compete head-on with the Apple Watch. BASEL, Switzerland, March 19 Tag Heuer, French luxury group LVMH's biggest watch maker, announced a partnership with Google Inc and Intel Corp to create a luxury smartwatch to compete head-on with Apple Inc .UPDATE 2-Tag Heuer, Intel challenge Apple with Android smartwatch BASEL, Switzerland, March 19 Tag Heuer, French luxury group LVMH's biggest watch maker, said it will launch a smartwatch later this year using Google Inc's  Android operating system in a venture with Intel Corp  to compete head-on with the Apple Watch.  
T,U.S. court rules AT&T;'s lawyers too late to appeal patent lossU.S. court rules AT&T;'s lawyers too late to appeal patent lossU.S. court rules AT&T;'s lawyers too late to appeal patent loss NEW YORK AT&T; Inc was too late to appeal a $40 million loss in a  patent infringement case because its lawyers did not read key rulings in time, a federal appeals court said on Thursday.  U.S. court rules AT&T;'s lawyers too late to appeal patent loss NEW YORK AT&T; Inc was too late to appeal a $40 million loss in a  patent infringement case because its lawyers did not read key rulings in time, a federal appeals court said on Thursday. NEW YORK AT&T; Inc was too late to appeal a $40 million loss in a  patent infringement case because its lawyers did not read key rulings in time, a federal appeals court said on Thursday.U.S. court rules AT&T;'s lawyers too late to appeal patent loss NEW YORK AT&T; Inc was too late to appeal a $40 million loss in a  patent infringement case because its lawyers did not read key rulings in time, a federal appeals court said on Thursday.   U.S. court rules AT&T;'s lawyers too late to appeal patent lossU.S. court rules AT&T;'s lawyers too late to appeal patent loss NEW YORK AT&T; Inc was too late to appeal a $40 million loss in a  patent infringement case because its lawyers did not read key rulings in time, a federal appeals court said on Thursday.  U.S. court rules AT&T;'s lawyers too late to appeal patent loss NEW YORK AT&T; Inc was too late to appeal a $40 million loss in a  patent infringement case because its lawyers did not read key rulings in time, a federal appeals court said on Thursday. NEW YORK AT&T; Inc was too late to appeal a $40 million loss in a  patent infringement case because its lawyers did not read key rulings in time, a federal appeals court said on Thursday.U.S. court rules AT&T;'s lawyers too late to appeal patent loss NEW YORK AT&T; Inc was too late to appeal a $40 million loss in a  patent infringement case because its lawyers did not read key rulings in time, a federal appeals court said on Thursday.  NEW YORK, March 19 AT&T; Inc was too late to appeal a $40 million loss in a  patent infringement case because its lawyers did not read key rulings in time, a federal appeals court said on Thursday.U.S. court rules AT&T;'s lawyers too late to appeal patent lossU.S. court rules AT&T;'s lawyers too late to appeal patent loss NEW YORK AT&T; Inc was too late to appeal a $40 million loss in a  patent infringement case because its lawyers did not read key rulings in time, a federal appeals court said on Thursday.  U.S. court rules AT&T;'s lawyers too late to appeal patent loss NEW YORK AT&T; Inc was too late to appeal a $40 million loss in a  patent infringement case because its lawyers did not read key rulings in time, a federal appeals court said on Thursday. NEW YORK AT&T; Inc was too late to appeal a $40 million loss in a  patent infringement case because its lawyers did not read key rulings in time, a federal appeals court said on Thursday.U.S. court rules AT&T;'s lawyers too late to appeal patent loss NEW YORK AT&T; Inc was too late to appeal a $40 million loss in a  patent infringement case because its lawyers did not read key rulings in time, a federal appeals court said on Thursday.   
BA,Senators release new Export-Import Bank blueprintUPDATE 2-U.S. senators launch bipartisan Export-Import Bank blueprint WASHINGTON, March 19 A bipartisan plan to save the U.S. Export-Import Bank seeks to extend the bank's term until 2019, increase lending to small businesses and overturn limits on coal-fired power plants projects, according to documents released on Thursday.  UPDATE 2-U.S. senators launch bipartisan Export-Import Bank blueprint WASHINGTON, March 19 A bipartisan plan to save the U.S. Export-Import Bank seeks to extend the bank's term until 2019, increase lending to small businesses and overturn limits on coal-fired power plants projects, according to documents released on Thursday. WASHINGTON A bipartisan plan to save the U.S. Export-Import Bank seeks to extend the bank's term until 2019, increase lending to small businesses and overturn limits on coal-fired power plants projects, according to documents released on Thursday.UPDATE 2-U.S. senators launch bipartisan Export-Import Bank blueprint WASHINGTON, March 19 A bipartisan plan to save the U.S. Export-Import Bank seeks to extend the bank's term until 2019, increase lending to small businesses and overturn limits on coal-fired power plants projects, according to documents released on Thursday.  
SCHW,American Express, Schwab sign co-branded card deal NEW YORK, March 19 American Express Co,  which recently gave up a co-branded card venture with retailer Costco, said on Thursday that it has made a new deal with brokerage Charles Schwab Corp to issue cards under both of their names. 
COST,American Express, Schwab sign co-branded card deal NEW YORK, March 19 American Express Co,  which recently gave up a co-branded card venture with retailer Costco, said on Thursday that it has made a new deal with brokerage Charles Schwab Corp to issue cards under both of their names. 
XOM,New Jersey environmental bills move ahead with Exxon deal pending NEW YORK, March 19 A New Jersey bill that calls for more money from environmental settlements to fund cleanups moved to the full state Assembly on Thursday in the wake of a controversial $225 million deal with Exxon Mobil Corp. 
GS,Allianz in $700 mln deal with Goldman to hedge CPIC stake-termsUPDATE 2-Allianz hedges stake in CPIC through $700 mln deal with Goldman * CPIC shares close 2.9 pct down following Goldman transaction   (Adds statement from Allianz in 3rd paragraph)  UPDATE 2-Allianz hedges stake in CPIC through $700 mln deal with Goldman * CPIC shares close 2.9 pct down following Goldman transaction   (Adds statement from Allianz in 3rd paragraph) HONG KONG, March 19 German insurer Allianz  has struck a $700 million deal with Goldman Sachs  to protect most of its stake in China Pacific Insurance Group Co Ltd (CPIC), according to a term sheet of the deal seen by Reuters.UPDATE 2-Allianz hedges stake in CPIC through $700 mln deal with Goldman * CPIC shares close 2.9 pct down following Goldman transaction   (Adds statement from Allianz in 3rd paragraph)  
INTC,UPDATE 1-Chip designer ARM sees 20 pct market share in servers by 2020CORRECTED-Tag Heuer unveils smartwatch venture with Intel, GoogleUPDATE 2-Tag Heuer, Intel challenge Apple with Android smartwatch BASEL, Switzerland, March 19 Tag Heuer, French luxury group LVMH's biggest watch maker, said it will launch a smartwatch later this year using Google Inc's  Android operating system in a venture with Intel Corp  to compete head-on with the Apple Watch.  UPDATE 2-Tag Heuer, Intel challenge Apple with Android smartwatch BASEL, Switzerland, March 19 Tag Heuer, French luxury group LVMH's biggest watch maker, said it will launch a smartwatch later this year using Google Inc's  Android operating system in a venture with Intel Corp  to compete head-on with the Apple Watch. BASEL, Switzerland, March 19 Tag Heuer, French luxury group LVMH's biggest watch maker, announced a partnership with Google Inc and Intel Corp to create a luxury smartwatch to compete head-on with Apple Inc .UPDATE 2-Tag Heuer, Intel challenge Apple with Android smartwatch BASEL, Switzerland, March 19 Tag Heuer, French luxury group LVMH's biggest watch maker, said it will launch a smartwatch later this year using Google Inc's  Android operating system in a venture with Intel Corp  to compete head-on with the Apple Watch.   CORRECTED-Tag Heuer unveils smartwatch venture with Intel, GoogleUPDATE 2-Tag Heuer, Intel challenge Apple with Android smartwatch BASEL, Switzerland, March 19 Tag Heuer, French luxury group LVMH's biggest watch maker, said it will launch a smartwatch later this year using Google Inc's  Android operating system in a venture with Intel Corp  to compete head-on with the Apple Watch.  UPDATE 2-Tag Heuer, Intel challenge Apple with Android smartwatch BASEL, Switzerland, March 19 Tag Heuer, French luxury group LVMH's biggest watch maker, said it will launch a smartwatch later this year using Google Inc's  Android operating system in a venture with Intel Corp  to compete head-on with the Apple Watch. BASEL, Switzerland, March 19 Tag Heuer, French luxury group LVMH's biggest watch maker, announced a partnership with Google Inc and Intel Corp to create a luxury smartwatch to compete head-on with Apple Inc .UPDATE 2-Tag Heuer, Intel challenge Apple with Android smartwatch BASEL, Switzerland, March 19 Tag Heuer, French luxury group LVMH's biggest watch maker, said it will launch a smartwatch later this year using Google Inc's  Android operating system in a venture with Intel Corp  to compete head-on with the Apple Watch.  * Chips would be priced less than leader Intel's   (Adds details, quotes)CORRECTED-Tag Heuer unveils smartwatch venture with Intel, GoogleUPDATE 2-Tag Heuer, Intel challenge Apple with Android smartwatch BASEL, Switzerland, March 19 Tag Heuer, French luxury group LVMH's biggest watch maker, said it will launch a smartwatch later this year using Google Inc's  Android operating system in a venture with Intel Corp  to compete head-on with the Apple Watch.  UPDATE 2-Tag Heuer, Intel challenge Apple with Android smartwatch BASEL, Switzerland, March 19 Tag Heuer, French luxury group LVMH's biggest watch maker, said it will launch a smartwatch later this year using Google Inc's  Android operating system in a venture with Intel Corp  to compete head-on with the Apple Watch. BASEL, Switzerland, March 19 Tag Heuer, French luxury group LVMH's biggest watch maker, announced a partnership with Google Inc and Intel Corp to create a luxury smartwatch to compete head-on with Apple Inc .UPDATE 2-Tag Heuer, Intel challenge Apple with Android smartwatch BASEL, Switzerland, March 19 Tag Heuer, French luxury group LVMH's biggest watch maker, said it will launch a smartwatch later this year using Google Inc's  Android operating system in a venture with Intel Corp  to compete head-on with the Apple Watch.   
