GOOGL,RPT - INSIGHT-Amazon, Google race to get your DNA into the cloudCORRECTED-INSIGHT-Amazon, Google race to get your DNA into the cloudAmazon, Google race to get your DNA into the cloud NEW YORK Amazon.com Inc is in a race against Google Inc to store data on human DNA, seeking both bragging rights in helping scientists make new medical discoveries and market share in a business that may be worth $1 billion a year by 2018. | Video   Amazon, Google race to get your DNA into the cloud NEW YORK Amazon.com Inc is in a race against Google Inc to store data on human DNA, seeking both bragging rights in helping scientists make new medical discoveries and market share in a business that may be worth $1 billion a year by 2018. | Video  NEW YORK, June 5 Amazon.com Inc is in a race against Google Inc to store data on human DNA, seeking both bragging rights in helping scientists make new medical discoveries and market share in a business that may be worth $1 billion a year by 2018.Amazon, Google race to get your DNA into the cloud NEW YORK Amazon.com Inc is in a race against Google Inc to store data on human DNA, seeking both bragging rights in helping scientists make new medical discoveries and market share in a business that may be worth $1 billion a year by 2018. | Video    CORRECTED-INSIGHT-Amazon, Google race to get your DNA into the cloudAmazon, Google race to get your DNA into the cloud NEW YORK Amazon.com Inc is in a race against Google Inc to store data on human DNA, seeking both bragging rights in helping scientists make new medical discoveries and market share in a business that may be worth $1 billion a year by 2018. | Video   Amazon, Google race to get your DNA into the cloud NEW YORK Amazon.com Inc is in a race against Google Inc to store data on human DNA, seeking both bragging rights in helping scientists make new medical discoveries and market share in a business that may be worth $1 billion a year by 2018. | Video  NEW YORK, June 5 Amazon.com Inc is in a race against Google Inc to store data on human DNA, seeking both bragging rights in helping scientists make new medical discoveries and market share in a business that may be worth $1 billion a year by 2018.Amazon, Google race to get your DNA into the cloud NEW YORK Amazon.com Inc is in a race against Google Inc to store data on human DNA, seeking both bragging rights in helping scientists make new medical discoveries and market share in a business that may be worth $1 billion a year by 2018. | Video   NEW YORK, June 5 Amazon.com Inc is in a race against Google Inc to store data on human DNA, seeking both bragging rights in helping scientists make new medical discoveries and market share in a business that may be worth $1 billion a year by 2018.CORRECTED-INSIGHT-Amazon, Google race to get your DNA into the cloudAmazon, Google race to get your DNA into the cloud NEW YORK Amazon.com Inc is in a race against Google Inc to store data on human DNA, seeking both bragging rights in helping scientists make new medical discoveries and market share in a business that may be worth $1 billion a year by 2018. | Video   Amazon, Google race to get your DNA into the cloud NEW YORK Amazon.com Inc is in a race against Google Inc to store data on human DNA, seeking both bragging rights in helping scientists make new medical discoveries and market share in a business that may be worth $1 billion a year by 2018. | Video  NEW YORK, June 5 Amazon.com Inc is in a race against Google Inc to store data on human DNA, seeking both bragging rights in helping scientists make new medical discoveries and market share in a business that may be worth $1 billion a year by 2018.Amazon, Google race to get your DNA into the cloud NEW YORK Amazon.com Inc is in a race against Google Inc to store data on human DNA, seeking both bragging rights in helping scientists make new medical discoveries and market share in a business that may be worth $1 billion a year by 2018. | Video    
GOOG,RPT - INSIGHT-Amazon, Google race to get your DNA into the cloudCORRECTED-INSIGHT-Amazon, Google race to get your DNA into the cloudAmazon, Google race to get your DNA into the cloud NEW YORK Amazon.com Inc is in a race against Google Inc to store data on human DNA, seeking both bragging rights in helping scientists make new medical discoveries and market share in a business that may be worth $1 billion a year by 2018. | Video   Amazon, Google race to get your DNA into the cloud NEW YORK Amazon.com Inc is in a race against Google Inc to store data on human DNA, seeking both bragging rights in helping scientists make new medical discoveries and market share in a business that may be worth $1 billion a year by 2018. | Video  NEW YORK, June 5 Amazon.com Inc is in a race against Google Inc to store data on human DNA, seeking both bragging rights in helping scientists make new medical discoveries and market share in a business that may be worth $1 billion a year by 2018.Amazon, Google race to get your DNA into the cloud NEW YORK Amazon.com Inc is in a race against Google Inc to store data on human DNA, seeking both bragging rights in helping scientists make new medical discoveries and market share in a business that may be worth $1 billion a year by 2018. | Video    CORRECTED-INSIGHT-Amazon, Google race to get your DNA into the cloudAmazon, Google race to get your DNA into the cloud NEW YORK Amazon.com Inc is in a race against Google Inc to store data on human DNA, seeking both bragging rights in helping scientists make new medical discoveries and market share in a business that may be worth $1 billion a year by 2018. | Video   Amazon, Google race to get your DNA into the cloud NEW YORK Amazon.com Inc is in a race against Google Inc to store data on human DNA, seeking both bragging rights in helping scientists make new medical discoveries and market share in a business that may be worth $1 billion a year by 2018. | Video  NEW YORK, June 5 Amazon.com Inc is in a race against Google Inc to store data on human DNA, seeking both bragging rights in helping scientists make new medical discoveries and market share in a business that may be worth $1 billion a year by 2018.Amazon, Google race to get your DNA into the cloud NEW YORK Amazon.com Inc is in a race against Google Inc to store data on human DNA, seeking both bragging rights in helping scientists make new medical discoveries and market share in a business that may be worth $1 billion a year by 2018. | Video   NEW YORK, June 5 Amazon.com Inc is in a race against Google Inc to store data on human DNA, seeking both bragging rights in helping scientists make new medical discoveries and market share in a business that may be worth $1 billion a year by 2018.CORRECTED-INSIGHT-Amazon, Google race to get your DNA into the cloudAmazon, Google race to get your DNA into the cloud NEW YORK Amazon.com Inc is in a race against Google Inc to store data on human DNA, seeking both bragging rights in helping scientists make new medical discoveries and market share in a business that may be worth $1 billion a year by 2018. | Video   Amazon, Google race to get your DNA into the cloud NEW YORK Amazon.com Inc is in a race against Google Inc to store data on human DNA, seeking both bragging rights in helping scientists make new medical discoveries and market share in a business that may be worth $1 billion a year by 2018. | Video  NEW YORK, June 5 Amazon.com Inc is in a race against Google Inc to store data on human DNA, seeking both bragging rights in helping scientists make new medical discoveries and market share in a business that may be worth $1 billion a year by 2018.Amazon, Google race to get your DNA into the cloud NEW YORK Amazon.com Inc is in a race against Google Inc to store data on human DNA, seeking both bragging rights in helping scientists make new medical discoveries and market share in a business that may be worth $1 billion a year by 2018. | Video    
AMZN,RPT - INSIGHT-Amazon, Google race to get your DNA into the cloudCORRECTED-INSIGHT-Amazon, Google race to get your DNA into the cloud NEW YORK, June 5 Amazon.com Inc is in a race against Google Inc to store data on human DNA, seeking both bragging rights in helping scientists make new medical discoveries and market share in a business that may be worth $1 billion a year by 2018.  CORRECTED-INSIGHT-Amazon, Google race to get your DNA into the cloud NEW YORK, June 5 Amazon.com Inc is in a race against Google Inc to store data on human DNA, seeking both bragging rights in helping scientists make new medical discoveries and market share in a business that may be worth $1 billion a year by 2018. NEW YORK, June 5 Amazon.com Inc is in a race against Google Inc to store data on human DNA, seeking both bragging rights in helping scientists make new medical discoveries and market share in a business that may be worth $1 billion a year by 2018.CORRECTED-INSIGHT-Amazon, Google race to get your DNA into the cloud NEW YORK, June 5 Amazon.com Inc is in a race against Google Inc to store data on human DNA, seeking both bragging rights in helping scientists make new medical discoveries and market share in a business that may be worth $1 billion a year by 2018.  
ANTM,Medical data, cybercriminals' holy grail, now espionage target SINGAPORE, June 5 Whoever was behind the latest theft of personal data from U.S. government computers, they appear to be following a new trend set by cybercriminals: targeting increasingly valuable medical records and personnel files. 
AVGO,TRLPC: Avago taps five for Broadcom acquisition loan NEW YORK, June 5 Avago Technologies Ltd  has lined up five banks to back its $37 billion acquisition of Broadcom Corp, the largest merger of chipmakers. 
BHI,U.S. oil drillers continue to pump from key formations -Baker Hughes By Scott DiSavino     June 5 U.S. oil drillers boosted activity in four key basins this week, bringing the promise of additional oil to a market that faces OPEC's Friday decision to leave production caps unchanged.     Oil drillers added rigs in Texas's Permian and three other U.S. shale basins, data showed on Friday, the strongest sign yet that higher crude prices are coaxing producers back to the well pad after a six-month slump in activity.     Overall, however, U.S. drillers redu 
