ADM,REFILE-Syngenta sues Cargill, ADM in GMO corn fightSyngenta sues Cargill, ADM in GMO corn fightSyngenta sues Cargill, ADM in GMO corn fight Swiss seed company Syngenta AG has sued top U.S. grain exporters Cargill Inc and Archer Daniels Midland Co over losses that U.S. farmers said they suffered from rejections of boatloads of genetically modified corn by China.  Syngenta sues Cargill, ADM in GMO corn fight Swiss seed company Syngenta AG has sued top U.S. grain exporters Cargill Inc and Archer Daniels Midland Co over losses that U.S. farmers said they suffered from rejections of boatloads of genetically modified corn by China. CHICAGO Swiss seed company Syngenta AG has sued top U.S. grain exporters Cargill Inc [CARG.UL] and Archer Daniels Midland Co over losses that U.S. farmers said they suffered from rejections of boatloads of genetically modified corn by China.Syngenta sues Cargill, ADM in GMO corn fight Swiss seed company Syngenta AG has sued top U.S. grain exporters Cargill Inc and Archer Daniels Midland Co over losses that U.S. farmers said they suffered from rejections of boatloads of genetically modified corn by China.   Syngenta sues Cargill, ADM in GMO corn fightSyngenta sues Cargill, ADM in GMO corn fight Swiss seed company Syngenta AG has sued top U.S. grain exporters Cargill Inc and Archer Daniels Midland Co over losses that U.S. farmers said they suffered from rejections of boatloads of genetically modified corn by China.  Syngenta sues Cargill, ADM in GMO corn fight Swiss seed company Syngenta AG has sued top U.S. grain exporters Cargill Inc and Archer Daniels Midland Co over losses that U.S. farmers said they suffered from rejections of boatloads of genetically modified corn by China. CHICAGO Swiss seed company Syngenta AG has sued top U.S. grain exporters Cargill Inc [CARG.UL] and Archer Daniels Midland Co over losses that U.S. farmers said they suffered from rejections of boatloads of genetically modified corn by China.Syngenta sues Cargill, ADM in GMO corn fight Swiss seed company Syngenta AG has sued top U.S. grain exporters Cargill Inc and Archer Daniels Midland Co over losses that U.S. farmers said they suffered from rejections of boatloads of genetically modified corn by China.  CHICAGO, Nov 20 Swiss seed company Syngenta AG  has sued top U.S. grain exporters Cargill Inc  and Archer Daniels Midland Co over losses that U.S. farmers said they suffered from rejections of boatloads of genetically modified corn by China.Syngenta sues Cargill, ADM in GMO corn fightSyngenta sues Cargill, ADM in GMO corn fight Swiss seed company Syngenta AG has sued top U.S. grain exporters Cargill Inc and Archer Daniels Midland Co over losses that U.S. farmers said they suffered from rejections of boatloads of genetically modified corn by China.  Syngenta sues Cargill, ADM in GMO corn fight Swiss seed company Syngenta AG has sued top U.S. grain exporters Cargill Inc and Archer Daniels Midland Co over losses that U.S. farmers said they suffered from rejections of boatloads of genetically modified corn by China. CHICAGO Swiss seed company Syngenta AG has sued top U.S. grain exporters Cargill Inc [CARG.UL] and Archer Daniels Midland Co over losses that U.S. farmers said they suffered from rejections of boatloads of genetically modified corn by China.Syngenta sues Cargill, ADM in GMO corn fight Swiss seed company Syngenta AG has sued top U.S. grain exporters Cargill Inc and Archer Daniels Midland Co over losses that U.S. farmers said they suffered from rejections of boatloads of genetically modified corn by China.   
BHI,U.S. oil drillers cut rigs for 11th week in the last 12 -Baker Hughes Nov 20 U.S. energy firms cut oil rigs for an 11th week in the last 12 this week, data showed on Friday, a sign drillers were still waiting for higher prices before returning to the well pad en masse. 
CAT,UPDATE 1-Daimler to invest $375 mln to build diesel engines DETROIT - Nov 20 The head of Daimler AG's  commercial truck operation told Reuters Friday the company will invest $375 million at a complex near Detroit to build diesel engines for medium duty trucks, expanding a strategy of building and selling trucks, engines, transmissions and axles as a package. 
SCHW,Fidelity plans new 'robo-adviser' to manage money for clients online NEW YORK, Nov 20 Fidelity Investments is building an automated portfolio-management service for individual investors, joining a growing group of money and brokers that have bought or designed such "robo-advisers," a spokesman for the firm said Friday. 
CMG,Chipotle E. coli outbreak reaches six states, shares tumble LOS ANGELES The U.S. Centers for Disease Control and Prevention (CDC) said on Friday that three additional states reported E. coli infections from the same strain as the Chipotle Mexican Grill  outbreak, sending shares in the chain down more than 12 percent. 
CSCO,BRIEF-Technicolor completes acquisition of Cisco connected devices divisionCisco to buy London-based Acano for $700 mlnCisco to buy London-based Acano for $700 million Cisco Systems Inc  said it would buy privately held Acano Ltd, which provides video conferencing hardware and software, for $700 million in cash and equity awards.  Cisco to buy London-based Acano for $700 million Cisco Systems Inc  said it would buy privately held Acano Ltd, which provides video conferencing hardware and software, for $700 million in cash and equity awards. Nov 20 Cisco Systems Inc said it would buy privately held Acano Ltd, which provides video conferencing hardware and software, for $700 million in cash and equity awards.Cisco to buy London-based Acano for $700 million Cisco Systems Inc  said it would buy privately held Acano Ltd, which provides video conferencing hardware and software, for $700 million in cash and equity awards.   Cisco to buy London-based Acano for $700 mlnCisco to buy London-based Acano for $700 million Cisco Systems Inc  said it would buy privately held Acano Ltd, which provides video conferencing hardware and software, for $700 million in cash and equity awards.  Cisco to buy London-based Acano for $700 million Cisco Systems Inc  said it would buy privately held Acano Ltd, which provides video conferencing hardware and software, for $700 million in cash and equity awards. Nov 20 Cisco Systems Inc said it would buy privately held Acano Ltd, which provides video conferencing hardware and software, for $700 million in cash and equity awards.Cisco to buy London-based Acano for $700 million Cisco Systems Inc  said it would buy privately held Acano Ltd, which provides video conferencing hardware and software, for $700 million in cash and equity awards.  Source text for Eikon:  Further company coverage:    (Gdynia Newsroom)Cisco to buy London-based Acano for $700 mlnCisco to buy London-based Acano for $700 million Cisco Systems Inc  said it would buy privately held Acano Ltd, which provides video conferencing hardware and software, for $700 million in cash and equity awards.  Cisco to buy London-based Acano for $700 million Cisco Systems Inc  said it would buy privately held Acano Ltd, which provides video conferencing hardware and software, for $700 million in cash and equity awards. Nov 20 Cisco Systems Inc said it would buy privately held Acano Ltd, which provides video conferencing hardware and software, for $700 million in cash and equity awards.Cisco to buy London-based Acano for $700 million Cisco Systems Inc  said it would buy privately held Acano Ltd, which provides video conferencing hardware and software, for $700 million in cash and equity awards.   
CMI,UPDATE 1-Daimler to invest $375 mln to build diesel engines DETROIT - Nov 20 The head of Daimler AG's  commercial truck operation told Reuters Friday the company will invest $375 million at a complex near Detroit to build diesel engines for medium duty trucks, expanding a strategy of building and selling trucks, engines, transmissions and axles as a package. 
FL,Footwear retailer Foot Locker's sales rise 3.6 pctUPDATE 2-Foot Locker profit and sales race past estimatesS&P; 500 scores best week in almost a year Wall Street racked up a solid week on Friday, with healthcare, technology and consumer stock making gains and investors looking beyond a widely-expected December interest rate hike.  S&P; 500 scores best week in almost a year Wall Street racked up a solid week on Friday, with healthcare, technology and consumer stock making gains and investors looking beyond a widely-expected December interest rate hike. * Shares rise as much as 10 pct   (Adds details, analyst and conference call comments; Updates shares)S&P; 500 scores best week in almost a year Wall Street racked up a solid week on Friday, with healthcare, technology and consumer stock making gains and investors looking beyond a widely-expected December interest rate hike.   UPDATE 2-Foot Locker profit and sales race past estimatesS&P; 500 scores best week in almost a year Wall Street racked up a solid week on Friday, with healthcare, technology and consumer stock making gains and investors looking beyond a widely-expected December interest rate hike.  S&P; 500 scores best week in almost a year Wall Street racked up a solid week on Friday, with healthcare, technology and consumer stock making gains and investors looking beyond a widely-expected December interest rate hike. * Shares rise as much as 10 pct   (Adds details, analyst and conference call comments; Updates shares)S&P; 500 scores best week in almost a year Wall Street racked up a solid week on Friday, with healthcare, technology and consumer stock making gains and investors looking beyond a widely-expected December interest rate hike.  Nov 20 Footwear retailer Foot Locker Inc  reported a 3.6 percent rise in quarterly sales, helped by strong demand for its new basketball and running shoes.UPDATE 2-Foot Locker profit and sales race past estimatesS&P; 500 scores best week in almost a year Wall Street racked up a solid week on Friday, with healthcare, technology and consumer stock making gains and investors looking beyond a widely-expected December interest rate hike.  S&P; 500 scores best week in almost a year Wall Street racked up a solid week on Friday, with healthcare, technology and consumer stock making gains and investors looking beyond a widely-expected December interest rate hike. * Shares rise as much as 10 pct   (Adds details, analyst and conference call comments; Updates shares)S&P; 500 scores best week in almost a year Wall Street racked up a solid week on Friday, with healthcare, technology and consumer stock making gains and investors looking beyond a widely-expected December interest rate hike.   
F,GM, Ford, Fiat Chrysler labor costs rise in new pacts -study DETROIT, Nov 20 Hourly labor costs will rise to an average of $60 per auto worker by 2019 if proposed contracts at General Motors Co and Ford Motor Co are ratified by rank-and-file members of the United Auto Workers union, a study released on Friday said. 
GIS,REUTERS SUMMIT-Heading into 2016, U.S. consumers look up, dress downWall St Week Ahead-Food stocks on the menu for Thanksgiving week NEW YORK, Nov 20 There are no picky eaters on Thanksgiving - as long as the menu is hormone and antibiotic free, locally grown and convenient.  Wall St Week Ahead-Food stocks on the menu for Thanksgiving week NEW YORK, Nov 20 There are no picky eaters on Thanksgiving - as long as the menu is hormone and antibiotic free, locally grown and convenient. * For other news from Reuters Global Investment Outlook Summit, click on http://www.reuters.com/summit/Investment16Wall St Week Ahead-Food stocks on the menu for Thanksgiving week NEW YORK, Nov 20 There are no picky eaters on Thanksgiving - as long as the menu is hormone and antibiotic free, locally grown and convenient.  
