IBM,CORRECTED-IBM launches Linux-only mainframe system LinuxONE Aug 17 International Business Machines Corp  said on Monday it launched Linux-only mainframe servers called LinuxONE. 
MCD,McDonald's No. 1 choice for 'Breakfastarians' -poll Aug 17 McDonald's Corp, which is expected to offer all-day breakfasts starting this fall to turn around slumping U.S. sales, is the top choice for "Breakfastarians," who crave breakfast food at any hour, according to a new survey obtained by Reuters on Monday. 
PNR,Pump maker Pentair to buy Erico Global in $1.8 bln dealUPDATE 2-Pump maker Pentair to buy Erico Global for $1.8 bln in cash Aug 17 Pump and valve maker Pentair Plc  agreed to buy fastening products maker Erico Global Co for $1.8 billion in cash, weeks after activist investor Nelson Peltz asked the company to bulk up through deals.  UPDATE 2-Pump maker Pentair to buy Erico Global for $1.8 bln in cash Aug 17 Pump and valve maker Pentair Plc  agreed to buy fastening products maker Erico Global Co for $1.8 billion in cash, weeks after activist investor Nelson Peltz asked the company to bulk up through deals. Aug 17 Pump and valve maker Pentair Plc  said it will buy privately held fastening products maker Erico Global Co for $1.8 billion in cash, including debt.UPDATE 2-Pump maker Pentair to buy Erico Global for $1.8 bln in cash Aug 17 Pump and valve maker Pentair Plc  agreed to buy fastening products maker Erico Global Co for $1.8 billion in cash, weeks after activist investor Nelson Peltz asked the company to bulk up through deals.  
LUV,U.S. FAA proposes $325,000 penalty against Southwest Airlines WASHINGTON, Aug 17 The U.S. Federal Aviation Administration (FAA) on Monday proposed a $325,000 penalty against Southwest Airlines Co for allegedly operating a Boeing 737 that was not in compliance with federal regulations. 
TGT,Target promotes CFO Mulligan to COOCORRECTED-UPDATE 1-Target promotes CFO John Mulligan to newly created COO role Aug 17 Target Corp promoted Chief Financial Officer John Mulligan to the newly created role of chief operating officer, and appointed Express Scripts Holding Co's CFO, Cathy Smith, as his replacement.  CORRECTED-UPDATE 1-Target promotes CFO John Mulligan to newly created COO role Aug 17 Target Corp promoted Chief Financial Officer John Mulligan to the newly created role of chief operating officer, and appointed Express Scripts Holding Co's CFO, Cathy Smith, as his replacement. Aug 17 Target Corp promoted Chief Financial Officer John Mulligan to the newly created role of chief operating officer, and appointed Express Scripts Holding Co's CFO Cathy Smith as his replacement.CORRECTED-UPDATE 1-Target promotes CFO John Mulligan to newly created COO role Aug 17 Target Corp promoted Chief Financial Officer John Mulligan to the newly created role of chief operating officer, and appointed Express Scripts Holding Co's CFO, Cathy Smith, as his replacement.  
DIS,US STOCKS-Wall St up on housing data; Disney boosts media stocks * Disney shines as Star Wars will make its way to theme parks 
URBN,Urban Outfitters sales rise 7 percentUPDATE 2-Urban Outfitters says comparable sales may be slower in 3rd qtr Aug 17 Urban Outfitters Inc on Monday said same-store sales growth so far in the third quarter was slower than in the previous three months, raising concerns about the apparel retailer's performance in the back-to-school shopping season.  UPDATE 2-Urban Outfitters says comparable sales may be slower in 3rd qtr Aug 17 Urban Outfitters Inc on Monday said same-store sales growth so far in the third quarter was slower than in the previous three months, raising concerns about the apparel retailer's performance in the back-to-school shopping season. Aug 17 Apparel retailer Urban Outfitters Inc  reported a 7 percent rise in quarterly sales, helped by recovering sales at its namesake brand and strong demand for its Free People line of clothes.UPDATE 2-Urban Outfitters says comparable sales may be slower in 3rd qtr Aug 17 Urban Outfitters Inc on Monday said same-store sales growth so far in the third quarter was slower than in the previous three months, raising concerns about the apparel retailer's performance in the back-to-school shopping season.  
