GIS,Cheerios seller General Mills to label GMOs in productsWhat to Watch in the Week Ahead and on Monday, March 21UPDATE 1-Cheerios maker General Mills to label GMOs in U.S. productsCheerios maker General Mills to label GMOs in U.S. products General Mills Inc said on Friday it would begin putting labels on U.S. products that contain genetically engineered ingredients, a move it said was forced by a Vermont law that will require food packages in that state to include such information on July 1.  Cheerios maker General Mills to label GMOs in U.S. products General Mills Inc said on Friday it would begin putting labels on U.S. products that contain genetically engineered ingredients, a move it said was forced by a Vermont law that will require food packages in that state to include such information on July 1. March 18 General Mills Inc said on Friday it would begin putting labels on U.S. products that contain genetically engineered ingredients, a move it said was forced by a Vermont law that will require food packages in that state to include such information on July 1.Cheerios maker General Mills to label GMOs in U.S. products General Mills Inc said on Friday it would begin putting labels on U.S. products that contain genetically engineered ingredients, a move it said was forced by a Vermont law that will require food packages in that state to include such information on July 1.   UPDATE 1-Cheerios maker General Mills to label GMOs in U.S. productsCheerios maker General Mills to label GMOs in U.S. products General Mills Inc said on Friday it would begin putting labels on U.S. products that contain genetically engineered ingredients, a move it said was forced by a Vermont law that will require food packages in that state to include such information on July 1.  Cheerios maker General Mills to label GMOs in U.S. products General Mills Inc said on Friday it would begin putting labels on U.S. products that contain genetically engineered ingredients, a move it said was forced by a Vermont law that will require food packages in that state to include such information on July 1. March 18 General Mills Inc said on Friday it would begin putting labels on U.S. products that contain genetically engineered ingredients, a move it said was forced by a Vermont law that will require food packages in that state to include such information on July 1.Cheerios maker General Mills to label GMOs in U.S. products General Mills Inc said on Friday it would begin putting labels on U.S. products that contain genetically engineered ingredients, a move it said was forced by a Vermont law that will require food packages in that state to include such information on July 1.  (The Day Ahead is an email and PDF publication that includes the day's major stories and events, analyses and other features. To receive The Day Ahead, Eikon users can register at . Thomson One users can register at RT/DAY/US. All times in ET/GMT) WEEK AHEAD  Markets lean into next week adjusting positions for the Federal Reserve, with the dollar experiencing more weakness due to rising inflation indicators and a more dovish outlook from the U.S. central bank. Stocks are expected to extend gainsUPDATE 1-Cheerios maker General Mills to label GMOs in U.S. productsCheerios maker General Mills to label GMOs in U.S. products General Mills Inc said on Friday it would begin putting labels on U.S. products that contain genetically engineered ingredients, a move it said was forced by a Vermont law that will require food packages in that state to include such information on July 1.  Cheerios maker General Mills to label GMOs in U.S. products General Mills Inc said on Friday it would begin putting labels on U.S. products that contain genetically engineered ingredients, a move it said was forced by a Vermont law that will require food packages in that state to include such information on July 1. March 18 General Mills Inc said on Friday it would begin putting labels on U.S. products that contain genetically engineered ingredients, a move it said was forced by a Vermont law that will require food packages in that state to include such information on July 1.Cheerios maker General Mills to label GMOs in U.S. products General Mills Inc said on Friday it would begin putting labels on U.S. products that contain genetically engineered ingredients, a move it said was forced by a Vermont law that will require food packages in that state to include such information on July 1.    What to Watch in the Week Ahead and on Monday, March 21UPDATE 1-Cheerios maker General Mills to label GMOs in U.S. productsCheerios maker General Mills to label GMOs in U.S. products General Mills Inc said on Friday it would begin putting labels on U.S. products that contain genetically engineered ingredients, a move it said was forced by a Vermont law that will require food packages in that state to include such information on July 1.  Cheerios maker General Mills to label GMOs in U.S. products General Mills Inc said on Friday it would begin putting labels on U.S. products that contain genetically engineered ingredients, a move it said was forced by a Vermont law that will require food packages in that state to include such information on July 1. March 18 General Mills Inc said on Friday it would begin putting labels on U.S. products that contain genetically engineered ingredients, a move it said was forced by a Vermont law that will require food packages in that state to include such information on July 1.Cheerios maker General Mills to label GMOs in U.S. products General Mills Inc said on Friday it would begin putting labels on U.S. products that contain genetically engineered ingredients, a move it said was forced by a Vermont law that will require food packages in that state to include such information on July 1.   UPDATE 1-Cheerios maker General Mills to label GMOs in U.S. productsCheerios maker General Mills to label GMOs in U.S. products General Mills Inc said on Friday it would begin putting labels on U.S. products that contain genetically engineered ingredients, a move it said was forced by a Vermont law that will require food packages in that state to include such information on July 1.  Cheerios maker General Mills to label GMOs in U.S. products General Mills Inc said on Friday it would begin putting labels on U.S. products that contain genetically engineered ingredients, a move it said was forced by a Vermont law that will require food packages in that state to include such information on July 1. March 18 General Mills Inc said on Friday it would begin putting labels on U.S. products that contain genetically engineered ingredients, a move it said was forced by a Vermont law that will require food packages in that state to include such information on July 1.Cheerios maker General Mills to label GMOs in U.S. products General Mills Inc said on Friday it would begin putting labels on U.S. products that contain genetically engineered ingredients, a move it said was forced by a Vermont law that will require food packages in that state to include such information on July 1.  (The Day Ahead is an email and PDF publication that includes the day's major stories and events, analyses and other features. To receive The Day Ahead, Eikon users can register at . Thomson One users can register at RT/DAY/US. All times in ET/GMT) WEEK AHEAD  Markets lean into next week adjusting positions for the Federal Reserve, with the dollar experiencing more weakness due to rising inflation indicators and a more dovish outlook from the U.S. central bank. Stocks are expected to extend gainsUPDATE 1-Cheerios maker General Mills to label GMOs in U.S. productsCheerios maker General Mills to label GMOs in U.S. products General Mills Inc said on Friday it would begin putting labels on U.S. products that contain genetically engineered ingredients, a move it said was forced by a Vermont law that will require food packages in that state to include such information on July 1.  Cheerios maker General Mills to label GMOs in U.S. products General Mills Inc said on Friday it would begin putting labels on U.S. products that contain genetically engineered ingredients, a move it said was forced by a Vermont law that will require food packages in that state to include such information on July 1. March 18 General Mills Inc said on Friday it would begin putting labels on U.S. products that contain genetically engineered ingredients, a move it said was forced by a Vermont law that will require food packages in that state to include such information on July 1.Cheerios maker General Mills to label GMOs in U.S. products General Mills Inc said on Friday it would begin putting labels on U.S. products that contain genetically engineered ingredients, a move it said was forced by a Vermont law that will require food packages in that state to include such information on July 1.   March 18 General Mills Inc on Friday said it would begin putting labels on its products that contain genetically engineered ingredients, a move that comes days after U.S. Senators failed to advance legislation aimed at blocking Vermont from requiring such labels on July 1.What to Watch in the Week Ahead and on Monday, March 21UPDATE 1-Cheerios maker General Mills to label GMOs in U.S. productsCheerios maker General Mills to label GMOs in U.S. products General Mills Inc said on Friday it would begin putting labels on U.S. products that contain genetically engineered ingredients, a move it said was forced by a Vermont law that will require food packages in that state to include such information on July 1.  Cheerios maker General Mills to label GMOs in U.S. products General Mills Inc said on Friday it would begin putting labels on U.S. products that contain genetically engineered ingredients, a move it said was forced by a Vermont law that will require food packages in that state to include such information on July 1. March 18 General Mills Inc said on Friday it would begin putting labels on U.S. products that contain genetically engineered ingredients, a move it said was forced by a Vermont law that will require food packages in that state to include such information on July 1.Cheerios maker General Mills to label GMOs in U.S. products General Mills Inc said on Friday it would begin putting labels on U.S. products that contain genetically engineered ingredients, a move it said was forced by a Vermont law that will require food packages in that state to include such information on July 1.   UPDATE 1-Cheerios maker General Mills to label GMOs in U.S. productsCheerios maker General Mills to label GMOs in U.S. products General Mills Inc said on Friday it would begin putting labels on U.S. products that contain genetically engineered ingredients, a move it said was forced by a Vermont law that will require food packages in that state to include such information on July 1.  Cheerios maker General Mills to label GMOs in U.S. products General Mills Inc said on Friday it would begin putting labels on U.S. products that contain genetically engineered ingredients, a move it said was forced by a Vermont law that will require food packages in that state to include such information on July 1. March 18 General Mills Inc said on Friday it would begin putting labels on U.S. products that contain genetically engineered ingredients, a move it said was forced by a Vermont law that will require food packages in that state to include such information on July 1.Cheerios maker General Mills to label GMOs in U.S. products General Mills Inc said on Friday it would begin putting labels on U.S. products that contain genetically engineered ingredients, a move it said was forced by a Vermont law that will require food packages in that state to include such information on July 1.  (The Day Ahead is an email and PDF publication that includes the day's major stories and events, analyses and other features. To receive The Day Ahead, Eikon users can register at . Thomson One users can register at RT/DAY/US. All times in ET/GMT) WEEK AHEAD  Markets lean into next week adjusting positions for the Federal Reserve, with the dollar experiencing more weakness due to rising inflation indicators and a more dovish outlook from the U.S. central bank. Stocks are expected to extend gainsUPDATE 1-Cheerios maker General Mills to label GMOs in U.S. productsCheerios maker General Mills to label GMOs in U.S. products General Mills Inc said on Friday it would begin putting labels on U.S. products that contain genetically engineered ingredients, a move it said was forced by a Vermont law that will require food packages in that state to include such information on July 1.  Cheerios maker General Mills to label GMOs in U.S. products General Mills Inc said on Friday it would begin putting labels on U.S. products that contain genetically engineered ingredients, a move it said was forced by a Vermont law that will require food packages in that state to include such information on July 1. March 18 General Mills Inc said on Friday it would begin putting labels on U.S. products that contain genetically engineered ingredients, a move it said was forced by a Vermont law that will require food packages in that state to include such information on July 1.Cheerios maker General Mills to label GMOs in U.S. products General Mills Inc said on Friday it would begin putting labels on U.S. products that contain genetically engineered ingredients, a move it said was forced by a Vermont law that will require food packages in that state to include such information on July 1.    
GILD,Gilead shares look cheap but investors fret over growth NEW YORK, March 18 Shares of Gilead Sciences Inc  are trading at ultra cheap levels as investors broadly shed biotech holdings and question what the company could do for an encore after several years of torrid growth. 
JNJ,J&J; psoriasis drug Stelara tames Crohn's disease in second trialJ&J; psoriasis drug Stelara eases Crohn's disease in second trial Johnson & Johnson's Stelara psoriasis drug has shown effectiveness against Crohn's disease in a second late-stage trial, the company said on Friday, bolstering prospects of its approval for the additional use.  J&J; psoriasis drug Stelara eases Crohn's disease in second trial Johnson & Johnson's Stelara psoriasis drug has shown effectiveness against Crohn's disease in a second late-stage trial, the company said on Friday, bolstering prospects of its approval for the additional use. March 18 Johnson & Johnson's Stelara psoriasis drug has shown effectiveness against Crohn's disease in a second late-stage trial, the company said on Friday, bolstering prospects of its approval for the additional use.J&J; psoriasis drug Stelara eases Crohn's disease in second trial Johnson & Johnson's Stelara psoriasis drug has shown effectiveness against Crohn's disease in a second late-stage trial, the company said on Friday, bolstering prospects of its approval for the additional use.  
LMT,U.S. Navy missile program uses first 3D printed component WASHINGTON, March 18 A U.S Navy ballistic missile program used its first component made from 3D printing, a process that sharply reduces the manufacturing time, according to the weapons' producer, Lockheed Martin Corp. 
M,UPDATE 3-Luxury jeweler Tiffany's profit beats estimates as costs fall * Shares rise as much as 4 pct   (Adds details from conference call, analyst comment; updates shares) 
JWN,UPDATE 3-Luxury jeweler Tiffany's profit beats estimates as costs fall * Shares rise as much as 4 pct   (Adds details from conference call, analyst comment; updates shares) 
KO,CORRECTED-UK sugary drink tax could be sweet for food ingredient suppliers LONDON, March 18 The British government's planned levy on sugary soft drinks means more business for suppliers of specialty ingredients that boost sweetness without adding calories and can mask aftertastes or add texture. 
TMO,BRIEF-Affymetrix -board recommends stockholders adoption of Thermo Fisher mergerUPDATE 3-Former Affymetrix executives bid for co; challenge Thermo Fisher * Ready to complete transaction upon shareholder approval - Thermo  UPDATE 3-Former Affymetrix executives bid for co; challenge Thermo Fisher * Ready to complete transaction upon shareholder approval - Thermo * While board is reviewing unsolicited proposal, as of now board continues to recommend stockholders adoption of merger agreement with thermo fisher  Source text for Eikon:  Further company coverage:UPDATE 3-Former Affymetrix executives bid for co; challenge Thermo Fisher * Ready to complete transaction upon shareholder approval - Thermo  
TIF,Upscale jeweler Tiffany's sales drop 5.6 pct in holiday quarterBRIEF-Tiffany's Q4 earnings per share $1.46 excluding itemsUPDATE 3-Luxury jeweler Tiffany's profit beats estimates as costs fallLuxury jeweler Tiffany's profit beats estimates as costs fall Upscale jeweler Tiffany & Co  reported a better-than-expected profit for the holiday quarter as it raised prices and benefited from lower prices of diamonds, gold and silver.  Luxury jeweler Tiffany's profit beats estimates as costs fall Upscale jeweler Tiffany & Co  reported a better-than-expected profit for the holiday quarter as it raised prices and benefited from lower prices of diamonds, gold and silver. * Shares rise as much as 4 pct   (Adds details from conference call, analyst comment; updates shares)Luxury jeweler Tiffany's profit beats estimates as costs fall Upscale jeweler Tiffany & Co  reported a better-than-expected profit for the holiday quarter as it raised prices and benefited from lower prices of diamonds, gold and silver.   UPDATE 3-Luxury jeweler Tiffany's profit beats estimates as costs fallLuxury jeweler Tiffany's profit beats estimates as costs fall Upscale jeweler Tiffany & Co  reported a better-than-expected profit for the holiday quarter as it raised prices and benefited from lower prices of diamonds, gold and silver.  Luxury jeweler Tiffany's profit beats estimates as costs fall Upscale jeweler Tiffany & Co  reported a better-than-expected profit for the holiday quarter as it raised prices and benefited from lower prices of diamonds, gold and silver. * Shares rise as much as 4 pct   (Adds details from conference call, analyst comment; updates shares)Luxury jeweler Tiffany's profit beats estimates as costs fall Upscale jeweler Tiffany & Co  reported a better-than-expected profit for the holiday quarter as it raised prices and benefited from lower prices of diamonds, gold and silver.  * Tiffany reports full year and fourth quarter 2015 results; management comments on sales and earnings outlookUPDATE 3-Luxury jeweler Tiffany's profit beats estimates as costs fallLuxury jeweler Tiffany's profit beats estimates as costs fall Upscale jeweler Tiffany & Co  reported a better-than-expected profit for the holiday quarter as it raised prices and benefited from lower prices of diamonds, gold and silver.  Luxury jeweler Tiffany's profit beats estimates as costs fall Upscale jeweler Tiffany & Co  reported a better-than-expected profit for the holiday quarter as it raised prices and benefited from lower prices of diamonds, gold and silver. * Shares rise as much as 4 pct   (Adds details from conference call, analyst comment; updates shares)Luxury jeweler Tiffany's profit beats estimates as costs fall Upscale jeweler Tiffany & Co  reported a better-than-expected profit for the holiday quarter as it raised prices and benefited from lower prices of diamonds, gold and silver.    BRIEF-Tiffany's Q4 earnings per share $1.46 excluding itemsUPDATE 3-Luxury jeweler Tiffany's profit beats estimates as costs fallLuxury jeweler Tiffany's profit beats estimates as costs fall Upscale jeweler Tiffany & Co  reported a better-than-expected profit for the holiday quarter as it raised prices and benefited from lower prices of diamonds, gold and silver.  Luxury jeweler Tiffany's profit beats estimates as costs fall Upscale jeweler Tiffany & Co  reported a better-than-expected profit for the holiday quarter as it raised prices and benefited from lower prices of diamonds, gold and silver. * Shares rise as much as 4 pct   (Adds details from conference call, analyst comment; updates shares)Luxury jeweler Tiffany's profit beats estimates as costs fall Upscale jeweler Tiffany & Co  reported a better-than-expected profit for the holiday quarter as it raised prices and benefited from lower prices of diamonds, gold and silver.   UPDATE 3-Luxury jeweler Tiffany's profit beats estimates as costs fallLuxury jeweler Tiffany's profit beats estimates as costs fall Upscale jeweler Tiffany & Co  reported a better-than-expected profit for the holiday quarter as it raised prices and benefited from lower prices of diamonds, gold and silver.  Luxury jeweler Tiffany's profit beats estimates as costs fall Upscale jeweler Tiffany & Co  reported a better-than-expected profit for the holiday quarter as it raised prices and benefited from lower prices of diamonds, gold and silver. * Shares rise as much as 4 pct   (Adds details from conference call, analyst comment; updates shares)Luxury jeweler Tiffany's profit beats estimates as costs fall Upscale jeweler Tiffany & Co  reported a better-than-expected profit for the holiday quarter as it raised prices and benefited from lower prices of diamonds, gold and silver.  * Tiffany reports full year and fourth quarter 2015 results; management comments on sales and earnings outlookUPDATE 3-Luxury jeweler Tiffany's profit beats estimates as costs fallLuxury jeweler Tiffany's profit beats estimates as costs fall Upscale jeweler Tiffany & Co  reported a better-than-expected profit for the holiday quarter as it raised prices and benefited from lower prices of diamonds, gold and silver.  Luxury jeweler Tiffany's profit beats estimates as costs fall Upscale jeweler Tiffany & Co  reported a better-than-expected profit for the holiday quarter as it raised prices and benefited from lower prices of diamonds, gold and silver. * Shares rise as much as 4 pct   (Adds details from conference call, analyst comment; updates shares)Luxury jeweler Tiffany's profit beats estimates as costs fall Upscale jeweler Tiffany & Co  reported a better-than-expected profit for the holiday quarter as it raised prices and benefited from lower prices of diamonds, gold and silver.   March 18 Tiffany & Co's sales fell 5.6 percent in the holiday quarter as a strong dollar hurt tourist spending at its stores in the United States and ate into revenue from other markets.BRIEF-Tiffany's Q4 earnings per share $1.46 excluding itemsUPDATE 3-Luxury jeweler Tiffany's profit beats estimates as costs fallLuxury jeweler Tiffany's profit beats estimates as costs fall Upscale jeweler Tiffany & Co  reported a better-than-expected profit for the holiday quarter as it raised prices and benefited from lower prices of diamonds, gold and silver.  Luxury jeweler Tiffany's profit beats estimates as costs fall Upscale jeweler Tiffany & Co  reported a better-than-expected profit for the holiday quarter as it raised prices and benefited from lower prices of diamonds, gold and silver. * Shares rise as much as 4 pct   (Adds details from conference call, analyst comment; updates shares)Luxury jeweler Tiffany's profit beats estimates as costs fall Upscale jeweler Tiffany & Co  reported a better-than-expected profit for the holiday quarter as it raised prices and benefited from lower prices of diamonds, gold and silver.   UPDATE 3-Luxury jeweler Tiffany's profit beats estimates as costs fallLuxury jeweler Tiffany's profit beats estimates as costs fall Upscale jeweler Tiffany & Co  reported a better-than-expected profit for the holiday quarter as it raised prices and benefited from lower prices of diamonds, gold and silver.  Luxury jeweler Tiffany's profit beats estimates as costs fall Upscale jeweler Tiffany & Co  reported a better-than-expected profit for the holiday quarter as it raised prices and benefited from lower prices of diamonds, gold and silver. * Shares rise as much as 4 pct   (Adds details from conference call, analyst comment; updates shares)Luxury jeweler Tiffany's profit beats estimates as costs fall Upscale jeweler Tiffany & Co  reported a better-than-expected profit for the holiday quarter as it raised prices and benefited from lower prices of diamonds, gold and silver.  * Tiffany reports full year and fourth quarter 2015 results; management comments on sales and earnings outlookUPDATE 3-Luxury jeweler Tiffany's profit beats estimates as costs fallLuxury jeweler Tiffany's profit beats estimates as costs fall Upscale jeweler Tiffany & Co  reported a better-than-expected profit for the holiday quarter as it raised prices and benefited from lower prices of diamonds, gold and silver.  Luxury jeweler Tiffany's profit beats estimates as costs fall Upscale jeweler Tiffany & Co  reported a better-than-expected profit for the holiday quarter as it raised prices and benefited from lower prices of diamonds, gold and silver. * Shares rise as much as 4 pct   (Adds details from conference call, analyst comment; updates shares)Luxury jeweler Tiffany's profit beats estimates as costs fall Upscale jeweler Tiffany & Co  reported a better-than-expected profit for the holiday quarter as it raised prices and benefited from lower prices of diamonds, gold and silver.    
WMT,US probe on Wal-Mart finds little sign of bribery in China-Bbg March 18 U.S. prosecutors investigating allegations of bribery by Wal-Mart Stores Inc across the globe have found little evidence of corrupt practices in China, Bloomberg reported. 
