GOOGL,UPDATE 2-News Corp denies rumors of Twitter bid Jan 20 Rupert Murdoch's News Corp said rumors about the company's interest in buying microblogging site Twitter Inc or building a stake in it were untrue. 
GOOG,UPDATE 2-News Corp denies rumors of Twitter bid Jan 20 Rupert Murdoch's News Corp said rumors about the company's interest in buying microblogging site Twitter Inc or building a stake in it were untrue. 
AAPL,REFILE-Apple seeks India govt approval to set up retail storesUPDATE 1-Apple seeks nod to open India stores amid concerns of slowing sales growthApple seeks nod to open India stores amid concerns of slowing sales growth MUMBAI Apple Inc has applied to set up its own stores in India, one of the world's fastest growing smartphone markets, as the iPhone-maker looks to tap new opportunities amid worries of slowing growth in its main markets.  Apple seeks nod to open India stores amid concerns of slowing sales growth MUMBAI Apple Inc has applied to set up its own stores in India, one of the world's fastest growing smartphone markets, as the iPhone-maker looks to tap new opportunities amid worries of slowing growth in its main markets. * Files application with trade ministry department for storesApple seeks nod to open India stores amid concerns of slowing sales growth MUMBAI Apple Inc has applied to set up its own stores in India, one of the world's fastest growing smartphone markets, as the iPhone-maker looks to tap new opportunities amid worries of slowing growth in its main markets.   UPDATE 1-Apple seeks nod to open India stores amid concerns of slowing sales growthApple seeks nod to open India stores amid concerns of slowing sales growth MUMBAI Apple Inc has applied to set up its own stores in India, one of the world's fastest growing smartphone markets, as the iPhone-maker looks to tap new opportunities amid worries of slowing growth in its main markets.  Apple seeks nod to open India stores amid concerns of slowing sales growth MUMBAI Apple Inc has applied to set up its own stores in India, one of the world's fastest growing smartphone markets, as the iPhone-maker looks to tap new opportunities amid worries of slowing growth in its main markets. * Files application with trade ministry department for storesApple seeks nod to open India stores amid concerns of slowing sales growth MUMBAI Apple Inc has applied to set up its own stores in India, one of the world's fastest growing smartphone markets, as the iPhone-maker looks to tap new opportunities amid worries of slowing growth in its main markets.  MUMBAI, Jan 20 Apple Inc has filed an application with the Indian government to set up its retail outlets in one of the fastest-growing smartphone markets, a spokesman for the Cupertino-based company said on Wednesday.UPDATE 1-Apple seeks nod to open India stores amid concerns of slowing sales growthApple seeks nod to open India stores amid concerns of slowing sales growth MUMBAI Apple Inc has applied to set up its own stores in India, one of the world's fastest growing smartphone markets, as the iPhone-maker looks to tap new opportunities amid worries of slowing growth in its main markets.  Apple seeks nod to open India stores amid concerns of slowing sales growth MUMBAI Apple Inc has applied to set up its own stores in India, one of the world's fastest growing smartphone markets, as the iPhone-maker looks to tap new opportunities amid worries of slowing growth in its main markets. * Files application with trade ministry department for storesApple seeks nod to open India stores amid concerns of slowing sales growth MUMBAI Apple Inc has applied to set up its own stores in India, one of the world's fastest growing smartphone markets, as the iPhone-maker looks to tap new opportunities amid worries of slowing growth in its main markets.   
BAC,MOVES-BofA Merrill Lynch appoints EMEA ECM co-heads -memo LONDON, Jan 20 Bank of America Merrill Lynch  has named two European co-heads of equity capital markets (ECM) from its own ranks, according to a memo seen by Reuters on Wednesday. 
BLK,BlackRock launches fund for European investment in Tel Aviv blue chipsUPDATE 1-BlackRock launches fund for European investment in Tel Aviv blue chips JERUSALEM, Jan 20 BlackRock, the world's largest money manager, said on Wednesday it had launched an exchange-traded fund (ETF) for European investors to invest directly in Israel's blue-chip share index, the Tel Aviv 25 .  UPDATE 1-BlackRock launches fund for European investment in Tel Aviv blue chips JERUSALEM, Jan 20 BlackRock, the world's largest money manager, said on Wednesday it had launched an exchange-traded fund (ETF) for European investors to invest directly in Israel's blue-chip share index, the Tel Aviv 25 . JERUSALEM, Jan 20 BlackRock, the world's largest money manager, said on Wednesday it had launched an exchange traded fund (ETF) for European investors to invest directly in Israel's blue-chip share index, the Tel Aviv 25 .UPDATE 1-BlackRock launches fund for European investment in Tel Aviv blue chips JERUSALEM, Jan 20 BlackRock, the world's largest money manager, said on Wednesday it had launched an exchange-traded fund (ETF) for European investors to invest directly in Israel's blue-chip share index, the Tel Aviv 25 .  
CBS,Viacom says Redstone paid $2 million in 2015, down 85 pct from prior yearUPDATE 2-Viacom cut pay for Redstone, CEO Dauman in 2015 BOSTON, Jan 20 Media giant Viacom Inc said on Wednesday it cut the compensation of its top two executives, Executive Chairman Sumner Redstone and Chief Executive Philippe Dauman, as the company faced business pressures and a sharp drop in its share price.  UPDATE 2-Viacom cut pay for Redstone, CEO Dauman in 2015 BOSTON, Jan 20 Media giant Viacom Inc said on Wednesday it cut the compensation of its top two executives, Executive Chairman Sumner Redstone and Chief Executive Philippe Dauman, as the company faced business pressures and a sharp drop in its share price. BOSTON, Jan 20 Media giant Viacom Inc said on Wednesday the annual compensation for its executive chairman Sumner Redstone declined 85 percent to $2 million for fiscal 2015.UPDATE 2-Viacom cut pay for Redstone, CEO Dauman in 2015 BOSTON, Jan 20 Media giant Viacom Inc said on Wednesday it cut the compensation of its top two executives, Executive Chairman Sumner Redstone and Chief Executive Philippe Dauman, as the company faced business pressures and a sharp drop in its share price.  
CMG,Big Chipotle investor held steady during stock's 4th-quarter plungeUPDATE 1-Big Chipotle investor held steady during stock's 4th-quarter plunge BOSTON, Jan 20 Fidelity's Contrafund, the biggest mutual fund investor in Chipotle Mexican Grill Inc , said it had held onto its entire stake during the fourth quarter even as an outbreak of food-borne illness in the restaurant chain pummeled its shares.  UPDATE 1-Big Chipotle investor held steady during stock's 4th-quarter plunge BOSTON, Jan 20 Fidelity's Contrafund, the biggest mutual fund investor in Chipotle Mexican Grill Inc , said it had held onto its entire stake during the fourth quarter even as an outbreak of food-borne illness in the restaurant chain pummeled its shares. BOSTON, Jan 20 Fidelity's Contrafund, the biggest mutual fund investor in Chipotle Mexican Grill Inc , held steady in the company during the fourth quarter, even as an outbreak of food-borne illness in the restaurant chain pummeled its shares.UPDATE 1-Big Chipotle investor held steady during stock's 4th-quarter plunge BOSTON, Jan 20 Fidelity's Contrafund, the biggest mutual fund investor in Chipotle Mexican Grill Inc , said it had held onto its entire stake during the fourth quarter even as an outbreak of food-borne illness in the restaurant chain pummeled its shares.  
C,Citigroup cuts 2016 Brent crude oil forecast to $40 per barrel LONDON Citigroup has cut its Brent crude oil price forecast for 2016 to $40 per barrel from $51, a note from the bank showed on Wednesday. 
DAL,UPDATE 1-American to add flights from Los Angeles in battle with Delta Jan 20 American Airlines Group Inc said on Wednesday it will add flights from Los Angeles to two hubs of its rival Delta Air Lines Inc, the latest move in a tug of war between the carriers for dominance in the No. 2 U.S. city. 
DOW,UPDATE 2-Investor urges Ashland to halt Valvoline spinoff, sell specialty arm Jan 20 One of Ashland Inc's largest shareholders is urging the chemical maker to halt plans to spin off its Valvoline business and instead seek a buyer for its specialty chemicals unit, according to a slide presentation seen by Reuters. 
FB,UPDATE 2-News Corp denies rumors of Twitter bid Jan 20 Rupert Murdoch's News Corp said rumors about the company's interest in buying microblogging site Twitter Inc or building a stake in it were untrue. 
