REGN,BRIEF-Sanofi and Regeneron accepted for priority review by U.S. FDAFrench and Benelux stocks-Factors to watch on Sept. 26Sanofi may win U.S. approval of $3 bln eczema drug by March Sept 26 French drugmaker Sanofi and its U.S. partner Regeneron Pharmaceuticals could win U.S. approval for their keenly awaited new eczema drug dupilumab, seen by analysts as a potential $3 billion-a-year seller, by next March.  Sanofi may win U.S. approval of $3 bln eczema drug by March Sept 26 French drugmaker Sanofi and its U.S. partner Regeneron Pharmaceuticals could win U.S. approval for their keenly awaited new eczema drug dupilumab, seen by analysts as a potential $3 billion-a-year seller, by next March. PARIS, Sept 26 Below are company-related news and stories from French and Benelux media which could have an impact on the region's markets or individual stocks.Sanofi may win U.S. approval of $3 bln eczema drug by March Sept 26 French drugmaker Sanofi and its U.S. partner Regeneron Pharmaceuticals could win U.S. approval for their keenly awaited new eczema drug dupilumab, seen by analysts as a potential $3 billion-a-year seller, by next March.   French and Benelux stocks-Factors to watch on Sept. 26Sanofi may win U.S. approval of $3 bln eczema drug by March Sept 26 French drugmaker Sanofi and its U.S. partner Regeneron Pharmaceuticals could win U.S. approval for their keenly awaited new eczema drug dupilumab, seen by analysts as a potential $3 billion-a-year seller, by next March.  Sanofi may win U.S. approval of $3 bln eczema drug by March Sept 26 French drugmaker Sanofi and its U.S. partner Regeneron Pharmaceuticals could win U.S. approval for their keenly awaited new eczema drug dupilumab, seen by analysts as a potential $3 billion-a-year seller, by next March. PARIS, Sept 26 Below are company-related news and stories from French and Benelux media which could have an impact on the region's markets or individual stocks.Sanofi may win U.S. approval of $3 bln eczema drug by March Sept 26 French drugmaker Sanofi and its U.S. partner Regeneron Pharmaceuticals could win U.S. approval for their keenly awaited new eczema drug dupilumab, seen by analysts as a potential $3 billion-a-year seller, by next March.  * Sanofi and Regeneron announce dupilumab biologics license application accepted for priority review by U.S. FDA  Source text for Eikon:  Further company coverage:    (Gdynia Newsroom)French and Benelux stocks-Factors to watch on Sept. 26Sanofi may win U.S. approval of $3 bln eczema drug by March Sept 26 French drugmaker Sanofi and its U.S. partner Regeneron Pharmaceuticals could win U.S. approval for their keenly awaited new eczema drug dupilumab, seen by analysts as a potential $3 billion-a-year seller, by next March.  Sanofi may win U.S. approval of $3 bln eczema drug by March Sept 26 French drugmaker Sanofi and its U.S. partner Regeneron Pharmaceuticals could win U.S. approval for their keenly awaited new eczema drug dupilumab, seen by analysts as a potential $3 billion-a-year seller, by next March. PARIS, Sept 26 Below are company-related news and stories from French and Benelux media which could have an impact on the region's markets or individual stocks.Sanofi may win U.S. approval of $3 bln eczema drug by March Sept 26 French drugmaker Sanofi and its U.S. partner Regeneron Pharmaceuticals could win U.S. approval for their keenly awaited new eczema drug dupilumab, seen by analysts as a potential $3 billion-a-year seller, by next March.   
SYMC,Network security company ForeScout interviews banks for IPO -sources Sept 26 ForeScout Technologies Inc has interviewed investment banks in recent weeks to hire underwriters for an initial public offering that could value the U.S. network security company at as much as $1 billion, people familiar with the matter said on Monday. 
TGNA,Slowdown in U.S. political ad spending takes toll on broadcasters Sept 26 U.S. broadcasters that typically can count on a big revenue bounce from political advertising in presidential election years are still waiting for that to happen. 
KO,BRIEF-Evan Greenberg to resign from Coca-Cola boardBRIEF-Japan's two leading Coca-Cola bottlers to merge as early as next spring- Nikkei * Japan's two leading Coca-Cola bottlers have reached a basic agreement to merge as early as next spring- Nikkei  BRIEF-Japan's two leading Coca-Cola bottlers to merge as early as next spring- Nikkei * Japan's two leading Coca-Cola bottlers have reached a basic agreement to merge as early as next spring- Nikkei * Evan G. Greenberg to resign from the Coca-Cola Company board of directorsBRIEF-Japan's two leading Coca-Cola bottlers to merge as early as next spring- Nikkei * Japan's two leading Coca-Cola bottlers have reached a basic agreement to merge as early as next spring- Nikkei  
VIAB,Viacom readies US dollar bond sale as soon as this week: sources NEW YORK, Sept 26 (IFR) - Media conglomerate Viacom is preparing to price a US dollar bond as soon as this week, market sources told IFR on Monday. 
V,AmEx can bar merchants from steering card customers elsewhereUPDATE 4-AmEx can bar merchants from steering card customers elsewhere NEW YORK, Sept 26 A federal appeals court on Monday cleared the way for American Express Co to block merchants that accept its cards from steering customers toward lower-cost cards from other issuers.  UPDATE 4-AmEx can bar merchants from steering card customers elsewhere NEW YORK, Sept 26 A federal appeals court on Monday cleared the way for American Express Co to block merchants that accept its cards from steering customers toward lower-cost cards from other issuers. NEW YORK A federal appeals court on Monday cleared the way for American Express Co  to block merchants that accept its cards from steering customers toward lower-cost cards from other issuers.UPDATE 4-AmEx can bar merchants from steering card customers elsewhere NEW YORK, Sept 26 A federal appeals court on Monday cleared the way for American Express Co to block merchants that accept its cards from steering customers toward lower-cost cards from other issuers.  
WFC,Former employees file class action against Wells FargoSupport for Wells Fargo CEO Stumpf 'now wavering': CLSALabor Dept launches review of all Wells Fargo complaintsUPDATE 2-U.S. Labor Dept launches review of all Wells Fargo complaints WASHINGTON, Sept 26 U.S. Labor Department Secretary Thomas Perez on Monday pledged to conduct a "top-to-bottom" review of all cases, complaints and other alleged violations that the department has received concerning Wells Fargo in recent years.  UPDATE 2-U.S. Labor Dept launches review of all Wells Fargo complaints WASHINGTON, Sept 26 U.S. Labor Department Secretary Thomas Perez on Monday pledged to conduct a "top-to-bottom" review of all cases, complaints and other alleged violations that the department has received concerning Wells Fargo in recent years. WASHINGTON, Sept 26 U.S. Labor Department Secretary Thomas Perez on Monday pledged to conduct a "top-to-bottom" review of all cases, complaints and other alleged violations that the department has received concerning Wells Fargo in recent years.UPDATE 2-U.S. Labor Dept launches review of all Wells Fargo complaints WASHINGTON, Sept 26 U.S. Labor Department Secretary Thomas Perez on Monday pledged to conduct a "top-to-bottom" review of all cases, complaints and other alleged violations that the department has received concerning Wells Fargo in recent years.   Labor Dept launches review of all Wells Fargo complaintsUPDATE 2-U.S. Labor Dept launches review of all Wells Fargo complaints WASHINGTON, Sept 26 U.S. Labor Department Secretary Thomas Perez on Monday pledged to conduct a "top-to-bottom" review of all cases, complaints and other alleged violations that the department has received concerning Wells Fargo in recent years.  UPDATE 2-U.S. Labor Dept launches review of all Wells Fargo complaints WASHINGTON, Sept 26 U.S. Labor Department Secretary Thomas Perez on Monday pledged to conduct a "top-to-bottom" review of all cases, complaints and other alleged violations that the department has received concerning Wells Fargo in recent years. WASHINGTON, Sept 26 U.S. Labor Department Secretary Thomas Perez on Monday pledged to conduct a "top-to-bottom" review of all cases, complaints and other alleged violations that the department has received concerning Wells Fargo in recent years.UPDATE 2-U.S. Labor Dept launches review of all Wells Fargo complaints WASHINGTON, Sept 26 U.S. Labor Department Secretary Thomas Perez on Monday pledged to conduct a "top-to-bottom" review of all cases, complaints and other alleged violations that the department has received concerning Wells Fargo in recent years.  CLSA analyst Mike Mayo said his support for Wells Fargo & Co  Chief Executive John Stumpf was "wavering" following problematic sales tactics that has brought him under fire from U.S. lawmakers.Labor Dept launches review of all Wells Fargo complaintsUPDATE 2-U.S. Labor Dept launches review of all Wells Fargo complaints WASHINGTON, Sept 26 U.S. Labor Department Secretary Thomas Perez on Monday pledged to conduct a "top-to-bottom" review of all cases, complaints and other alleged violations that the department has received concerning Wells Fargo in recent years.  UPDATE 2-U.S. Labor Dept launches review of all Wells Fargo complaints WASHINGTON, Sept 26 U.S. Labor Department Secretary Thomas Perez on Monday pledged to conduct a "top-to-bottom" review of all cases, complaints and other alleged violations that the department has received concerning Wells Fargo in recent years. WASHINGTON, Sept 26 U.S. Labor Department Secretary Thomas Perez on Monday pledged to conduct a "top-to-bottom" review of all cases, complaints and other alleged violations that the department has received concerning Wells Fargo in recent years.UPDATE 2-U.S. Labor Dept launches review of all Wells Fargo complaints WASHINGTON, Sept 26 U.S. Labor Department Secretary Thomas Perez on Monday pledged to conduct a "top-to-bottom" review of all cases, complaints and other alleged violations that the department has received concerning Wells Fargo in recent years.    Support for Wells Fargo CEO Stumpf 'now wavering': CLSALabor Dept launches review of all Wells Fargo complaintsUPDATE 2-U.S. Labor Dept launches review of all Wells Fargo complaints WASHINGTON, Sept 26 U.S. Labor Department Secretary Thomas Perez on Monday pledged to conduct a "top-to-bottom" review of all cases, complaints and other alleged violations that the department has received concerning Wells Fargo in recent years.  UPDATE 2-U.S. Labor Dept launches review of all Wells Fargo complaints WASHINGTON, Sept 26 U.S. Labor Department Secretary Thomas Perez on Monday pledged to conduct a "top-to-bottom" review of all cases, complaints and other alleged violations that the department has received concerning Wells Fargo in recent years. WASHINGTON, Sept 26 U.S. Labor Department Secretary Thomas Perez on Monday pledged to conduct a "top-to-bottom" review of all cases, complaints and other alleged violations that the department has received concerning Wells Fargo in recent years.UPDATE 2-U.S. Labor Dept launches review of all Wells Fargo complaints WASHINGTON, Sept 26 U.S. Labor Department Secretary Thomas Perez on Monday pledged to conduct a "top-to-bottom" review of all cases, complaints and other alleged violations that the department has received concerning Wells Fargo in recent years.   Labor Dept launches review of all Wells Fargo complaintsUPDATE 2-U.S. Labor Dept launches review of all Wells Fargo complaints WASHINGTON, Sept 26 U.S. Labor Department Secretary Thomas Perez on Monday pledged to conduct a "top-to-bottom" review of all cases, complaints and other alleged violations that the department has received concerning Wells Fargo in recent years.  UPDATE 2-U.S. Labor Dept launches review of all Wells Fargo complaints WASHINGTON, Sept 26 U.S. Labor Department Secretary Thomas Perez on Monday pledged to conduct a "top-to-bottom" review of all cases, complaints and other alleged violations that the department has received concerning Wells Fargo in recent years. WASHINGTON, Sept 26 U.S. Labor Department Secretary Thomas Perez on Monday pledged to conduct a "top-to-bottom" review of all cases, complaints and other alleged violations that the department has received concerning Wells Fargo in recent years.UPDATE 2-U.S. Labor Dept launches review of all Wells Fargo complaints WASHINGTON, Sept 26 U.S. Labor Department Secretary Thomas Perez on Monday pledged to conduct a "top-to-bottom" review of all cases, complaints and other alleged violations that the department has received concerning Wells Fargo in recent years.  CLSA analyst Mike Mayo said his support for Wells Fargo & Co  Chief Executive John Stumpf was "wavering" following problematic sales tactics that has brought him under fire from U.S. lawmakers.Labor Dept launches review of all Wells Fargo complaintsUPDATE 2-U.S. Labor Dept launches review of all Wells Fargo complaints WASHINGTON, Sept 26 U.S. Labor Department Secretary Thomas Perez on Monday pledged to conduct a "top-to-bottom" review of all cases, complaints and other alleged violations that the department has received concerning Wells Fargo in recent years.  UPDATE 2-U.S. Labor Dept launches review of all Wells Fargo complaints WASHINGTON, Sept 26 U.S. Labor Department Secretary Thomas Perez on Monday pledged to conduct a "top-to-bottom" review of all cases, complaints and other alleged violations that the department has received concerning Wells Fargo in recent years. WASHINGTON, Sept 26 U.S. Labor Department Secretary Thomas Perez on Monday pledged to conduct a "top-to-bottom" review of all cases, complaints and other alleged violations that the department has received concerning Wells Fargo in recent years.UPDATE 2-U.S. Labor Dept launches review of all Wells Fargo complaints WASHINGTON, Sept 26 U.S. Labor Department Secretary Thomas Perez on Monday pledged to conduct a "top-to-bottom" review of all cases, complaints and other alleged violations that the department has received concerning Wells Fargo in recent years.   Two former Wells Fargo & Co employees have filed a class action in California seeking $2.6 billion or more for workers who tried to meet aggressive sales quotas without engaging in fraud and were later demoted, forced to resign or fired.Support for Wells Fargo CEO Stumpf 'now wavering': CLSALabor Dept launches review of all Wells Fargo complaintsUPDATE 2-U.S. Labor Dept launches review of all Wells Fargo complaints WASHINGTON, Sept 26 U.S. Labor Department Secretary Thomas Perez on Monday pledged to conduct a "top-to-bottom" review of all cases, complaints and other alleged violations that the department has received concerning Wells Fargo in recent years.  UPDATE 2-U.S. Labor Dept launches review of all Wells Fargo complaints WASHINGTON, Sept 26 U.S. Labor Department Secretary Thomas Perez on Monday pledged to conduct a "top-to-bottom" review of all cases, complaints and other alleged violations that the department has received concerning Wells Fargo in recent years. WASHINGTON, Sept 26 U.S. Labor Department Secretary Thomas Perez on Monday pledged to conduct a "top-to-bottom" review of all cases, complaints and other alleged violations that the department has received concerning Wells Fargo in recent years.UPDATE 2-U.S. Labor Dept launches review of all Wells Fargo complaints WASHINGTON, Sept 26 U.S. Labor Department Secretary Thomas Perez on Monday pledged to conduct a "top-to-bottom" review of all cases, complaints and other alleged violations that the department has received concerning Wells Fargo in recent years.   Labor Dept launches review of all Wells Fargo complaintsUPDATE 2-U.S. Labor Dept launches review of all Wells Fargo complaints WASHINGTON, Sept 26 U.S. Labor Department Secretary Thomas Perez on Monday pledged to conduct a "top-to-bottom" review of all cases, complaints and other alleged violations that the department has received concerning Wells Fargo in recent years.  UPDATE 2-U.S. Labor Dept launches review of all Wells Fargo complaints WASHINGTON, Sept 26 U.S. Labor Department Secretary Thomas Perez on Monday pledged to conduct a "top-to-bottom" review of all cases, complaints and other alleged violations that the department has received concerning Wells Fargo in recent years. WASHINGTON, Sept 26 U.S. Labor Department Secretary Thomas Perez on Monday pledged to conduct a "top-to-bottom" review of all cases, complaints and other alleged violations that the department has received concerning Wells Fargo in recent years.UPDATE 2-U.S. Labor Dept launches review of all Wells Fargo complaints WASHINGTON, Sept 26 U.S. Labor Department Secretary Thomas Perez on Monday pledged to conduct a "top-to-bottom" review of all cases, complaints and other alleged violations that the department has received concerning Wells Fargo in recent years.  CLSA analyst Mike Mayo said his support for Wells Fargo & Co  Chief Executive John Stumpf was "wavering" following problematic sales tactics that has brought him under fire from U.S. lawmakers.Labor Dept launches review of all Wells Fargo complaintsUPDATE 2-U.S. Labor Dept launches review of all Wells Fargo complaints WASHINGTON, Sept 26 U.S. Labor Department Secretary Thomas Perez on Monday pledged to conduct a "top-to-bottom" review of all cases, complaints and other alleged violations that the department has received concerning Wells Fargo in recent years.  UPDATE 2-U.S. Labor Dept launches review of all Wells Fargo complaints WASHINGTON, Sept 26 U.S. Labor Department Secretary Thomas Perez on Monday pledged to conduct a "top-to-bottom" review of all cases, complaints and other alleged violations that the department has received concerning Wells Fargo in recent years. WASHINGTON, Sept 26 U.S. Labor Department Secretary Thomas Perez on Monday pledged to conduct a "top-to-bottom" review of all cases, complaints and other alleged violations that the department has received concerning Wells Fargo in recent years.UPDATE 2-U.S. Labor Dept launches review of all Wells Fargo complaints WASHINGTON, Sept 26 U.S. Labor Department Secretary Thomas Perez on Monday pledged to conduct a "top-to-bottom" review of all cases, complaints and other alleged violations that the department has received concerning Wells Fargo in recent years.    
YHOO,Senator seeks SEC probe of Yahoo hackUPDATE 3-U.S. senator seeks SEC probe of Yahoo disclosure on hackingU.S. senator seeks SEC probe of Yahoo disclosure on hacking WASHINGTON Democratic Senator Mark Warner on Monday asked the U.S. Securities and Exchange Commission to investigate whether Yahoo  and its senior executives fulfilled obligations to inform investors and the public about a hacking attack affecting 500 million user accounts.  U.S. senator seeks SEC probe of Yahoo disclosure on hacking WASHINGTON Democratic Senator Mark Warner on Monday asked the U.S. Securities and Exchange Commission to investigate whether Yahoo  and its senior executives fulfilled obligations to inform investors and the public about a hacking attack affecting 500 million user accounts. WASHINGTON, Sept 26 Democratic Senator Mark Warner on Monday asked the U.S. Securities and Exchange Commission to investigate whether Yahoo and its senior executives fulfilled obligations to inform investors and the public about a hacking attack affecting 500 million user accounts.U.S. senator seeks SEC probe of Yahoo disclosure on hacking WASHINGTON Democratic Senator Mark Warner on Monday asked the U.S. Securities and Exchange Commission to investigate whether Yahoo  and its senior executives fulfilled obligations to inform investors and the public about a hacking attack affecting 500 million user accounts.   UPDATE 3-U.S. senator seeks SEC probe of Yahoo disclosure on hackingU.S. senator seeks SEC probe of Yahoo disclosure on hacking WASHINGTON Democratic Senator Mark Warner on Monday asked the U.S. Securities and Exchange Commission to investigate whether Yahoo  and its senior executives fulfilled obligations to inform investors and the public about a hacking attack affecting 500 million user accounts.  U.S. senator seeks SEC probe of Yahoo disclosure on hacking WASHINGTON Democratic Senator Mark Warner on Monday asked the U.S. Securities and Exchange Commission to investigate whether Yahoo  and its senior executives fulfilled obligations to inform investors and the public about a hacking attack affecting 500 million user accounts. WASHINGTON, Sept 26 Democratic Senator Mark Warner on Monday asked the U.S. Securities and Exchange Commission to investigate whether Yahoo and its senior executives fulfilled obligations to inform investors and the public about a hacking attack affecting 500 million user accounts.U.S. senator seeks SEC probe of Yahoo disclosure on hacking WASHINGTON Democratic Senator Mark Warner on Monday asked the U.S. Securities and Exchange Commission to investigate whether Yahoo  and its senior executives fulfilled obligations to inform investors and the public about a hacking attack affecting 500 million user accounts.  WASHINGTON, Sept 26 Democratic Senator Mark Warner on Monday asked the U.S. Securities and Exchange Commission to investigate whether Yahoo and its senior executives fulfilled obligations to inform investors and the public about a hack affecting 500 million user accounts.UPDATE 3-U.S. senator seeks SEC probe of Yahoo disclosure on hackingU.S. senator seeks SEC probe of Yahoo disclosure on hacking WASHINGTON Democratic Senator Mark Warner on Monday asked the U.S. Securities and Exchange Commission to investigate whether Yahoo  and its senior executives fulfilled obligations to inform investors and the public about a hacking attack affecting 500 million user accounts.  U.S. senator seeks SEC probe of Yahoo disclosure on hacking WASHINGTON Democratic Senator Mark Warner on Monday asked the U.S. Securities and Exchange Commission to investigate whether Yahoo  and its senior executives fulfilled obligations to inform investors and the public about a hacking attack affecting 500 million user accounts. WASHINGTON, Sept 26 Democratic Senator Mark Warner on Monday asked the U.S. Securities and Exchange Commission to investigate whether Yahoo and its senior executives fulfilled obligations to inform investors and the public about a hacking attack affecting 500 million user accounts.U.S. senator seeks SEC probe of Yahoo disclosure on hacking WASHINGTON Democratic Senator Mark Warner on Monday asked the U.S. Securities and Exchange Commission to investigate whether Yahoo  and its senior executives fulfilled obligations to inform investors and the public about a hacking attack affecting 500 million user accounts.   
YUM,BRIEF-Yum Brands appoints Paget Alves to board * With Alves's appointment, Yum! brands board will consist of 12 directors, 11 of whom will be independent 
