AAPL,Taiwanese chip supplier says Apple conservative on orders-Nikkei June 28 Taiwanese chip firm Advanced Semiconductor Engineering Inc said on Tuesday that its biggest customer, Apple Inc, was being more conservative in placing orders compared with last year, according to the Nikkei. (http://s.nikkei.com/290gukL) 
BLL,BRIEF-Ball offer for Rexam Plc approved in the U.S.UPDATE 1-Ball wins conditional U.S. approval to buy Rexam WASHINGTON, June 28 Ball Corp and Rexam Plc, the world's two largest beverage can makers, have won U.S. antitrust approval to merge on condition that they sell eight aluminum can plants in the United States, the Federal Trade Commission said on Tuesday.  UPDATE 1-Ball wins conditional U.S. approval to buy Rexam WASHINGTON, June 28 Ball Corp and Rexam Plc, the world's two largest beverage can makers, have won U.S. antitrust approval to merge on condition that they sell eight aluminum can plants in the United States, the Federal Trade Commission said on Tuesday. * Says following closing of transaction, Ball will remain a New York Stock Exchange listed company domiciled in U.SUPDATE 1-Ball wins conditional U.S. approval to buy Rexam WASHINGTON, June 28 Ball Corp and Rexam Plc, the world's two largest beverage can makers, have won U.S. antitrust approval to merge on condition that they sell eight aluminum can plants in the United States, the Federal Trade Commission said on Tuesday.  
CCL,Carnival Corp revenue rises on higher ticket pricesUPDATE 2-Carnival cruises past estimates after hiking ticket prices * CEO says "no need to adjust" guidance in response to "Brexit"  UPDATE 2-Carnival cruises past estimates after hiking ticket prices * CEO says "no need to adjust" guidance in response to "Brexit" June 28 Carnival Corp reported a 3.2 percent rise in quarterly revenue as the world's largest cruise operator gained from higher ticket prices and onboard spending.UPDATE 2-Carnival cruises past estimates after hiking ticket prices * CEO says "no need to adjust" guidance in response to "Brexit"  
CSCO,BRIEF-Cisco announces intent to acquire CloudLock * Under terms of agreement, Cisco will pay $293 million in cash and assumed equity awards 
C,UPDATE 2-U.S. Supreme Court to weigh Miami predatory lending lawsuitU.S. Supreme Court to weigh Miami predatory lending lawsuit WASHINGTON The U.S. Supreme Court on Tuesday agreed to decide whether Miami can pursue lawsuits accusing major banks of predatory mortgage lending to black and Hispanic home buyers resulting in loan defaults that drove down city tax revenues and property values.  U.S. Supreme Court to weigh Miami predatory lending lawsuit WASHINGTON The U.S. Supreme Court on Tuesday agreed to decide whether Miami can pursue lawsuits accusing major banks of predatory mortgage lending to black and Hispanic home buyers resulting in loan defaults that drove down city tax revenues and property values. WASHINGTON, June 28 The U.S. Supreme Court on Tuesday agreed to decide whether Miami can pursue lawsuits accusing major banks of predatory mortgage lending to black and Hispanic home buyers resulting in loan defaults that drove down city tax revenues and property values.U.S. Supreme Court to weigh Miami predatory lending lawsuit WASHINGTON The U.S. Supreme Court on Tuesday agreed to decide whether Miami can pursue lawsuits accusing major banks of predatory mortgage lending to black and Hispanic home buyers resulting in loan defaults that drove down city tax revenues and property values.  
CMCSA,Katzenberg sued over 'side deal' to Comcast-DreamWorks merger WILMINGTON, Del. Jeffrey Katzenberg, DreamWorks Animation SKG Inc's chief executive, has been hit with a proposed class action lawsuit over what a minority shareholder called an "extraordinarily valuable" side deal he struck as part of the $3.8 billion sale of the studio to Comcast Corp . 
GLW,Dow Chemical to cut 2500 jobs as part of Dow Corning deal June 28 Dow Chemical Co said it would lay off about 2,500 employees globally, or about 4 percent of its workforce, as part of a deal to assume full control of Dow Corning, which was a joint-venture with Gorilla glass maker Corning Inc. 
CMI,Volkswagen diesel deal could be a win for many companiesVolkswagen diesel deal could be a win for many companies Volkswagen AG's  $15.3 billion settlement of allegations that it cheated on diesel engine pollution tests promises a substantial boost for federal and state efforts to expand electric vehicle sales, and could also help producers of commercial trucks and buses and other heavy equipment.  Volkswagen diesel deal could be a win for many companies Volkswagen AG's  $15.3 billion settlement of allegations that it cheated on diesel engine pollution tests promises a substantial boost for federal and state efforts to expand electric vehicle sales, and could also help producers of commercial trucks and buses and other heavy equipment. June 28 Volkswagen AG's $15.3 billion settlement of allegations that it cheated on diesel engine pollution tests promises a substantial boost for federal and state efforts to expand electric vehicle sales, and could also help producers of commercial trucks and buses and other heavy equipment.Volkswagen diesel deal could be a win for many companies Volkswagen AG's  $15.3 billion settlement of allegations that it cheated on diesel engine pollution tests promises a substantial boost for federal and state efforts to expand electric vehicle sales, and could also help producers of commercial trucks and buses and other heavy equipment.  
DOW,BRIEF-Dow Chemical Co says to shut some facilities, reduce 2,500 positionsDow Chemical to cut 2500 jobs as part of Dow Corning dealUPDATE 1-Dow Chemical to cut 2,500 jobs as part of Dow Corning deal June 28 Dow Chemical Co said it would lay off about 2,500 employees globally, or about 4 percent of its workforce, as part of a deal to assume full control of Dow Corning, which was a joint venture with Gorilla glass maker Corning Inc.  UPDATE 1-Dow Chemical to cut 2,500 jobs as part of Dow Corning deal June 28 Dow Chemical Co said it would lay off about 2,500 employees globally, or about 4 percent of its workforce, as part of a deal to assume full control of Dow Corning, which was a joint venture with Gorilla glass maker Corning Inc. June 28 Dow Chemical Co said it would lay off about 2,500 employees globally, or about 4 percent of its workforce, as part of a deal to assume full control of Dow Corning, which was a joint-venture with Gorilla glass maker Corning Inc.UPDATE 1-Dow Chemical to cut 2,500 jobs as part of Dow Corning deal June 28 Dow Chemical Co said it would lay off about 2,500 employees globally, or about 4 percent of its workforce, as part of a deal to assume full control of Dow Corning, which was a joint venture with Gorilla glass maker Corning Inc.   Dow Chemical to cut 2500 jobs as part of Dow Corning dealUPDATE 1-Dow Chemical to cut 2,500 jobs as part of Dow Corning deal June 28 Dow Chemical Co said it would lay off about 2,500 employees globally, or about 4 percent of its workforce, as part of a deal to assume full control of Dow Corning, which was a joint venture with Gorilla glass maker Corning Inc.  UPDATE 1-Dow Chemical to cut 2,500 jobs as part of Dow Corning deal June 28 Dow Chemical Co said it would lay off about 2,500 employees globally, or about 4 percent of its workforce, as part of a deal to assume full control of Dow Corning, which was a joint venture with Gorilla glass maker Corning Inc. June 28 Dow Chemical Co said it would lay off about 2,500 employees globally, or about 4 percent of its workforce, as part of a deal to assume full control of Dow Corning, which was a joint-venture with Gorilla glass maker Corning Inc.UPDATE 1-Dow Chemical to cut 2,500 jobs as part of Dow Corning deal June 28 Dow Chemical Co said it would lay off about 2,500 employees globally, or about 4 percent of its workforce, as part of a deal to assume full control of Dow Corning, which was a joint venture with Gorilla glass maker Corning Inc.  * Dow announces multiple actions to accelerate shareholder value creation from dow corning transaction; increases synergy capture to $500 millionDow Chemical to cut 2500 jobs as part of Dow Corning dealUPDATE 1-Dow Chemical to cut 2,500 jobs as part of Dow Corning deal June 28 Dow Chemical Co said it would lay off about 2,500 employees globally, or about 4 percent of its workforce, as part of a deal to assume full control of Dow Corning, which was a joint venture with Gorilla glass maker Corning Inc.  UPDATE 1-Dow Chemical to cut 2,500 jobs as part of Dow Corning deal June 28 Dow Chemical Co said it would lay off about 2,500 employees globally, or about 4 percent of its workforce, as part of a deal to assume full control of Dow Corning, which was a joint venture with Gorilla glass maker Corning Inc. June 28 Dow Chemical Co said it would lay off about 2,500 employees globally, or about 4 percent of its workforce, as part of a deal to assume full control of Dow Corning, which was a joint-venture with Gorilla glass maker Corning Inc.UPDATE 1-Dow Chemical to cut 2,500 jobs as part of Dow Corning deal June 28 Dow Chemical Co said it would lay off about 2,500 employees globally, or about 4 percent of its workforce, as part of a deal to assume full control of Dow Corning, which was a joint venture with Gorilla glass maker Corning Inc.   
GILD,U.S. FDA approves Gilead's hep C drug EpclusaUPDATE 2-Gilead wins U.S. nod for drug for all types of hepatitis C June 28 U.S. health regulators on Tuesday approved a combination drug by Gilead Sciences Inc that is the first available treatment for all six major forms of hepatitis C, advancing the company's leadership in the field and sending its shares up more than 4 percent.  UPDATE 2-Gilead wins U.S. nod for drug for all types of hepatitis C June 28 U.S. health regulators on Tuesday approved a combination drug by Gilead Sciences Inc that is the first available treatment for all six major forms of hepatitis C, advancing the company's leadership in the field and sending its shares up more than 4 percent. June 28 The U.S. Food and Drug Administration approved Gilead Sciences Inc's drug for treating chronic hepatitis C virus infection.UPDATE 2-Gilead wins U.S. nod for drug for all types of hepatitis C June 28 U.S. health regulators on Tuesday approved a combination drug by Gilead Sciences Inc that is the first available treatment for all six major forms of hepatitis C, advancing the company's leadership in the field and sending its shares up more than 4 percent.  
GS,UPDATE 1-ECB's Draghi calls for global central bank policy alignmentECB's Draghi calls for global central bank policy alignmentLibya wealth fund boss screamed, cursed at Goldman bankers -witness LONDON, June 28 The Libyan wealth fund's former deputy chief screamed and cursed at Goldman Sachs bankers in a stormy meeting over derivatives trades made on the bank's advice that ultimately turned out to be worthless, a witness told a court on Tuesday.  Libya wealth fund boss screamed, cursed at Goldman bankers -witness LONDON, June 28 The Libyan wealth fund's former deputy chief screamed and cursed at Goldman Sachs bankers in a stormy meeting over derivatives trades made on the bank's advice that ultimately turned out to be worthless, a witness told a court on Tuesday. SINTRA, Portugal Central banks around the world should align their monetary policies to help prevent "destabilizing spillovers" between economies growing at different paces, European Central Bank President Mario Draghi said on Tuesday.Libya wealth fund boss screamed, cursed at Goldman bankers -witness LONDON, June 28 The Libyan wealth fund's former deputy chief screamed and cursed at Goldman Sachs bankers in a stormy meeting over derivatives trades made on the bank's advice that ultimately turned out to be worthless, a witness told a court on Tuesday.   ECB's Draghi calls for global central bank policy alignmentLibya wealth fund boss screamed, cursed at Goldman bankers -witness LONDON, June 28 The Libyan wealth fund's former deputy chief screamed and cursed at Goldman Sachs bankers in a stormy meeting over derivatives trades made on the bank's advice that ultimately turned out to be worthless, a witness told a court on Tuesday.  Libya wealth fund boss screamed, cursed at Goldman bankers -witness LONDON, June 28 The Libyan wealth fund's former deputy chief screamed and cursed at Goldman Sachs bankers in a stormy meeting over derivatives trades made on the bank's advice that ultimately turned out to be worthless, a witness told a court on Tuesday. SINTRA, Portugal Central banks around the world should align their monetary policies to help prevent "destabilizing spillovers" between economies growing at different paces, European Central Bank President Mario Draghi said on Tuesday.Libya wealth fund boss screamed, cursed at Goldman bankers -witness LONDON, June 28 The Libyan wealth fund's former deputy chief screamed and cursed at Goldman Sachs bankers in a stormy meeting over derivatives trades made on the bank's advice that ultimately turned out to be worthless, a witness told a court on Tuesday.  SINTRA, Portugal, June 28 Central banks around the world should align their monetary policies to help prevent "destabilising spillovers" between economies growing at different paces, European Central Bank President Mario Draghi said on Tuesday.ECB's Draghi calls for global central bank policy alignmentLibya wealth fund boss screamed, cursed at Goldman bankers -witness LONDON, June 28 The Libyan wealth fund's former deputy chief screamed and cursed at Goldman Sachs bankers in a stormy meeting over derivatives trades made on the bank's advice that ultimately turned out to be worthless, a witness told a court on Tuesday.  Libya wealth fund boss screamed, cursed at Goldman bankers -witness LONDON, June 28 The Libyan wealth fund's former deputy chief screamed and cursed at Goldman Sachs bankers in a stormy meeting over derivatives trades made on the bank's advice that ultimately turned out to be worthless, a witness told a court on Tuesday. SINTRA, Portugal Central banks around the world should align their monetary policies to help prevent "destabilizing spillovers" between economies growing at different paces, European Central Bank President Mario Draghi said on Tuesday.Libya wealth fund boss screamed, cursed at Goldman bankers -witness LONDON, June 28 The Libyan wealth fund's former deputy chief screamed and cursed at Goldman Sachs bankers in a stormy meeting over derivatives trades made on the bank's advice that ultimately turned out to be worthless, a witness told a court on Tuesday.   
HON,BRIEF-Honeywell names Darius Adamczyk to succeed Dave Cote as CEOHoneywell names Darius Adamczyk to succeed Dave Cote as CEO June 28 Honeywell International Inc said Chief Operating Officer Darius Adamczyk will succeed company veteran Dave Cote as chief executive next year.  Honeywell names Darius Adamczyk to succeed Dave Cote as CEO June 28 Honeywell International Inc said Chief Operating Officer Darius Adamczyk will succeed company veteran Dave Cote as chief executive next year. * Cote will continue as executive chairman until company's annual shareowners meeting in April 2018Honeywell names Darius Adamczyk to succeed Dave Cote as CEO June 28 Honeywell International Inc said Chief Operating Officer Darius Adamczyk will succeed company veteran Dave Cote as chief executive next year.  
KMI,Kinder Morgan sells 50 pct stake in Ohio pipeline to PE firmBRIEF-Kinder Morgan sells 50 pct stake in in Utopia pipeline project to Riverstone Investment GroupUPDATE 1-Kinder Morgan sells 50 pct stake in Ohio pipeline to Riverstone June 28 Kinder Morgan Inc said it had agreed to sell half its stake in an Ohio pipeline project to private equity firm Riverstone Investment Group LLC for an undisclosed amount.  UPDATE 1-Kinder Morgan sells 50 pct stake in Ohio pipeline to Riverstone June 28 Kinder Morgan Inc said it had agreed to sell half its stake in an Ohio pipeline project to private equity firm Riverstone Investment Group LLC for an undisclosed amount. * Kinder Morgan sells 50 pct equity interest in Utopia pipeline project to Riverstone Investment GroupUPDATE 1-Kinder Morgan sells 50 pct stake in Ohio pipeline to Riverstone June 28 Kinder Morgan Inc said it had agreed to sell half its stake in an Ohio pipeline project to private equity firm Riverstone Investment Group LLC for an undisclosed amount.   BRIEF-Kinder Morgan sells 50 pct stake in in Utopia pipeline project to Riverstone Investment GroupUPDATE 1-Kinder Morgan sells 50 pct stake in Ohio pipeline to Riverstone June 28 Kinder Morgan Inc said it had agreed to sell half its stake in an Ohio pipeline project to private equity firm Riverstone Investment Group LLC for an undisclosed amount.  UPDATE 1-Kinder Morgan sells 50 pct stake in Ohio pipeline to Riverstone June 28 Kinder Morgan Inc said it had agreed to sell half its stake in an Ohio pipeline project to private equity firm Riverstone Investment Group LLC for an undisclosed amount. * Kinder Morgan sells 50 pct equity interest in Utopia pipeline project to Riverstone Investment GroupUPDATE 1-Kinder Morgan sells 50 pct stake in Ohio pipeline to Riverstone June 28 Kinder Morgan Inc said it had agreed to sell half its stake in an Ohio pipeline project to private equity firm Riverstone Investment Group LLC for an undisclosed amount.  June 28 Kinder Morgan Inc said it agreed to sell half of its stake in an Ohio pipeline project to Riverstone Investment Group LLC and the private equity firm would help fund construction and commissioning of the pipeline.BRIEF-Kinder Morgan sells 50 pct stake in in Utopia pipeline project to Riverstone Investment GroupUPDATE 1-Kinder Morgan sells 50 pct stake in Ohio pipeline to Riverstone June 28 Kinder Morgan Inc said it had agreed to sell half its stake in an Ohio pipeline project to private equity firm Riverstone Investment Group LLC for an undisclosed amount.  UPDATE 1-Kinder Morgan sells 50 pct stake in Ohio pipeline to Riverstone June 28 Kinder Morgan Inc said it had agreed to sell half its stake in an Ohio pipeline project to private equity firm Riverstone Investment Group LLC for an undisclosed amount. * Kinder Morgan sells 50 pct equity interest in Utopia pipeline project to Riverstone Investment GroupUPDATE 1-Kinder Morgan sells 50 pct stake in Ohio pipeline to Riverstone June 28 Kinder Morgan Inc said it had agreed to sell half its stake in an Ohio pipeline project to private equity firm Riverstone Investment Group LLC for an undisclosed amount.   
MA,UPDATE 1-U.S. top court agrees to review ATM fee antitrust lawsuitU.S. top court agrees to review ATM fee antitrust lawsuitSupreme Court agrees to review ATM fee antitrust lawsuit WASHINGTON The U.S. Supreme Court on Tuesday agreed to hear appeals by Visa Inc, Mastercard Inc and several U.S. banks seeking to throw out lawsuits claiming they conspired to inflate the prices of ATM access fees in violation of antitrust law.  Supreme Court agrees to review ATM fee antitrust lawsuit WASHINGTON The U.S. Supreme Court on Tuesday agreed to hear appeals by Visa Inc, Mastercard Inc and several U.S. banks seeking to throw out lawsuits claiming they conspired to inflate the prices of ATM access fees in violation of antitrust law. WASHINGTON The U.S. Supreme Court on Tuesday agreed to hear appeals by Visa Inc, Mastercard Inc  and several U.S. banks seeking to throw out lawsuits claiming they conspired to inflate the prices of ATM access fees in violation of antitrust law.Supreme Court agrees to review ATM fee antitrust lawsuit WASHINGTON The U.S. Supreme Court on Tuesday agreed to hear appeals by Visa Inc, Mastercard Inc and several U.S. banks seeking to throw out lawsuits claiming they conspired to inflate the prices of ATM access fees in violation of antitrust law.   U.S. top court agrees to review ATM fee antitrust lawsuitSupreme Court agrees to review ATM fee antitrust lawsuit WASHINGTON The U.S. Supreme Court on Tuesday agreed to hear appeals by Visa Inc, Mastercard Inc and several U.S. banks seeking to throw out lawsuits claiming they conspired to inflate the prices of ATM access fees in violation of antitrust law.  Supreme Court agrees to review ATM fee antitrust lawsuit WASHINGTON The U.S. Supreme Court on Tuesday agreed to hear appeals by Visa Inc, Mastercard Inc and several U.S. banks seeking to throw out lawsuits claiming they conspired to inflate the prices of ATM access fees in violation of antitrust law. WASHINGTON The U.S. Supreme Court on Tuesday agreed to hear appeals by Visa Inc, Mastercard Inc  and several U.S. banks seeking to throw out lawsuits claiming they conspired to inflate the prices of ATM access fees in violation of antitrust law.Supreme Court agrees to review ATM fee antitrust lawsuit WASHINGTON The U.S. Supreme Court on Tuesday agreed to hear appeals by Visa Inc, Mastercard Inc and several U.S. banks seeking to throw out lawsuits claiming they conspired to inflate the prices of ATM access fees in violation of antitrust law.  WASHINGTON, June 28 The U.S. Supreme Court on Tuesday agreed to hear appeals by Visa Inc, Mastercard Inc  and several U.S. banks seeking to throw out lawsuits claiming they conspired to inflate the prices of ATM access fees in violation of antitrust law.U.S. top court agrees to review ATM fee antitrust lawsuitSupreme Court agrees to review ATM fee antitrust lawsuit WASHINGTON The U.S. Supreme Court on Tuesday agreed to hear appeals by Visa Inc, Mastercard Inc and several U.S. banks seeking to throw out lawsuits claiming they conspired to inflate the prices of ATM access fees in violation of antitrust law.  Supreme Court agrees to review ATM fee antitrust lawsuit WASHINGTON The U.S. Supreme Court on Tuesday agreed to hear appeals by Visa Inc, Mastercard Inc and several U.S. banks seeking to throw out lawsuits claiming they conspired to inflate the prices of ATM access fees in violation of antitrust law. WASHINGTON The U.S. Supreme Court on Tuesday agreed to hear appeals by Visa Inc, Mastercard Inc  and several U.S. banks seeking to throw out lawsuits claiming they conspired to inflate the prices of ATM access fees in violation of antitrust law.Supreme Court agrees to review ATM fee antitrust lawsuit WASHINGTON The U.S. Supreme Court on Tuesday agreed to hear appeals by Visa Inc, Mastercard Inc and several U.S. banks seeking to throw out lawsuits claiming they conspired to inflate the prices of ATM access fees in violation of antitrust law.   
