HAL,REFILE-CORRECTED-EU opens probe into Halliburton's planned purchase of Baker HughesUPDATE 1-EU probes Halliburton's planned purchase of Baker HughesEU opens probe into Halliburton's planned purchase of Baker Hughes BRUSSELS The European Commission said on Tuesday it had launched an in-depth investigation into Halliburton's  planned purchase of its oilfield services rival Baker Hughes .  EU opens probe into Halliburton's planned purchase of Baker Hughes BRUSSELS The European Commission said on Tuesday it had launched an in-depth investigation into Halliburton's  planned purchase of its oilfield services rival Baker Hughes . BRUSSELS, Jan 12 The European Commission said on Tuesday it had launched an in-depth investigation into oilfield services provider Halliburton's planned purchase of its smaller rival Baker Hughes.EU opens probe into Halliburton's planned purchase of Baker Hughes BRUSSELS The European Commission said on Tuesday it had launched an in-depth investigation into Halliburton's  planned purchase of its oilfield services rival Baker Hughes .   UPDATE 1-EU probes Halliburton's planned purchase of Baker HughesEU opens probe into Halliburton's planned purchase of Baker Hughes BRUSSELS The European Commission said on Tuesday it had launched an in-depth investigation into Halliburton's  planned purchase of its oilfield services rival Baker Hughes .  EU opens probe into Halliburton's planned purchase of Baker Hughes BRUSSELS The European Commission said on Tuesday it had launched an in-depth investigation into Halliburton's  planned purchase of its oilfield services rival Baker Hughes . BRUSSELS, Jan 12 The European Commission said on Tuesday it had launched an in-depth investigation into oilfield services provider Halliburton's planned purchase of its smaller rival Baker Hughes.EU opens probe into Halliburton's planned purchase of Baker Hughes BRUSSELS The European Commission said on Tuesday it had launched an in-depth investigation into Halliburton's  planned purchase of its oilfield services rival Baker Hughes .  BRUSSELS, Jan 12 The European Commission said on Tuesday it had launched an in-depth investigation into Halliburton's planned purchase of its oilfield services rival Baker Hughes.UPDATE 1-EU probes Halliburton's planned purchase of Baker HughesEU opens probe into Halliburton's planned purchase of Baker Hughes BRUSSELS The European Commission said on Tuesday it had launched an in-depth investigation into Halliburton's  planned purchase of its oilfield services rival Baker Hughes .  EU opens probe into Halliburton's planned purchase of Baker Hughes BRUSSELS The European Commission said on Tuesday it had launched an in-depth investigation into Halliburton's  planned purchase of its oilfield services rival Baker Hughes . BRUSSELS, Jan 12 The European Commission said on Tuesday it had launched an in-depth investigation into oilfield services provider Halliburton's planned purchase of its smaller rival Baker Hughes.EU opens probe into Halliburton's planned purchase of Baker Hughes BRUSSELS The European Commission said on Tuesday it had launched an in-depth investigation into Halliburton's  planned purchase of its oilfield services rival Baker Hughes .   
LNC,Ford unveils resurrected Lincoln Continental, targets China market Jan 12 Ford Motor Co unveiled on Tuesday a new luxury flagship full-size Continental sedan aimed at Chinese and American consumers. 
MCD,UPDATE 3-Italian groups seek EU antitrust probe into McDonald's * EU already looking into McDonald's tax deal with Luxembourg 
MRK,Merck, BioLineRX to study drug combo to fight pancreatic cancer JERUSALEM, Jan 12 Israeli biopharmaceutical company BioLineRX Ltd said on Tuesday it would collaborate with U.S. industry heavyweight Merck to test a combination of drugs for the treatment of pancreatic cancer. 
MET,Metlife plans to separate U.S. retail businessMetlife plans to separate U.S. retail business; shares rise Metlife Inc , the largest U.S. life insurer, said it plans to separate a substantial portion of its U.S. retail business.  Metlife plans to separate U.S. retail business; shares rise Metlife Inc , the largest U.S. life insurer, said it plans to separate a substantial portion of its U.S. retail business. Jan 12 Metlife Inc, the largest U.S. life insurer, plans to separate a substantial portion of its U.S. retail segment.Metlife plans to separate U.S. retail business; shares rise Metlife Inc , the largest U.S. life insurer, said it plans to separate a substantial portion of its U.S. retail business.  
NSC,Norfolk Southern to consolidate Virginia units to cut costs Jan 12 U.S. railroad operator Norfolk Southern Corp, which has repeatedly rejected Canadian Pacific Railway Ltd's takeover bid, said it will consolidate its Virginia and Pocahontas units, to cut costs and support growth. 
PFE,BRIEF-Allergan research chief says Pfizer immuno-oncology pipeline underappreciatedPfizer, Allergan say combined drug pipeline 'underappreciated' NEW YORK, Jan 12 The research chiefs of betrothed drugmakers Pfizer Inc and Allergan say the proposed combination of their experimental drugs deserves more credit, including potential blockbuster treatments for schizophrenia and depression.  Pfizer, Allergan say combined drug pipeline 'underappreciated' NEW YORK, Jan 12 The research chiefs of betrothed drugmakers Pfizer Inc and Allergan say the proposed combination of their experimental drugs deserves more credit, including potential blockbuster treatments for schizophrenia and depression. * Pfizer says its experimental off-the-shelf CAR T cell therapies for cancer may have major advantages over personalized CAR T cellsPfizer, Allergan say combined drug pipeline 'underappreciated' NEW YORK, Jan 12 The research chiefs of betrothed drugmakers Pfizer Inc and Allergan say the proposed combination of their experimental drugs deserves more credit, including potential blockbuster treatments for schizophrenia and depression.  
DIS,Shanghai Disneyland set to open in June Jan 12 Walt Disney Co's theme park in Shanghai is slated to open on June 16, the company said on Tuesday. 
