ABBV,J&J; psoriasis drug Stelara tames Crohn's disease in second trialJ&J; psoriasis drug Stelara eases Crohn's disease in second trial Johnson & Johnson's Stelara psoriasis drug has shown effectiveness against Crohn's disease in a second late-stage trial, the company said on Friday, bolstering prospects of its approval for the additional use.  J&J; psoriasis drug Stelara eases Crohn's disease in second trial Johnson & Johnson's Stelara psoriasis drug has shown effectiveness against Crohn's disease in a second late-stage trial, the company said on Friday, bolstering prospects of its approval for the additional use. March 18 Johnson & Johnson's Stelara psoriasis drug has shown effectiveness against Crohn's disease in a second late-stage trial, the company said on Friday, bolstering prospects of its approval for the additional use.J&J; psoriasis drug Stelara eases Crohn's disease in second trial Johnson & Johnson's Stelara psoriasis drug has shown effectiveness against Crohn's disease in a second late-stage trial, the company said on Friday, bolstering prospects of its approval for the additional use.  
GOOGL,UPDATE 2-U.S. FCC says it receives 104 bids to participate in spectrum auction WASHINGTON/NEW YORK March 18 The U.S. Federal Communications Commission said on Friday that it had received 104 applications to take part in an auction of valuable low-frequency airwaves relinquished by TV broadcasters,     including many wireless companies who want to use the airwaves to build new networks or improve existing coverage. 
GOOG,UPDATE 2-U.S. FCC says it receives 104 bids to participate in spectrum auction WASHINGTON/NEW YORK March 18 The U.S. Federal Communications Commission said on Friday that it had received 104 applications to take part in an auction of valuable low-frequency airwaves relinquished by TV broadcasters,     including many wireless companies who want to use the airwaves to build new networks or improve existing coverage. 
AAPL,SEC says Amazon should allow shareholder vote on gender payUPDATE 2-U.S. prosecutors, Apple to bring witnesses to hearing on locked iPhone WASHINGTON, March 18 The U.S. government and Apple Inc will be able to cross-examine the other's witnesses in a court hearing next week on whether the technology company must help federal investigators unlock an encrypted iPhone tied to one of the San Bernardino killers, Apple said.  UPDATE 2-U.S. prosecutors, Apple to bring witnesses to hearing on locked iPhone WASHINGTON, March 18 The U.S. government and Apple Inc will be able to cross-examine the other's witnesses in a court hearing next week on whether the technology company must help federal investigators unlock an encrypted iPhone tied to one of the San Bernardino killers, Apple said. Amazon.com Inc  should allow shareholders to vote on a proposal on gender pay equality, the U.S. securities regulator decided this week in rejecting the retailer's request to omit the measure from its annual ballot.UPDATE 2-U.S. prosecutors, Apple to bring witnesses to hearing on locked iPhone WASHINGTON, March 18 The U.S. government and Apple Inc will be able to cross-examine the other's witnesses in a court hearing next week on whether the technology company must help federal investigators unlock an encrypted iPhone tied to one of the San Bernardino killers, Apple said.  
T,GameStop attracts large investors as shorts back off SAN FRANCISCO, March 18 GameStop, one of the most shorted U.S. stocks, has started to attract institutional buyers and dissuade some traders betting against it as it fights off a consumer shift toward downloading video games and its depressed share price stabilizes. 
BAC,BRIEF-Bank of America's board authorizes repurchase of up to $800 mln common stock * Bank Of America Corp says board of directors has authorized corporation to repurchase up to $800 million of Corporation's common stock 
