ABBV,FDA approves J&J;'s autoimmune drug Stelara for Crohn's disease Sept 26 Johnson & Johnson said on Monday that the U.S. Food and Drug Administration approved the company's blockbuster psoriasis drug, Stelara, for use in adults with Crohn's disease. 
AGN,Pfizer says not to split into two Sept 26 U.S. drugmaker Pfizer Inc said on Monday it had decided not to separate into two publicly traded companies at this time. 
GOOGL,Exclusive: Thailand considering tougher tax collection rules for internet, tech firms BANGKOK/JAKARTA Thailand is studying plans to toughen tax collection rules for internet and technology firms like Alphabet Inc's Google, the head of the Revenue Department told Reuters, as the tax affairs of these firms comes under growing scrutiny in Southeast Asia. 
GOOG,Exclusive: Thailand considering tougher tax collection rules for internet, tech firms BANGKOK/JAKARTA Thailand is studying plans to toughen tax collection rules for internet and technology firms like Alphabet Inc's Google, the head of the Revenue Department told Reuters, as the tax affairs of these firms comes under growing scrutiny in Southeast Asia. 
AAPL,Nikkei falls on strong yen, selling in Apple suppliersUS STOCKS SNAPSHOT-Wall St opens lower, weighed down by AppleLVMH's digital drive takes time despite Apple hireLVMH's digital drive takes time despite Apple hire PARIS When LVMH hired former Apple music executive Ian Rogers to craft a digital strategy, investors may have hoped for some quick results. If so, they are probably disappointed.  LVMH's digital drive takes time despite Apple hire PARIS When LVMH hired former Apple music executive Ian Rogers to craft a digital strategy, investors may have hoped for some quick results. If so, they are probably disappointed. PARIS, Sept 26 When LVMH hired former Apple music executive Ian Rogers to craft a digital strategy, investors may have hoped for some quick results. If so, they are probably disappointed.LVMH's digital drive takes time despite Apple hire PARIS When LVMH hired former Apple music executive Ian Rogers to craft a digital strategy, investors may have hoped for some quick results. If so, they are probably disappointed.   LVMH's digital drive takes time despite Apple hireLVMH's digital drive takes time despite Apple hire PARIS When LVMH hired former Apple music executive Ian Rogers to craft a digital strategy, investors may have hoped for some quick results. If so, they are probably disappointed.  LVMH's digital drive takes time despite Apple hire PARIS When LVMH hired former Apple music executive Ian Rogers to craft a digital strategy, investors may have hoped for some quick results. If so, they are probably disappointed. PARIS, Sept 26 When LVMH hired former Apple music executive Ian Rogers to craft a digital strategy, investors may have hoped for some quick results. If so, they are probably disappointed.LVMH's digital drive takes time despite Apple hire PARIS When LVMH hired former Apple music executive Ian Rogers to craft a digital strategy, investors may have hoped for some quick results. If so, they are probably disappointed.  Sept 26 U.S. stocks opened lower on Monday as Apple weighed on the three major indexes and investors geared up for the first debate between U.S. presidential candidates Hillary Clinton and Donald Trump.LVMH's digital drive takes time despite Apple hireLVMH's digital drive takes time despite Apple hire PARIS When LVMH hired former Apple music executive Ian Rogers to craft a digital strategy, investors may have hoped for some quick results. If so, they are probably disappointed.  LVMH's digital drive takes time despite Apple hire PARIS When LVMH hired former Apple music executive Ian Rogers to craft a digital strategy, investors may have hoped for some quick results. If so, they are probably disappointed. PARIS, Sept 26 When LVMH hired former Apple music executive Ian Rogers to craft a digital strategy, investors may have hoped for some quick results. If so, they are probably disappointed.LVMH's digital drive takes time despite Apple hire PARIS When LVMH hired former Apple music executive Ian Rogers to craft a digital strategy, investors may have hoped for some quick results. If so, they are probably disappointed.    US STOCKS SNAPSHOT-Wall St opens lower, weighed down by AppleLVMH's digital drive takes time despite Apple hireLVMH's digital drive takes time despite Apple hire PARIS When LVMH hired former Apple music executive Ian Rogers to craft a digital strategy, investors may have hoped for some quick results. If so, they are probably disappointed.  LVMH's digital drive takes time despite Apple hire PARIS When LVMH hired former Apple music executive Ian Rogers to craft a digital strategy, investors may have hoped for some quick results. If so, they are probably disappointed. PARIS, Sept 26 When LVMH hired former Apple music executive Ian Rogers to craft a digital strategy, investors may have hoped for some quick results. If so, they are probably disappointed.LVMH's digital drive takes time despite Apple hire PARIS When LVMH hired former Apple music executive Ian Rogers to craft a digital strategy, investors may have hoped for some quick results. If so, they are probably disappointed.   LVMH's digital drive takes time despite Apple hireLVMH's digital drive takes time despite Apple hire PARIS When LVMH hired former Apple music executive Ian Rogers to craft a digital strategy, investors may have hoped for some quick results. If so, they are probably disappointed.  LVMH's digital drive takes time despite Apple hire PARIS When LVMH hired former Apple music executive Ian Rogers to craft a digital strategy, investors may have hoped for some quick results. If so, they are probably disappointed. PARIS, Sept 26 When LVMH hired former Apple music executive Ian Rogers to craft a digital strategy, investors may have hoped for some quick results. If so, they are probably disappointed.LVMH's digital drive takes time despite Apple hire PARIS When LVMH hired former Apple music executive Ian Rogers to craft a digital strategy, investors may have hoped for some quick results. If so, they are probably disappointed.  Sept 26 U.S. stocks opened lower on Monday as Apple weighed on the three major indexes and investors geared up for the first debate between U.S. presidential candidates Hillary Clinton and Donald Trump.LVMH's digital drive takes time despite Apple hireLVMH's digital drive takes time despite Apple hire PARIS When LVMH hired former Apple music executive Ian Rogers to craft a digital strategy, investors may have hoped for some quick results. If so, they are probably disappointed.  LVMH's digital drive takes time despite Apple hire PARIS When LVMH hired former Apple music executive Ian Rogers to craft a digital strategy, investors may have hoped for some quick results. If so, they are probably disappointed. PARIS, Sept 26 When LVMH hired former Apple music executive Ian Rogers to craft a digital strategy, investors may have hoped for some quick results. If so, they are probably disappointed.LVMH's digital drive takes time despite Apple hire PARIS When LVMH hired former Apple music executive Ian Rogers to craft a digital strategy, investors may have hoped for some quick results. If so, they are probably disappointed.   TOKYO, Sept 26 Japan's Nikkei fell on Monday, with a strong yen souring overall sentiment and Apple Inc's  suppliers underperforming on worries about weak overseas iPhone sales, while some investors turned their focus to the U.S. presidential debate.US STOCKS SNAPSHOT-Wall St opens lower, weighed down by AppleLVMH's digital drive takes time despite Apple hireLVMH's digital drive takes time despite Apple hire PARIS When LVMH hired former Apple music executive Ian Rogers to craft a digital strategy, investors may have hoped for some quick results. If so, they are probably disappointed.  LVMH's digital drive takes time despite Apple hire PARIS When LVMH hired former Apple music executive Ian Rogers to craft a digital strategy, investors may have hoped for some quick results. If so, they are probably disappointed. PARIS, Sept 26 When LVMH hired former Apple music executive Ian Rogers to craft a digital strategy, investors may have hoped for some quick results. If so, they are probably disappointed.LVMH's digital drive takes time despite Apple hire PARIS When LVMH hired former Apple music executive Ian Rogers to craft a digital strategy, investors may have hoped for some quick results. If so, they are probably disappointed.   LVMH's digital drive takes time despite Apple hireLVMH's digital drive takes time despite Apple hire PARIS When LVMH hired former Apple music executive Ian Rogers to craft a digital strategy, investors may have hoped for some quick results. If so, they are probably disappointed.  LVMH's digital drive takes time despite Apple hire PARIS When LVMH hired former Apple music executive Ian Rogers to craft a digital strategy, investors may have hoped for some quick results. If so, they are probably disappointed. PARIS, Sept 26 When LVMH hired former Apple music executive Ian Rogers to craft a digital strategy, investors may have hoped for some quick results. If so, they are probably disappointed.LVMH's digital drive takes time despite Apple hire PARIS When LVMH hired former Apple music executive Ian Rogers to craft a digital strategy, investors may have hoped for some quick results. If so, they are probably disappointed.  Sept 26 U.S. stocks opened lower on Monday as Apple weighed on the three major indexes and investors geared up for the first debate between U.S. presidential candidates Hillary Clinton and Donald Trump.LVMH's digital drive takes time despite Apple hireLVMH's digital drive takes time despite Apple hire PARIS When LVMH hired former Apple music executive Ian Rogers to craft a digital strategy, investors may have hoped for some quick results. If so, they are probably disappointed.  LVMH's digital drive takes time despite Apple hire PARIS When LVMH hired former Apple music executive Ian Rogers to craft a digital strategy, investors may have hoped for some quick results. If so, they are probably disappointed. PARIS, Sept 26 When LVMH hired former Apple music executive Ian Rogers to craft a digital strategy, investors may have hoped for some quick results. If so, they are probably disappointed.LVMH's digital drive takes time despite Apple hire PARIS When LVMH hired former Apple music executive Ian Rogers to craft a digital strategy, investors may have hoped for some quick results. If so, they are probably disappointed.    
BAC,BRIEF-Bank of America  plans to eliminate about dozen senior positions at its corporate and investment banking operations in Asia - Bloomberg, citing sourcesBank of America set to cut about two dozen Asia investment banking jobs-sources SINGAPORE/HONG KONG, Sept 26 Bank of America  is set to cut about two dozen investment banking (IB) jobs in Asia, including some top dealmakers starting this week, according to people familiar with the matter.  Bank of America set to cut about two dozen Asia investment banking jobs-sources SINGAPORE/HONG KONG, Sept 26 Bank of America  is set to cut about two dozen investment banking (IB) jobs in Asia, including some top dealmakers starting this week, according to people familiar with the matter. * Plans to eliminate about dozen senior positions at its corporate and investment banking operations in Asia - Bloomberg, citing sourcesBank of America set to cut about two dozen Asia investment banking jobs-sources SINGAPORE/HONG KONG, Sept 26 Bank of America  is set to cut about two dozen investment banking (IB) jobs in Asia, including some top dealmakers starting this week, according to people familiar with the matter.  
CCL,Carnival Corp revenue rises on higher N. America, Europe salesBRIEF-Carnival corporation & plc reports record third quarter earningsDemand for North America, Europe cruises drives Carnival's results Carnival Corp , the world's largest cruise operator, reported higher-than-expected quarterly profit and revenue and boosted its earnings forecast for the year as its benefits from strong demand for its cruises in North America and Europe.  Demand for North America, Europe cruises drives Carnival's results Carnival Corp , the world's largest cruise operator, reported higher-than-expected quarterly profit and revenue and boosted its earnings forecast for the year as its benefits from strong demand for its cruises in North America and Europe. * Carnival corporation & plc reports record third quarter earningsDemand for North America, Europe cruises drives Carnival's results Carnival Corp , the world's largest cruise operator, reported higher-than-expected quarterly profit and revenue and boosted its earnings forecast for the year as its benefits from strong demand for its cruises in North America and Europe.   BRIEF-Carnival corporation & plc reports record third quarter earningsDemand for North America, Europe cruises drives Carnival's results Carnival Corp , the world's largest cruise operator, reported higher-than-expected quarterly profit and revenue and boosted its earnings forecast for the year as its benefits from strong demand for its cruises in North America and Europe.  Demand for North America, Europe cruises drives Carnival's results Carnival Corp , the world's largest cruise operator, reported higher-than-expected quarterly profit and revenue and boosted its earnings forecast for the year as its benefits from strong demand for its cruises in North America and Europe. * Carnival corporation & plc reports record third quarter earningsDemand for North America, Europe cruises drives Carnival's results Carnival Corp , the world's largest cruise operator, reported higher-than-expected quarterly profit and revenue and boosted its earnings forecast for the year as its benefits from strong demand for its cruises in North America and Europe.  Sept 26 - Carnival Corp, the world's largest cruise operator, reported a 4.4 percent increase in quarterly revenue, helped by strong sales in North America and Europe.BRIEF-Carnival corporation & plc reports record third quarter earningsDemand for North America, Europe cruises drives Carnival's results Carnival Corp , the world's largest cruise operator, reported higher-than-expected quarterly profit and revenue and boosted its earnings forecast for the year as its benefits from strong demand for its cruises in North America and Europe.  Demand for North America, Europe cruises drives Carnival's results Carnival Corp , the world's largest cruise operator, reported higher-than-expected quarterly profit and revenue and boosted its earnings forecast for the year as its benefits from strong demand for its cruises in North America and Europe. * Carnival corporation & plc reports record third quarter earningsDemand for North America, Europe cruises drives Carnival's results Carnival Corp , the world's largest cruise operator, reported higher-than-expected quarterly profit and revenue and boosted its earnings forecast for the year as its benefits from strong demand for its cruises in North America and Europe.   
DTE,BRIEF-Dte Energy to purchase natural gas midstream assets * Transactions, expected to be completed in Q4 2016, will not materially change DTE's current business mix. 
GIS,Investors urge food companies to shift from meat to plants LONDON, Sept 26 A group of 40 investors managing $1.25 trillion in assets have launched a campaign to encourage 16 global food companies to change the way they source protein for their products to help to reduce environmental and health risks. 
