GOOGL,UPDATE 2-News Corp denies rumors of Twitter bid Jan 20 Rupert Murdoch's News Corp said rumors about the company's interest in buying microblogging site Twitter Inc or building a stake in it were untrue. 
IBM,REFILE-UPDATE 3-IBM forecasts weak earnings for 2016; shares slideIBM forecasts weak earnings for 2016; shares slideUS STOCKS-Wall St selloff relentless as oil prices sink * Indexes down: Dow 2.72 pct, S&P; 2.83 pct, Nasdaq 2.75 pct   (Adds details, updates prices)  US STOCKS-Wall St selloff relentless as oil prices sink * Indexes down: Dow 2.72 pct, S&P; 2.83 pct, Nasdaq 2.75 pct   (Adds details, updates prices) International Business Machines Corp forecast weak earnings for this year after reporting an 8.5 percent fall in fourth-quarter revenue as a strong dollar and tepid IT spending weigh on Big Blue's results.US STOCKS-Wall St selloff relentless as oil prices sink * Indexes down: Dow 2.72 pct, S&P; 2.83 pct, Nasdaq 2.75 pct   (Adds details, updates prices)   IBM forecasts weak earnings for 2016; shares slideUS STOCKS-Wall St selloff relentless as oil prices sink * Indexes down: Dow 2.72 pct, S&P; 2.83 pct, Nasdaq 2.75 pct   (Adds details, updates prices)  US STOCKS-Wall St selloff relentless as oil prices sink * Indexes down: Dow 2.72 pct, S&P; 2.83 pct, Nasdaq 2.75 pct   (Adds details, updates prices) International Business Machines Corp forecast weak earnings for this year after reporting an 8.5 percent fall in fourth-quarter revenue as a strong dollar and tepid IT spending weigh on Big Blue's results.US STOCKS-Wall St selloff relentless as oil prices sink * Indexes down: Dow 2.72 pct, S&P; 2.83 pct, Nasdaq 2.75 pct   (Adds details, updates prices)  Jan 19 International Business Machines Corp  forecast weak earnings for this year after reporting an 8.5 percent fall in fourth-quarter revenue as a strong dollar and tepid IT spending weigh on Big Blue's results.IBM forecasts weak earnings for 2016; shares slideUS STOCKS-Wall St selloff relentless as oil prices sink * Indexes down: Dow 2.72 pct, S&P; 2.83 pct, Nasdaq 2.75 pct   (Adds details, updates prices)  US STOCKS-Wall St selloff relentless as oil prices sink * Indexes down: Dow 2.72 pct, S&P; 2.83 pct, Nasdaq 2.75 pct   (Adds details, updates prices) International Business Machines Corp forecast weak earnings for this year after reporting an 8.5 percent fall in fourth-quarter revenue as a strong dollar and tepid IT spending weigh on Big Blue's results.US STOCKS-Wall St selloff relentless as oil prices sink * Indexes down: Dow 2.72 pct, S&P; 2.83 pct, Nasdaq 2.75 pct   (Adds details, updates prices)   
ISRG,Intuitive Surgical stock run leads healthcare group as Q4 report nears NEW YORK, Jan 20 In a beaten-up stock market, Intuitive Surgical Inc stands out as the best-performing large-cap U.S. healthcare stock that is not an acquisition target. 
KMI,Kinder Morgan swings to loss in Q4Kinder Morgan discloses writedowns, warns of more with falling energy pricesKinder Morgan discloses writedowns, warns of more with falling energy prices HOUSTON Kinder Morgan Inc  recorded a $1.15 billion non-cash goodwill writedown on midstream natural gas assets and a $285 million writedown primarily in carbon dioxide segment, Chief Financial Officer Kimberly Allen Dang told analysts on Wednesday.  Kinder Morgan discloses writedowns, warns of more with falling energy prices HOUSTON Kinder Morgan Inc  recorded a $1.15 billion non-cash goodwill writedown on midstream natural gas assets and a $285 million writedown primarily in carbon dioxide segment, Chief Financial Officer Kimberly Allen Dang told analysts on Wednesday. HOUSTON, Jan 20 Kinder Morgan Inc  recorded a $1.15 billion non-cash goodwill writedown on midstream natural gas assets and a $285 million writedown primarily in carbon dioxide segment, Chief Financial Officer Kimberly Allen Dang told analysts on Wednesday.Kinder Morgan discloses writedowns, warns of more with falling energy prices HOUSTON Kinder Morgan Inc  recorded a $1.15 billion non-cash goodwill writedown on midstream natural gas assets and a $285 million writedown primarily in carbon dioxide segment, Chief Financial Officer Kimberly Allen Dang told analysts on Wednesday.   Kinder Morgan discloses writedowns, warns of more with falling energy pricesKinder Morgan discloses writedowns, warns of more with falling energy prices HOUSTON Kinder Morgan Inc  recorded a $1.15 billion non-cash goodwill writedown on midstream natural gas assets and a $285 million writedown primarily in carbon dioxide segment, Chief Financial Officer Kimberly Allen Dang told analysts on Wednesday.  Kinder Morgan discloses writedowns, warns of more with falling energy prices HOUSTON Kinder Morgan Inc  recorded a $1.15 billion non-cash goodwill writedown on midstream natural gas assets and a $285 million writedown primarily in carbon dioxide segment, Chief Financial Officer Kimberly Allen Dang told analysts on Wednesday. HOUSTON, Jan 20 Kinder Morgan Inc  recorded a $1.15 billion non-cash goodwill writedown on midstream natural gas assets and a $285 million writedown primarily in carbon dioxide segment, Chief Financial Officer Kimberly Allen Dang told analysts on Wednesday.Kinder Morgan discloses writedowns, warns of more with falling energy prices HOUSTON Kinder Morgan Inc  recorded a $1.15 billion non-cash goodwill writedown on midstream natural gas assets and a $285 million writedown primarily in carbon dioxide segment, Chief Financial Officer Kimberly Allen Dang told analysts on Wednesday.  Jan 20 U.S. pipeline giant Kinder Morgan Inc  swung to a fourth-quarter loss as it moved lower volumes of oil and gas amid falling prices.Kinder Morgan discloses writedowns, warns of more with falling energy pricesKinder Morgan discloses writedowns, warns of more with falling energy prices HOUSTON Kinder Morgan Inc  recorded a $1.15 billion non-cash goodwill writedown on midstream natural gas assets and a $285 million writedown primarily in carbon dioxide segment, Chief Financial Officer Kimberly Allen Dang told analysts on Wednesday.  Kinder Morgan discloses writedowns, warns of more with falling energy prices HOUSTON Kinder Morgan Inc  recorded a $1.15 billion non-cash goodwill writedown on midstream natural gas assets and a $285 million writedown primarily in carbon dioxide segment, Chief Financial Officer Kimberly Allen Dang told analysts on Wednesday. HOUSTON, Jan 20 Kinder Morgan Inc  recorded a $1.15 billion non-cash goodwill writedown on midstream natural gas assets and a $285 million writedown primarily in carbon dioxide segment, Chief Financial Officer Kimberly Allen Dang told analysts on Wednesday.Kinder Morgan discloses writedowns, warns of more with falling energy prices HOUSTON Kinder Morgan Inc  recorded a $1.15 billion non-cash goodwill writedown on midstream natural gas assets and a $285 million writedown primarily in carbon dioxide segment, Chief Financial Officer Kimberly Allen Dang told analysts on Wednesday.   
LMT,Deals of the day- Mergers and acquisitions Jan 20 The following bids, mergers, acquisitions and disposals were reported by 2200 GMT on Wednesday: 
MRK,Vaccines alliance signs $5 mln advance deal for Merck's Ebola shot DAVOS/LONDON, Jan 20 The Gavi global alliance for vaccines and immunisation group signed a $5 million advance purchase commitment on Wednesday to buy a vaccine being developed by Merck to protect against future outbreaks of the deadly Ebola virus. 
NFLX,Netflix swept up in market rout despite strong subscriber signups Jan 20 Netflix Inc's shares fell as much as 10 percent on Wednesday after a widespread selloff on Wall Street overshadowed the video streaming company's impressive subscriber additions in the fourth quarter. 
PM,Philip Morris-controlled Sampoerna seeks wider Indonesia reach with stronger cigarettes JAKARTA, Jan 20 PT Hanjaya Mandala Sampoerna Tbk  plans to aggressively market stronger-flavoured cigarettes this year, its top executive said, as Indonesia's biggest tobacco firm seeks to extend its dominance of one of the world's fastest growing markets for cigarettes. 
SPLS,UPDATE 1-Staples, Office Depot buy time to fight merger-related lawsuit Jan 20 Staples Inc said it would give itself three more months before calling off its proposed $6.3 billion-acquisition of Office Depot Inc, giving the companies time to fight an antitrust lawsuit with the Federal Trade Commission. 
SYMC,Symantec to get $1 billion less cash in sale of Veritas to Carlyle Jan 19 Antivirus software maker Symantec Corp  said on Tuesday it will receive $1 billion less in cash for its data storage unit Veritas from Carlyle Group LP, cutting the price of the biggest leveraged buyout of 2015 after debt backing the deal failed to sell. 
DIS,Star Wars toys generate more than $700 mln in sales in 2015UPDATE 1-Disney postpones 'Star Wars: Episode VIII' to Dec 2017Disney pushes next 'Star Wars' movie release to December 2017 LOS ANGELES, Jan 20 Fans of the blockbuster "Star Wars: The Force Awakens" will have to wait two more years for the next installment as Walt Disney Co. on Wednesday pushed back the release of "Star Wars: Episode VIII" by seven months.  Disney pushes next 'Star Wars' movie release to December 2017 LOS ANGELES, Jan 20 Fans of the blockbuster "Star Wars: The Force Awakens" will have to wait two more years for the next installment as Walt Disney Co. on Wednesday pushed back the release of "Star Wars: Episode VIII" by seven months. Jan 20 Walt Disney Studios said on Wednesday "Star Wars: Episode VIII" will be released on Dec. 15, 2017, seven months later than originally scheduled.Disney pushes next 'Star Wars' movie release to December 2017 LOS ANGELES, Jan 20 Fans of the blockbuster "Star Wars: The Force Awakens" will have to wait two more years for the next installment as Walt Disney Co. on Wednesday pushed back the release of "Star Wars: Episode VIII" by seven months.   UPDATE 1-Disney postpones 'Star Wars: Episode VIII' to Dec 2017Disney pushes next 'Star Wars' movie release to December 2017 LOS ANGELES, Jan 20 Fans of the blockbuster "Star Wars: The Force Awakens" will have to wait two more years for the next installment as Walt Disney Co. on Wednesday pushed back the release of "Star Wars: Episode VIII" by seven months.  Disney pushes next 'Star Wars' movie release to December 2017 LOS ANGELES, Jan 20 Fans of the blockbuster "Star Wars: The Force Awakens" will have to wait two more years for the next installment as Walt Disney Co. on Wednesday pushed back the release of "Star Wars: Episode VIII" by seven months. Jan 20 Walt Disney Studios said on Wednesday "Star Wars: Episode VIII" will be released on Dec. 15, 2017, seven months later than originally scheduled.Disney pushes next 'Star Wars' movie release to December 2017 LOS ANGELES, Jan 20 Fans of the blockbuster "Star Wars: The Force Awakens" will have to wait two more years for the next installment as Walt Disney Co. on Wednesday pushed back the release of "Star Wars: Episode VIII" by seven months.  Jan 20 Star Wars toys generated sales of more than $700 million in the United States in 2015, making them "the number-one property" in the toy industry during the year, a retail research group said.UPDATE 1-Disney postpones 'Star Wars: Episode VIII' to Dec 2017Disney pushes next 'Star Wars' movie release to December 2017 LOS ANGELES, Jan 20 Fans of the blockbuster "Star Wars: The Force Awakens" will have to wait two more years for the next installment as Walt Disney Co. on Wednesday pushed back the release of "Star Wars: Episode VIII" by seven months.  Disney pushes next 'Star Wars' movie release to December 2017 LOS ANGELES, Jan 20 Fans of the blockbuster "Star Wars: The Force Awakens" will have to wait two more years for the next installment as Walt Disney Co. on Wednesday pushed back the release of "Star Wars: Episode VIII" by seven months. Jan 20 Walt Disney Studios said on Wednesday "Star Wars: Episode VIII" will be released on Dec. 15, 2017, seven months later than originally scheduled.Disney pushes next 'Star Wars' movie release to December 2017 LOS ANGELES, Jan 20 Fans of the blockbuster "Star Wars: The Force Awakens" will have to wait two more years for the next installment as Walt Disney Co. on Wednesday pushed back the release of "Star Wars: Episode VIII" by seven months.   
WMT,Wal-Mart to hike pay for 1.2 mln workers in 2016Brazil's GPA taps Argentina boss, former Wal-Mart head to run supermarketsUPDATE 1-Brazil's GPA taps Argentina boss, ex-Wal Mart head to run supermarketsUPDATE 2-Wal-Mart Stores to hike pay for 1.2 mln workers in 2016 Jan 20 Wal-Mart Stores Inc said Wednesday that more than 1.2 million employees would get a raise in 2016, and the retailer will allow paid days off to be carried over into the next year as it aims to retain workers amid a tight U.S. labor market.  UPDATE 2-Wal-Mart Stores to hike pay for 1.2 mln workers in 2016 Jan 20 Wal-Mart Stores Inc said Wednesday that more than 1.2 million employees would get a raise in 2016, and the retailer will allow paid days off to be carried over into the next year as it aims to retain workers amid a tight U.S. labor market. SAO PAULO, Jan 20 Brazil's largest diversified retailer GPA SA tapped a senior executive in Argentina and the former head of Wal Mart Stores Inc's  Brazil business to run its struggling supermarket and convenience store unit, according to a securities filing on Wednesday.UPDATE 2-Wal-Mart Stores to hike pay for 1.2 mln workers in 2016 Jan 20 Wal-Mart Stores Inc said Wednesday that more than 1.2 million employees would get a raise in 2016, and the retailer will allow paid days off to be carried over into the next year as it aims to retain workers amid a tight U.S. labor market.   UPDATE 1-Brazil's GPA taps Argentina boss, ex-Wal Mart head to run supermarketsUPDATE 2-Wal-Mart Stores to hike pay for 1.2 mln workers in 2016 Jan 20 Wal-Mart Stores Inc said Wednesday that more than 1.2 million employees would get a raise in 2016, and the retailer will allow paid days off to be carried over into the next year as it aims to retain workers amid a tight U.S. labor market.  UPDATE 2-Wal-Mart Stores to hike pay for 1.2 mln workers in 2016 Jan 20 Wal-Mart Stores Inc said Wednesday that more than 1.2 million employees would get a raise in 2016, and the retailer will allow paid days off to be carried over into the next year as it aims to retain workers amid a tight U.S. labor market. SAO PAULO, Jan 20 Brazil's largest diversified retailer GPA SA tapped a senior executive in Argentina and the former head of Wal Mart Stores Inc's  Brazil business to run its struggling supermarket and convenience store unit, according to a securities filing on Wednesday.UPDATE 2-Wal-Mart Stores to hike pay for 1.2 mln workers in 2016 Jan 20 Wal-Mart Stores Inc said Wednesday that more than 1.2 million employees would get a raise in 2016, and the retailer will allow paid days off to be carried over into the next year as it aims to retain workers amid a tight U.S. labor market.  SAO PAULO, Jan 20 GPA SA, Brazil's biggest retailer, on Wednesday named Luis Moreno as chief executive of its supermarket and convenience store division and Marcos Samaha as head of operations for the unit, according to a securities filing.UPDATE 1-Brazil's GPA taps Argentina boss, ex-Wal Mart head to run supermarketsUPDATE 2-Wal-Mart Stores to hike pay for 1.2 mln workers in 2016 Jan 20 Wal-Mart Stores Inc said Wednesday that more than 1.2 million employees would get a raise in 2016, and the retailer will allow paid days off to be carried over into the next year as it aims to retain workers amid a tight U.S. labor market.  UPDATE 2-Wal-Mart Stores to hike pay for 1.2 mln workers in 2016 Jan 20 Wal-Mart Stores Inc said Wednesday that more than 1.2 million employees would get a raise in 2016, and the retailer will allow paid days off to be carried over into the next year as it aims to retain workers amid a tight U.S. labor market. SAO PAULO, Jan 20 Brazil's largest diversified retailer GPA SA tapped a senior executive in Argentina and the former head of Wal Mart Stores Inc's  Brazil business to run its struggling supermarket and convenience store unit, according to a securities filing on Wednesday.UPDATE 2-Wal-Mart Stores to hike pay for 1.2 mln workers in 2016 Jan 20 Wal-Mart Stores Inc said Wednesday that more than 1.2 million employees would get a raise in 2016, and the retailer will allow paid days off to be carried over into the next year as it aims to retain workers amid a tight U.S. labor market.    Brazil's GPA taps Argentina boss, former Wal-Mart head to run supermarketsUPDATE 1-Brazil's GPA taps Argentina boss, ex-Wal Mart head to run supermarketsUPDATE 2-Wal-Mart Stores to hike pay for 1.2 mln workers in 2016 Jan 20 Wal-Mart Stores Inc said Wednesday that more than 1.2 million employees would get a raise in 2016, and the retailer will allow paid days off to be carried over into the next year as it aims to retain workers amid a tight U.S. labor market.  UPDATE 2-Wal-Mart Stores to hike pay for 1.2 mln workers in 2016 Jan 20 Wal-Mart Stores Inc said Wednesday that more than 1.2 million employees would get a raise in 2016, and the retailer will allow paid days off to be carried over into the next year as it aims to retain workers amid a tight U.S. labor market. SAO PAULO, Jan 20 Brazil's largest diversified retailer GPA SA tapped a senior executive in Argentina and the former head of Wal Mart Stores Inc's  Brazil business to run its struggling supermarket and convenience store unit, according to a securities filing on Wednesday.UPDATE 2-Wal-Mart Stores to hike pay for 1.2 mln workers in 2016 Jan 20 Wal-Mart Stores Inc said Wednesday that more than 1.2 million employees would get a raise in 2016, and the retailer will allow paid days off to be carried over into the next year as it aims to retain workers amid a tight U.S. labor market.   UPDATE 1-Brazil's GPA taps Argentina boss, ex-Wal Mart head to run supermarketsUPDATE 2-Wal-Mart Stores to hike pay for 1.2 mln workers in 2016 Jan 20 Wal-Mart Stores Inc said Wednesday that more than 1.2 million employees would get a raise in 2016, and the retailer will allow paid days off to be carried over into the next year as it aims to retain workers amid a tight U.S. labor market.  UPDATE 2-Wal-Mart Stores to hike pay for 1.2 mln workers in 2016 Jan 20 Wal-Mart Stores Inc said Wednesday that more than 1.2 million employees would get a raise in 2016, and the retailer will allow paid days off to be carried over into the next year as it aims to retain workers amid a tight U.S. labor market. SAO PAULO, Jan 20 Brazil's largest diversified retailer GPA SA tapped a senior executive in Argentina and the former head of Wal Mart Stores Inc's  Brazil business to run its struggling supermarket and convenience store unit, according to a securities filing on Wednesday.UPDATE 2-Wal-Mart Stores to hike pay for 1.2 mln workers in 2016 Jan 20 Wal-Mart Stores Inc said Wednesday that more than 1.2 million employees would get a raise in 2016, and the retailer will allow paid days off to be carried over into the next year as it aims to retain workers amid a tight U.S. labor market.  SAO PAULO, Jan 20 GPA SA, Brazil's biggest retailer, on Wednesday named Luis Moreno as chief executive of its supermarket and convenience store division and Marcos Samaha as head of operations for the unit, according to a securities filing.UPDATE 1-Brazil's GPA taps Argentina boss, ex-Wal Mart head to run supermarketsUPDATE 2-Wal-Mart Stores to hike pay for 1.2 mln workers in 2016 Jan 20 Wal-Mart Stores Inc said Wednesday that more than 1.2 million employees would get a raise in 2016, and the retailer will allow paid days off to be carried over into the next year as it aims to retain workers amid a tight U.S. labor market.  UPDATE 2-Wal-Mart Stores to hike pay for 1.2 mln workers in 2016 Jan 20 Wal-Mart Stores Inc said Wednesday that more than 1.2 million employees would get a raise in 2016, and the retailer will allow paid days off to be carried over into the next year as it aims to retain workers amid a tight U.S. labor market. SAO PAULO, Jan 20 Brazil's largest diversified retailer GPA SA tapped a senior executive in Argentina and the former head of Wal Mart Stores Inc's  Brazil business to run its struggling supermarket and convenience store unit, according to a securities filing on Wednesday.UPDATE 2-Wal-Mart Stores to hike pay for 1.2 mln workers in 2016 Jan 20 Wal-Mart Stores Inc said Wednesday that more than 1.2 million employees would get a raise in 2016, and the retailer will allow paid days off to be carried over into the next year as it aims to retain workers amid a tight U.S. labor market.   Jan 20 Wal-Mart Stores Inc said more than 1.2 million Walmart U.S. and Sam's Club employees will receive a pay increase in 2016.Brazil's GPA taps Argentina boss, former Wal-Mart head to run supermarketsUPDATE 1-Brazil's GPA taps Argentina boss, ex-Wal Mart head to run supermarketsUPDATE 2-Wal-Mart Stores to hike pay for 1.2 mln workers in 2016 Jan 20 Wal-Mart Stores Inc said Wednesday that more than 1.2 million employees would get a raise in 2016, and the retailer will allow paid days off to be carried over into the next year as it aims to retain workers amid a tight U.S. labor market.  UPDATE 2-Wal-Mart Stores to hike pay for 1.2 mln workers in 2016 Jan 20 Wal-Mart Stores Inc said Wednesday that more than 1.2 million employees would get a raise in 2016, and the retailer will allow paid days off to be carried over into the next year as it aims to retain workers amid a tight U.S. labor market. SAO PAULO, Jan 20 Brazil's largest diversified retailer GPA SA tapped a senior executive in Argentina and the former head of Wal Mart Stores Inc's  Brazil business to run its struggling supermarket and convenience store unit, according to a securities filing on Wednesday.UPDATE 2-Wal-Mart Stores to hike pay for 1.2 mln workers in 2016 Jan 20 Wal-Mart Stores Inc said Wednesday that more than 1.2 million employees would get a raise in 2016, and the retailer will allow paid days off to be carried over into the next year as it aims to retain workers amid a tight U.S. labor market.   UPDATE 1-Brazil's GPA taps Argentina boss, ex-Wal Mart head to run supermarketsUPDATE 2-Wal-Mart Stores to hike pay for 1.2 mln workers in 2016 Jan 20 Wal-Mart Stores Inc said Wednesday that more than 1.2 million employees would get a raise in 2016, and the retailer will allow paid days off to be carried over into the next year as it aims to retain workers amid a tight U.S. labor market.  UPDATE 2-Wal-Mart Stores to hike pay for 1.2 mln workers in 2016 Jan 20 Wal-Mart Stores Inc said Wednesday that more than 1.2 million employees would get a raise in 2016, and the retailer will allow paid days off to be carried over into the next year as it aims to retain workers amid a tight U.S. labor market. SAO PAULO, Jan 20 Brazil's largest diversified retailer GPA SA tapped a senior executive in Argentina and the former head of Wal Mart Stores Inc's  Brazil business to run its struggling supermarket and convenience store unit, according to a securities filing on Wednesday.UPDATE 2-Wal-Mart Stores to hike pay for 1.2 mln workers in 2016 Jan 20 Wal-Mart Stores Inc said Wednesday that more than 1.2 million employees would get a raise in 2016, and the retailer will allow paid days off to be carried over into the next year as it aims to retain workers amid a tight U.S. labor market.  SAO PAULO, Jan 20 GPA SA, Brazil's biggest retailer, on Wednesday named Luis Moreno as chief executive of its supermarket and convenience store division and Marcos Samaha as head of operations for the unit, according to a securities filing.UPDATE 1-Brazil's GPA taps Argentina boss, ex-Wal Mart head to run supermarketsUPDATE 2-Wal-Mart Stores to hike pay for 1.2 mln workers in 2016 Jan 20 Wal-Mart Stores Inc said Wednesday that more than 1.2 million employees would get a raise in 2016, and the retailer will allow paid days off to be carried over into the next year as it aims to retain workers amid a tight U.S. labor market.  UPDATE 2-Wal-Mart Stores to hike pay for 1.2 mln workers in 2016 Jan 20 Wal-Mart Stores Inc said Wednesday that more than 1.2 million employees would get a raise in 2016, and the retailer will allow paid days off to be carried over into the next year as it aims to retain workers amid a tight U.S. labor market. SAO PAULO, Jan 20 Brazil's largest diversified retailer GPA SA tapped a senior executive in Argentina and the former head of Wal Mart Stores Inc's  Brazil business to run its struggling supermarket and convenience store unit, according to a securities filing on Wednesday.UPDATE 2-Wal-Mart Stores to hike pay for 1.2 mln workers in 2016 Jan 20 Wal-Mart Stores Inc said Wednesday that more than 1.2 million employees would get a raise in 2016, and the retailer will allow paid days off to be carried over into the next year as it aims to retain workers amid a tight U.S. labor market.    
