T,BRIEF-AT&T; sets quarterly dividend of $0.48/shr * Says dividend is payable on August 1, 2016  Source text for Eikon:  Further company coverage:    (Bengaluru Newsroom; +1 646 223 8780) 
CVX,Australia in sweet spot to meet Asia demand for ultra-light oil   
EQT,EQT launches sale of utility services provider SAG - sourcesEQT launches sale of utility services provider SAG - sources FRANKFURT Buyout group EQT is launching the sale of German utility services provider SAG, which may fetch roughly 1 billion euros  ($1.1 billion), three people familiar with the matter said.  EQT launches sale of utility services provider SAG - sources FRANKFURT Buyout group EQT is launching the sale of German utility services provider SAG, which may fetch roughly 1 billion euros  ($1.1 billion), three people familiar with the matter said. FRANKFURT, June 24 Buyout group EQT is launching the sale of German utility services provider SAG, which may fetch roughly 1 billion euros  ($1.1 billion), three people familiar with the matter said.EQT launches sale of utility services provider SAG - sources FRANKFURT Buyout group EQT is launching the sale of German utility services provider SAG, which may fetch roughly 1 billion euros  ($1.1 billion), three people familiar with the matter said.  
ESRX,Express Scripts shares languish as Anthem dispute weighs NEW YORK, June 24 As a pharmacy benefits manager geared toward holding down prescription costs, Express Scripts would appear to be in a sweet spot with rising political and public pressure on drug prices, but its stock has struggled this year. 
XOM,U.S. states, Rockefellers clash with U.S. House panel on Exxon climate probesUPDATE 1-U.S. states, Rockefellers clash with U.S. House panel on Exxon climate probesU.S. states, Rockefellers clash with U.S. House panel on Exxon climate probes HOUSTON With a number of U.S. states proceeding with investigations of Exxon Mobil Corp's record on climate change, the attorney general of Massachusetts and investment funds of the Rockefeller family on Friday told a Congressional committee it lacked powers to oversee those probes.  U.S. states, Rockefellers clash with U.S. House panel on Exxon climate probes HOUSTON With a number of U.S. states proceeding with investigations of Exxon Mobil Corp's record on climate change, the attorney general of Massachusetts and investment funds of the Rockefeller family on Friday told a Congressional committee it lacked powers to oversee those probes. HOUSTON, June 24 With a number of U.S. states proceeding with investigations of Exxon Mobil Corp's  record on climate change, the attorney general of Massachusetts and investment funds of the Rockefeller family on Friday told a Congressional committee it lacked powers to oversee those probes.U.S. states, Rockefellers clash with U.S. House panel on Exxon climate probes HOUSTON With a number of U.S. states proceeding with investigations of Exxon Mobil Corp's record on climate change, the attorney general of Massachusetts and investment funds of the Rockefeller family on Friday told a Congressional committee it lacked powers to oversee those probes.   UPDATE 1-U.S. states, Rockefellers clash with U.S. House panel on Exxon climate probesU.S. states, Rockefellers clash with U.S. House panel on Exxon climate probes HOUSTON With a number of U.S. states proceeding with investigations of Exxon Mobil Corp's record on climate change, the attorney general of Massachusetts and investment funds of the Rockefeller family on Friday told a Congressional committee it lacked powers to oversee those probes.  U.S. states, Rockefellers clash with U.S. House panel on Exxon climate probes HOUSTON With a number of U.S. states proceeding with investigations of Exxon Mobil Corp's record on climate change, the attorney general of Massachusetts and investment funds of the Rockefeller family on Friday told a Congressional committee it lacked powers to oversee those probes. HOUSTON, June 24 With a number of U.S. states proceeding with investigations of Exxon Mobil Corp's  record on climate change, the attorney general of Massachusetts and investment funds of the Rockefeller family on Friday told a Congressional committee it lacked powers to oversee those probes.U.S. states, Rockefellers clash with U.S. House panel on Exxon climate probes HOUSTON With a number of U.S. states proceeding with investigations of Exxon Mobil Corp's record on climate change, the attorney general of Massachusetts and investment funds of the Rockefeller family on Friday told a Congressional committee it lacked powers to oversee those probes.  HOUSTON, June 24 With many U.S. states proceeding with investigations of Exxon Mobil Corp's  record on climate change, the attorney general of Massachusetts and investment funds of the Rockefeller family on Friday told a Congressional committee it lacked powers to oversee those probes.UPDATE 1-U.S. states, Rockefellers clash with U.S. House panel on Exxon climate probesU.S. states, Rockefellers clash with U.S. House panel on Exxon climate probes HOUSTON With a number of U.S. states proceeding with investigations of Exxon Mobil Corp's record on climate change, the attorney general of Massachusetts and investment funds of the Rockefeller family on Friday told a Congressional committee it lacked powers to oversee those probes.  U.S. states, Rockefellers clash with U.S. House panel on Exxon climate probes HOUSTON With a number of U.S. states proceeding with investigations of Exxon Mobil Corp's record on climate change, the attorney general of Massachusetts and investment funds of the Rockefeller family on Friday told a Congressional committee it lacked powers to oversee those probes. HOUSTON, June 24 With a number of U.S. states proceeding with investigations of Exxon Mobil Corp's  record on climate change, the attorney general of Massachusetts and investment funds of the Rockefeller family on Friday told a Congressional committee it lacked powers to oversee those probes.U.S. states, Rockefellers clash with U.S. House panel on Exxon climate probes HOUSTON With a number of U.S. states proceeding with investigations of Exxon Mobil Corp's record on climate change, the attorney general of Massachusetts and investment funds of the Rockefeller family on Friday told a Congressional committee it lacked powers to oversee those probes.   
GS,Goldman Sachs, Barclays, HSBC downplay Brexit threat LONDON, June 24 Some of the world's largest banks have sought to play down fears of a catastophic hit to Britain's banking sector after the country voted to leave the European Union on Friday. 
HD,Amid 'Brexit' selloff, some fund managers are bargain shopping NEW YORK, June 24 Britain's unexpected decision to leave the European Union spurred a global stock market selloff that has inspired some opportunistic U.S. investors to move in the opposite direction. 
JPM,Foreign exchange markets functioning 'pretty well' -JPMorgan executiveUPDATE 1-JPMorgan post-Brexit plan hinges on tone of discourse in Europe NEW YORK, June 24 JPMorgan Chase & Co is grappling with how much of its business can stay in Britain and a lot will depend on how well European Union and U.K. politicians appear to be getting along.  UPDATE 1-JPMorgan post-Brexit plan hinges on tone of discourse in Europe NEW YORK, June 24 JPMorgan Chase & Co is grappling with how much of its business can stay in Britain and a lot will depend on how well European Union and U.K. politicians appear to be getting along. NEW YORK, June 24 Foreign exchange markets are functioning "pretty well" following the initial shock of Britain's vote to leave the European Union, a senior JPMorgan Chase & Co executive said on Friday.UPDATE 1-JPMorgan post-Brexit plan hinges on tone of discourse in Europe NEW YORK, June 24 JPMorgan Chase & Co is grappling with how much of its business can stay in Britain and a lot will depend on how well European Union and U.K. politicians appear to be getting along.  
TAP,From beer to drugs to cars: Global business laments EU vote LONDON, June 24 Shocked chief executives from Mumbai to Denver woke up on Friday to face tough decisions over how to respond to Britain's vote to leave the European Union. 
MON,EU officials to decide on Roundup herbicide after political impasse BRUSSELS, June 24 An impasse between EU nations on whether to allow Monsanto's Roundup and similar weed-killers to continue to be sold means that the European Commission, rather than national politicians, will decide the issue next week. 
