GS,RPT-EXCLUSIVE-Goldman axing nearly 30 pct of Asia investment banking jobs - sources LONDON, Sept 23 Goldman Sachs is cutting almost 30 percent of its 300 investment banking jobs in Asia outside Japan in response to a slowdown in activity in the region, two sources familiar with the matter told Reuters. 
INTC,R3, 8 banks successfully test Intel blockchain platform for bond trading NEW YORK, Sept 26 U.S.-based financial innovation start-up R3 announced on Monday that it and eight banks, including HSBC and State Street, have successfully tested a blockchain platform powered by Intel Corp technology for bond transactions. 
JNJ,FDA approves J&J;'s autoimmune drug Stelara for Crohn's disease Sept 26 Johnson & Johnson said on Monday that the U.S. Food and Drug Administration approved the company's blockbuster psoriasis drug, Stelara, for use in adults with Crohn's disease. 
MCD,S.Korea KG Group says not chosen to buy McDonald's S.Korea unit -Money Today SEOUL, Sept 26 South Korea conglomerate KG Group said its consortium with NHN Entertainment Corp was not chosen as the preferred bidder to buy McDonald's Corp  South Korean business, a South Korean online publication said on Monday, citing KG Group. 
MSFT,BRIEF-Microsoft and Renault-Nissan alliance signed global multiyear dealRenault, Nissan partner with Microsoft for connected car technology Sept 26 Renault SA's carmaking alliance with Nissan Motor Co is partnering with Microsoft Corp to develop cloud-based services for cars, a step toward the group's plans to build self-driving automobiles by 2020.  Renault, Nissan partner with Microsoft for connected car technology Sept 26 Renault SA's carmaking alliance with Nissan Motor Co is partnering with Microsoft Corp to develop cloud-based services for cars, a step toward the group's plans to build self-driving automobiles by 2020. * Renault-Nissan alliance and Microsoft signed global, multiyear deal to partner on technologies to advance connected driving experiences  Source text for Eikon:  Further company coverage:Renault, Nissan partner with Microsoft for connected car technology Sept 26 Renault SA's carmaking alliance with Nissan Motor Co is partnering with Microsoft Corp to develop cloud-based services for cars, a step toward the group's plans to build self-driving automobiles by 2020.  
MDLZ,Investors urge food companies to shift from meat to plants LONDON, Sept 26 A group of 40 investors managing $1.25 trillion in assets have launched a campaign to encourage 16 global food companies to change the way they source protein for their products to help to reduce environmental and health risks. 
MYL,Mylan reiterates profit on EpiPen two-pack in USBRIEF-Mylan NV sees 2016 sales for EpiPen in U.S. of $1,100 mln - SEC Filing * Mylan NV sees 2016 sales for EpiPen in U.S. $1,100 MLN - SEC Filing  BRIEF-Mylan NV sees 2016 sales for EpiPen in U.S. of $1,100 mln - SEC Filing * Mylan NV sees 2016 sales for EpiPen in U.S. $1,100 MLN - SEC Filing Sept 26 Under fire generic drugmaker Mylan NV  reiterated it makes a net profit of $104, after taxes, for a pair of its EpiPen emergency allergy treatment sold in the United States, the company said in a filing on Monday.BRIEF-Mylan NV sees 2016 sales for EpiPen in U.S. of $1,100 mln - SEC Filing * Mylan NV sees 2016 sales for EpiPen in U.S. $1,100 MLN - SEC Filing  
PFE,BRIEF-Pfizer says it will not pursue splitting into two separate publicly traded companiesPfizer says not to split into twoUS STOCKS-Wall St drops as Pfizer falls; presidential debate eyedPfizer abandons plan to split into two companiesBRIEF-Moody's changes outlook on Pfizer's to stable from negative, affirms ratings * Moody's affirms Pfizer's ratings; changes outlook to stable  BRIEF-Moody's changes outlook on Pfizer's to stable from negative, affirms ratings * Moody's affirms Pfizer's ratings; changes outlook to stable U.S. drugmaker Pfizer Inc, which has been considering a split into two companies for more than two years, said on Monday it would not do so because the move would not create any shareholder value.BRIEF-Moody's changes outlook on Pfizer's to stable from negative, affirms ratings * Moody's affirms Pfizer's ratings; changes outlook to stable   Pfizer abandons plan to split into two companiesBRIEF-Moody's changes outlook on Pfizer's to stable from negative, affirms ratings * Moody's affirms Pfizer's ratings; changes outlook to stable  BRIEF-Moody's changes outlook on Pfizer's to stable from negative, affirms ratings * Moody's affirms Pfizer's ratings; changes outlook to stable U.S. drugmaker Pfizer Inc, which has been considering a split into two companies for more than two years, said on Monday it would not do so because the move would not create any shareholder value.BRIEF-Moody's changes outlook on Pfizer's to stable from negative, affirms ratings * Moody's affirms Pfizer's ratings; changes outlook to stable  * Indexes down: Dow 0.56 pct, S&P; 0.46 pct, Nasdaq 0.61 pct   (Adds details, comments, updates prices)Pfizer abandons plan to split into two companiesBRIEF-Moody's changes outlook on Pfizer's to stable from negative, affirms ratings * Moody's affirms Pfizer's ratings; changes outlook to stable  BRIEF-Moody's changes outlook on Pfizer's to stable from negative, affirms ratings * Moody's affirms Pfizer's ratings; changes outlook to stable U.S. drugmaker Pfizer Inc, which has been considering a split into two companies for more than two years, said on Monday it would not do so because the move would not create any shareholder value.BRIEF-Moody's changes outlook on Pfizer's to stable from negative, affirms ratings * Moody's affirms Pfizer's ratings; changes outlook to stable    US STOCKS-Wall St drops as Pfizer falls; presidential debate eyedPfizer abandons plan to split into two companiesBRIEF-Moody's changes outlook on Pfizer's to stable from negative, affirms ratings * Moody's affirms Pfizer's ratings; changes outlook to stable  BRIEF-Moody's changes outlook on Pfizer's to stable from negative, affirms ratings * Moody's affirms Pfizer's ratings; changes outlook to stable U.S. drugmaker Pfizer Inc, which has been considering a split into two companies for more than two years, said on Monday it would not do so because the move would not create any shareholder value.BRIEF-Moody's changes outlook on Pfizer's to stable from negative, affirms ratings * Moody's affirms Pfizer's ratings; changes outlook to stable   Pfizer abandons plan to split into two companiesBRIEF-Moody's changes outlook on Pfizer's to stable from negative, affirms ratings * Moody's affirms Pfizer's ratings; changes outlook to stable  BRIEF-Moody's changes outlook on Pfizer's to stable from negative, affirms ratings * Moody's affirms Pfizer's ratings; changes outlook to stable U.S. drugmaker Pfizer Inc, which has been considering a split into two companies for more than two years, said on Monday it would not do so because the move would not create any shareholder value.BRIEF-Moody's changes outlook on Pfizer's to stable from negative, affirms ratings * Moody's affirms Pfizer's ratings; changes outlook to stable  * Indexes down: Dow 0.56 pct, S&P; 0.46 pct, Nasdaq 0.61 pct   (Adds details, comments, updates prices)Pfizer abandons plan to split into two companiesBRIEF-Moody's changes outlook on Pfizer's to stable from negative, affirms ratings * Moody's affirms Pfizer's ratings; changes outlook to stable  BRIEF-Moody's changes outlook on Pfizer's to stable from negative, affirms ratings * Moody's affirms Pfizer's ratings; changes outlook to stable U.S. drugmaker Pfizer Inc, which has been considering a split into two companies for more than two years, said on Monday it would not do so because the move would not create any shareholder value.BRIEF-Moody's changes outlook on Pfizer's to stable from negative, affirms ratings * Moody's affirms Pfizer's ratings; changes outlook to stable   Sept 26 U.S. drugmaker Pfizer Inc said on Monday it had decided not to separate into two publicly traded companies at this time.US STOCKS-Wall St drops as Pfizer falls; presidential debate eyedPfizer abandons plan to split into two companiesBRIEF-Moody's changes outlook on Pfizer's to stable from negative, affirms ratings * Moody's affirms Pfizer's ratings; changes outlook to stable  BRIEF-Moody's changes outlook on Pfizer's to stable from negative, affirms ratings * Moody's affirms Pfizer's ratings; changes outlook to stable U.S. drugmaker Pfizer Inc, which has been considering a split into two companies for more than two years, said on Monday it would not do so because the move would not create any shareholder value.BRIEF-Moody's changes outlook on Pfizer's to stable from negative, affirms ratings * Moody's affirms Pfizer's ratings; changes outlook to stable   Pfizer abandons plan to split into two companiesBRIEF-Moody's changes outlook on Pfizer's to stable from negative, affirms ratings * Moody's affirms Pfizer's ratings; changes outlook to stable  BRIEF-Moody's changes outlook on Pfizer's to stable from negative, affirms ratings * Moody's affirms Pfizer's ratings; changes outlook to stable U.S. drugmaker Pfizer Inc, which has been considering a split into two companies for more than two years, said on Monday it would not do so because the move would not create any shareholder value.BRIEF-Moody's changes outlook on Pfizer's to stable from negative, affirms ratings * Moody's affirms Pfizer's ratings; changes outlook to stable  * Indexes down: Dow 0.56 pct, S&P; 0.46 pct, Nasdaq 0.61 pct   (Adds details, comments, updates prices)Pfizer abandons plan to split into two companiesBRIEF-Moody's changes outlook on Pfizer's to stable from negative, affirms ratings * Moody's affirms Pfizer's ratings; changes outlook to stable  BRIEF-Moody's changes outlook on Pfizer's to stable from negative, affirms ratings * Moody's affirms Pfizer's ratings; changes outlook to stable U.S. drugmaker Pfizer Inc, which has been considering a split into two companies for more than two years, said on Monday it would not do so because the move would not create any shareholder value.BRIEF-Moody's changes outlook on Pfizer's to stable from negative, affirms ratings * Moody's affirms Pfizer's ratings; changes outlook to stable     Pfizer says not to split into twoUS STOCKS-Wall St drops as Pfizer falls; presidential debate eyedPfizer abandons plan to split into two companiesBRIEF-Moody's changes outlook on Pfizer's to stable from negative, affirms ratings * Moody's affirms Pfizer's ratings; changes outlook to stable  BRIEF-Moody's changes outlook on Pfizer's to stable from negative, affirms ratings * Moody's affirms Pfizer's ratings; changes outlook to stable U.S. drugmaker Pfizer Inc, which has been considering a split into two companies for more than two years, said on Monday it would not do so because the move would not create any shareholder value.BRIEF-Moody's changes outlook on Pfizer's to stable from negative, affirms ratings * Moody's affirms Pfizer's ratings; changes outlook to stable   Pfizer abandons plan to split into two companiesBRIEF-Moody's changes outlook on Pfizer's to stable from negative, affirms ratings * Moody's affirms Pfizer's ratings; changes outlook to stable  BRIEF-Moody's changes outlook on Pfizer's to stable from negative, affirms ratings * Moody's affirms Pfizer's ratings; changes outlook to stable U.S. drugmaker Pfizer Inc, which has been considering a split into two companies for more than two years, said on Monday it would not do so because the move would not create any shareholder value.BRIEF-Moody's changes outlook on Pfizer's to stable from negative, affirms ratings * Moody's affirms Pfizer's ratings; changes outlook to stable  * Indexes down: Dow 0.56 pct, S&P; 0.46 pct, Nasdaq 0.61 pct   (Adds details, comments, updates prices)Pfizer abandons plan to split into two companiesBRIEF-Moody's changes outlook on Pfizer's to stable from negative, affirms ratings * Moody's affirms Pfizer's ratings; changes outlook to stable  BRIEF-Moody's changes outlook on Pfizer's to stable from negative, affirms ratings * Moody's affirms Pfizer's ratings; changes outlook to stable U.S. drugmaker Pfizer Inc, which has been considering a split into two companies for more than two years, said on Monday it would not do so because the move would not create any shareholder value.BRIEF-Moody's changes outlook on Pfizer's to stable from negative, affirms ratings * Moody's affirms Pfizer's ratings; changes outlook to stable    US STOCKS-Wall St drops as Pfizer falls; presidential debate eyedPfizer abandons plan to split into two companiesBRIEF-Moody's changes outlook on Pfizer's to stable from negative, affirms ratings * Moody's affirms Pfizer's ratings; changes outlook to stable  BRIEF-Moody's changes outlook on Pfizer's to stable from negative, affirms ratings * Moody's affirms Pfizer's ratings; changes outlook to stable U.S. drugmaker Pfizer Inc, which has been considering a split into two companies for more than two years, said on Monday it would not do so because the move would not create any shareholder value.BRIEF-Moody's changes outlook on Pfizer's to stable from negative, affirms ratings * Moody's affirms Pfizer's ratings; changes outlook to stable   Pfizer abandons plan to split into two companiesBRIEF-Moody's changes outlook on Pfizer's to stable from negative, affirms ratings * Moody's affirms Pfizer's ratings; changes outlook to stable  BRIEF-Moody's changes outlook on Pfizer's to stable from negative, affirms ratings * Moody's affirms Pfizer's ratings; changes outlook to stable U.S. drugmaker Pfizer Inc, which has been considering a split into two companies for more than two years, said on Monday it would not do so because the move would not create any shareholder value.BRIEF-Moody's changes outlook on Pfizer's to stable from negative, affirms ratings * Moody's affirms Pfizer's ratings; changes outlook to stable  * Indexes down: Dow 0.56 pct, S&P; 0.46 pct, Nasdaq 0.61 pct   (Adds details, comments, updates prices)Pfizer abandons plan to split into two companiesBRIEF-Moody's changes outlook on Pfizer's to stable from negative, affirms ratings * Moody's affirms Pfizer's ratings; changes outlook to stable  BRIEF-Moody's changes outlook on Pfizer's to stable from negative, affirms ratings * Moody's affirms Pfizer's ratings; changes outlook to stable U.S. drugmaker Pfizer Inc, which has been considering a split into two companies for more than two years, said on Monday it would not do so because the move would not create any shareholder value.BRIEF-Moody's changes outlook on Pfizer's to stable from negative, affirms ratings * Moody's affirms Pfizer's ratings; changes outlook to stable   Sept 26 U.S. drugmaker Pfizer Inc said on Monday it had decided not to separate into two publicly traded companies at this time.US STOCKS-Wall St drops as Pfizer falls; presidential debate eyedPfizer abandons plan to split into two companiesBRIEF-Moody's changes outlook on Pfizer's to stable from negative, affirms ratings * Moody's affirms Pfizer's ratings; changes outlook to stable  BRIEF-Moody's changes outlook on Pfizer's to stable from negative, affirms ratings * Moody's affirms Pfizer's ratings; changes outlook to stable U.S. drugmaker Pfizer Inc, which has been considering a split into two companies for more than two years, said on Monday it would not do so because the move would not create any shareholder value.BRIEF-Moody's changes outlook on Pfizer's to stable from negative, affirms ratings * Moody's affirms Pfizer's ratings; changes outlook to stable   Pfizer abandons plan to split into two companiesBRIEF-Moody's changes outlook on Pfizer's to stable from negative, affirms ratings * Moody's affirms Pfizer's ratings; changes outlook to stable  BRIEF-Moody's changes outlook on Pfizer's to stable from negative, affirms ratings * Moody's affirms Pfizer's ratings; changes outlook to stable U.S. drugmaker Pfizer Inc, which has been considering a split into two companies for more than two years, said on Monday it would not do so because the move would not create any shareholder value.BRIEF-Moody's changes outlook on Pfizer's to stable from negative, affirms ratings * Moody's affirms Pfizer's ratings; changes outlook to stable  * Indexes down: Dow 0.56 pct, S&P; 0.46 pct, Nasdaq 0.61 pct   (Adds details, comments, updates prices)Pfizer abandons plan to split into two companiesBRIEF-Moody's changes outlook on Pfizer's to stable from negative, affirms ratings * Moody's affirms Pfizer's ratings; changes outlook to stable  BRIEF-Moody's changes outlook on Pfizer's to stable from negative, affirms ratings * Moody's affirms Pfizer's ratings; changes outlook to stable U.S. drugmaker Pfizer Inc, which has been considering a split into two companies for more than two years, said on Monday it would not do so because the move would not create any shareholder value.BRIEF-Moody's changes outlook on Pfizer's to stable from negative, affirms ratings * Moody's affirms Pfizer's ratings; changes outlook to stable    * Company to continue to operate as one company with two distinct and complementary businessesPfizer says not to split into twoUS STOCKS-Wall St drops as Pfizer falls; presidential debate eyedPfizer abandons plan to split into two companiesBRIEF-Moody's changes outlook on Pfizer's to stable from negative, affirms ratings * Moody's affirms Pfizer's ratings; changes outlook to stable  BRIEF-Moody's changes outlook on Pfizer's to stable from negative, affirms ratings * Moody's affirms Pfizer's ratings; changes outlook to stable U.S. drugmaker Pfizer Inc, which has been considering a split into two companies for more than two years, said on Monday it would not do so because the move would not create any shareholder value.BRIEF-Moody's changes outlook on Pfizer's to stable from negative, affirms ratings * Moody's affirms Pfizer's ratings; changes outlook to stable   Pfizer abandons plan to split into two companiesBRIEF-Moody's changes outlook on Pfizer's to stable from negative, affirms ratings * Moody's affirms Pfizer's ratings; changes outlook to stable  BRIEF-Moody's changes outlook on Pfizer's to stable from negative, affirms ratings * Moody's affirms Pfizer's ratings; changes outlook to stable U.S. drugmaker Pfizer Inc, which has been considering a split into two companies for more than two years, said on Monday it would not do so because the move would not create any shareholder value.BRIEF-Moody's changes outlook on Pfizer's to stable from negative, affirms ratings * Moody's affirms Pfizer's ratings; changes outlook to stable  * Indexes down: Dow 0.56 pct, S&P; 0.46 pct, Nasdaq 0.61 pct   (Adds details, comments, updates prices)Pfizer abandons plan to split into two companiesBRIEF-Moody's changes outlook on Pfizer's to stable from negative, affirms ratings * Moody's affirms Pfizer's ratings; changes outlook to stable  BRIEF-Moody's changes outlook on Pfizer's to stable from negative, affirms ratings * Moody's affirms Pfizer's ratings; changes outlook to stable U.S. drugmaker Pfizer Inc, which has been considering a split into two companies for more than two years, said on Monday it would not do so because the move would not create any shareholder value.BRIEF-Moody's changes outlook on Pfizer's to stable from negative, affirms ratings * Moody's affirms Pfizer's ratings; changes outlook to stable    US STOCKS-Wall St drops as Pfizer falls; presidential debate eyedPfizer abandons plan to split into two companiesBRIEF-Moody's changes outlook on Pfizer's to stable from negative, affirms ratings * Moody's affirms Pfizer's ratings; changes outlook to stable  BRIEF-Moody's changes outlook on Pfizer's to stable from negative, affirms ratings * Moody's affirms Pfizer's ratings; changes outlook to stable U.S. drugmaker Pfizer Inc, which has been considering a split into two companies for more than two years, said on Monday it would not do so because the move would not create any shareholder value.BRIEF-Moody's changes outlook on Pfizer's to stable from negative, affirms ratings * Moody's affirms Pfizer's ratings; changes outlook to stable   Pfizer abandons plan to split into two companiesBRIEF-Moody's changes outlook on Pfizer's to stable from negative, affirms ratings * Moody's affirms Pfizer's ratings; changes outlook to stable  BRIEF-Moody's changes outlook on Pfizer's to stable from negative, affirms ratings * Moody's affirms Pfizer's ratings; changes outlook to stable U.S. drugmaker Pfizer Inc, which has been considering a split into two companies for more than two years, said on Monday it would not do so because the move would not create any shareholder value.BRIEF-Moody's changes outlook on Pfizer's to stable from negative, affirms ratings * Moody's affirms Pfizer's ratings; changes outlook to stable  * Indexes down: Dow 0.56 pct, S&P; 0.46 pct, Nasdaq 0.61 pct   (Adds details, comments, updates prices)Pfizer abandons plan to split into two companiesBRIEF-Moody's changes outlook on Pfizer's to stable from negative, affirms ratings * Moody's affirms Pfizer's ratings; changes outlook to stable  BRIEF-Moody's changes outlook on Pfizer's to stable from negative, affirms ratings * Moody's affirms Pfizer's ratings; changes outlook to stable U.S. drugmaker Pfizer Inc, which has been considering a split into two companies for more than two years, said on Monday it would not do so because the move would not create any shareholder value.BRIEF-Moody's changes outlook on Pfizer's to stable from negative, affirms ratings * Moody's affirms Pfizer's ratings; changes outlook to stable   Sept 26 U.S. drugmaker Pfizer Inc said on Monday it had decided not to separate into two publicly traded companies at this time.US STOCKS-Wall St drops as Pfizer falls; presidential debate eyedPfizer abandons plan to split into two companiesBRIEF-Moody's changes outlook on Pfizer's to stable from negative, affirms ratings * Moody's affirms Pfizer's ratings; changes outlook to stable  BRIEF-Moody's changes outlook on Pfizer's to stable from negative, affirms ratings * Moody's affirms Pfizer's ratings; changes outlook to stable U.S. drugmaker Pfizer Inc, which has been considering a split into two companies for more than two years, said on Monday it would not do so because the move would not create any shareholder value.BRIEF-Moody's changes outlook on Pfizer's to stable from negative, affirms ratings * Moody's affirms Pfizer's ratings; changes outlook to stable   Pfizer abandons plan to split into two companiesBRIEF-Moody's changes outlook on Pfizer's to stable from negative, affirms ratings * Moody's affirms Pfizer's ratings; changes outlook to stable  BRIEF-Moody's changes outlook on Pfizer's to stable from negative, affirms ratings * Moody's affirms Pfizer's ratings; changes outlook to stable U.S. drugmaker Pfizer Inc, which has been considering a split into two companies for more than two years, said on Monday it would not do so because the move would not create any shareholder value.BRIEF-Moody's changes outlook on Pfizer's to stable from negative, affirms ratings * Moody's affirms Pfizer's ratings; changes outlook to stable  * Indexes down: Dow 0.56 pct, S&P; 0.46 pct, Nasdaq 0.61 pct   (Adds details, comments, updates prices)Pfizer abandons plan to split into two companiesBRIEF-Moody's changes outlook on Pfizer's to stable from negative, affirms ratings * Moody's affirms Pfizer's ratings; changes outlook to stable  BRIEF-Moody's changes outlook on Pfizer's to stable from negative, affirms ratings * Moody's affirms Pfizer's ratings; changes outlook to stable U.S. drugmaker Pfizer Inc, which has been considering a split into two companies for more than two years, said on Monday it would not do so because the move would not create any shareholder value.BRIEF-Moody's changes outlook on Pfizer's to stable from negative, affirms ratings * Moody's affirms Pfizer's ratings; changes outlook to stable     
