MRK,BRIEF-Merck Q1 earnings per share $0.40Merck sales disappoint as Januvia, Remicade fall shortRPT-UPDATE 2-Merck sales disappoint as Januvia, Remicade fall shortBRIEF-Merck says EU manufacturer of Zepatier cited for recordkeeping lapses * Says on conference call that third party manufacturer of its new Zepatier hepatitis C drug cited by EU regulators for inadquate record keeping  BRIEF-Merck says EU manufacturer of Zepatier cited for recordkeeping lapses * Says on conference call that third party manufacturer of its new Zepatier hepatitis C drug cited by EU regulators for inadquate record keeping May 5 Merck & Co Inc on Thursday reported lower-than-expected quarterly revenue, hurt by disappointing sales of its Januvia diabetes treatment and Remicade arthritis drug.BRIEF-Merck says EU manufacturer of Zepatier cited for recordkeeping lapses * Says on conference call that third party manufacturer of its new Zepatier hepatitis C drug cited by EU regulators for inadquate record keeping   RPT-UPDATE 2-Merck sales disappoint as Januvia, Remicade fall shortBRIEF-Merck says EU manufacturer of Zepatier cited for recordkeeping lapses * Says on conference call that third party manufacturer of its new Zepatier hepatitis C drug cited by EU regulators for inadquate record keeping  BRIEF-Merck says EU manufacturer of Zepatier cited for recordkeeping lapses * Says on conference call that third party manufacturer of its new Zepatier hepatitis C drug cited by EU regulators for inadquate record keeping May 5 Merck & Co Inc on Thursday reported lower-than-expected quarterly revenue, hurt by disappointing sales of its Januvia diabetes treatment and Remicade arthritis drug.BRIEF-Merck says EU manufacturer of Zepatier cited for recordkeeping lapses * Says on conference call that third party manufacturer of its new Zepatier hepatitis C drug cited by EU regulators for inadquate record keeping  Merck & Co Inc  on Thursday reported lower-than-expected quarterly revenue, hurt by disappointing sales of its Januvia diabetes treatment and Remicade arthritis drug.RPT-UPDATE 2-Merck sales disappoint as Januvia, Remicade fall shortBRIEF-Merck says EU manufacturer of Zepatier cited for recordkeeping lapses * Says on conference call that third party manufacturer of its new Zepatier hepatitis C drug cited by EU regulators for inadquate record keeping  BRIEF-Merck says EU manufacturer of Zepatier cited for recordkeeping lapses * Says on conference call that third party manufacturer of its new Zepatier hepatitis C drug cited by EU regulators for inadquate record keeping May 5 Merck & Co Inc on Thursday reported lower-than-expected quarterly revenue, hurt by disappointing sales of its Januvia diabetes treatment and Remicade arthritis drug.BRIEF-Merck says EU manufacturer of Zepatier cited for recordkeeping lapses * Says on conference call that third party manufacturer of its new Zepatier hepatitis C drug cited by EU regulators for inadquate record keeping    Merck sales disappoint as Januvia, Remicade fall shortRPT-UPDATE 2-Merck sales disappoint as Januvia, Remicade fall shortBRIEF-Merck says EU manufacturer of Zepatier cited for recordkeeping lapses * Says on conference call that third party manufacturer of its new Zepatier hepatitis C drug cited by EU regulators for inadquate record keeping  BRIEF-Merck says EU manufacturer of Zepatier cited for recordkeeping lapses * Says on conference call that third party manufacturer of its new Zepatier hepatitis C drug cited by EU regulators for inadquate record keeping May 5 Merck & Co Inc on Thursday reported lower-than-expected quarterly revenue, hurt by disappointing sales of its Januvia diabetes treatment and Remicade arthritis drug.BRIEF-Merck says EU manufacturer of Zepatier cited for recordkeeping lapses * Says on conference call that third party manufacturer of its new Zepatier hepatitis C drug cited by EU regulators for inadquate record keeping   RPT-UPDATE 2-Merck sales disappoint as Januvia, Remicade fall shortBRIEF-Merck says EU manufacturer of Zepatier cited for recordkeeping lapses * Says on conference call that third party manufacturer of its new Zepatier hepatitis C drug cited by EU regulators for inadquate record keeping  BRIEF-Merck says EU manufacturer of Zepatier cited for recordkeeping lapses * Says on conference call that third party manufacturer of its new Zepatier hepatitis C drug cited by EU regulators for inadquate record keeping May 5 Merck & Co Inc on Thursday reported lower-than-expected quarterly revenue, hurt by disappointing sales of its Januvia diabetes treatment and Remicade arthritis drug.BRIEF-Merck says EU manufacturer of Zepatier cited for recordkeeping lapses * Says on conference call that third party manufacturer of its new Zepatier hepatitis C drug cited by EU regulators for inadquate record keeping  Merck & Co Inc  on Thursday reported lower-than-expected quarterly revenue, hurt by disappointing sales of its Januvia diabetes treatment and Remicade arthritis drug.RPT-UPDATE 2-Merck sales disappoint as Januvia, Remicade fall shortBRIEF-Merck says EU manufacturer of Zepatier cited for recordkeeping lapses * Says on conference call that third party manufacturer of its new Zepatier hepatitis C drug cited by EU regulators for inadquate record keeping  BRIEF-Merck says EU manufacturer of Zepatier cited for recordkeeping lapses * Says on conference call that third party manufacturer of its new Zepatier hepatitis C drug cited by EU regulators for inadquate record keeping May 5 Merck & Co Inc on Thursday reported lower-than-expected quarterly revenue, hurt by disappointing sales of its Januvia diabetes treatment and Remicade arthritis drug.BRIEF-Merck says EU manufacturer of Zepatier cited for recordkeeping lapses * Says on conference call that third party manufacturer of its new Zepatier hepatitis C drug cited by EU regulators for inadquate record keeping   * Q1 earnings per share view $0.85 -- Thomson Reuters I/B/E/SMerck sales disappoint as Januvia, Remicade fall shortRPT-UPDATE 2-Merck sales disappoint as Januvia, Remicade fall shortBRIEF-Merck says EU manufacturer of Zepatier cited for recordkeeping lapses * Says on conference call that third party manufacturer of its new Zepatier hepatitis C drug cited by EU regulators for inadquate record keeping  BRIEF-Merck says EU manufacturer of Zepatier cited for recordkeeping lapses * Says on conference call that third party manufacturer of its new Zepatier hepatitis C drug cited by EU regulators for inadquate record keeping May 5 Merck & Co Inc on Thursday reported lower-than-expected quarterly revenue, hurt by disappointing sales of its Januvia diabetes treatment and Remicade arthritis drug.BRIEF-Merck says EU manufacturer of Zepatier cited for recordkeeping lapses * Says on conference call that third party manufacturer of its new Zepatier hepatitis C drug cited by EU regulators for inadquate record keeping   RPT-UPDATE 2-Merck sales disappoint as Januvia, Remicade fall shortBRIEF-Merck says EU manufacturer of Zepatier cited for recordkeeping lapses * Says on conference call that third party manufacturer of its new Zepatier hepatitis C drug cited by EU regulators for inadquate record keeping  BRIEF-Merck says EU manufacturer of Zepatier cited for recordkeeping lapses * Says on conference call that third party manufacturer of its new Zepatier hepatitis C drug cited by EU regulators for inadquate record keeping May 5 Merck & Co Inc on Thursday reported lower-than-expected quarterly revenue, hurt by disappointing sales of its Januvia diabetes treatment and Remicade arthritis drug.BRIEF-Merck says EU manufacturer of Zepatier cited for recordkeeping lapses * Says on conference call that third party manufacturer of its new Zepatier hepatitis C drug cited by EU regulators for inadquate record keeping  Merck & Co Inc  on Thursday reported lower-than-expected quarterly revenue, hurt by disappointing sales of its Januvia diabetes treatment and Remicade arthritis drug.RPT-UPDATE 2-Merck sales disappoint as Januvia, Remicade fall shortBRIEF-Merck says EU manufacturer of Zepatier cited for recordkeeping lapses * Says on conference call that third party manufacturer of its new Zepatier hepatitis C drug cited by EU regulators for inadquate record keeping  BRIEF-Merck says EU manufacturer of Zepatier cited for recordkeeping lapses * Says on conference call that third party manufacturer of its new Zepatier hepatitis C drug cited by EU regulators for inadquate record keeping May 5 Merck & Co Inc on Thursday reported lower-than-expected quarterly revenue, hurt by disappointing sales of its Januvia diabetes treatment and Remicade arthritis drug.BRIEF-Merck says EU manufacturer of Zepatier cited for recordkeeping lapses * Says on conference call that third party manufacturer of its new Zepatier hepatitis C drug cited by EU regulators for inadquate record keeping    
MYL,BRIEF-Mylan launches generic version of Novartis' hypertension drug * u.s. Launch of hydralazine hydrochloride injection usp, 20 mg/ml  Source text for Eikon:  Further company coverage:    (Bengaluru Newsroom +1-646-223-8780) 
ORCL,Ford invests $182.2 million in software company Pivotal SAN FRANCISCO Ford Motor Co  is investing $182.2 million in San Francisco-based Pivotal Software, underscoring the pressure carmakers face to boost their technology platforms given the rise of connected and self-driving cars. 
PKI,PerkinElmer raises 2016 forecast after strong first quarter PerkinElmer Inc bounced back from a disappointing quarter with a strong start to the year, as the scientific instruments maker reported higher-than-expected first-quarter profit and raised its full-year earnings forecast by 10 cents. 
PWR,BRIEF-Dycom Industries files amended complaint against Quanta Services * Dycom industries, inc. Files amended complaint against quanta services, inc. For breach of contract 
REGN,BRIEF-Regeneron reports Q1 adj. earnings per share $2.57 * Regeneron reports first quarter 2016 financial and operating results 
TDC,BRIEF-Teradata names Victor Lund CEOBRIEF-Teradata Q1 loss per share $0.36 * Q1 earnings per share view $0.37 -- Thomson Reuters I/B/E/S  BRIEF-Teradata Q1 loss per share $0.36 * Q1 earnings per share view $0.37 -- Thomson Reuters I/B/E/S * Elected Victor Lund , a member of Teradata's board since september 2007 , as president and chief executive officerBRIEF-Teradata Q1 loss per share $0.36 * Q1 earnings per share view $0.37 -- Thomson Reuters I/B/E/S  
FOXA,Ex-Venezuela parliament head sues News Corp over drug articleEx-Venezuela parliament head sues News Corp over drug article NEW YORK The former head of Venezuela's National Assembly filed a lawsuit on Thursday accusing the Wall Street Journal of libeling him in an article in which it was reported that he was the target of a U.S. drug trafficking probe.  Ex-Venezuela parliament head sues News Corp over drug article NEW YORK The former head of Venezuela's National Assembly filed a lawsuit on Thursday accusing the Wall Street Journal of libeling him in an article in which it was reported that he was the target of a U.S. drug trafficking probe. NEW YORK The former head of Venezuela's National Assembly filed a lawsuit on Thursday accusing the Wall Street Journal of libeling him in an article in which it was reported that he was the target of a U.S. drug trafficking probe.Ex-Venezuela parliament head sues News Corp over drug article NEW YORK The former head of Venezuela's National Assembly filed a lawsuit on Thursday accusing the Wall Street Journal of libeling him in an article in which it was reported that he was the target of a U.S. drug trafficking probe.  
FOX,Ex-Venezuela parliament head sues News Corp over drug articleEx-Venezuela parliament head sues News Corp over drug article NEW YORK The former head of Venezuela's National Assembly filed a lawsuit on Thursday accusing the Wall Street Journal of libeling him in an article in which it was reported that he was the target of a U.S. drug trafficking probe.  Ex-Venezuela parliament head sues News Corp over drug article NEW YORK The former head of Venezuela's National Assembly filed a lawsuit on Thursday accusing the Wall Street Journal of libeling him in an article in which it was reported that he was the target of a U.S. drug trafficking probe. NEW YORK The former head of Venezuela's National Assembly filed a lawsuit on Thursday accusing the Wall Street Journal of libeling him in an article in which it was reported that he was the target of a U.S. drug trafficking probe.Ex-Venezuela parliament head sues News Corp over drug article NEW YORK The former head of Venezuela's National Assembly filed a lawsuit on Thursday accusing the Wall Street Journal of libeling him in an article in which it was reported that he was the target of a U.S. drug trafficking probe.  
UPS,BRIEF-UPS says shareowners didn't approve proposal that would have required more disclosure concerning co's lobbying activitiesBRIEF-United Parcel Service declares qtrly dividend of $0.78 per share * Declared a regular quarterly dividend of $0.78 per share on all outstanding Class A and Class B shares  Source text for Eikon:  Further company coverage:    (Bengaluru Newsroom: +1-646-223-8780)  BRIEF-United Parcel Service declares qtrly dividend of $0.78 per share * Declared a regular quarterly dividend of $0.78 per share on all outstanding Class A and Class B shares  Source text for Eikon:  Further company coverage:    (Bengaluru Newsroom: +1-646-223-8780) * Shareowners rejected proposal requiring board to reduce voting power of class A stock from 10 votes/share to 1 vote/shareBRIEF-United Parcel Service declares qtrly dividend of $0.78 per share * Declared a regular quarterly dividend of $0.78 per share on all outstanding Class A and Class B shares  Source text for Eikon:  Further company coverage:    (Bengaluru Newsroom: +1-646-223-8780)  
VZ,Striking union workers protest at Verizon shareholder meeting Dozens of Verizon Communications Inc  landline workers, on strike since mid-April after contract talks hit an impasse, marched on the company's annual shareholder meeting in Albuquerque, New Mexico, on Thursday and several people were arrested for blocking traffic, unions said. 
WBA,BRIEF-Amerisourcebergen announces 3-year extension of strategic relationship with Walgreens Boots Alliance * Amerisourcebergen announces three year extension of strategic, long-term relationship with walgreens boots alliance 
