CBS,UPDATE 1-Viacom receives interest for Paramount minority stake-WSJ March 17 Viacom Inc has received interest from three dozen companies for a minority stake in its Paramount Pictures studio, Chief Executive Philippe Dauman said in an interview with the Wall Street Journal. 
CSCO,Cisco to invest $100 mln in India's digital push NEW DELHI, March 18 Cisco Systems Inc  will invest over $100 million in India to support the country's ambitious plan to connect thousands of its villages to the internet and create jobs, Executive Chairman John Chambers said on Friday. 
CMCSA,UPDATE 2-U.S. FCC says it receives 104 bids to participate in spectrum auction WASHINGTON/NEW YORK March 18 The U.S. Federal Communications Commission said on Friday that it had received 104 applications to take part in an auction of valuable low-frequency airwaves relinquished by TV broadcasters,     including many wireless companies who want to use the airwaves to build new networks or improve existing coverage. 
XOM,BRIEF-Upset at Exxon's Torrance refinery delays critical startup activities HOUSTON, March 18 A power failure on Wednesday at Exxon Mobil's 149,500 barrel per day Torrance refinery in Los Angeles is delaying restart activities that must be complete before PBF Energy acquires the facility this year. 
F,BRIEF-Ford CEO's compensation jumped 17 pct to $17.4 mln in 2015CORRECTED-Ford CEO's compensation jumped 17 pct to $17.4 million in 2015BRIEF-Ford CEO's compensation jumped 17 pct to $17.4 mln in 2015UPDATE 1-Ford CEO's compensation jumped 17 pct to $17.4 million in 2015 DETROIT, March 18 Ford Motor Co Chief Executive Officer Mark Fields' salary, bonus and stock awards jumped 17 percent to $17.4 million in 2015, a year in which the auto maker earned a record pretax profit, the company said on Friday.  UPDATE 1-Ford CEO's compensation jumped 17 pct to $17.4 million in 2015 DETROIT, March 18 Ford Motor Co Chief Executive Officer Mark Fields' salary, bonus and stock awards jumped 17 percent to $17.4 million in 2015, a year in which the auto maker earned a record pretax profit, the company said on Friday. * Executive Chairman Bill Ford's 2015 compensation including salary, bonus and stock rose 1.6 percent to $10.07 millionUPDATE 1-Ford CEO's compensation jumped 17 pct to $17.4 million in 2015 DETROIT, March 18 Ford Motor Co Chief Executive Officer Mark Fields' salary, bonus and stock awards jumped 17 percent to $17.4 million in 2015, a year in which the auto maker earned a record pretax profit, the company said on Friday.   BRIEF-Ford CEO's compensation jumped 17 pct to $17.4 mln in 2015UPDATE 1-Ford CEO's compensation jumped 17 pct to $17.4 million in 2015 DETROIT, March 18 Ford Motor Co Chief Executive Officer Mark Fields' salary, bonus and stock awards jumped 17 percent to $17.4 million in 2015, a year in which the auto maker earned a record pretax profit, the company said on Friday.  UPDATE 1-Ford CEO's compensation jumped 17 pct to $17.4 million in 2015 DETROIT, March 18 Ford Motor Co Chief Executive Officer Mark Fields' salary, bonus and stock awards jumped 17 percent to $17.4 million in 2015, a year in which the auto maker earned a record pretax profit, the company said on Friday. * Executive Chairman Bill Ford's 2015 compensation including salary, bonus and stock rose 1.6 percent to $10.07 millionUPDATE 1-Ford CEO's compensation jumped 17 pct to $17.4 million in 2015 DETROIT, March 18 Ford Motor Co Chief Executive Officer Mark Fields' salary, bonus and stock awards jumped 17 percent to $17.4 million in 2015, a year in which the auto maker earned a record pretax profit, the company said on Friday.  DETROIT, March 18 Ford Motor Co Chief Executive Officer Mark Fields' salary, bonus and stock awards jumped 17 percent to $17.4 million in 2015, a year in which the auto maker earned a record pretax profit, the company said on Friday.BRIEF-Ford CEO's compensation jumped 17 pct to $17.4 mln in 2015UPDATE 1-Ford CEO's compensation jumped 17 pct to $17.4 million in 2015 DETROIT, March 18 Ford Motor Co Chief Executive Officer Mark Fields' salary, bonus and stock awards jumped 17 percent to $17.4 million in 2015, a year in which the auto maker earned a record pretax profit, the company said on Friday.  UPDATE 1-Ford CEO's compensation jumped 17 pct to $17.4 million in 2015 DETROIT, March 18 Ford Motor Co Chief Executive Officer Mark Fields' salary, bonus and stock awards jumped 17 percent to $17.4 million in 2015, a year in which the auto maker earned a record pretax profit, the company said on Friday. * Executive Chairman Bill Ford's 2015 compensation including salary, bonus and stock rose 1.6 percent to $10.07 millionUPDATE 1-Ford CEO's compensation jumped 17 pct to $17.4 million in 2015 DETROIT, March 18 Ford Motor Co Chief Executive Officer Mark Fields' salary, bonus and stock awards jumped 17 percent to $17.4 million in 2015, a year in which the auto maker earned a record pretax profit, the company said on Friday.    CORRECTED-Ford CEO's compensation jumped 17 pct to $17.4 million in 2015BRIEF-Ford CEO's compensation jumped 17 pct to $17.4 mln in 2015UPDATE 1-Ford CEO's compensation jumped 17 pct to $17.4 million in 2015 DETROIT, March 18 Ford Motor Co Chief Executive Officer Mark Fields' salary, bonus and stock awards jumped 17 percent to $17.4 million in 2015, a year in which the auto maker earned a record pretax profit, the company said on Friday.  UPDATE 1-Ford CEO's compensation jumped 17 pct to $17.4 million in 2015 DETROIT, March 18 Ford Motor Co Chief Executive Officer Mark Fields' salary, bonus and stock awards jumped 17 percent to $17.4 million in 2015, a year in which the auto maker earned a record pretax profit, the company said on Friday. * Executive Chairman Bill Ford's 2015 compensation including salary, bonus and stock rose 1.6 percent to $10.07 millionUPDATE 1-Ford CEO's compensation jumped 17 pct to $17.4 million in 2015 DETROIT, March 18 Ford Motor Co Chief Executive Officer Mark Fields' salary, bonus and stock awards jumped 17 percent to $17.4 million in 2015, a year in which the auto maker earned a record pretax profit, the company said on Friday.   BRIEF-Ford CEO's compensation jumped 17 pct to $17.4 mln in 2015UPDATE 1-Ford CEO's compensation jumped 17 pct to $17.4 million in 2015 DETROIT, March 18 Ford Motor Co Chief Executive Officer Mark Fields' salary, bonus and stock awards jumped 17 percent to $17.4 million in 2015, a year in which the auto maker earned a record pretax profit, the company said on Friday.  UPDATE 1-Ford CEO's compensation jumped 17 pct to $17.4 million in 2015 DETROIT, March 18 Ford Motor Co Chief Executive Officer Mark Fields' salary, bonus and stock awards jumped 17 percent to $17.4 million in 2015, a year in which the auto maker earned a record pretax profit, the company said on Friday. * Executive Chairman Bill Ford's 2015 compensation including salary, bonus and stock rose 1.6 percent to $10.07 millionUPDATE 1-Ford CEO's compensation jumped 17 pct to $17.4 million in 2015 DETROIT, March 18 Ford Motor Co Chief Executive Officer Mark Fields' salary, bonus and stock awards jumped 17 percent to $17.4 million in 2015, a year in which the auto maker earned a record pretax profit, the company said on Friday.  DETROIT, March 18 Ford Motor Co Chief Executive Officer Mark Fields' salary, bonus and stock awards jumped 17 percent to $17.4 million in 2015, a year in which the auto maker earned a record pretax profit, the company said on Friday.BRIEF-Ford CEO's compensation jumped 17 pct to $17.4 mln in 2015UPDATE 1-Ford CEO's compensation jumped 17 pct to $17.4 million in 2015 DETROIT, March 18 Ford Motor Co Chief Executive Officer Mark Fields' salary, bonus and stock awards jumped 17 percent to $17.4 million in 2015, a year in which the auto maker earned a record pretax profit, the company said on Friday.  UPDATE 1-Ford CEO's compensation jumped 17 pct to $17.4 million in 2015 DETROIT, March 18 Ford Motor Co Chief Executive Officer Mark Fields' salary, bonus and stock awards jumped 17 percent to $17.4 million in 2015, a year in which the auto maker earned a record pretax profit, the company said on Friday. * Executive Chairman Bill Ford's 2015 compensation including salary, bonus and stock rose 1.6 percent to $10.07 millionUPDATE 1-Ford CEO's compensation jumped 17 pct to $17.4 million in 2015 DETROIT, March 18 Ford Motor Co Chief Executive Officer Mark Fields' salary, bonus and stock awards jumped 17 percent to $17.4 million in 2015, a year in which the auto maker earned a record pretax profit, the company said on Friday.   * Ford Motor Co CEO Mark Fields' 2015 compensation was $18.6 million, from $18.9 million in 2014CORRECTED-Ford CEO's compensation jumped 17 pct to $17.4 million in 2015BRIEF-Ford CEO's compensation jumped 17 pct to $17.4 mln in 2015UPDATE 1-Ford CEO's compensation jumped 17 pct to $17.4 million in 2015 DETROIT, March 18 Ford Motor Co Chief Executive Officer Mark Fields' salary, bonus and stock awards jumped 17 percent to $17.4 million in 2015, a year in which the auto maker earned a record pretax profit, the company said on Friday.  UPDATE 1-Ford CEO's compensation jumped 17 pct to $17.4 million in 2015 DETROIT, March 18 Ford Motor Co Chief Executive Officer Mark Fields' salary, bonus and stock awards jumped 17 percent to $17.4 million in 2015, a year in which the auto maker earned a record pretax profit, the company said on Friday. * Executive Chairman Bill Ford's 2015 compensation including salary, bonus and stock rose 1.6 percent to $10.07 millionUPDATE 1-Ford CEO's compensation jumped 17 pct to $17.4 million in 2015 DETROIT, March 18 Ford Motor Co Chief Executive Officer Mark Fields' salary, bonus and stock awards jumped 17 percent to $17.4 million in 2015, a year in which the auto maker earned a record pretax profit, the company said on Friday.   BRIEF-Ford CEO's compensation jumped 17 pct to $17.4 mln in 2015UPDATE 1-Ford CEO's compensation jumped 17 pct to $17.4 million in 2015 DETROIT, March 18 Ford Motor Co Chief Executive Officer Mark Fields' salary, bonus and stock awards jumped 17 percent to $17.4 million in 2015, a year in which the auto maker earned a record pretax profit, the company said on Friday.  UPDATE 1-Ford CEO's compensation jumped 17 pct to $17.4 million in 2015 DETROIT, March 18 Ford Motor Co Chief Executive Officer Mark Fields' salary, bonus and stock awards jumped 17 percent to $17.4 million in 2015, a year in which the auto maker earned a record pretax profit, the company said on Friday. * Executive Chairman Bill Ford's 2015 compensation including salary, bonus and stock rose 1.6 percent to $10.07 millionUPDATE 1-Ford CEO's compensation jumped 17 pct to $17.4 million in 2015 DETROIT, March 18 Ford Motor Co Chief Executive Officer Mark Fields' salary, bonus and stock awards jumped 17 percent to $17.4 million in 2015, a year in which the auto maker earned a record pretax profit, the company said on Friday.  DETROIT, March 18 Ford Motor Co Chief Executive Officer Mark Fields' salary, bonus and stock awards jumped 17 percent to $17.4 million in 2015, a year in which the auto maker earned a record pretax profit, the company said on Friday.BRIEF-Ford CEO's compensation jumped 17 pct to $17.4 mln in 2015UPDATE 1-Ford CEO's compensation jumped 17 pct to $17.4 million in 2015 DETROIT, March 18 Ford Motor Co Chief Executive Officer Mark Fields' salary, bonus and stock awards jumped 17 percent to $17.4 million in 2015, a year in which the auto maker earned a record pretax profit, the company said on Friday.  UPDATE 1-Ford CEO's compensation jumped 17 pct to $17.4 million in 2015 DETROIT, March 18 Ford Motor Co Chief Executive Officer Mark Fields' salary, bonus and stock awards jumped 17 percent to $17.4 million in 2015, a year in which the auto maker earned a record pretax profit, the company said on Friday. * Executive Chairman Bill Ford's 2015 compensation including salary, bonus and stock rose 1.6 percent to $10.07 millionUPDATE 1-Ford CEO's compensation jumped 17 pct to $17.4 million in 2015 DETROIT, March 18 Ford Motor Co Chief Executive Officer Mark Fields' salary, bonus and stock awards jumped 17 percent to $17.4 million in 2015, a year in which the auto maker earned a record pretax profit, the company said on Friday.    
GD,BRIEF-General Dynamics NASSCO awarded contract for repair and modernization of ships * General Dynamics NASSCO awarded contract for repair and modernization of amphibious and combatant ships 
