AA,U.S. grants aid to Alcoa smelter workers after China complaint- rulingUPDATE 1-U.S. grants aid to Alcoa smelter workers after China complaint - rulingU.S. grants aid to Alcoa smelter workers after China complaint - ruling NEW YORK The U.S. government has granted aid to workers at Alcoa Inc's Intalco aluminum smelter in Washington state, after they complained that Chinese dumping threatened their jobs, according to a federal ruling.  U.S. grants aid to Alcoa smelter workers after China complaint - ruling NEW YORK The U.S. government has granted aid to workers at Alcoa Inc's Intalco aluminum smelter in Washington state, after they complained that Chinese dumping threatened their jobs, according to a federal ruling. NEW YORK, Feb 3 The U.S. government has granted aid to workers at Alcoa Inc's Intalco aluminum smelter in Washington state, after they complained that Chinese dumping threatened their jobs, according to a federal ruling.U.S. grants aid to Alcoa smelter workers after China complaint - ruling NEW YORK The U.S. government has granted aid to workers at Alcoa Inc's Intalco aluminum smelter in Washington state, after they complained that Chinese dumping threatened their jobs, according to a federal ruling.   UPDATE 1-U.S. grants aid to Alcoa smelter workers after China complaint - rulingU.S. grants aid to Alcoa smelter workers after China complaint - ruling NEW YORK The U.S. government has granted aid to workers at Alcoa Inc's Intalco aluminum smelter in Washington state, after they complained that Chinese dumping threatened their jobs, according to a federal ruling.  U.S. grants aid to Alcoa smelter workers after China complaint - ruling NEW YORK The U.S. government has granted aid to workers at Alcoa Inc's Intalco aluminum smelter in Washington state, after they complained that Chinese dumping threatened their jobs, according to a federal ruling. NEW YORK, Feb 3 The U.S. government has granted aid to workers at Alcoa Inc's Intalco aluminum smelter in Washington state, after they complained that Chinese dumping threatened their jobs, according to a federal ruling.U.S. grants aid to Alcoa smelter workers after China complaint - ruling NEW YORK The U.S. government has granted aid to workers at Alcoa Inc's Intalco aluminum smelter in Washington state, after they complained that Chinese dumping threatened their jobs, according to a federal ruling.  NEW YORK, Feb 3 The U.S. government has granted aid to workers at Alcoa Inc's Intalco aluminum smelter in Washington state, after they complained that Chinese dumping threatened their jobs, according to a federal ruling.UPDATE 1-U.S. grants aid to Alcoa smelter workers after China complaint - rulingU.S. grants aid to Alcoa smelter workers after China complaint - ruling NEW YORK The U.S. government has granted aid to workers at Alcoa Inc's Intalco aluminum smelter in Washington state, after they complained that Chinese dumping threatened their jobs, according to a federal ruling.  U.S. grants aid to Alcoa smelter workers after China complaint - ruling NEW YORK The U.S. government has granted aid to workers at Alcoa Inc's Intalco aluminum smelter in Washington state, after they complained that Chinese dumping threatened their jobs, according to a federal ruling. NEW YORK, Feb 3 The U.S. government has granted aid to workers at Alcoa Inc's Intalco aluminum smelter in Washington state, after they complained that Chinese dumping threatened their jobs, according to a federal ruling.U.S. grants aid to Alcoa smelter workers after China complaint - ruling NEW YORK The U.S. government has granted aid to workers at Alcoa Inc's Intalco aluminum smelter in Washington state, after they complained that Chinese dumping threatened their jobs, according to a federal ruling.   
GOOGL,Lenovo's Q3 revenue falls 8 pct to $12.9 bln; net profit beats estimates HONG KONG, Feb 3 The world's largest personal computer (PC) maker Lenovo Group Ltd said on Wednesday its third-quarter revenue fell 8 percent to $12.9 billion due to slower global PC demand and weaker smartphone sales. 
GOOG,Lenovo's Q3 revenue falls 8 pct to $12.9 bln; net profit beats estimates HONG KONG, Feb 3 The world's largest personal computer (PC) maker Lenovo Group Ltd said on Wednesday its third-quarter revenue fell 8 percent to $12.9 billion due to slower global PC demand and weaker smartphone sales. 
AMZN,UPDATE 2-Amazon plans to open up to 400 bookstores, says mall operatorAmazon plans to open up to 400 bookstores, says mall operatorBUZZ-Ocado: another day in red as brokerages back away ** British online grocer Ocado down c.3 pct & top FTSE midcap loser with at least two brokerages cutting their TPs on stock  BUZZ-Ocado: another day in red as brokerages back away ** British online grocer Ocado down c.3 pct & top FTSE midcap loser with at least two brokerages cutting their TPs on stock Amazon.com Inc  plans to open up to 400 physical bookstores, an executive of a major U.S. mall operator said on Tuesday.BUZZ-Ocado: another day in red as brokerages back away ** British online grocer Ocado down c.3 pct & top FTSE midcap loser with at least two brokerages cutting their TPs on stock   Amazon plans to open up to 400 bookstores, says mall operatorBUZZ-Ocado: another day in red as brokerages back away ** British online grocer Ocado down c.3 pct & top FTSE midcap loser with at least two brokerages cutting their TPs on stock  BUZZ-Ocado: another day in red as brokerages back away ** British online grocer Ocado down c.3 pct & top FTSE midcap loser with at least two brokerages cutting their TPs on stock Amazon.com Inc  plans to open up to 400 physical bookstores, an executive of a major U.S. mall operator said on Tuesday.BUZZ-Ocado: another day in red as brokerages back away ** British online grocer Ocado down c.3 pct & top FTSE midcap loser with at least two brokerages cutting their TPs on stock  Feb 2 Amazon.com Inc plans to open up to 400 physical bookstores, an executive of a major U.S. mall operator said on Tuesday.Amazon plans to open up to 400 bookstores, says mall operatorBUZZ-Ocado: another day in red as brokerages back away ** British online grocer Ocado down c.3 pct & top FTSE midcap loser with at least two brokerages cutting their TPs on stock  BUZZ-Ocado: another day in red as brokerages back away ** British online grocer Ocado down c.3 pct & top FTSE midcap loser with at least two brokerages cutting their TPs on stock Amazon.com Inc  plans to open up to 400 physical bookstores, an executive of a major U.S. mall operator said on Tuesday.BUZZ-Ocado: another day in red as brokerages back away ** British online grocer Ocado down c.3 pct & top FTSE midcap loser with at least two brokerages cutting their TPs on stock   
ADSK,Autodesk to cut 10 pct of workforceUPDATE 2-Autodesk to cut jobs by 10 pct as it transitions to cloud * Shares rise as much as 11 pct   (Adds shares, analyst comment, details)  UPDATE 2-Autodesk to cut jobs by 10 pct as it transitions to cloud * Shares rise as much as 11 pct   (Adds shares, analyst comment, details) Feb 3 AutoCAD software maker Autodesk Inc  said it would cut about 925 jobs, or 10 percent of its workforce, in the near term as part of a restructuring plan to accelerate transition to its cloud business.UPDATE 2-Autodesk to cut jobs by 10 pct as it transitions to cloud * Shares rise as much as 11 pct   (Adds shares, analyst comment, details)  
BA,Boeing CEO pitches F/A-18 Super Hornet fighter jet to IndiaBoeing CEO pitches F/A-18 Super Hornet fighter jet to IndiaUPDATE 1-Spirit AeroSystems forecasts profit largely above Street Feb 3 Aircraft parts maker Spirit AeroSystems Holdings Inc forecast 2016 profit largely above Wall Street expectations despite Boeing Co, its biggest customer, expecting to deliver fewer planes this year.  UPDATE 1-Spirit AeroSystems forecasts profit largely above Street Feb 3 Aircraft parts maker Spirit AeroSystems Holdings Inc forecast 2016 profit largely above Wall Street expectations despite Boeing Co, its biggest customer, expecting to deliver fewer planes this year. NEW DELHI U.S. aircraft maker Boeing Co is in a "conversation" on manufacturing its F/A-18 Super Hornet fighter jet in India, Chief Executive Officer Dennis Muilenburg was quoted on Wednesday as saying on his first visit to the country.UPDATE 1-Spirit AeroSystems forecasts profit largely above Street Feb 3 Aircraft parts maker Spirit AeroSystems Holdings Inc forecast 2016 profit largely above Wall Street expectations despite Boeing Co, its biggest customer, expecting to deliver fewer planes this year.   Boeing CEO pitches F/A-18 Super Hornet fighter jet to IndiaUPDATE 1-Spirit AeroSystems forecasts profit largely above Street Feb 3 Aircraft parts maker Spirit AeroSystems Holdings Inc forecast 2016 profit largely above Wall Street expectations despite Boeing Co, its biggest customer, expecting to deliver fewer planes this year.  UPDATE 1-Spirit AeroSystems forecasts profit largely above Street Feb 3 Aircraft parts maker Spirit AeroSystems Holdings Inc forecast 2016 profit largely above Wall Street expectations despite Boeing Co, its biggest customer, expecting to deliver fewer planes this year. NEW DELHI U.S. aircraft maker Boeing Co is in a "conversation" on manufacturing its F/A-18 Super Hornet fighter jet in India, Chief Executive Officer Dennis Muilenburg was quoted on Wednesday as saying on his first visit to the country.UPDATE 1-Spirit AeroSystems forecasts profit largely above Street Feb 3 Aircraft parts maker Spirit AeroSystems Holdings Inc forecast 2016 profit largely above Wall Street expectations despite Boeing Co, its biggest customer, expecting to deliver fewer planes this year.  NEW DELHI, Feb 3 U.S. aircraft maker Boeing Co  is in a "conversation" on manufacturing its F/A-18 Super Hornet fighter jet in India, Chief Executive Officer Dennis Muilenburg was quoted on Wednesday as saying on his first visit to the country.Boeing CEO pitches F/A-18 Super Hornet fighter jet to IndiaUPDATE 1-Spirit AeroSystems forecasts profit largely above Street Feb 3 Aircraft parts maker Spirit AeroSystems Holdings Inc forecast 2016 profit largely above Wall Street expectations despite Boeing Co, its biggest customer, expecting to deliver fewer planes this year.  UPDATE 1-Spirit AeroSystems forecasts profit largely above Street Feb 3 Aircraft parts maker Spirit AeroSystems Holdings Inc forecast 2016 profit largely above Wall Street expectations despite Boeing Co, its biggest customer, expecting to deliver fewer planes this year. NEW DELHI U.S. aircraft maker Boeing Co is in a "conversation" on manufacturing its F/A-18 Super Hornet fighter jet in India, Chief Executive Officer Dennis Muilenburg was quoted on Wednesday as saying on his first visit to the country.UPDATE 1-Spirit AeroSystems forecasts profit largely above Street Feb 3 Aircraft parts maker Spirit AeroSystems Holdings Inc forecast 2016 profit largely above Wall Street expectations despite Boeing Co, its biggest customer, expecting to deliver fewer planes this year.   
CBS,Sumner Redstone resigns as CBS executive chairman Feb 3 CBS Corp said on Wednesday Sumner Redstone had resigned as executive chairman, a move that comes amid heightened questions about the billionaire's physical and mental health. 
CMG,UPDATE 5-Chipotle says California probe widens into national investigationChipotle says California probe widens into national investigationChipotle says California probe widens into national investigation Chipotle Mexican Grill Inc  said a federal criminal probe linked to a food-safety incident at a California restaurant had widened into a national investigation, sending its shares down 7 percent in extended trading on Tuesday.  Chipotle says California probe widens into national investigation Chipotle Mexican Grill Inc  said a federal criminal probe linked to a food-safety incident at a California restaurant had widened into a national investigation, sending its shares down 7 percent in extended trading on Tuesday. Feb 2 Chipotle Mexican Grill Inc said a federal criminal probe linked to a food-safety incident at a California restaurant has widened into a national investigation, sending its shares down 7 percent in extended trading on Tuesday.Chipotle says California probe widens into national investigation Chipotle Mexican Grill Inc  said a federal criminal probe linked to a food-safety incident at a California restaurant had widened into a national investigation, sending its shares down 7 percent in extended trading on Tuesday.   Chipotle says California probe widens into national investigationChipotle says California probe widens into national investigation Chipotle Mexican Grill Inc  said a federal criminal probe linked to a food-safety incident at a California restaurant had widened into a national investigation, sending its shares down 7 percent in extended trading on Tuesday.  Chipotle says California probe widens into national investigation Chipotle Mexican Grill Inc  said a federal criminal probe linked to a food-safety incident at a California restaurant had widened into a national investigation, sending its shares down 7 percent in extended trading on Tuesday. Feb 2 Chipotle Mexican Grill Inc said a federal criminal probe linked to a food-safety incident at a California restaurant has widened into a national investigation, sending its shares down 7 percent in extended trading on Tuesday.Chipotle says California probe widens into national investigation Chipotle Mexican Grill Inc  said a federal criminal probe linked to a food-safety incident at a California restaurant had widened into a national investigation, sending its shares down 7 percent in extended trading on Tuesday.  * Chipotle sees break-even on per-share basis in current qtr   (Adds CEO, analyst comment)Chipotle says California probe widens into national investigationChipotle says California probe widens into national investigation Chipotle Mexican Grill Inc  said a federal criminal probe linked to a food-safety incident at a California restaurant had widened into a national investigation, sending its shares down 7 percent in extended trading on Tuesday.  Chipotle says California probe widens into national investigation Chipotle Mexican Grill Inc  said a federal criminal probe linked to a food-safety incident at a California restaurant had widened into a national investigation, sending its shares down 7 percent in extended trading on Tuesday. Feb 2 Chipotle Mexican Grill Inc said a federal criminal probe linked to a food-safety incident at a California restaurant has widened into a national investigation, sending its shares down 7 percent in extended trading on Tuesday.Chipotle says California probe widens into national investigation Chipotle Mexican Grill Inc  said a federal criminal probe linked to a food-safety incident at a California restaurant had widened into a national investigation, sending its shares down 7 percent in extended trading on Tuesday.   
CMCSA,Comcast revenue beats Street as NBCUniversal, Internet units growUPDATE 4-Comcast revs beat Street; records big boost in video customers NEW YORK, Feb 3 Comcast Corp posted better-than-expected fourth-quarter revenue and added the most video customers in any quarter in eight years, even as viewers gravitate toward online offerings.  UPDATE 4-Comcast revs beat Street; records big boost in video customers NEW YORK, Feb 3 Comcast Corp posted better-than-expected fourth-quarter revenue and added the most video customers in any quarter in eight years, even as viewers gravitate toward online offerings. NEW YORK, Feb 3 Comcast Corp posted better-than-expected fourth-quarter revenue on Wednesday, driven by growth in its media and entertainment unit NBCUniversal in addition to its high-speed Internet and business services divisions.UPDATE 4-Comcast revs beat Street; records big boost in video customers NEW YORK, Feb 3 Comcast Corp posted better-than-expected fourth-quarter revenue and added the most video customers in any quarter in eight years, even as viewers gravitate toward online offerings.  
DOW,UPDATE 6-Dow Chemical CEO plans retirement and handover in 2017 * Andrew Liveris orchestrated $130 bln merger with rival DuPont 
FB,U.S. gun traders rush to set up new sites after Facebook firearms ban WASHINGTON U.S. gun traders are setting up new websites to arrange deals after Facebook Inc barred private gun sales on its platform. 
F,Ford Europe cuts jobs to achieve $200 mln cost savingsUPDATE 2-Ford cuts jobs to sustain European profits as GM lags * GM says Europe has right cost structure in place   (Recasts, adds comments from GM CFO)  UPDATE 2-Ford cuts jobs to sustain European profits as GM lags * GM says Europe has right cost structure in place   (Recasts, adds comments from GM CFO) BERLIN, Feb 3 Ford plans to shed hundreds of white-collar jobs in Europe to cut costs by $200 million annually and is taking additional steps to revamp its lineup as it targets durable profitability in the region, the carmaker said on Wednesday.UPDATE 2-Ford cuts jobs to sustain European profits as GM lags * GM says Europe has right cost structure in place   (Recasts, adds comments from GM CFO)  
