ANTM,Anthem, Cigna merger squabbles could delay antitrust approval - WSJUPDATE 1-Anthem, Cigna merger squabbles could delay antitrust approval -WSJ WASHINGTON, May 22 Quarrels have broken out behind the scenes of Anthem Inc's proposed acquisition of Cigna Corp, as the health insurers seek regulatory approval for their landmark deal, the Wall Street Journal reported on Sunday.  UPDATE 1-Anthem, Cigna merger squabbles could delay antitrust approval -WSJ WASHINGTON, May 22 Quarrels have broken out behind the scenes of Anthem Inc's proposed acquisition of Cigna Corp, as the health insurers seek regulatory approval for their landmark deal, the Wall Street Journal reported on Sunday. WASHINGTON, May 22 Quarrels have broken out behind the scenes of Anthem Inc's proposed acquisition of Cigna Corp, as the health insurers seek regulatory approval for their landmark deal, the Wall Street Journal reported on Sunday.UPDATE 1-Anthem, Cigna merger squabbles could delay antitrust approval -WSJ WASHINGTON, May 22 Quarrels have broken out behind the scenes of Anthem Inc's proposed acquisition of Cigna Corp, as the health insurers seek regulatory approval for their landmark deal, the Wall Street Journal reported on Sunday.  
BA,Boeing shares could fall 15 percent if sales slow -Barron's May 22 Boeing Co's stock could fall as much as 15 percent if sales of its aircraft fall on weakening demand, according to a report on Sunday in the financial publication Barron's. 
CI,Anthem, Cigna merger squabbles could delay antitrust approval - WSJUPDATE 1-Anthem, Cigna merger squabbles could delay antitrust approval -WSJ WASHINGTON, May 22 Quarrels have broken out behind the scenes of Anthem Inc's proposed acquisition of Cigna Corp, as the health insurers seek regulatory approval for their landmark deal, the Wall Street Journal reported on Sunday.  UPDATE 1-Anthem, Cigna merger squabbles could delay antitrust approval -WSJ WASHINGTON, May 22 Quarrels have broken out behind the scenes of Anthem Inc's proposed acquisition of Cigna Corp, as the health insurers seek regulatory approval for their landmark deal, the Wall Street Journal reported on Sunday. WASHINGTON, May 22 Quarrels have broken out behind the scenes of Anthem Inc's proposed acquisition of Cigna Corp, as the health insurers seek regulatory approval for their landmark deal, the Wall Street Journal reported on Sunday.UPDATE 1-Anthem, Cigna merger squabbles could delay antitrust approval -WSJ WASHINGTON, May 22 Quarrels have broken out behind the scenes of Anthem Inc's proposed acquisition of Cigna Corp, as the health insurers seek regulatory approval for their landmark deal, the Wall Street Journal reported on Sunday.  
PSX,UPDATE 2-Phillips 66 in final stages of selling Ireland's only oil refinery - sources LONDON, May 21 U.S. energy group Phillips 66  is in the final stages of selling the only oil refinery in Ireland, a source familiar with negotiations said on Saturday. 
RHT,Red Hat shares could rise 30 percent in a year -Barron's May 22 Red Hat Inc shares could rise 30 percent in a year as more companies use its server software, according to a report on Sunday in the financial publication Barron's. 
VLO,UPDATE 2-Phillips 66 in final stages of selling Ireland's only oil refinery - sources LONDON, May 21 U.S. energy group Phillips 66  is in the final stages of selling the only oil refinery in Ireland, a source familiar with negotiations said on Saturday. 
