ABBV,AbbVie gets option on early Argenx cancer drug for $40 mlnAbbVie gets option on early Argenx cancer drug for $40 millionBRIEF-Argenx and Abbvie to collaborate on ARGX-115 against novel immuno-oncology target * Argenx and Abbvie to collaborate on ARGX-115 against novel immuno-oncology target  BRIEF-Argenx and Abbvie to collaborate on ARGX-115 against novel immuno-oncology target * Argenx and Abbvie to collaborate on ARGX-115 against novel immuno-oncology target AbbVie has acquired an option on an early-stage immuno-oncology drug from biotech company Argenx, giving the U.S. drugmaker access to a treatment with the potential to block a biological pathway that allows cancers to grow.BRIEF-Argenx and Abbvie to collaborate on ARGX-115 against novel immuno-oncology target * Argenx and Abbvie to collaborate on ARGX-115 against novel immuno-oncology target   AbbVie gets option on early Argenx cancer drug for $40 millionBRIEF-Argenx and Abbvie to collaborate on ARGX-115 against novel immuno-oncology target * Argenx and Abbvie to collaborate on ARGX-115 against novel immuno-oncology target  BRIEF-Argenx and Abbvie to collaborate on ARGX-115 against novel immuno-oncology target * Argenx and Abbvie to collaborate on ARGX-115 against novel immuno-oncology target AbbVie has acquired an option on an early-stage immuno-oncology drug from biotech company Argenx, giving the U.S. drugmaker access to a treatment with the potential to block a biological pathway that allows cancers to grow.BRIEF-Argenx and Abbvie to collaborate on ARGX-115 against novel immuno-oncology target * Argenx and Abbvie to collaborate on ARGX-115 against novel immuno-oncology target  April 21 AbbVie has acquired an option on an early-stage immuno-oncology drug from biotech company Argenx, giving the U.S. drugmaker access to a treatment with the potential to block a biological pathway that allows cancers to grow.AbbVie gets option on early Argenx cancer drug for $40 millionBRIEF-Argenx and Abbvie to collaborate on ARGX-115 against novel immuno-oncology target * Argenx and Abbvie to collaborate on ARGX-115 against novel immuno-oncology target  BRIEF-Argenx and Abbvie to collaborate on ARGX-115 against novel immuno-oncology target * Argenx and Abbvie to collaborate on ARGX-115 against novel immuno-oncology target AbbVie has acquired an option on an early-stage immuno-oncology drug from biotech company Argenx, giving the U.S. drugmaker access to a treatment with the potential to block a biological pathway that allows cancers to grow.BRIEF-Argenx and Abbvie to collaborate on ARGX-115 against novel immuno-oncology target * Argenx and Abbvie to collaborate on ARGX-115 against novel immuno-oncology target   
ALK,Alaska Air CEO sees challenge in keeping Virgin America customers after mergerUPDATE 1-Alaska Air CEO sees challenge in keeping Virgin customers after merger April 21 Alaska Air Group Inc expects it will be challenging to keep customers who are loyal to Virgin America Inc after the two companies merge, Alaska Air's chief executive said on an analyst call on Thursday.  UPDATE 1-Alaska Air CEO sees challenge in keeping Virgin customers after merger April 21 Alaska Air Group Inc expects it will be challenging to keep customers who are loyal to Virgin America Inc after the two companies merge, Alaska Air's chief executive said on an analyst call on Thursday. April 21 Alaska Air Group Inc's chief executive said on an analyst call Thursday that keeping customers who are loyal to Virgin America Inc will be a major challenge.UPDATE 1-Alaska Air CEO sees challenge in keeping Virgin customers after merger April 21 Alaska Air Group Inc expects it will be challenging to keep customers who are loyal to Virgin America Inc after the two companies merge, Alaska Air's chief executive said on an analyst call on Thursday.  
GOOGL,Alphabet's quarterly revenue rises 17.4 pctBRIEF-Alphabet reports 1st-qtr adj earnings of $7.50/shr * Q1 Google segment revenue $20.09 billion versus $17.18 billion last year  BRIEF-Alphabet reports 1st-qtr adj earnings of $7.50/shr * Q1 Google segment revenue $20.09 billion versus $17.18 billion last year April 21 Google's parent Alphabet Inc  reported a 17.4 percent rise in quarterly revenue, driven by strong advertising sales on mobile devices.BRIEF-Alphabet reports 1st-qtr adj earnings of $7.50/shr * Q1 Google segment revenue $20.09 billion versus $17.18 billion last year  
GOOG,Alphabet's quarterly revenue rises 17.4 pctBRIEF-Alphabet reports 1st-qtr adj earnings of $7.50/shr * Q1 Google segment revenue $20.09 billion versus $17.18 billion last year  BRIEF-Alphabet reports 1st-qtr adj earnings of $7.50/shr * Q1 Google segment revenue $20.09 billion versus $17.18 billion last year April 21 Google's parent Alphabet Inc  reported a 17.4 percent rise in quarterly revenue, driven by strong advertising sales on mobile devices.BRIEF-Alphabet reports 1st-qtr adj earnings of $7.50/shr * Q1 Google segment revenue $20.09 billion versus $17.18 billion last year  
AMZN,Amazon launches Fire tablet in 3 new colors with higher storage April 21 Amazon.com Inc has launched its Fire tablet in three new colors with higher internal storage. 
BIIB,Biogen first-quarter sales rise 6.7 percentBRIEF-Biogen Q1 adj shr $4.79UPDATE 3-Cost cutting helps Biogen top Wall Street estimates for quarter * 1st-qtr profit $4.79/shr vs est. $4.47   (Adds company, analyst comment, share move)  UPDATE 3-Cost cutting helps Biogen top Wall Street estimates for quarter * 1st-qtr profit $4.79/shr vs est. $4.47   (Adds company, analyst comment, share move) * Q1 earnings per share view $4.47 -- Thomson Reuters I/B/E/SUPDATE 3-Cost cutting helps Biogen top Wall Street estimates for quarter * 1st-qtr profit $4.79/shr vs est. $4.47   (Adds company, analyst comment, share move)   BRIEF-Biogen Q1 adj shr $4.79UPDATE 3-Cost cutting helps Biogen top Wall Street estimates for quarter * 1st-qtr profit $4.79/shr vs est. $4.47   (Adds company, analyst comment, share move)  UPDATE 3-Cost cutting helps Biogen top Wall Street estimates for quarter * 1st-qtr profit $4.79/shr vs est. $4.47   (Adds company, analyst comment, share move) * Q1 earnings per share view $4.47 -- Thomson Reuters I/B/E/SUPDATE 3-Cost cutting helps Biogen top Wall Street estimates for quarter * 1st-qtr profit $4.79/shr vs est. $4.47   (Adds company, analyst comment, share move)  April 21 Biogen Inc's quarterly sales rose 6.7 percent, helped by growing demand for its key oral multiple sclerosis (MS) drug, Tecfidera.BRIEF-Biogen Q1 adj shr $4.79UPDATE 3-Cost cutting helps Biogen top Wall Street estimates for quarter * 1st-qtr profit $4.79/shr vs est. $4.47   (Adds company, analyst comment, share move)  UPDATE 3-Cost cutting helps Biogen top Wall Street estimates for quarter * 1st-qtr profit $4.79/shr vs est. $4.47   (Adds company, analyst comment, share move) * Q1 earnings per share view $4.47 -- Thomson Reuters I/B/E/SUPDATE 3-Cost cutting helps Biogen top Wall Street estimates for quarter * 1st-qtr profit $4.79/shr vs est. $4.47   (Adds company, analyst comment, share move)   
BA,Norwegian Air CEO says may order extra 10 Dreamliners from BoeingCORRECTED-UPDATE 1-Southwest would consider new variant of Boeing 737 jet -COO April 21 Southwest Airlines Co would "absolutely" consider a new version of Boeing Co's 737 jet that the planemaker is said to be mulling, the budget airline's Chief Operating Officer Mike Van de Ven said on a conference call with media on Thursday.  CORRECTED-UPDATE 1-Southwest would consider new variant of Boeing 737 jet -COO April 21 Southwest Airlines Co would "absolutely" consider a new version of Boeing Co's 737 jet that the planemaker is said to be mulling, the budget airline's Chief Operating Officer Mike Van de Ven said on a conference call with media on Thursday. OSLO, April 21 Budget airline Norwegian Air  will likely order an extra 10 Dreamliners from Boeing , its chief executive told Reuters on Thursday.CORRECTED-UPDATE 1-Southwest would consider new variant of Boeing 737 jet -COO April 21 Southwest Airlines Co would "absolutely" consider a new version of Boeing Co's 737 jet that the planemaker is said to be mulling, the budget airline's Chief Operating Officer Mike Van de Ven said on a conference call with media on Thursday.  
CBS,Dish, Viacom deadline passes with no programming deal announcedBRIEF-Viacom and Dish agree to multi-year renewalViacom, Dish agree to renew contractUPDATE 2-Viacom shares soar after deal to renew Dish contract April 21 Viacom Inc said on Thursday it has renewed a multiyear distribution contract with satellite TV provider Dish Network Corp, lifting the media company's shares over 11 percent.  UPDATE 2-Viacom shares soar after deal to renew Dish contract April 21 Viacom Inc said on Thursday it has renewed a multiyear distribution contract with satellite TV provider Dish Network Corp, lifting the media company's shares over 11 percent. April 21 Viacom Inc said it reached an agreement with Dish Network Corp, averting a blackout of its programs on the satellite TV network.UPDATE 2-Viacom shares soar after deal to renew Dish contract April 21 Viacom Inc said on Thursday it has renewed a multiyear distribution contract with satellite TV provider Dish Network Corp, lifting the media company's shares over 11 percent.   Viacom, Dish agree to renew contractUPDATE 2-Viacom shares soar after deal to renew Dish contract April 21 Viacom Inc said on Thursday it has renewed a multiyear distribution contract with satellite TV provider Dish Network Corp, lifting the media company's shares over 11 percent.  UPDATE 2-Viacom shares soar after deal to renew Dish contract April 21 Viacom Inc said on Thursday it has renewed a multiyear distribution contract with satellite TV provider Dish Network Corp, lifting the media company's shares over 11 percent. April 21 Viacom Inc said it reached an agreement with Dish Network Corp, averting a blackout of its programs on the satellite TV network.UPDATE 2-Viacom shares soar after deal to renew Dish contract April 21 Viacom Inc said on Thursday it has renewed a multiyear distribution contract with satellite TV provider Dish Network Corp, lifting the media company's shares over 11 percent.  * Select Viacom live and video-on-demand content to join Sling TV single- and multi-stream servicesViacom, Dish agree to renew contractUPDATE 2-Viacom shares soar after deal to renew Dish contract April 21 Viacom Inc said on Thursday it has renewed a multiyear distribution contract with satellite TV provider Dish Network Corp, lifting the media company's shares over 11 percent.  UPDATE 2-Viacom shares soar after deal to renew Dish contract April 21 Viacom Inc said on Thursday it has renewed a multiyear distribution contract with satellite TV provider Dish Network Corp, lifting the media company's shares over 11 percent. April 21 Viacom Inc said it reached an agreement with Dish Network Corp, averting a blackout of its programs on the satellite TV network.UPDATE 2-Viacom shares soar after deal to renew Dish contract April 21 Viacom Inc said on Thursday it has renewed a multiyear distribution contract with satellite TV provider Dish Network Corp, lifting the media company's shares over 11 percent.    BRIEF-Viacom and Dish agree to multi-year renewalViacom, Dish agree to renew contractUPDATE 2-Viacom shares soar after deal to renew Dish contract April 21 Viacom Inc said on Thursday it has renewed a multiyear distribution contract with satellite TV provider Dish Network Corp, lifting the media company's shares over 11 percent.  UPDATE 2-Viacom shares soar after deal to renew Dish contract April 21 Viacom Inc said on Thursday it has renewed a multiyear distribution contract with satellite TV provider Dish Network Corp, lifting the media company's shares over 11 percent. April 21 Viacom Inc said it reached an agreement with Dish Network Corp, averting a blackout of its programs on the satellite TV network.UPDATE 2-Viacom shares soar after deal to renew Dish contract April 21 Viacom Inc said on Thursday it has renewed a multiyear distribution contract with satellite TV provider Dish Network Corp, lifting the media company's shares over 11 percent.   Viacom, Dish agree to renew contractUPDATE 2-Viacom shares soar after deal to renew Dish contract April 21 Viacom Inc said on Thursday it has renewed a multiyear distribution contract with satellite TV provider Dish Network Corp, lifting the media company's shares over 11 percent.  UPDATE 2-Viacom shares soar after deal to renew Dish contract April 21 Viacom Inc said on Thursday it has renewed a multiyear distribution contract with satellite TV provider Dish Network Corp, lifting the media company's shares over 11 percent. April 21 Viacom Inc said it reached an agreement with Dish Network Corp, averting a blackout of its programs on the satellite TV network.UPDATE 2-Viacom shares soar after deal to renew Dish contract April 21 Viacom Inc said on Thursday it has renewed a multiyear distribution contract with satellite TV provider Dish Network Corp, lifting the media company's shares over 11 percent.  * Select Viacom live and video-on-demand content to join Sling TV single- and multi-stream servicesViacom, Dish agree to renew contractUPDATE 2-Viacom shares soar after deal to renew Dish contract April 21 Viacom Inc said on Thursday it has renewed a multiyear distribution contract with satellite TV provider Dish Network Corp, lifting the media company's shares over 11 percent.  UPDATE 2-Viacom shares soar after deal to renew Dish contract April 21 Viacom Inc said on Thursday it has renewed a multiyear distribution contract with satellite TV provider Dish Network Corp, lifting the media company's shares over 11 percent. April 21 Viacom Inc said it reached an agreement with Dish Network Corp, averting a blackout of its programs on the satellite TV network.UPDATE 2-Viacom shares soar after deal to renew Dish contract April 21 Viacom Inc said on Thursday it has renewed a multiyear distribution contract with satellite TV provider Dish Network Corp, lifting the media company's shares over 11 percent.   NEW YORK, April 21 A midnight deadline has passed without the announcement of a programming deal between Viacom Inc and Dish Network Corp.BRIEF-Viacom and Dish agree to multi-year renewalViacom, Dish agree to renew contractUPDATE 2-Viacom shares soar after deal to renew Dish contract April 21 Viacom Inc said on Thursday it has renewed a multiyear distribution contract with satellite TV provider Dish Network Corp, lifting the media company's shares over 11 percent.  UPDATE 2-Viacom shares soar after deal to renew Dish contract April 21 Viacom Inc said on Thursday it has renewed a multiyear distribution contract with satellite TV provider Dish Network Corp, lifting the media company's shares over 11 percent. April 21 Viacom Inc said it reached an agreement with Dish Network Corp, averting a blackout of its programs on the satellite TV network.UPDATE 2-Viacom shares soar after deal to renew Dish contract April 21 Viacom Inc said on Thursday it has renewed a multiyear distribution contract with satellite TV provider Dish Network Corp, lifting the media company's shares over 11 percent.   Viacom, Dish agree to renew contractUPDATE 2-Viacom shares soar after deal to renew Dish contract April 21 Viacom Inc said on Thursday it has renewed a multiyear distribution contract with satellite TV provider Dish Network Corp, lifting the media company's shares over 11 percent.  UPDATE 2-Viacom shares soar after deal to renew Dish contract April 21 Viacom Inc said on Thursday it has renewed a multiyear distribution contract with satellite TV provider Dish Network Corp, lifting the media company's shares over 11 percent. April 21 Viacom Inc said it reached an agreement with Dish Network Corp, averting a blackout of its programs on the satellite TV network.UPDATE 2-Viacom shares soar after deal to renew Dish contract April 21 Viacom Inc said on Thursday it has renewed a multiyear distribution contract with satellite TV provider Dish Network Corp, lifting the media company's shares over 11 percent.  * Select Viacom live and video-on-demand content to join Sling TV single- and multi-stream servicesViacom, Dish agree to renew contractUPDATE 2-Viacom shares soar after deal to renew Dish contract April 21 Viacom Inc said on Thursday it has renewed a multiyear distribution contract with satellite TV provider Dish Network Corp, lifting the media company's shares over 11 percent.  UPDATE 2-Viacom shares soar after deal to renew Dish contract April 21 Viacom Inc said on Thursday it has renewed a multiyear distribution contract with satellite TV provider Dish Network Corp, lifting the media company's shares over 11 percent. April 21 Viacom Inc said it reached an agreement with Dish Network Corp, averting a blackout of its programs on the satellite TV network.UPDATE 2-Viacom shares soar after deal to renew Dish contract April 21 Viacom Inc said on Thursday it has renewed a multiyear distribution contract with satellite TV provider Dish Network Corp, lifting the media company's shares over 11 percent.    
CVX,Ex-oil trader, consultant charged with conspiracy to defraud ChevronEx-oil trader, consultant charged with conspiracy to defraud Chevron A former Chevron Corp trader and an oil company consultant have been arrested and charged with running a kickback scheme that allegedly enriched them while cheating Chevron out of the full value of trades, U.S. authorities said on Thursday.  Ex-oil trader, consultant charged with conspiracy to defraud Chevron A former Chevron Corp trader and an oil company consultant have been arrested and charged with running a kickback scheme that allegedly enriched them while cheating Chevron out of the full value of trades, U.S. authorities said on Thursday. April 21 A former Chevron Corp trader and an oil company consultant have been arrested and charged with running a kickback scheme that allegedly enriched them while cheating Chevron out of the full value of trades, U.S. authorities said on Thursday.Ex-oil trader, consultant charged with conspiracy to defraud Chevron A former Chevron Corp trader and an oil company consultant have been arrested and charged with running a kickback scheme that allegedly enriched them while cheating Chevron out of the full value of trades, U.S. authorities said on Thursday.  
