ABT,Delaware Judge expedites Alere lawsuit against AbbottUPDATE 1-Delaware judge expedites Alere lawsuit against AbbottDelaware judge expedites Alere lawsuit against Abbott NEW YORK/WILMINGTON, Del. A Delaware judge on Friday granted a motion to expedite Alere Inc's lawsuit against Abbott Laboratories, which seeks to ensure that Abbott lives up to the terms of its $5.8 billion takeover of the diagnostics company, representatives for Alere said.  Delaware judge expedites Alere lawsuit against Abbott NEW YORK/WILMINGTON, Del. A Delaware judge on Friday granted a motion to expedite Alere Inc's lawsuit against Abbott Laboratories, which seeks to ensure that Abbott lives up to the terms of its $5.8 billion takeover of the diagnostics company, representatives for Alere said. NEW YORK/WILMINGTON, Del., Sept 2 A Delaware judge on Friday granted a motion to expedite Alere Inc's  lawsuit against Abbott Laboratories, which seeks to ensure that Abbott lives up to the terms of its $5.8 billion takeover of the diagnostics company, representatives for Alere said.Delaware judge expedites Alere lawsuit against Abbott NEW YORK/WILMINGTON, Del. A Delaware judge on Friday granted a motion to expedite Alere Inc's lawsuit against Abbott Laboratories, which seeks to ensure that Abbott lives up to the terms of its $5.8 billion takeover of the diagnostics company, representatives for Alere said.   UPDATE 1-Delaware judge expedites Alere lawsuit against AbbottDelaware judge expedites Alere lawsuit against Abbott NEW YORK/WILMINGTON, Del. A Delaware judge on Friday granted a motion to expedite Alere Inc's lawsuit against Abbott Laboratories, which seeks to ensure that Abbott lives up to the terms of its $5.8 billion takeover of the diagnostics company, representatives for Alere said.  Delaware judge expedites Alere lawsuit against Abbott NEW YORK/WILMINGTON, Del. A Delaware judge on Friday granted a motion to expedite Alere Inc's lawsuit against Abbott Laboratories, which seeks to ensure that Abbott lives up to the terms of its $5.8 billion takeover of the diagnostics company, representatives for Alere said. NEW YORK/WILMINGTON, Del., Sept 2 A Delaware judge on Friday granted a motion to expedite Alere Inc's  lawsuit against Abbott Laboratories, which seeks to ensure that Abbott lives up to the terms of its $5.8 billion takeover of the diagnostics company, representatives for Alere said.Delaware judge expedites Alere lawsuit against Abbott NEW YORK/WILMINGTON, Del. A Delaware judge on Friday granted a motion to expedite Alere Inc's lawsuit against Abbott Laboratories, which seeks to ensure that Abbott lives up to the terms of its $5.8 billion takeover of the diagnostics company, representatives for Alere said.  NEW YORK, Sept 2 A Delaware judge on Friday granted a motion to expedite Alere Inc's lawsuit against Abbott Laboratories, which seeks to ensure that Abbott lives up to the terms of its $5.8 billion takeover of the diagnostics company, representatives for Alere said.UPDATE 1-Delaware judge expedites Alere lawsuit against AbbottDelaware judge expedites Alere lawsuit against Abbott NEW YORK/WILMINGTON, Del. A Delaware judge on Friday granted a motion to expedite Alere Inc's lawsuit against Abbott Laboratories, which seeks to ensure that Abbott lives up to the terms of its $5.8 billion takeover of the diagnostics company, representatives for Alere said.  Delaware judge expedites Alere lawsuit against Abbott NEW YORK/WILMINGTON, Del. A Delaware judge on Friday granted a motion to expedite Alere Inc's lawsuit against Abbott Laboratories, which seeks to ensure that Abbott lives up to the terms of its $5.8 billion takeover of the diagnostics company, representatives for Alere said. NEW YORK/WILMINGTON, Del., Sept 2 A Delaware judge on Friday granted a motion to expedite Alere Inc's  lawsuit against Abbott Laboratories, which seeks to ensure that Abbott lives up to the terms of its $5.8 billion takeover of the diagnostics company, representatives for Alere said.Delaware judge expedites Alere lawsuit against Abbott NEW YORK/WILMINGTON, Del. A Delaware judge on Friday granted a motion to expedite Alere Inc's lawsuit against Abbott Laboratories, which seeks to ensure that Abbott lives up to the terms of its $5.8 billion takeover of the diagnostics company, representatives for Alere said.   
AA,Alcoa, Alumina settle dispute, clearing hurdle to Alcoa splitUPDATE 2-Alcoa, Alumina settle dispute, clearing hurdle to Alcoa split * Alumina shares jump 8.5 pct   (Adds Alumina CEO, investor comments, share price)  UPDATE 2-Alcoa, Alumina settle dispute, clearing hurdle to Alcoa split * Alumina shares jump 8.5 pct   (Adds Alumina CEO, investor comments, share price) MELBOURNE Alcoa Inc and Alumina Ltd  have settled a dispute and agreed to reshape their joint venture, removing an obstacle to Alcoa's plan to split into two companies and making its Australian partner a more attractive takeover target.UPDATE 2-Alcoa, Alumina settle dispute, clearing hurdle to Alcoa split * Alumina shares jump 8.5 pct   (Adds Alumina CEO, investor comments, share price)  
AMZN,LG Elec says to partner with Amazon on smart homesEU's Vestager warns others, says Apple could cut bill BRUSSELS Other multinationals that do not employ as extreme Irish tax schemes as Apple Inc but shift profits via the country to tax havens could also be breaching EU rules, Competition Commissioner Margrethe Vestager said on Thursday.  EU's Vestager warns others, says Apple could cut bill BRUSSELS Other multinationals that do not employ as extreme Irish tax schemes as Apple Inc but shift profits via the country to tax havens could also be breaching EU rules, Competition Commissioner Margrethe Vestager said on Thursday. SEOUL, Sept 2 South Korea's LG Electronics Inc  said on Friday it is partnering with Amazon.com Inc  on smart-home services, enabling the U.S. company's services such as the Alexa virtual assistant on some of the electronics maker's devices.EU's Vestager warns others, says Apple could cut bill BRUSSELS Other multinationals that do not employ as extreme Irish tax schemes as Apple Inc but shift profits via the country to tax havens could also be breaching EU rules, Competition Commissioner Margrethe Vestager said on Thursday.  
AAPL,Apple appeal against EU tax demand would break new ground LONDON, Sept 2 Apple CEO Tim Cook has said he will appeal the European Commission's ruling that his company received an unlawful 13 billion euro ($14.5 billion) subsidy when Ireland gave it preferential tax deals and that he was confident the decision would be reversed. 
BHI,UPDATE 9-Oil up 3 pct as U.S. jobs data hits dollar; tumbles on week * Russia's Putin supports OPEC production freeze efforts   (Recasts, updates market activity to settlement, adds comments) 
CAT,BRIEF-Caterpillar contemplates allocation of production from Gosselies, Belgium, to other manufacturing facilitiesCaterpillar says it may lay off 2,000 workers at Belgium plant Sept 2 Heavy machinery maker Caterpillar Inc  said it could lay off about 2,000 employees at a plant in Belgium, as it considers shifting production to other facilities as part of a restructuring program announced last year.  Caterpillar says it may lay off 2,000 workers at Belgium plant Sept 2 Heavy machinery maker Caterpillar Inc  said it could lay off about 2,000 employees at a plant in Belgium, as it considers shifting production to other facilities as part of a restructuring program announced last year. * Caterpillar Inc contemplates allocation of production from Gosselies, Belgium, to other manufacturing facilitiesCaterpillar says it may lay off 2,000 workers at Belgium plant Sept 2 Heavy machinery maker Caterpillar Inc  said it could lay off about 2,000 employees at a plant in Belgium, as it considers shifting production to other facilities as part of a restructuring program announced last year.  
DAL,BRIEF-Delta reports financial and operating performance for august 2016 * Delta reports financial and operating performance for august 2016 
GS,UPDATE 1-Fortress, PAG show interest in Japan's public apartment sale -sources TOKYO, Sept 2 Fortress Investment and Hong Kong-based buyout firm PAG are among investors that took bidding papers for Japan's biggest sale of public apartment blocks, according to sources, a deal for which government wants at least 64 billion yen ($618 million). 
JPM,Good Technology shareholders sue JPMorgan over fiduciary duty Sept 1 Former shareholders of Good Technology Corp, a mobile software maker, are suing JPMorgan Chase & Co  for breach of fiduciary duty, according to a lawsuit filed on Thursday. 
MCD,S.Korea Maeil Dairy says it's considering whether to bid for McDonald's S.Korean operationsUPDATE 2-Carlyle, TPG form separate teams to bid for McDonald's N.Asia stores -sources HONG KONG, Sept 2 Private equity firms Carlyle Group and TPG Capital have teamed up with two separate Chinese state companies to bid for McDonald's outlets in China and Hong Kong in a deal worth between $2 billion and $3 billion, four people familiar with the matter said.  UPDATE 2-Carlyle, TPG form separate teams to bid for McDonald's N.Asia stores -sources HONG KONG, Sept 2 Private equity firms Carlyle Group and TPG Capital have teamed up with two separate Chinese state companies to bid for McDonald's outlets in China and Hong Kong in a deal worth between $2 billion and $3 billion, four people familiar with the matter said. SEOUL, Sept 2 South Korea's Maeil Dairy Industry Co Ltd is considering whether to bid for McDonald's Corp's South Korean operations, a Maeil spokesman said on Friday.UPDATE 2-Carlyle, TPG form separate teams to bid for McDonald's N.Asia stores -sources HONG KONG, Sept 2 Private equity firms Carlyle Group and TPG Capital have teamed up with two separate Chinese state companies to bid for McDonald's outlets in China and Hong Kong in a deal worth between $2 billion and $3 billion, four people familiar with the matter said.  
MRK,REFILE-Merck aborts development of osteoporosis drug due to stroke riskBRIEF-Merck provides update on odanacatib development programUPDATE 1-Merck scraps development of osteoporosis drug due to stroke risk Sept 2 Merck & Co Inc said it would stop developing its experimental osteoporosis drug after an independent analysis confirmed the treatment raises the risk of stroke.  UPDATE 1-Merck scraps development of osteoporosis drug due to stroke risk Sept 2 Merck & Co Inc said it would stop developing its experimental osteoporosis drug after an independent analysis confirmed the treatment raises the risk of stroke. * To discontinue development after independent adjudication of major adverse cardiovascular events confirmed an increased risk of strokeUPDATE 1-Merck scraps development of osteoporosis drug due to stroke risk Sept 2 Merck & Co Inc said it would stop developing its experimental osteoporosis drug after an independent analysis confirmed the treatment raises the risk of stroke.   BRIEF-Merck provides update on odanacatib development programUPDATE 1-Merck scraps development of osteoporosis drug due to stroke risk Sept 2 Merck & Co Inc said it would stop developing its experimental osteoporosis drug after an independent analysis confirmed the treatment raises the risk of stroke.  UPDATE 1-Merck scraps development of osteoporosis drug due to stroke risk Sept 2 Merck & Co Inc said it would stop developing its experimental osteoporosis drug after an independent analysis confirmed the treatment raises the risk of stroke. * To discontinue development after independent adjudication of major adverse cardiovascular events confirmed an increased risk of strokeUPDATE 1-Merck scraps development of osteoporosis drug due to stroke risk Sept 2 Merck & Co Inc said it would stop developing its experimental osteoporosis drug after an independent analysis confirmed the treatment raises the risk of stroke.  Sept 2 Merck & Co Inc said it would cease the development of its experimental osteoporosis drug after an independent analysis confirmed that the therapy was associated with an increased risk of stroke.BRIEF-Merck provides update on odanacatib development programUPDATE 1-Merck scraps development of osteoporosis drug due to stroke risk Sept 2 Merck & Co Inc said it would stop developing its experimental osteoporosis drug after an independent analysis confirmed the treatment raises the risk of stroke.  UPDATE 1-Merck scraps development of osteoporosis drug due to stroke risk Sept 2 Merck & Co Inc said it would stop developing its experimental osteoporosis drug after an independent analysis confirmed the treatment raises the risk of stroke. * To discontinue development after independent adjudication of major adverse cardiovascular events confirmed an increased risk of strokeUPDATE 1-Merck scraps development of osteoporosis drug due to stroke risk Sept 2 Merck & Co Inc said it would stop developing its experimental osteoporosis drug after an independent analysis confirmed the treatment raises the risk of stroke.   
SLB,Rosneft, BP, Schlumberger to collaborate on seismic researchBRIEF-BP, Rosneft and Schlumberger sign seismic research agreementsSchlumberger lets go of workers in Venezuela as it scales back CARACAS/PUNTO FIJO, Venezuela, Sept 2 Oilfield services company Schlumberger has let go of workers and pulled out of projects as it cuts operations in crisis-stricken Venezuela, sparking worker protests and heightening worry over the OPEC country's slumping oil output.  Schlumberger lets go of workers in Venezuela as it scales back CARACAS/PUNTO FIJO, Venezuela, Sept 2 Oilfield services company Schlumberger has let go of workers and pulled out of projects as it cuts operations in crisis-stricken Venezuela, sparking worker protests and heightening worry over the OPEC country's slumping oil output. * Rosneft, BP and Schlumberger today announced agreements for collaboration on seismic research and developmentSchlumberger lets go of workers in Venezuela as it scales back CARACAS/PUNTO FIJO, Venezuela, Sept 2 Oilfield services company Schlumberger has let go of workers and pulled out of projects as it cuts operations in crisis-stricken Venezuela, sparking worker protests and heightening worry over the OPEC country's slumping oil output.   BRIEF-BP, Rosneft and Schlumberger sign seismic research agreementsSchlumberger lets go of workers in Venezuela as it scales back CARACAS/PUNTO FIJO, Venezuela, Sept 2 Oilfield services company Schlumberger has let go of workers and pulled out of projects as it cuts operations in crisis-stricken Venezuela, sparking worker protests and heightening worry over the OPEC country's slumping oil output.  Schlumberger lets go of workers in Venezuela as it scales back CARACAS/PUNTO FIJO, Venezuela, Sept 2 Oilfield services company Schlumberger has let go of workers and pulled out of projects as it cuts operations in crisis-stricken Venezuela, sparking worker protests and heightening worry over the OPEC country's slumping oil output. * Rosneft, BP and Schlumberger today announced agreements for collaboration on seismic research and developmentSchlumberger lets go of workers in Venezuela as it scales back CARACAS/PUNTO FIJO, Venezuela, Sept 2 Oilfield services company Schlumberger has let go of workers and pulled out of projects as it cuts operations in crisis-stricken Venezuela, sparking worker protests and heightening worry over the OPEC country's slumping oil output.  VLADIVOSTOK, Russia, Sept 2 Russian biggest oil producer Rosneft signed agreements with British oil major BP and top world oilfield services provider Schlumberger for collaboration on seismic research and development, the companies said on Friday.BRIEF-BP, Rosneft and Schlumberger sign seismic research agreementsSchlumberger lets go of workers in Venezuela as it scales back CARACAS/PUNTO FIJO, Venezuela, Sept 2 Oilfield services company Schlumberger has let go of workers and pulled out of projects as it cuts operations in crisis-stricken Venezuela, sparking worker protests and heightening worry over the OPEC country's slumping oil output.  Schlumberger lets go of workers in Venezuela as it scales back CARACAS/PUNTO FIJO, Venezuela, Sept 2 Oilfield services company Schlumberger has let go of workers and pulled out of projects as it cuts operations in crisis-stricken Venezuela, sparking worker protests and heightening worry over the OPEC country's slumping oil output. * Rosneft, BP and Schlumberger today announced agreements for collaboration on seismic research and developmentSchlumberger lets go of workers in Venezuela as it scales back CARACAS/PUNTO FIJO, Venezuela, Sept 2 Oilfield services company Schlumberger has let go of workers and pulled out of projects as it cuts operations in crisis-stricken Venezuela, sparking worker protests and heightening worry over the OPEC country's slumping oil output.   
WFC,BRIEF-Wells Fargo announces sponsorship with Los Angeles Rams * Announced sponsorship with Los Angeles Rams in support of their inaugural season  Source text for Eikon:  Further company coverage: 
YUM,BRIEF-Yum! Brands struck deal to sell stake in China operations - WSJYum's China unit gets $460 mln investment from Alibaba arm, Primavera - sourceBRIEF-Yum China and investors expect to enter into shareholders agreement * Yum China and investors expect to enter into a shareholders agreement  BRIEF-Yum China and investors expect to enter into shareholders agreement * Yum China and investors expect to enter into a shareholders agreement HONG KONG, Sept 2 Yum Brands Inc's China unit has secured an investment worth about $460 million from an affiliate of Alibaba Group Holding and private equity firm Primavera Capital, a person familiar with the matter told Reuters.BRIEF-Yum China and investors expect to enter into shareholders agreement * Yum China and investors expect to enter into a shareholders agreement   Yum's China unit gets $460 mln investment from Alibaba arm, Primavera - sourceBRIEF-Yum China and investors expect to enter into shareholders agreement * Yum China and investors expect to enter into a shareholders agreement  BRIEF-Yum China and investors expect to enter into shareholders agreement * Yum China and investors expect to enter into a shareholders agreement HONG KONG, Sept 2 Yum Brands Inc's China unit has secured an investment worth about $460 million from an affiliate of Alibaba Group Holding and private equity firm Primavera Capital, a person familiar with the matter told Reuters.BRIEF-Yum China and investors expect to enter into shareholders agreement * Yum China and investors expect to enter into a shareholders agreement  * Yum Brands Inc struck deal to sell stake in China operations to prominent Chinese deal maker & financial affiliate of Alibaba Group Holding - WSJYum's China unit gets $460 mln investment from Alibaba arm, Primavera - sourceBRIEF-Yum China and investors expect to enter into shareholders agreement * Yum China and investors expect to enter into a shareholders agreement  BRIEF-Yum China and investors expect to enter into shareholders agreement * Yum China and investors expect to enter into a shareholders agreement HONG KONG, Sept 2 Yum Brands Inc's China unit has secured an investment worth about $460 million from an affiliate of Alibaba Group Holding and private equity firm Primavera Capital, a person familiar with the matter told Reuters.BRIEF-Yum China and investors expect to enter into shareholders agreement * Yum China and investors expect to enter into a shareholders agreement   
