AMG,BRIEF-Affiliated Managers Group to invest in leading alternative firmsBRIEF-Affiliated Managers Group enters commitment increase agreementAffiliated Managers buys stakes in hedge funds from Goldman fundUPDATE 1-Affiliated Managers buys stakes in hedge funds from Goldman fund BOSTON, June 6 Affiliated Managers Group Inc , a holding company for money management firms, said on Monday it will buy stakes in five hedge funds from Goldman Sachs Group Inc for $800 million, sparking a 3.5 percent jump in Affiliated Managers stock.  UPDATE 1-Affiliated Managers buys stakes in hedge funds from Goldman fund BOSTON, June 6 Affiliated Managers Group Inc , a holding company for money management firms, said on Monday it will buy stakes in five hedge funds from Goldman Sachs Group Inc for $800 million, sparking a 3.5 percent jump in Affiliated Managers stock. BOSTON, June 6 Affiliated Managers Group Inc , a holding company for money management firms, said on Monday it will buy stakes in five hedge funds from Goldman Sachs for $800 million, sparking a  3.5 percent jump in the stock.UPDATE 1-Affiliated Managers buys stakes in hedge funds from Goldman fund BOSTON, June 6 Affiliated Managers Group Inc , a holding company for money management firms, said on Monday it will buy stakes in five hedge funds from Goldman Sachs Group Inc for $800 million, sparking a 3.5 percent jump in Affiliated Managers stock.   Affiliated Managers buys stakes in hedge funds from Goldman fundUPDATE 1-Affiliated Managers buys stakes in hedge funds from Goldman fund BOSTON, June 6 Affiliated Managers Group Inc , a holding company for money management firms, said on Monday it will buy stakes in five hedge funds from Goldman Sachs Group Inc for $800 million, sparking a 3.5 percent jump in Affiliated Managers stock.  UPDATE 1-Affiliated Managers buys stakes in hedge funds from Goldman fund BOSTON, June 6 Affiliated Managers Group Inc , a holding company for money management firms, said on Monday it will buy stakes in five hedge funds from Goldman Sachs Group Inc for $800 million, sparking a 3.5 percent jump in Affiliated Managers stock. BOSTON, June 6 Affiliated Managers Group Inc , a holding company for money management firms, said on Monday it will buy stakes in five hedge funds from Goldman Sachs for $800 million, sparking a  3.5 percent jump in the stock.UPDATE 1-Affiliated Managers buys stakes in hedge funds from Goldman fund BOSTON, June 6 Affiliated Managers Group Inc , a holding company for money management firms, said on Monday it will buy stakes in five hedge funds from Goldman Sachs Group Inc for $800 million, sparking a 3.5 percent jump in Affiliated Managers stock.  * Entered commitment increase agreement increasing commitments under revolving credit agreement from $1.3 billion to $1.45 billionAffiliated Managers buys stakes in hedge funds from Goldman fundUPDATE 1-Affiliated Managers buys stakes in hedge funds from Goldman fund BOSTON, June 6 Affiliated Managers Group Inc , a holding company for money management firms, said on Monday it will buy stakes in five hedge funds from Goldman Sachs Group Inc for $800 million, sparking a 3.5 percent jump in Affiliated Managers stock.  UPDATE 1-Affiliated Managers buys stakes in hedge funds from Goldman fund BOSTON, June 6 Affiliated Managers Group Inc , a holding company for money management firms, said on Monday it will buy stakes in five hedge funds from Goldman Sachs Group Inc for $800 million, sparking a 3.5 percent jump in Affiliated Managers stock. BOSTON, June 6 Affiliated Managers Group Inc , a holding company for money management firms, said on Monday it will buy stakes in five hedge funds from Goldman Sachs for $800 million, sparking a  3.5 percent jump in the stock.UPDATE 1-Affiliated Managers buys stakes in hedge funds from Goldman fund BOSTON, June 6 Affiliated Managers Group Inc , a holding company for money management firms, said on Monday it will buy stakes in five hedge funds from Goldman Sachs Group Inc for $800 million, sparking a 3.5 percent jump in Affiliated Managers stock.    BRIEF-Affiliated Managers Group enters commitment increase agreementAffiliated Managers buys stakes in hedge funds from Goldman fundUPDATE 1-Affiliated Managers buys stakes in hedge funds from Goldman fund BOSTON, June 6 Affiliated Managers Group Inc , a holding company for money management firms, said on Monday it will buy stakes in five hedge funds from Goldman Sachs Group Inc for $800 million, sparking a 3.5 percent jump in Affiliated Managers stock.  UPDATE 1-Affiliated Managers buys stakes in hedge funds from Goldman fund BOSTON, June 6 Affiliated Managers Group Inc , a holding company for money management firms, said on Monday it will buy stakes in five hedge funds from Goldman Sachs Group Inc for $800 million, sparking a 3.5 percent jump in Affiliated Managers stock. BOSTON, June 6 Affiliated Managers Group Inc , a holding company for money management firms, said on Monday it will buy stakes in five hedge funds from Goldman Sachs for $800 million, sparking a  3.5 percent jump in the stock.UPDATE 1-Affiliated Managers buys stakes in hedge funds from Goldman fund BOSTON, June 6 Affiliated Managers Group Inc , a holding company for money management firms, said on Monday it will buy stakes in five hedge funds from Goldman Sachs Group Inc for $800 million, sparking a 3.5 percent jump in Affiliated Managers stock.   Affiliated Managers buys stakes in hedge funds from Goldman fundUPDATE 1-Affiliated Managers buys stakes in hedge funds from Goldman fund BOSTON, June 6 Affiliated Managers Group Inc , a holding company for money management firms, said on Monday it will buy stakes in five hedge funds from Goldman Sachs Group Inc for $800 million, sparking a 3.5 percent jump in Affiliated Managers stock.  UPDATE 1-Affiliated Managers buys stakes in hedge funds from Goldman fund BOSTON, June 6 Affiliated Managers Group Inc , a holding company for money management firms, said on Monday it will buy stakes in five hedge funds from Goldman Sachs Group Inc for $800 million, sparking a 3.5 percent jump in Affiliated Managers stock. BOSTON, June 6 Affiliated Managers Group Inc , a holding company for money management firms, said on Monday it will buy stakes in five hedge funds from Goldman Sachs for $800 million, sparking a  3.5 percent jump in the stock.UPDATE 1-Affiliated Managers buys stakes in hedge funds from Goldman fund BOSTON, June 6 Affiliated Managers Group Inc , a holding company for money management firms, said on Monday it will buy stakes in five hedge funds from Goldman Sachs Group Inc for $800 million, sparking a 3.5 percent jump in Affiliated Managers stock.  * Entered commitment increase agreement increasing commitments under revolving credit agreement from $1.3 billion to $1.45 billionAffiliated Managers buys stakes in hedge funds from Goldman fundUPDATE 1-Affiliated Managers buys stakes in hedge funds from Goldman fund BOSTON, June 6 Affiliated Managers Group Inc , a holding company for money management firms, said on Monday it will buy stakes in five hedge funds from Goldman Sachs Group Inc for $800 million, sparking a 3.5 percent jump in Affiliated Managers stock.  UPDATE 1-Affiliated Managers buys stakes in hedge funds from Goldman fund BOSTON, June 6 Affiliated Managers Group Inc , a holding company for money management firms, said on Monday it will buy stakes in five hedge funds from Goldman Sachs Group Inc for $800 million, sparking a 3.5 percent jump in Affiliated Managers stock. BOSTON, June 6 Affiliated Managers Group Inc , a holding company for money management firms, said on Monday it will buy stakes in five hedge funds from Goldman Sachs for $800 million, sparking a  3.5 percent jump in the stock.UPDATE 1-Affiliated Managers buys stakes in hedge funds from Goldman fund BOSTON, June 6 Affiliated Managers Group Inc , a holding company for money management firms, said on Monday it will buy stakes in five hedge funds from Goldman Sachs Group Inc for $800 million, sparking a 3.5 percent jump in Affiliated Managers stock.   * AMG announces agreement to invest in leading alternative firmsBRIEF-Affiliated Managers Group enters commitment increase agreementAffiliated Managers buys stakes in hedge funds from Goldman fundUPDATE 1-Affiliated Managers buys stakes in hedge funds from Goldman fund BOSTON, June 6 Affiliated Managers Group Inc , a holding company for money management firms, said on Monday it will buy stakes in five hedge funds from Goldman Sachs Group Inc for $800 million, sparking a 3.5 percent jump in Affiliated Managers stock.  UPDATE 1-Affiliated Managers buys stakes in hedge funds from Goldman fund BOSTON, June 6 Affiliated Managers Group Inc , a holding company for money management firms, said on Monday it will buy stakes in five hedge funds from Goldman Sachs Group Inc for $800 million, sparking a 3.5 percent jump in Affiliated Managers stock. BOSTON, June 6 Affiliated Managers Group Inc , a holding company for money management firms, said on Monday it will buy stakes in five hedge funds from Goldman Sachs for $800 million, sparking a  3.5 percent jump in the stock.UPDATE 1-Affiliated Managers buys stakes in hedge funds from Goldman fund BOSTON, June 6 Affiliated Managers Group Inc , a holding company for money management firms, said on Monday it will buy stakes in five hedge funds from Goldman Sachs Group Inc for $800 million, sparking a 3.5 percent jump in Affiliated Managers stock.   Affiliated Managers buys stakes in hedge funds from Goldman fundUPDATE 1-Affiliated Managers buys stakes in hedge funds from Goldman fund BOSTON, June 6 Affiliated Managers Group Inc , a holding company for money management firms, said on Monday it will buy stakes in five hedge funds from Goldman Sachs Group Inc for $800 million, sparking a 3.5 percent jump in Affiliated Managers stock.  UPDATE 1-Affiliated Managers buys stakes in hedge funds from Goldman fund BOSTON, June 6 Affiliated Managers Group Inc , a holding company for money management firms, said on Monday it will buy stakes in five hedge funds from Goldman Sachs Group Inc for $800 million, sparking a 3.5 percent jump in Affiliated Managers stock. BOSTON, June 6 Affiliated Managers Group Inc , a holding company for money management firms, said on Monday it will buy stakes in five hedge funds from Goldman Sachs for $800 million, sparking a  3.5 percent jump in the stock.UPDATE 1-Affiliated Managers buys stakes in hedge funds from Goldman fund BOSTON, June 6 Affiliated Managers Group Inc , a holding company for money management firms, said on Monday it will buy stakes in five hedge funds from Goldman Sachs Group Inc for $800 million, sparking a 3.5 percent jump in Affiliated Managers stock.  * Entered commitment increase agreement increasing commitments under revolving credit agreement from $1.3 billion to $1.45 billionAffiliated Managers buys stakes in hedge funds from Goldman fundUPDATE 1-Affiliated Managers buys stakes in hedge funds from Goldman fund BOSTON, June 6 Affiliated Managers Group Inc , a holding company for money management firms, said on Monday it will buy stakes in five hedge funds from Goldman Sachs Group Inc for $800 million, sparking a 3.5 percent jump in Affiliated Managers stock.  UPDATE 1-Affiliated Managers buys stakes in hedge funds from Goldman fund BOSTON, June 6 Affiliated Managers Group Inc , a holding company for money management firms, said on Monday it will buy stakes in five hedge funds from Goldman Sachs Group Inc for $800 million, sparking a 3.5 percent jump in Affiliated Managers stock. BOSTON, June 6 Affiliated Managers Group Inc , a holding company for money management firms, said on Monday it will buy stakes in five hedge funds from Goldman Sachs for $800 million, sparking a  3.5 percent jump in the stock.UPDATE 1-Affiliated Managers buys stakes in hedge funds from Goldman fund BOSTON, June 6 Affiliated Managers Group Inc , a holding company for money management firms, said on Monday it will buy stakes in five hedge funds from Goldman Sachs Group Inc for $800 million, sparking a 3.5 percent jump in Affiliated Managers stock.    
ALB,COLUMN-What price lithium, the metal of the future? Andy Home LONDON, June 6 Lithium is shaping up to be The Next Big Thing. 
ALXN,BRIEF-Alexion announces topline results from Phase 3 regain study of eculizumabAlexion drug misses goal in late-stage trialUPDATE 1-Alexion shares slump as drug misses goal in late-stage trial June 6 Alexion Pharmaceuticals Inc said its drug Soliris, already approved in the United States for the treatment of two rare blood disorders, missed its primary goal in a late-stage trial.  UPDATE 1-Alexion shares slump as drug misses goal in late-stage trial June 6 Alexion Pharmaceuticals Inc said its drug Soliris, already approved in the United States for the treatment of two rare blood disorders, missed its primary goal in a late-stage trial. June 6 Alexion Pharmaceuticals Inc said its drug Soliris, already approved in the United States for the treatment of two rare blood disorders, missed its primary goal in a late-stage trial, sending its shares down 9 percent in extended trade.UPDATE 1-Alexion shares slump as drug misses goal in late-stage trial June 6 Alexion Pharmaceuticals Inc said its drug Soliris, already approved in the United States for the treatment of two rare blood disorders, missed its primary goal in a late-stage trial.   Alexion drug misses goal in late-stage trialUPDATE 1-Alexion shares slump as drug misses goal in late-stage trial June 6 Alexion Pharmaceuticals Inc said its drug Soliris, already approved in the United States for the treatment of two rare blood disorders, missed its primary goal in a late-stage trial.  UPDATE 1-Alexion shares slump as drug misses goal in late-stage trial June 6 Alexion Pharmaceuticals Inc said its drug Soliris, already approved in the United States for the treatment of two rare blood disorders, missed its primary goal in a late-stage trial. June 6 Alexion Pharmaceuticals Inc said its drug Soliris, already approved in the United States for the treatment of two rare blood disorders, missed its primary goal in a late-stage trial, sending its shares down 9 percent in extended trade.UPDATE 1-Alexion shares slump as drug misses goal in late-stage trial June 6 Alexion Pharmaceuticals Inc said its drug Soliris, already approved in the United States for the treatment of two rare blood disorders, missed its primary goal in a late-stage trial.  * Alexion announces topline results from Phase 3 regain study of eculizumab (soliris) in patients with refractory generalized myasthenia gravis (GMG)Alexion drug misses goal in late-stage trialUPDATE 1-Alexion shares slump as drug misses goal in late-stage trial June 6 Alexion Pharmaceuticals Inc said its drug Soliris, already approved in the United States for the treatment of two rare blood disorders, missed its primary goal in a late-stage trial.  UPDATE 1-Alexion shares slump as drug misses goal in late-stage trial June 6 Alexion Pharmaceuticals Inc said its drug Soliris, already approved in the United States for the treatment of two rare blood disorders, missed its primary goal in a late-stage trial. June 6 Alexion Pharmaceuticals Inc said its drug Soliris, already approved in the United States for the treatment of two rare blood disorders, missed its primary goal in a late-stage trial, sending its shares down 9 percent in extended trade.UPDATE 1-Alexion shares slump as drug misses goal in late-stage trial June 6 Alexion Pharmaceuticals Inc said its drug Soliris, already approved in the United States for the treatment of two rare blood disorders, missed its primary goal in a late-stage trial.   
AGN,BRIEF-Allergan announces FDA approval of byvalsonU.S. FDA approves Allergan's hypertension treatmentUPDATE 1-FDA approves Allergan's combination therapy for hypertensionFDA approves Allergan's combination therapy for hypertension The U.S. Food and Drug Administration approved Allergan Plc's treatment for high blood pressure or hypertension, the company said on Monday.  FDA approves Allergan's combination therapy for hypertension The U.S. Food and Drug Administration approved Allergan Plc's treatment for high blood pressure or hypertension, the company said on Monday. June 6 The U.S. Food and Drug Administration approved Allergan Plc's treatment for high blood pressure or hypertension, the company said on Monday.FDA approves Allergan's combination therapy for hypertension The U.S. Food and Drug Administration approved Allergan Plc's treatment for high blood pressure or hypertension, the company said on Monday.   UPDATE 1-FDA approves Allergan's combination therapy for hypertensionFDA approves Allergan's combination therapy for hypertension The U.S. Food and Drug Administration approved Allergan Plc's treatment for high blood pressure or hypertension, the company said on Monday.  FDA approves Allergan's combination therapy for hypertension The U.S. Food and Drug Administration approved Allergan Plc's treatment for high blood pressure or hypertension, the company said on Monday. June 6 The U.S. Food and Drug Administration approved Allergan Plc's treatment for high blood pressure or hypertension, the company said on Monday.FDA approves Allergan's combination therapy for hypertension The U.S. Food and Drug Administration approved Allergan Plc's treatment for high blood pressure or hypertension, the company said on Monday.  June 6 The U.S. Food and Drug Administration approved Allergan Plc's treatment for high blood pressure or hypertension, the company said on Monday.UPDATE 1-FDA approves Allergan's combination therapy for hypertensionFDA approves Allergan's combination therapy for hypertension The U.S. Food and Drug Administration approved Allergan Plc's treatment for high blood pressure or hypertension, the company said on Monday.  FDA approves Allergan's combination therapy for hypertension The U.S. Food and Drug Administration approved Allergan Plc's treatment for high blood pressure or hypertension, the company said on Monday. June 6 The U.S. Food and Drug Administration approved Allergan Plc's treatment for high blood pressure or hypertension, the company said on Monday.FDA approves Allergan's combination therapy for hypertension The U.S. Food and Drug Administration approved Allergan Plc's treatment for high blood pressure or hypertension, the company said on Monday.    U.S. FDA approves Allergan's hypertension treatmentUPDATE 1-FDA approves Allergan's combination therapy for hypertensionFDA approves Allergan's combination therapy for hypertension The U.S. Food and Drug Administration approved Allergan Plc's treatment for high blood pressure or hypertension, the company said on Monday.  FDA approves Allergan's combination therapy for hypertension The U.S. Food and Drug Administration approved Allergan Plc's treatment for high blood pressure or hypertension, the company said on Monday. June 6 The U.S. Food and Drug Administration approved Allergan Plc's treatment for high blood pressure or hypertension, the company said on Monday.FDA approves Allergan's combination therapy for hypertension The U.S. Food and Drug Administration approved Allergan Plc's treatment for high blood pressure or hypertension, the company said on Monday.   UPDATE 1-FDA approves Allergan's combination therapy for hypertensionFDA approves Allergan's combination therapy for hypertension The U.S. Food and Drug Administration approved Allergan Plc's treatment for high blood pressure or hypertension, the company said on Monday.  FDA approves Allergan's combination therapy for hypertension The U.S. Food and Drug Administration approved Allergan Plc's treatment for high blood pressure or hypertension, the company said on Monday. June 6 The U.S. Food and Drug Administration approved Allergan Plc's treatment for high blood pressure or hypertension, the company said on Monday.FDA approves Allergan's combination therapy for hypertension The U.S. Food and Drug Administration approved Allergan Plc's treatment for high blood pressure or hypertension, the company said on Monday.  June 6 The U.S. Food and Drug Administration approved Allergan Plc's treatment for high blood pressure or hypertension, the company said on Monday.UPDATE 1-FDA approves Allergan's combination therapy for hypertensionFDA approves Allergan's combination therapy for hypertension The U.S. Food and Drug Administration approved Allergan Plc's treatment for high blood pressure or hypertension, the company said on Monday.  FDA approves Allergan's combination therapy for hypertension The U.S. Food and Drug Administration approved Allergan Plc's treatment for high blood pressure or hypertension, the company said on Monday. June 6 The U.S. Food and Drug Administration approved Allergan Plc's treatment for high blood pressure or hypertension, the company said on Monday.FDA approves Allergan's combination therapy for hypertension The U.S. Food and Drug Administration approved Allergan Plc's treatment for high blood pressure or hypertension, the company said on Monday.   * Allergan expects byvalson to be available in 2nd half of 2016.U.S. FDA approves Allergan's hypertension treatmentUPDATE 1-FDA approves Allergan's combination therapy for hypertensionFDA approves Allergan's combination therapy for hypertension The U.S. Food and Drug Administration approved Allergan Plc's treatment for high blood pressure or hypertension, the company said on Monday.  FDA approves Allergan's combination therapy for hypertension The U.S. Food and Drug Administration approved Allergan Plc's treatment for high blood pressure or hypertension, the company said on Monday. June 6 The U.S. Food and Drug Administration approved Allergan Plc's treatment for high blood pressure or hypertension, the company said on Monday.FDA approves Allergan's combination therapy for hypertension The U.S. Food and Drug Administration approved Allergan Plc's treatment for high blood pressure or hypertension, the company said on Monday.   UPDATE 1-FDA approves Allergan's combination therapy for hypertensionFDA approves Allergan's combination therapy for hypertension The U.S. Food and Drug Administration approved Allergan Plc's treatment for high blood pressure or hypertension, the company said on Monday.  FDA approves Allergan's combination therapy for hypertension The U.S. Food and Drug Administration approved Allergan Plc's treatment for high blood pressure or hypertension, the company said on Monday. June 6 The U.S. Food and Drug Administration approved Allergan Plc's treatment for high blood pressure or hypertension, the company said on Monday.FDA approves Allergan's combination therapy for hypertension The U.S. Food and Drug Administration approved Allergan Plc's treatment for high blood pressure or hypertension, the company said on Monday.  June 6 The U.S. Food and Drug Administration approved Allergan Plc's treatment for high blood pressure or hypertension, the company said on Monday.UPDATE 1-FDA approves Allergan's combination therapy for hypertensionFDA approves Allergan's combination therapy for hypertension The U.S. Food and Drug Administration approved Allergan Plc's treatment for high blood pressure or hypertension, the company said on Monday.  FDA approves Allergan's combination therapy for hypertension The U.S. Food and Drug Administration approved Allergan Plc's treatment for high blood pressure or hypertension, the company said on Monday. June 6 The U.S. Food and Drug Administration approved Allergan Plc's treatment for high blood pressure or hypertension, the company said on Monday.FDA approves Allergan's combination therapy for hypertension The U.S. Food and Drug Administration approved Allergan Plc's treatment for high blood pressure or hypertension, the company said on Monday.    
