AAL,American Airlines to axe newly reinstated Caracas-New York route CARACAS, March 8 American Airlines said on Tuesday it will axe its Caracas to New York route on April 4 due to low demand just over three months after reinstating it. 
AAPL,Mac ransomware caught before large number of computers infectedUPDATE 2-Justice Department asks judge to revisit NY iPhone caseJustice Department asks judge to revisit NY iPhone case WASHINGTON The U.S. Justice Department on Monday sought to overturn a ruling which protects Apple  from unlocking an iPhone in a New York drug case.  Justice Department asks judge to revisit NY iPhone case WASHINGTON The U.S. Justice Department on Monday sought to overturn a ruling which protects Apple  from unlocking an iPhone in a New York drug case. WASHINGTON, March 7 The U.S. Justice Department on Monday sought to overturn a ruling which protects Apple  from unlocking an iPhone in a New York drug case.Justice Department asks judge to revisit NY iPhone case WASHINGTON The U.S. Justice Department on Monday sought to overturn a ruling which protects Apple  from unlocking an iPhone in a New York drug case.   UPDATE 2-Justice Department asks judge to revisit NY iPhone caseJustice Department asks judge to revisit NY iPhone case WASHINGTON The U.S. Justice Department on Monday sought to overturn a ruling which protects Apple  from unlocking an iPhone in a New York drug case.  Justice Department asks judge to revisit NY iPhone case WASHINGTON The U.S. Justice Department on Monday sought to overturn a ruling which protects Apple  from unlocking an iPhone in a New York drug case. WASHINGTON, March 7 The U.S. Justice Department on Monday sought to overturn a ruling which protects Apple  from unlocking an iPhone in a New York drug case.Justice Department asks judge to revisit NY iPhone case WASHINGTON The U.S. Justice Department on Monday sought to overturn a ruling which protects Apple  from unlocking an iPhone in a New York drug case.  The first known ransomware attack on Apple Inc's  Mac computers, which was discovered over the weekend, was downloaded more than 6,000 times before the threat was contained, according to a developer whose product was tainted with the malicious software. | UPDATE 2-Justice Department asks judge to revisit NY iPhone caseJustice Department asks judge to revisit NY iPhone case WASHINGTON The U.S. Justice Department on Monday sought to overturn a ruling which protects Apple  from unlocking an iPhone in a New York drug case.  Justice Department asks judge to revisit NY iPhone case WASHINGTON The U.S. Justice Department on Monday sought to overturn a ruling which protects Apple  from unlocking an iPhone in a New York drug case. WASHINGTON, March 7 The U.S. Justice Department on Monday sought to overturn a ruling which protects Apple  from unlocking an iPhone in a New York drug case.Justice Department asks judge to revisit NY iPhone case WASHINGTON The U.S. Justice Department on Monday sought to overturn a ruling which protects Apple  from unlocking an iPhone in a New York drug case.  VideoUPDATE 2-Justice Department asks judge to revisit NY iPhone caseJustice Department asks judge to revisit NY iPhone case WASHINGTON The U.S. Justice Department on Monday sought to overturn a ruling which protects Apple  from unlocking an iPhone in a New York drug case.  Justice Department asks judge to revisit NY iPhone case WASHINGTON The U.S. Justice Department on Monday sought to overturn a ruling which protects Apple  from unlocking an iPhone in a New York drug case. WASHINGTON, March 7 The U.S. Justice Department on Monday sought to overturn a ruling which protects Apple  from unlocking an iPhone in a New York drug case.Justice Department asks judge to revisit NY iPhone case WASHINGTON The U.S. Justice Department on Monday sought to overturn a ruling which protects Apple  from unlocking an iPhone in a New York drug case.   UPDATE 2-Justice Department asks judge to revisit NY iPhone caseJustice Department asks judge to revisit NY iPhone case WASHINGTON The U.S. Justice Department on Monday sought to overturn a ruling which protects Apple  from unlocking an iPhone in a New York drug case.  Justice Department asks judge to revisit NY iPhone case WASHINGTON The U.S. Justice Department on Monday sought to overturn a ruling which protects Apple  from unlocking an iPhone in a New York drug case. WASHINGTON, March 7 The U.S. Justice Department on Monday sought to overturn a ruling which protects Apple  from unlocking an iPhone in a New York drug case.Justice Department asks judge to revisit NY iPhone case WASHINGTON The U.S. Justice Department on Monday sought to overturn a ruling which protects Apple  from unlocking an iPhone in a New York drug case.   
BHI,EU regulators to decide on Halliburton, Baker Hughes deal by July 11EU regulators to decide on Halliburton, Baker Hughes deal by July 11 BRUSSELS - European Union antitrust enforcers have resumed their investigation into U.S. oilfield services provider Halliburton Co's  proposed takeover of Baker Hughes  and will decide by July 11 whether to approve the $35 billion deal.  EU regulators to decide on Halliburton, Baker Hughes deal by July 11 BRUSSELS - European Union antitrust enforcers have resumed their investigation into U.S. oilfield services provider Halliburton Co's  proposed takeover of Baker Hughes  and will decide by July 11 whether to approve the $35 billion deal. BRUSSELS, March 8 - European Union antitrust enforcers have resumed their investigation into U.S. oilfield services provider Halliburton Co's proposed takeover of Baker Hughes  and will decide by July 11 whether to approve the $35 billion deal.EU regulators to decide on Halliburton, Baker Hughes deal by July 11 BRUSSELS - European Union antitrust enforcers have resumed their investigation into U.S. oilfield services provider Halliburton Co's  proposed takeover of Baker Hughes  and will decide by July 11 whether to approve the $35 billion deal.  
BLK,Who's next? Asia investor activism set to grow after BlackRock public campaignUPDATE 1-Who's next? Asia investor activism set to grow after BlackRock public campaignWho's next? Asia investor activism set to grow after BlackRock public campaignStocks, junk bonds could gain despite slowing U.S. growth -BlackRock's Rieder NEW YORK, March 8 Stocks "can go up five, ten percent, maybe" despite a slowing U.S. economy, BlackRock Inc's  chief investment officer of global fixed income Rick Rieder said on Tuesday.  Stocks, junk bonds could gain despite slowing U.S. growth -BlackRock's Rieder NEW YORK, March 8 Stocks "can go up five, ten percent, maybe" despite a slowing U.S. economy, BlackRock Inc's  chief investment officer of global fixed income Rick Rieder said on Tuesday. HONG KONG Following a rare public campaign, BlackRock Inc  voted against a deal planned by a Hong Kong firm that the world's biggest asset manager partly owns, revving up investor activism in Asia after it roared ahead in 2015.Stocks, junk bonds could gain despite slowing U.S. growth -BlackRock's Rieder NEW YORK, March 8 Stocks "can go up five, ten percent, maybe" despite a slowing U.S. economy, BlackRock Inc's  chief investment officer of global fixed income Rick Rieder said on Tuesday.   Who's next? Asia investor activism set to grow after BlackRock public campaignStocks, junk bonds could gain despite slowing U.S. growth -BlackRock's Rieder NEW YORK, March 8 Stocks "can go up five, ten percent, maybe" despite a slowing U.S. economy, BlackRock Inc's  chief investment officer of global fixed income Rick Rieder said on Tuesday.  Stocks, junk bonds could gain despite slowing U.S. growth -BlackRock's Rieder NEW YORK, March 8 Stocks "can go up five, ten percent, maybe" despite a slowing U.S. economy, BlackRock Inc's  chief investment officer of global fixed income Rick Rieder said on Tuesday. HONG KONG Following a rare public campaign, BlackRock Inc  voted against a deal planned by a Hong Kong firm that the world's biggest asset manager partly owns, revving up investor activism in Asia after it roared ahead in 2015.Stocks, junk bonds could gain despite slowing U.S. growth -BlackRock's Rieder NEW YORK, March 8 Stocks "can go up five, ten percent, maybe" despite a slowing U.S. economy, BlackRock Inc's  chief investment officer of global fixed income Rick Rieder said on Tuesday.  * BlackRock campaign fails, but overall success rates rising   (Adds result of vote paragraph 3)Who's next? Asia investor activism set to grow after BlackRock public campaignStocks, junk bonds could gain despite slowing U.S. growth -BlackRock's Rieder NEW YORK, March 8 Stocks "can go up five, ten percent, maybe" despite a slowing U.S. economy, BlackRock Inc's  chief investment officer of global fixed income Rick Rieder said on Tuesday.  Stocks, junk bonds could gain despite slowing U.S. growth -BlackRock's Rieder NEW YORK, March 8 Stocks "can go up five, ten percent, maybe" despite a slowing U.S. economy, BlackRock Inc's  chief investment officer of global fixed income Rick Rieder said on Tuesday. HONG KONG Following a rare public campaign, BlackRock Inc  voted against a deal planned by a Hong Kong firm that the world's biggest asset manager partly owns, revving up investor activism in Asia after it roared ahead in 2015.Stocks, junk bonds could gain despite slowing U.S. growth -BlackRock's Rieder NEW YORK, March 8 Stocks "can go up five, ten percent, maybe" despite a slowing U.S. economy, BlackRock Inc's  chief investment officer of global fixed income Rick Rieder said on Tuesday.    UPDATE 1-Who's next? Asia investor activism set to grow after BlackRock public campaignWho's next? Asia investor activism set to grow after BlackRock public campaignStocks, junk bonds could gain despite slowing U.S. growth -BlackRock's Rieder NEW YORK, March 8 Stocks "can go up five, ten percent, maybe" despite a slowing U.S. economy, BlackRock Inc's  chief investment officer of global fixed income Rick Rieder said on Tuesday.  Stocks, junk bonds could gain despite slowing U.S. growth -BlackRock's Rieder NEW YORK, March 8 Stocks "can go up five, ten percent, maybe" despite a slowing U.S. economy, BlackRock Inc's  chief investment officer of global fixed income Rick Rieder said on Tuesday. HONG KONG Following a rare public campaign, BlackRock Inc  voted against a deal planned by a Hong Kong firm that the world's biggest asset manager partly owns, revving up investor activism in Asia after it roared ahead in 2015.Stocks, junk bonds could gain despite slowing U.S. growth -BlackRock's Rieder NEW YORK, March 8 Stocks "can go up five, ten percent, maybe" despite a slowing U.S. economy, BlackRock Inc's  chief investment officer of global fixed income Rick Rieder said on Tuesday.   Who's next? Asia investor activism set to grow after BlackRock public campaignStocks, junk bonds could gain despite slowing U.S. growth -BlackRock's Rieder NEW YORK, March 8 Stocks "can go up five, ten percent, maybe" despite a slowing U.S. economy, BlackRock Inc's  chief investment officer of global fixed income Rick Rieder said on Tuesday.  Stocks, junk bonds could gain despite slowing U.S. growth -BlackRock's Rieder NEW YORK, March 8 Stocks "can go up five, ten percent, maybe" despite a slowing U.S. economy, BlackRock Inc's  chief investment officer of global fixed income Rick Rieder said on Tuesday. HONG KONG Following a rare public campaign, BlackRock Inc  voted against a deal planned by a Hong Kong firm that the world's biggest asset manager partly owns, revving up investor activism in Asia after it roared ahead in 2015.Stocks, junk bonds could gain despite slowing U.S. growth -BlackRock's Rieder NEW YORK, March 8 Stocks "can go up five, ten percent, maybe" despite a slowing U.S. economy, BlackRock Inc's  chief investment officer of global fixed income Rick Rieder said on Tuesday.  * BlackRock campaign fails, but overall success rates rising   (Adds result of vote paragraph 3)Who's next? Asia investor activism set to grow after BlackRock public campaignStocks, junk bonds could gain despite slowing U.S. growth -BlackRock's Rieder NEW YORK, March 8 Stocks "can go up five, ten percent, maybe" despite a slowing U.S. economy, BlackRock Inc's  chief investment officer of global fixed income Rick Rieder said on Tuesday.  Stocks, junk bonds could gain despite slowing U.S. growth -BlackRock's Rieder NEW YORK, March 8 Stocks "can go up five, ten percent, maybe" despite a slowing U.S. economy, BlackRock Inc's  chief investment officer of global fixed income Rick Rieder said on Tuesday. HONG KONG Following a rare public campaign, BlackRock Inc  voted against a deal planned by a Hong Kong firm that the world's biggest asset manager partly owns, revving up investor activism in Asia after it roared ahead in 2015.Stocks, junk bonds could gain despite slowing U.S. growth -BlackRock's Rieder NEW YORK, March 8 Stocks "can go up five, ten percent, maybe" despite a slowing U.S. economy, BlackRock Inc's  chief investment officer of global fixed income Rick Rieder said on Tuesday.   HONG KONG, March 8 Following a rare public campaign, BlackRock Inc voted against a deal planned by a Hong Kong firm that the world's biggest asset manager partly owns, revving up investor activism in Asia after it roared ahead in 2015.UPDATE 1-Who's next? Asia investor activism set to grow after BlackRock public campaignWho's next? Asia investor activism set to grow after BlackRock public campaignStocks, junk bonds could gain despite slowing U.S. growth -BlackRock's Rieder NEW YORK, March 8 Stocks "can go up five, ten percent, maybe" despite a slowing U.S. economy, BlackRock Inc's  chief investment officer of global fixed income Rick Rieder said on Tuesday.  Stocks, junk bonds could gain despite slowing U.S. growth -BlackRock's Rieder NEW YORK, March 8 Stocks "can go up five, ten percent, maybe" despite a slowing U.S. economy, BlackRock Inc's  chief investment officer of global fixed income Rick Rieder said on Tuesday. HONG KONG Following a rare public campaign, BlackRock Inc  voted against a deal planned by a Hong Kong firm that the world's biggest asset manager partly owns, revving up investor activism in Asia after it roared ahead in 2015.Stocks, junk bonds could gain despite slowing U.S. growth -BlackRock's Rieder NEW YORK, March 8 Stocks "can go up five, ten percent, maybe" despite a slowing U.S. economy, BlackRock Inc's  chief investment officer of global fixed income Rick Rieder said on Tuesday.   Who's next? Asia investor activism set to grow after BlackRock public campaignStocks, junk bonds could gain despite slowing U.S. growth -BlackRock's Rieder NEW YORK, March 8 Stocks "can go up five, ten percent, maybe" despite a slowing U.S. economy, BlackRock Inc's  chief investment officer of global fixed income Rick Rieder said on Tuesday.  Stocks, junk bonds could gain despite slowing U.S. growth -BlackRock's Rieder NEW YORK, March 8 Stocks "can go up five, ten percent, maybe" despite a slowing U.S. economy, BlackRock Inc's  chief investment officer of global fixed income Rick Rieder said on Tuesday. HONG KONG Following a rare public campaign, BlackRock Inc  voted against a deal planned by a Hong Kong firm that the world's biggest asset manager partly owns, revving up investor activism in Asia after it roared ahead in 2015.Stocks, junk bonds could gain despite slowing U.S. growth -BlackRock's Rieder NEW YORK, March 8 Stocks "can go up five, ten percent, maybe" despite a slowing U.S. economy, BlackRock Inc's  chief investment officer of global fixed income Rick Rieder said on Tuesday.  * BlackRock campaign fails, but overall success rates rising   (Adds result of vote paragraph 3)Who's next? Asia investor activism set to grow after BlackRock public campaignStocks, junk bonds could gain despite slowing U.S. growth -BlackRock's Rieder NEW YORK, March 8 Stocks "can go up five, ten percent, maybe" despite a slowing U.S. economy, BlackRock Inc's  chief investment officer of global fixed income Rick Rieder said on Tuesday.  Stocks, junk bonds could gain despite slowing U.S. growth -BlackRock's Rieder NEW YORK, March 8 Stocks "can go up five, ten percent, maybe" despite a slowing U.S. economy, BlackRock Inc's  chief investment officer of global fixed income Rick Rieder said on Tuesday. HONG KONG Following a rare public campaign, BlackRock Inc  voted against a deal planned by a Hong Kong firm that the world's biggest asset manager partly owns, revving up investor activism in Asia after it roared ahead in 2015.Stocks, junk bonds could gain despite slowing U.S. growth -BlackRock's Rieder NEW YORK, March 8 Stocks "can go up five, ten percent, maybe" despite a slowing U.S. economy, BlackRock Inc's  chief investment officer of global fixed income Rick Rieder said on Tuesday.    
BA,United Airlines to buy 25 more narrowbody aircraft from BoeingUPDATE 1-United Airlines to buy 25 single-aisle Boeing aircraft March 8 United Airlines said it would buy 25 single-aisle  aircraft from Boeing Co in addition to the 40 it had ordered earlier.  UPDATE 1-United Airlines to buy 25 single-aisle Boeing aircraft March 8 United Airlines said it would buy 25 single-aisle  aircraft from Boeing Co in addition to the 40 it had ordered earlier. March 8 United Airlines said it would buy 25 narrowbody aircraft from Boeing Co in addition to the 40 it had ordered earlier.UPDATE 1-United Airlines to buy 25 single-aisle Boeing aircraft March 8 United Airlines said it would buy 25 single-aisle  aircraft from Boeing Co in addition to the 40 it had ordered earlier.  
BMY,Bristol-Myers Squibb says stops some initiatives in China LONDON, March 8 U.S. drugmaker Bristol-Myers Squibb said on Tuesday it had stopped "certain initiatives" in China, when asked by Reuters to comment on industry chatter it was curbing financial incentives for prescribing doctors. 
